"keyword","category","title","price","savings","percent","link","imageUrl","page"
"4k smart tv","TV & Video","SAMSUNG 43-Inch U8200 Crystal UHD 4k Smart TV, Crystal Processor 4K, HDR, Titan Grey Metal Stream Design, Q-Symphony, Gaming Hub, 3 HDMI, HDMI Cable - [UN43U8200FFXZC] [Canada] (2025)","$378.00","$170.00 (31%)","31","https://www.amazon.ca/dp/B0DYQNL7L9?tag=lesdealsduw02-20&linkCode=osi&th=1&psc=1","https://m.media-amazon.com/images/I/41QSjzYbe3L._SL500_.jpg","1"
"baby wipes","Baby","Huggies Skin Essentials Baby Wipes, Hypoallergenic, 99% Water, 10 Flip Top Packs (560 Wipes Total)","$23.97 ($0.04 / count)","$11.02 (31%)","31","https://www.amazon.ca/dp/B0CQ74ZPTW?tag=lesdealsduw02-20&linkCode=osi&th=1&psc=1","https://m.media-amazon.com/images/I/51sfnwT9NIL._SL500_.jpg","2"
"bamboo sheets","Bedroom","Bedsure 100% Rayon Derived from Bamboo Sheets King Size Set, Cooling Sheets for Hot Sleepers, Breathable & Soft King Bedsheets, Deep Pocket Up to 16 Inches, Bedsheet & Pillowcase Sets, Dark Grey","$89.99","$40.00 (31%)","31","https://www.amazon.ca/dp/B07YKCQBBL?tag=lesdealsduw02-20&linkCode=osi&th=1&psc=1","https://m.media-amazon.com/images/I/51lTuYvTQ6L._SL500_.jpg","1"
"bicycle","Sports & Fitness","Gyrocopters Rizz Electric Bike for Adults/Teens | UL2849 Safe Folding Ebike | Peak 400W Brushless Motor 14*2 Inch Tires | Speed upto 25Km/h Range upto 55Km | Light E-bike, SMART ANTI-THEFT GPS TRACKER","$549.95","$250.00 (31%)","31","https://www.amazon.ca/dp/B0CWSD23X8?tag=lesdealsduw02-20&linkCode=osi&th=1&psc=1","https://m.media-amazon.com/images/I/41tTUdamwyL._SL500_.jpg","1"
"blackout curtains","Bedroom","Joydeco Blackout Curtains 2 Panels - Natural Linen Curtains 84 Inch Long, Thermal Insulated Linen Light Blocking Drapes, Rod Pocket & Back Tabs, Darkening Privacy for Living Room Bedroom","$28.99","$13.00 (31%)","31","https://www.amazon.ca/dp/B0BZDLT95R?tag=lesdealsduw02-20&linkCode=osi&th=1&psc=1","https://m.media-amazon.com/images/I/41hrdAFVXdL._SL500_.jpg","1"
"blender","Kitchen","Ninja Blender, Blast Max, Cordless, Personal Blender for Smoothies, Frozen Drinks, Ice Crush, 22 oz. Removable Vessel, Leakproof Lid, BPA-Free, Dishwasher Safe, Auto-iQ Technology, Lavender, BC251CLD","$89.99","$40.00 (31%)","31","https://www.amazon.ca/dp/B0DD4FTRJV?tag=lesdealsduw02-20&linkCode=osi&th=1&psc=1","https://m.media-amazon.com/images/I/31Ni5GEw9EL._SL500_.jpg","2"
"books","Books","Atomic Habits: An Easy & Proven Way to Build Good Habits & Break Bad Ones","$24.68","$11.32 (31%)","31","https://www.amazon.ca/dp/0735211299?tag=lesdealsduw02-20&linkCode=osi&th=1&psc=1","https://m.media-amazon.com/images/I/51b4CfdTSDL._SL500_.jpg","2"
"car battery","Automotive","9-in-1 5000A 150PSI Car Battery Booster Jump Starter with Air Compressor (All Gas/9L Diesel), Portable Car Battery Booster Pack, Safe Durable Car Jump Starter with Extended Jumper Cables, Glove, Light","$99.99","$44.00 (31%)","31","https://www.amazon.ca/dp/B0F1SWLT89?tag=lesdealsduw02-20&linkCode=osi&th=1&psc=1","https://m.media-amazon.com/images/I/5139sKd8kQL._SL500_.jpg","2"
"cat water fountain","Pet Supplies","Catit Senses Flower 2.0 Cat Water Fountain 3L Green, Modern Cat Fountain, Triple Filtration, Fontaine Pour Chat, Pet Water Fountains, Perfect for Indoor Cats","$27.02","$11.98 (31%)","31","https://www.amazon.ca/dp/B0146QXOB0?tag=lesdealsduw02-20&linkCode=osi&th=1&psc=1","https://m.media-amazon.com/images/I/31WPsfReV-L._SL500_.jpg","1"
"coffee grinder","Kitchen","Salton Coffee Grinder, Electric Blade Grinder for Ground Coffee, Spices, Herbs, Nuts with Stainless Steel Blade, 60 g capacity, 8 Cups, White (CG1990WH)","$17.12","$7.87 (31%)","31","https://www.amazon.ca/dp/B07SM3P3ZT?tag=lesdealsduw02-20&linkCode=osi&th=1&psc=1","https://m.media-amazon.com/images/I/31mO5k77DJL._SL500_.jpg","2"
"cooling vest","Health & Wellness","Cooling Ice Vest for Men Women,PVA Water Activated Evaporative Cool Cold Vest,Reusable Adjust Cold Fabric Sport Cool Body Ice Vest,High Temperature Protective Clothes for Working in the Heat","$10.99","$5.00 (31%)","31","https://www.amazon.ca/dp/B0CXHYYH42?tag=lesdealsduw02-20&linkCode=osi&th=1&psc=1","https://m.media-amazon.com/images/I/61lFv8Ur+kL._SL500_.jpg","2"
"cooling towel","Outdoor & Camping","Sukeen [4 Pack] Cooling Towel (40""x12""), Ice Towel, Soft Breathable Chilly Towel, Microfiber Towel for Yoga, Sport, Running, Gym, Workout,Camping, Fitness, Workout & More Activities","$19.99","$9.00 (31%)","31","https://www.amazon.ca/dp/B073F1TBMR?tag=lesdealsduw02-20&linkCode=osi&th=1&psc=1","https://m.media-amazon.com/images/I/61hAdUSsF2L._SL500_.jpg","1"
"cutting board","Kitchen","Titanium Cutting Board, Double Sided Cutting Board for Kitchen, 16 * 11 inch Dishwasher Safe Chopping Board, Titanium and Food-Grade Wheat Straw PP","$21.99","$10.00 (31%)","31","https://www.amazon.ca/dp/B0DQ4F9DSS?tag=lesdealsduw02-20&linkCode=osi&th=1&psc=1","https://m.media-amazon.com/images/I/41Egs8x7q7L._SL500_.jpg","2"
"docking station","Computers & Tech","Lenovo ThinkPad Hybrid USB-C with USB-A Dock US (40AF0135US)","$239.99","$106.00 (31%)","31","https://www.amazon.ca/dp/B079N9BJY7?tag=lesdealsduw02-20&linkCode=osi&th=1&psc=1","https://m.media-amazon.com/images/I/31WIvd4B6XL._SL500_.jpg","1"
"eufy","Smart Home","eufy security S220 SoloCam, Wireless Outdoor Camera, Solar Security Camera, Always Powered, 2K Resolution, No Monthly Fee, 2.4 GHz Wi-Fi, HomeBase 3 Compatible, Home Security System","$109.99 ($109.99 / Count)","$50.00 (31%)","31","https://www.amazon.ca/dp/B0BZ55JZ4S?tag=lesdealsduw02-20&linkCode=osi&th=1&psc=1","https://m.media-amazon.com/images/I/311lpab1FHL._SL500_.jpg","1"
"eufy","Smart Home","eufy Security eufyCam 2C Wireless Home Security Add-on Camera, Requires HomeBase 2, 180-Day Battery Life, HomeKit Compatibility, 1080p HD, No Monthly Fee","$89.99","$40.00 (31%)","31","https://www.amazon.ca/dp/B07X41CXJ7?tag=lesdealsduw02-20&linkCode=osi&th=1&psc=1","https://m.media-amazon.com/images/I/21Gcl7QMp5L._SL500_.jpg","2"
"face serum","Beauty & Personal Care","Dark Spot Correcting Glow Serum：Melasma Hyperpigmentation Treatment for Face with Niacinamide Serum - Vitamin C Face Serum for Dark Spot Remover","$19.99 ($0.67 / gram)","$9.00 (31%)","31","https://www.amazon.ca/dp/B0DTQB714P?tag=lesdealsduw02-20&linkCode=osi&th=1&psc=1","https://m.media-amazon.com/images/I/31LliVytj8L._SL500_.jpg","2"
"fast charger","Power & Chargers","Adaptive Fast Charger and USB-C Cable 10ft(3m), Excgood Type C Cable Fast Charging Compatible with Galaxy A16/A15/A13/A14/A03s, S25 Ultra/S24/S23/S22/S20/S8/9+/10e,Note, Android Phone (2Pack Black)","$21.99","$10.00 (31%)","31","https://www.amazon.ca/dp/B0816CFNZG?tag=lesdealsduw02-20&linkCode=osi&th=1&psc=1","https://m.media-amazon.com/images/I/51lF7ab8cvL._SL500_.jpg","1"
"gaming monitor","Gaming","MSI MAG 275QF 27-inch 2K Gaming Monitor, 2560 x 1440 (UHD), 0.5ms Response Time, 180Hz, HDR Ready, HDMI, DP Port, Tilt Adjustable","$199.99","$90.00 (31%)","31","https://www.amazon.ca/dp/B0D68BYX1K?tag=lesdealsduw02-20&linkCode=osi&th=1&psc=1","https://m.media-amazon.com/images/I/41x09uNNhwL._SL500_.jpg","2"
"garden tools","Garden","Grenebo Garden Tools 9-Piece Heavy Duty Gardening Tools with Pruning Shears & Large Garden Tote, Rust-Proof Tools Set for Gardening, Ideal Gardening Gifts for Women & Birthday Gifts for Mom","$37.99","$17.00 (31%)","31","https://www.amazon.ca/dp/B09F9C3KFS?tag=lesdealsduw02-20&linkCode=osi&th=1&psc=1","https://m.media-amazon.com/images/I/51BUZi2NZML._SL500_.jpg","1"
"golf balls","Sports & Fitness","TaylorMade Golf Noodle Long & Soft DDZ, White, Pack of 24","$24.99","$11.17 (31%)","31","https://www.amazon.ca/dp/B09F5N3PV2?tag=lesdealsduw02-20&linkCode=osi&th=1&psc=1","https://m.media-amazon.com/images/I/51ojExit4eL._SL500_.jpg","1"
"greeting cards","Home & Cleaning","DEEPLAY Birthday Card 24 Pack, Bulk Glossy Blank Greeting Card Box Set, Multipack Funny Holographic Gold Foil Happy Birthday Cards Assortment for Friend Adult Teen, 4.7"" X 6.7"" with Envelops and Cute Stickers","$10.99","$5.00 (31%)","31","https://www.amazon.ca/dp/B088JTQ4V8?tag=lesdealsduw02-20&linkCode=osi&th=1&psc=1","https://m.media-amazon.com/images/I/61yeYWnKjBL._SL500_.jpg","1"
"grill cover","Garden","Grill Cover, 58 inch BBQ Gas Grill Cover for Outdoor Grill, Waterproof, Anti-UV, Rip-Proof, Fade Resistant Material, Barbecue Cover with Hook-and-Loop Straps & Adjustable Hem Drawstring, Black","$23.99","$11.00 (31%)","31","https://www.amazon.ca/dp/B07W6SP4W1?tag=lesdealsduw02-20&linkCode=osi&th=1&psc=1","https://m.media-amazon.com/images/I/31O5SWjJs4L._SL500_.jpg","1"
"gua sha","Beauty & Personal Care","FUANKANG Gua Sha Facial Tools Black Guasha Stone for Skincare Face Body Relieve Muscle Tensions Reduce Puffiness","$8.99 ($8.99 / count)","$4.00 (31%)","31","https://www.amazon.ca/dp/B0CGHQ2TGX?tag=lesdealsduw02-20&linkCode=osi&th=1&psc=1","https://m.media-amazon.com/images/I/41SsB8OBPRL._SL500_.jpg","1"
"hanging organizer","Bedroom","SimpleHouseware 10 Shelves Hanging Shoes Organizer Holder for Closet, Grey","$19.97","$9.02 (31%)","31","https://www.amazon.ca/dp/B01MR7G2ES?tag=lesdealsduw02-20&linkCode=osi&th=1&psc=1","https://m.media-amazon.com/images/I/31R9XEacm0L._SL500_.jpg","2"
"htc vive","Gaming","HTC Vive XR Elite with Deluxe Pack — Mixed Reality and PC VR Headset + Controllers","$877.94","$398.68 (31%)","31","https://www.amazon.ca/dp/B0D6D5Q5M2?tag=lesdealsduw02-20&linkCode=osi&th=1&psc=1","https://m.media-amazon.com/images/I/31hoQRpAMfL._SL500_.jpg","1"
"ice maker","Kitchen","ecozy Smart Ice Makers Countertop, Portable Ice Maker with App Remote & Voice Control, 9 Bullet Ice Cubes in 6 Mins, 26lbs/24Hrs, Self-Cleaning, Quiet Ice Maker Machine for Home Kitchen Office RV","$89.99","$39.99 (31%)","31","https://www.amazon.ca/dp/B0D7M7CZK4?tag=lesdealsduw02-20&linkCode=osi&th=1&psc=1","https://m.media-amazon.com/images/I/41dJku3syNL._SL500_.jpg","2"
"iphone case","Smartphones","QLTYPRI Compatible with iPhone 13 Case/iPhone 14 Case, Cute Curly Wave Frame Clear Case for Girls Women, Transparent Soft Silicone TPU Bumper Shockproof Protective Cover for iPhone 13/14 - White","$10.99","$5.00 (31%)","31","https://www.amazon.ca/dp/B0C13X2HD5?tag=lesdealsduw02-20&linkCode=osi&th=1&psc=1","https://m.media-amazon.com/images/I/41JxStcM0cL._SL500_.jpg","2"
"knives","Kitchen","Cuisinart 15-Piece Kitchen Knife Block Set, Stainless Steel, Black (SSC-15C)","$80.99","$36.81 (31%)","31","https://www.amazon.ca/dp/B00LLZYG1W?tag=lesdealsduw02-20&linkCode=osi&th=1&psc=1","https://m.media-amazon.com/images/I/41UvFvTlDaL._SL500_.jpg","2"
"ladle","Kitchen","RSVP International Endurance Canning Collection Non-Reactive 18/8 Stainless Steel, Dishwasher Safe, Ladle, 13-1/2""","$22.18","$9.81 (31%)","31","https://www.amazon.ca/dp/B003FIMO26?tag=lesdealsduw02-20&linkCode=osi&th=1&psc=1","https://m.media-amazon.com/images/I/21nNjXoPWwL._SL500_.jpg","2"
"lg","TV & Video","LG 24U411A-B 23.8"" FHD (1920x1080) IPS Display Computer Monitor, 120Hz Refresh Rate, sRGB 99% (Typ.), USB-C, Reader Mode & Flicker Safe, Dynamic Action Sync, Black Stabilizer, Slim Stand Base, Black","$96.99","$43.00 (31%)","31","https://www.amazon.ca/dp/B0FHKDC59F?tag=lesdealsduw02-20&linkCode=osi&th=1&psc=1","https://m.media-amazon.com/images/I/41FgQKYdoZL._SL500_.jpg","1"
"lunch bags","Kitchen","Expandable Large Lunch Bag, Double Deck Insulated Lunch Box Leakproof Durable Soft Cooler Bag for Men Women Adults Work Construction Beach Picnic Daytrip,16L,Black, GLENKEY","$39.99","$18.00 (31%)","31","https://www.amazon.ca/dp/B0BFXCZD8W?tag=lesdealsduw02-20&linkCode=osi&th=1&psc=1","https://m.media-amazon.com/images/I/41+IqAZyMPL._SL500_.jpg","2"
"mascara","Beauty & Personal Care","COVERGIRL - Lash Blast Fusion Water Resistant Mascara - Packaging May Vary , Very Black - 885","$8.99 ($68.63 / 100 ml)","$4.00 (31%)","31","https://www.amazon.ca/dp/B0043P0G0C?tag=lesdealsduw02-20&linkCode=osi&th=1&psc=1","https://m.media-amazon.com/images/I/31u43u0NSHL._SL500_.jpg","2"
"mic stand","Audio & Music","PYLE Microphone Stand Heavy Duty - Mic Stand Height Adjustable 51.2'' to 78.75'', w/Extendable Telescoping Boom Arm, Very Sturdy Tripod Base- Ideal for Studio or Performance Use- Black","$43.99","$20.00 (31%)","31","https://www.amazon.ca/dp/B00SVRLPYY?tag=lesdealsduw02-20&linkCode=osi&th=1&psc=1","https://m.media-amazon.com/images/I/21vZRErGN-L._SL500_.jpg","2"
"multimeter","Tools","AstroAI Digital Clamp Meter Multimeter 2000 Counts Amp Voltage Tester Auto-ranging with AC/DC Voltage, AC Current, Resistance, Capacitance, Continuity, Live Wire Test, Non-contact Voltage Detection","$36.99","$16.99 (31%)","31","https://www.amazon.ca/dp/B08MTTX66X?tag=lesdealsduw02-20&linkCode=osi&th=1&psc=1","https://m.media-amazon.com/images/I/416l1pMq2GL._SL500_.jpg","1"
"outdoor furniture","Outdoor & Camping","KOTEK 3 Piece Patio Furniture Set, Outdoor Conversation Set with Washable Cushions & Tempered Glass Tabletop, PE Rattan Wicker Bistro Set for Porch, Garden, Balcony (Red)","$239.99","$110.00 (31%)","31","https://www.amazon.ca/dp/B0BYZZNK8W?tag=lesdealsduw02-20&linkCode=osi&th=1&psc=1","https://m.media-amazon.com/images/I/41LFxQTj-CL._SL500_.jpg","1"
"pet treats","Pet Supplies","DreamBone Mini Dog Treats, Chicken, Rawhide Alternative Dog Chews, 45 Mini Bones, 720g","$17.28 ($24.00 / kg)","$7.70 (31%)","31","https://www.amazon.ca/dp/B091D45L3R?tag=lesdealsduw02-20&linkCode=osi&th=1&psc=1","https://m.media-amazon.com/images/I/51jVAFdbGlL._SL500_.jpg","2"
"ph meter","Tools","Sonkir Soil pH Meter, MS02 3-in-1 Soil Moisture/Light/pH Tester Gardening Tool Kits for Plant Care, Great for Garden, Lawn, Farm, Indoor & Outdoor Use (Green)","$17.99","$8.00 (31%)","31","https://www.amazon.ca/dp/B07BR52P26?tag=lesdealsduw02-20&linkCode=osi&th=1&psc=1","https://m.media-amazon.com/images/I/41TsWY51fbL._SL500_.jpg","2"
"pool noodles","Outdoor & Camping","Pool Swim Noodles 2.6x60 Inch Solid Foam Pool Swim Noodle Lightweight Foam Noodles for Kids Floating Swimming Pool Noodles. (A)","$12.99","$5.89 (31%)","31","https://www.amazon.ca/dp/B0DJLLKGKG?tag=lesdealsduw02-20&linkCode=osi&th=1&psc=1","https://m.media-amazon.com/images/I/41egbBTJPqL._SL500_.jpg","1"
"pressure gauge","Tools","AstroAI Digital Tire Pressure Gauge with Replaceable AAA Batteries, 150 PSI 4 Settings Industrial Tire Gauge for Car Truck Bicycle Backlit LCD Non-Slip Grip Car Accessories(Black)","$17.99","$8.00 (31%)","31","https://www.amazon.ca/dp/B07Y9HS7GT?tag=lesdealsduw02-20&linkCode=osi&th=1&psc=1","https://m.media-amazon.com/images/I/31UUJ9TUT3L._SL500_.jpg","1"
"pressure gauge","Tools","AstroAI Tire Pressure Gauge (10-75PSI) with 4 Black Stem Caps Stainless Steel Body and Metal Made Nozzle 3 Measurements for Vehicles Tire Pressure Monitor (2 Pack)","$12.99","$5.82 (31%)","31","https://www.amazon.ca/dp/B07X8GLGK3?tag=lesdealsduw02-20&linkCode=osi&th=1&psc=1","https://m.media-amazon.com/images/I/31uQAyiXStL._SL500_.jpg","1"
"pressure washer","Automotive","Birtechway Pressure Washer 4000PSI 2.8GPM Power Washer with 55FT Total Long & Upgraded Foam Cannon, Electric Pressure Washer for Car Driveway Patio Fence Walls Gardens Yards","$109.99","$50.00 (31%)","31","https://www.amazon.ca/dp/B0DRD1L1BG?tag=lesdealsduw02-20&linkCode=osi&th=1&psc=1","https://m.media-amazon.com/images/I/41ij3159RxL._SL500_.jpg","2"
"pressure washer","Automotive","Jowque Electric Pressure Washer 4800 PSI 2.8 GPM, Power Washers Electric Powered with 4 Nozzles and Foam Cannon, High Pressure Cleaner Machine for Cars, Patio, Driveway, Home Cleaning (Green)","$89.99","$40.00 (31%)","31","https://www.amazon.ca/dp/B0F5PP6QV4?tag=lesdealsduw02-20&linkCode=osi&th=1&psc=1","https://m.media-amazon.com/images/I/41O-PX0bg7L._SL500_.jpg","2"
"printer","Computers & Tech","HP Envy Inspire 7958e All-in-One Printer (Amazon Exclusive)","$179.99","$79.16 (31%)","31","https://www.amazon.ca/dp/B0BCCMCRY8?tag=lesdealsduw02-20&linkCode=osi&th=1&psc=1","https://m.media-amazon.com/images/I/31E2uO4Dq+L._SL500_.jpg","2"
"salt","Food","Sea Salt - 250 grams of Large Salt Flakes - Hand Harvested on Vancouver Island - Perfect for Seasoning, Baking, Cooking, and Finishing - All Natural Flaked Salt","$9.65 ($3.86 / 100 g)","$4.30 (31%)","31","https://www.amazon.ca/dp/B083X9RPR2?tag=lesdealsduw02-20&linkCode=osi&th=1&psc=1","https://m.media-amazon.com/images/I/5128kqvAZiL._SL500_.jpg","2"
"shoes","Clothing & Accessories","New Balance Men's Fresh Foam X 1440 V1 Running Shoe, Slate Grey/Castlerock/Sea Salt, 8 W","$71.94","$33.05 (31%)","31","https://www.amazon.ca/dp/B0D1LGM3NG?tag=lesdealsduw02-20&linkCode=osi&th=1&psc=1","https://m.media-amazon.com/images/I/41UGtFDrTxL._SL500_.jpg","2"
"sticky notes","Office","HQCME 9 Pack Lined Sticky Notes, 4X6 in, 9 Pastel Colors Large Ruled Stickies Colorful Super Sticking Power Memo Pads Strong Adhesive, Sticky Notes with Lines for Home, Office","$10.99","$5.00 (31%)","31","https://www.amazon.ca/dp/B0CCVWXXRT?tag=lesdealsduw02-20&linkCode=osi&th=1&psc=1","https://m.media-amazon.com/images/I/41XlLbpihVL._SL500_.jpg","1"
"streaming lights","Cameras & Photography","NEEWER BASICS LED Video Light, 2 Pack Studio Panel Key Lighting Kit with Tripod Stands & Filters, Bi Color Dimmable Portable 3200~5600K CRI95 750lux for Photography Recording Streaming Podcast, BP66","$45.91","$21.08 (31%)","31","https://www.amazon.ca/dp/B0DJXMFRN2?tag=lesdealsduw02-20&linkCode=osi&th=1&psc=1","https://m.media-amazon.com/images/I/419N7pw+kPL._SL500_.jpg","2"
"sunglasses","Clothing & Accessories","Breaksun Retro Oval Sunglasses for Women Men Fashion Small Oval Sunglasses 90s Vintage Shades, 2 Pack (A1 Black/Grey+ Leopard/G15), MM","$7.22","$3.18 (31%)","31","https://www.amazon.ca/dp/B0C68QGFX4?tag=lesdealsduw02-20&linkCode=osi&th=1&psc=1","https://m.media-amazon.com/images/I/41as3dv2+UL._SL500_.jpg","1"
"tennis shoes","Clothing & Accessories","adidas Men's CourtJam Control 3 Tennis, Core Black/White/Grey Four, 11","$82.43","$37.57 (31%)","31","https://www.amazon.ca/dp/B0BZQH2H4J?tag=lesdealsduw02-20&linkCode=osi&th=1&psc=1","https://m.media-amazon.com/images/I/31JyUFvmb+L._SL500_.jpg","1"
"usb adapter","Computers & Tech","Anker 2-Pack Dual Port 12W USB A Charger Block with Foldable Plug, Charging Box Brick, Cube for iPhone 16 15 14 13 12 Pro Max, Galaxy S22 S21 Note 20","$19.99","$9.00 (31%)","31","https://www.amazon.ca/dp/B07DFWKBF7?tag=lesdealsduw02-20&linkCode=osi&th=1&psc=1","https://m.media-amazon.com/images/I/21HMyWLDOQL._SL500_.jpg","1"
"usb wifi adapter","Networking & Connectivity","TP-Link AXE5400 WiFi 6E USB Adapter for Desktop PC (Archer TXE70UH) - Tri-Band Wireless Network Adapter, Ultra-Low Latency, MU-MIMO, OFDMA, Refined Security, WPA3, Supports Windows 11/10","$54.99","$25.00 (31%)","31","https://www.amazon.ca/dp/B0D23YBBQ6?tag=lesdealsduw02-20&linkCode=osi&th=1&psc=1","https://m.media-amazon.com/images/I/21if5zGeazL._SL500_.jpg","2"
"vacuum sealer","Kitchen","Mesliese Vacuum Sealer Machine, 85kPa 120W Automatic Food Sealer, Powerful Sealing System, Build-in Cutter | Bags Storage | Moist Mode and Air Suction Hose | 2 Bag Rolls and 5pcs Pre-cut Bags","$89.99","$40.00 (31%)","31","https://www.amazon.ca/dp/B0D8BB83Y1?tag=lesdealsduw02-20&linkCode=osi&th=1&psc=1","https://m.media-amazon.com/images/I/41pEdOT1LVL._SL500_.jpg","2"
"vr carrying case","Gaming","Hard Carrying Case for Meta Quest 3S, VR Gaming Headset and Touch Controllers Accessories Travel Case, Small Hard Shell Storage Case for Oculus Quest 3S/Quest 3/Vision Pro, Black","$20.70","$9.29 (31%)","31","https://www.amazon.ca/dp/B0DH28LMCX?tag=lesdealsduw02-20&linkCode=osi&th=1&psc=1","https://m.media-amazon.com/images/I/414gsYTJVVL._SL500_.jpg","1"
"watercolor","Arts & Crafts","Learn to Watercolor: 20 Step-by-Step Beginner-Friendly Lessons on Watercolor Paper - Includes Watercolor Pad with Sketches – No Drawing Required!","$22.91","$10.08 (31%)","31","https://www.amazon.ca/dp/0760391416?tag=lesdealsduw02-20&linkCode=osi&th=1&psc=1","https://m.media-amazon.com/images/I/51zbMP1l1CL._SL500_.jpg","1"
"watering can","Garden","Small Watering Can Indoor Plants - 12 oz Mini Metal Watering Can with Long Spout Rust-Proof Stainless Steel Tiny Watering Pot for Small Indoor Plants Home & Office Black","$13.03","$5.96 (31%)","31","https://www.amazon.ca/dp/B0FCY5RXJG?tag=lesdealsduw02-20&linkCode=osi&th=1&psc=1","https://m.media-amazon.com/images/I/41lOvz1wDaL._SL500_.jpg","2"
"window cleaner","Home & Cleaning","Bon Ami Power Foam Glass and Window Cleaner, Removes Fingerprints, Smudges, and Smears, 560g","$5.00 ($0.89 / 100 g)","$2.29 (31%)","31","https://www.amazon.ca/dp/B003M5MLIO?tag=lesdealsduw02-20&linkCode=osi&th=1&psc=1","https://m.media-amazon.com/images/I/41PyLP5JOOL._SL500_.jpg","1"
"window valance","Bedroom","Lazzzy Kitchen Tie Up Valance Curtain Linen Floral Farmhouse Valance for Living Room Bathroom Bedroom Window Treatments Small Cafe Curtian 20 Inch Rod Pocket 1 Panel Blue on Beige","$23.99","$11.00 (31%)","31","https://www.amazon.ca/dp/B09J54F7VP?tag=lesdealsduw02-20&linkCode=osi&th=1&psc=1","https://m.media-amazon.com/images/I/5177wcoF7kL._SL500_.jpg","1"
"womens pants","Clothing & Accessories","onlypuff Women Pants Flowy Pants Drawstring Waist Wide Leg Palazzo Baggy Pants Loose Fit with Pockets","$19.99","$8.80 (31%)","31","https://www.amazon.ca/dp/B0F9P1VGND?tag=lesdealsduw02-20&linkCode=osi&th=1&psc=1","https://m.media-amazon.com/images/I/31NxS7QOdlL._SL500_.jpg","2"
"air fryer","Kitchen","Chefman Air Fryer – 4 QT Compact Airfryer for Quick & Easy Meals, Features Hi-Fry Technology for Extra Crisp, Easy-View Window, Touch Controls with 4 Presets, Nonstick & Dishwasher Safe Basket - Black","$77.49","$32.50 (30%)","30","https://www.amazon.ca/dp/B0D5FRXYMJ?tag=lesdealsduw02-20&linkCode=osi&th=1&psc=1","https://m.media-amazon.com/images/I/41bGcYTIvpL._SL500_.jpg","1"
"aluminum foil","Kitchen","Strongmor Aluminum Foil Heavy Duty 25ft X 12in","$6.99","$3.00 (30%)","30","https://www.amazon.ca/dp/B0D67RT9RC?tag=lesdealsduw02-20&linkCode=osi&th=1&psc=1","https://m.media-amazon.com/images/I/41RLsBtVGzL._SL500_.jpg","1"
"apple vision pro","Gaming","SOULWIT TPU Protective Case Cover for Apple Vision Pro VR Headset, Durable & Slim Fit Screen Protector Accessory, Without Affecting Tracking Scans - Non-Holed","$14.67","$6.28 (30%)","30","https://www.amazon.ca/dp/B0CZKQF24S?tag=lesdealsduw02-20&linkCode=osi&th=1&psc=1","https://m.media-amazon.com/images/I/41c8Ehd7AYL._SL500_.jpg","2"
"backpacking gear","Outdoor & Camping","Outmate Premium Aluminum D-Ring Locking Carabiners (Pack of 6) - Lightweight & Durable for Hiking, Camping, Keychains, Dog Leashes & More - NOT for Climbing","$13.95","$6.00 (30%)","30","https://www.amazon.ca/dp/B01GA3N9MQ?tag=lesdealsduw02-20&linkCode=osi&th=1&psc=1","https://m.media-amazon.com/images/I/51F3krb4kiL._SL500_.jpg","2"
"bath bombs","Beauty & Personal Care","Halloween Bath Bombs for Kids & Women, Handmade Spooky Bath Bomb Set of 6 Fun Shapes – Perfect Gifts for Kids, Skin care Bathbombs for Girls’ Spooky Celebration","$13.99 ($3.11 / 100 g)","$6.00 (30%)","30","https://www.amazon.ca/dp/B0F74CRTMT?tag=lesdealsduw02-20&linkCode=osi&th=1&psc=1","https://m.media-amazon.com/images/I/51BTz909YAL._SL500_.jpg","2"
"bathroom organizer","Home & Cleaning","Cicilyna 2 Pack Under Sink Organizer, 2 Tier Bathroom Cabinet Organizers and Storage with Hook, Multi-purpose Storage Basket Shelf for Kitchen, Black","$31.99 ($16.00 / Pack)","$14.00 (30%)","30","https://www.amazon.ca/dp/B0B7WYQ7RP?tag=lesdealsduw02-20&linkCode=osi&th=1&psc=1","https://m.media-amazon.com/images/I/51S3ynGuVWL._SL500_.jpg","2"
"binoculars","Outdoor & Camping","18X70 High Power Binoculars for Adults-Outdoor and Astronomy Binocular,Large Aperture for Long Distance Viewing with Smartphone Adapter Mount and Binocular Tripod Adapter","$132.13","$57.86 (30%)","30","https://www.amazon.ca/dp/B0D9DH4HR1?tag=lesdealsduw02-20&linkCode=osi&th=1&psc=1","https://m.media-amazon.com/images/I/41vBQnUsKcL._SL500_.jpg","2"
"books","Books","One Golden Summer","$18.86","$8.09 (30%)","30","https://www.amazon.ca/dp/0735247293?tag=lesdealsduw02-20&linkCode=osi&th=1&psc=1","https://m.media-amazon.com/images/I/4135NlN5MzL._SL500_.jpg","2"
"books","Books","The Tenant","$18.89","$8.10 (30%)","30","https://www.amazon.ca/dp/1464227314?tag=lesdealsduw02-20&linkCode=osi&th=1&psc=1","https://m.media-amazon.com/images/I/41MB3zKti4L._SL500_.jpg","2"
"boots","Clothing & Accessories","DREAM PAIRS Women's Knee High Buckle Boots Motorcycle Biker Boots Square Toe Chunky Mid Heel Fashion Buckles Riding Boots,Size 7,Black,SDKB2416W","$62.99","$27.00 (30%)","30","https://www.amazon.ca/dp/B0CTJJ74PB?tag=lesdealsduw02-20&linkCode=osi&th=1&psc=1","https://m.media-amazon.com/images/I/31w8wnltq4L._SL500_.jpg","2"
"command hooks","Home & Cleaning","Jwxstore 24 Pack Wall Hooks for Hanging 33lb(Max) Heavy Duty Self Adhesive Hooks Transparent Waterproof Sticky Hooks for Keys Bathroom Shower Outdoor Kitchen Door Home Improvement Utility Hooks","$13.99 ($0.58 / count)","$6.00 (30%)","30","https://www.amazon.ca/dp/B07KFDML8G?tag=lesdealsduw02-20&linkCode=osi&th=1&psc=1","https://m.media-amazon.com/images/I/41207stgkTL._SL500_.jpg","2"
"compression socks","Health & Wellness","Physix Gear Sport Compression Socks for Men & Women 20-30 mmHg, Gry LXL","$14.61","$6.35 (30%)","30","https://www.amazon.ca/dp/B01J4MF53Q?tag=lesdealsduw02-20&linkCode=osi&th=1&psc=1","https://m.media-amazon.com/images/I/41Pgpv9FKiL._SL500_.jpg","1"
"cooling towel","Outdoor & Camping","6 Pack Cooling Towel (40""x12""), Cooling Towels for Instant Cooling,Sports Towel,for Yoga, Sport, Running, Gym, Workout,Camping, Fitness, Workout,Hot Weather Travel","$15.99","$7.00 (30%)","30","https://www.amazon.ca/dp/B0D4ZDQP5T?tag=lesdealsduw02-20&linkCode=osi&th=1&psc=1","https://m.media-amazon.com/images/I/41p8IYZ8EUL._SL500_.jpg","1"
