"keyword","category","title","price","savings","percent","link","imageUrl","page"
"pet bed","Pet Supplies","Bunlitent 23'' inch Calming Dog Bed, Anti-Anxiety Donut Small Dog Bed, Warming Cozy Soft Cute Round Washable, Marshmallow Cuddler Nest Puppy Bed, Grey","$16.99","$4.00 (19%)","19","https://www.amazon.ca/dp/B0D5QPPPQV?tag=lesdealsduw02-20&linkCode=osi&th=1&psc=1","https://m.media-amazon.com/images/I/31+wpk52FxL._SL500_.jpg","2"
"pet bed","Pet Supplies","VERZEY Medium/Large Dog Bed Mat Crate Pad, 36"" Metal Crates Fit, Ultra-Soft, Machine Washable & Anti-Slip Kennel Mat, Cozy Sleeping Mat for Medium/Large Dogs, Gray, 36L x 23W x 1H Inches","$29.99 ($29.99 / meter)","$7.19 (19%)","19","https://www.amazon.ca/dp/B0B591N61M?tag=lesdealsduw02-20&linkCode=osi&th=1&psc=1","https://m.media-amazon.com/images/I/41JJXyrUAhL._SL500_.jpg","2"
"polymer clay","Arts & Crafts","Polymer Clay 50 Colors, QMay Modeling Clay for Kids DIY Starter Kits, Oven Baked Model Clay with Sculpting Tools, Non-Toxic, Non-Sticky, Ideal Gift for Children and Artists","$21.99","$5.00 (19%)","19","https://www.amazon.ca/dp/B07YFFYD77?tag=lesdealsduw02-20&linkCode=osi&th=1&psc=1","https://m.media-amazon.com/images/I/51pElrEXQ+L._SL500_.jpg","2"
"pool","Outdoor & Camping","BerrysParadise Foldable Dog Pool with Sprinkler, 87 in Extra Large Dog Swimming Pool, Outdoor Collapsible Pet Bathing Tub for Pets Dogs Cats and Kids (87"" D x 12"" H, Blue)","$51.99","$12.00 (19%)","19","https://www.amazon.ca/dp/B0DS21H271?tag=lesdealsduw02-20&linkCode=osi&th=1&psc=1","https://m.media-amazon.com/images/I/41Yx23Xy3+L._SL500_.jpg","1"
"power bank","Power & Chargers","JIGA Portable Charger Power Bank 30000mAh USB C 22.5W Fast Charging External Battery Pack PD QC4.0 with Flashlight 3 Outputs & 2 Inputs Battery Bank for iPhone Samsung Galaxy iPad etc","$21.99","$5.00 (19%)","19","https://www.amazon.ca/dp/B0DGPTDTGL?tag=lesdealsduw02-20&linkCode=osi&th=1&psc=1","https://m.media-amazon.com/images/I/31H9GHR858L._SL500_.jpg","2"
"pressure cooker","Kitchen","Hawkins CB40 Hard Anodised Pressure Cooker, 4-Liter, Contura Black","$70.49","$16.21 (19%)","19","https://www.amazon.ca/dp/B00SX03I76?tag=lesdealsduw02-20&linkCode=osi&th=1&psc=1","https://m.media-amazon.com/images/I/41-7HOr4LsL._SL500_.jpg","1"
"printer","Computers & Tech","Brother DCP-L2640DW Business-Ready Wireless Monochrome Multifunction Laser Printer – Print, Copy, Scan, Mobile Printing, 700 Prints in-Box, Toner with a Refresh Subscription","$219.99","$50.00 (19%)","19","https://www.amazon.ca/dp/B0CPLFTPCV?tag=lesdealsduw02-20&linkCode=osi&th=1&psc=1","https://m.media-amazon.com/images/I/31x6G9x3JSL._SL500_.jpg","1"
"printer paper","Office","A1 Letter Size 8.5""x11"" Copy Paper","$52.00","$12.00 (19%)","19","https://www.amazon.ca/dp/B01JRYVIUK?tag=lesdealsduw02-20&linkCode=osi&th=1&psc=1","https://m.media-amazon.com/images/I/41Zl-6ZDpLL._SL500_.jpg","1"
"printer paper","Office","5,000 Sheets PaperPlex ® Premier Multipurpose Paper, Copy/Copier/Inkjet Printer/Fax/Photocopy Paper, 95 Brightness, 20 lb, Letter Size 8.5''x11'' (8-1/2 x 11), 500 Sheets/Ream, 10 Reams","$68.00","$15.53 (19%)","19","https://www.amazon.ca/dp/B07517JGJ5?tag=lesdealsduw02-20&linkCode=osi&th=1&psc=1","https://m.media-amazon.com/images/I/31KoHP6x4XL._SL500_.jpg","1"
"protein bars","Health & Wellness","Pure Protein Bars - Nutritious, Gluten Free bar, made with Whey protein blend - low sugar, protein snack. Deliciously satisfying. Made in Canada, Cookies and Cream (Pack of 6)","$10.47 ($3.49 / 100 g)","$2.52 (19%)","19","https://www.amazon.ca/dp/B0CQ6Q5NWJ?tag=lesdealsduw02-20&linkCode=osi&th=1&psc=1","https://m.media-amazon.com/images/I/41LIRO1UBzL._SL500_.jpg","1"
"protein bars","Health & Wellness","Pure Protein Bars - Nutritious, Gluten Free protein bar & Bars - Nutritious, Gluten Free protein bar","$20.94 ($1.74 / count)","$5.04 (19%)","19","https://www.amazon.ca/dp/B0D2TZB32S?tag=lesdealsduw02-20&linkCode=osi&th=1&psc=1","https://m.media-amazon.com/images/I/41A5e9+M-NL._SL500_.jpg","1"
"rice cooker","Kitchen","CUCKOO CR-0375FW | 3-Cup (Uncooked) Micom Rice Cooker | 10 Menu Options: Oatmeal, Brown Rice & More, Touch-Screen, Nonstick Inner Pot | White (CR-0375FW)","$104.99","$25.00 (19%)","19","https://www.amazon.ca/dp/B0B4MYBLZQ?tag=lesdealsduw02-20&linkCode=osi&th=1&psc=1","https://m.media-amazon.com/images/I/31XKNE9EMvL._SL500_.jpg","1"
"robe","Bedroom","Ekouaer Womens House Robes Short Knit Bathrobe Waffle Spa Robes Soft Dressing Gown, Large","$32.29","$7.70 (19%)","19","https://www.amazon.ca/dp/B0C6TMJR6T?tag=lesdealsduw02-20&linkCode=osi&th=1&psc=1","https://m.media-amazon.com/images/I/51A72S8r--L._SL500_.jpg","1"
"robe","Bedroom","HEARTNICE Womens Cotton Robe, Soft Kimono Spa Knit Long Bathrobe Lightweight Loungewear (Grey mel.,M)","$29.99","$7.00 (19%)","19","https://www.amazon.ca/dp/B079GWD2S5?tag=lesdealsduw02-20&linkCode=osi&th=1&psc=1","https://m.media-amazon.com/images/I/31jECD1AgsL._SL500_.jpg","2"
"school backpack","Kids & Education","Backpack for Women Men, Lightweight School Backpack 15.6 Inch Travel Laptop Backpack Waterproof Bookbag Casual Carry-on Daypack for School Sports College Travel, Black","$28.47","$6.52 (19%)","19","https://www.amazon.ca/dp/B0BQMF7LYZ?tag=lesdealsduw02-20&linkCode=osi&th=1&psc=1","https://m.media-amazon.com/images/I/419ivfOvpFL._SL500_.jpg","1"
"seeds","Garden","Classic Heirloom Vegetables | 12 Varieties of Heritage Vegetable Seeds for Home Gardens | Beginner-Friendly Gardening Seeds for Planting | Limitless Growth","$16.99","$4.00 (19%)","19","https://www.amazon.ca/dp/B09TD1TSL9?tag=lesdealsduw02-20&linkCode=osi&th=1&psc=1","https://m.media-amazon.com/images/I/51IYRBTWLHL._SL500_.jpg","2"
"silk pillowcase","Bedroom","Adubor Silk Pillowcase - 100% Pure Mulberry Silk, 23 Momme 6A Grade Fibers, 900 Thread Count, Silk Pillow Cases for Hair and Skin Health, with Hidden Zipper (Standard 20''×26'', Lvory White, 1PC)","$21.99","$5.22 (19%)","19","https://www.amazon.ca/dp/B07VKRTKRM?tag=lesdealsduw02-20&linkCode=osi&th=1&psc=1","https://m.media-amazon.com/images/I/31kq6e+GtIL._SL500_.jpg","1"
"slow cooker","Kitchen","Crock-Pot Large 8-Quart Programmable Slow Cooker with Auto Warm Setting Black Stainless Steel","$129.87","$30.12 (19%)","19","https://www.amazon.ca/dp/B07DFVY29X?tag=lesdealsduw02-20&linkCode=osi&th=1&psc=1","https://m.media-amazon.com/images/I/41hpxKhb5fL._SL500_.jpg","2"
"smart alarm","Security","ecozy Sunrise Alarm Clock for Heavy Sleepers, Smart Wake Up Light with Sunrise/Sunset Simulation, App & Voice Controlled, Natural Sounds & FM Radio, 4 Alarms & Snooze, 8 Colors Night Light for Bedroom","$56.99","$13.00 (19%)","19","https://www.amazon.ca/dp/B09YHBRHC4?tag=lesdealsduw02-20&linkCode=osi&th=1&psc=1","https://m.media-amazon.com/images/I/31OicpbkfcL._SL500_.jpg","1"
"snow boots","Clothing & Accessories","NORTIV 8 Men's Waterproof Hiking Winter Snow Boots Insulated Fur Liner Lightweight Outdoor Tall Bootie,Size 10,Black,QUEBEC-M","$69.99","$16.00 (19%)","19","https://www.amazon.ca/dp/B07V2DJ52J?tag=lesdealsduw02-20&linkCode=osi&th=1&psc=1","https://m.media-amazon.com/images/I/31w5lP8PvlL._SL500_.jpg","1"
"socket set","Tools","Amazon Basics Mechanic's 201-Piece Tool Socket Set With Case, SAE/Metric","$127.99","$30.38 (19%)","19","https://www.amazon.ca/dp/B074MFYGSF?tag=lesdealsduw02-20&linkCode=osi&th=1&psc=1","https://m.media-amazon.com/images/I/51Y+-kG9JdL._SL500_.jpg","1"
"solar protection","Beauty & Personal Care","codree Solar Reel Protective Cover for Pool up to 16 FT Wide, Waterproof Pool Reel Cover Solar Blanket Cover for Above Ground and Inground Pools","$19.29","$4.46 (19%)","19","https://www.amazon.ca/dp/B098QPDJ1H?tag=lesdealsduw02-20&linkCode=osi&th=1&psc=1","https://m.media-amazon.com/images/I/41LhIM7lacL._SL500_.jpg","1"
"spinner luggage","Travel","Amazon Basics 21-Inch Hardside Carry-On Luggage, Hardshell Suitcase With Wheels, Expandable For Up to 25% More Space, With Scratch-Resistant Surface, Four Multi-directional Wheels, Navy Blue","$89.99","$21.75 (19%)","19","https://www.amazon.ca/dp/B0711DPSXT?tag=lesdealsduw02-20&linkCode=osi&th=1&psc=1","https://m.media-amazon.com/images/I/31C7EKKBBiL._SL500_.jpg","1"
"sprinkler","Garden","Apollo Exports International Rainforest Ecological Sprinkler - Green & Silver, Impulse Style, Rubber Material, Garden Sprinkler, 1900 sq. ft. Coverage, 12"" Spike, Low Pressure Well Systems Compatible","$15.00","$3.59 (19%)","19","https://www.amazon.ca/dp/B07PH428FV?tag=lesdealsduw02-20&linkCode=osi&th=1&psc=1","https://m.media-amazon.com/images/I/317kOM3tTkL._SL500_.jpg","2"
"summer dress","Clothing & Accessories","WNEEDU Women's Summer Dress Halter Neck Sleeveless Mini Dress Casual Floral Beach Cover ups wih Pockets, Black 2XL","$12.99","$3.00 (19%)","19","https://www.amazon.ca/dp/B0CXPWDPTS?tag=lesdealsduw02-20&linkCode=osi&th=1&psc=1","https://m.media-amazon.com/images/I/31Adz9Nkg6L._SL500_.jpg","1"
"survival backpack","Outdoor & Camping","QT&QY 45L Military Tactical Backpack combat Molle Army Assault Pack CCW 3 Day survival Bag Hiking rucking Rucksack heavy duty backpack","$45.99","$11.00 (19%)","19","https://www.amazon.ca/dp/B087RF22S8?tag=lesdealsduw02-20&linkCode=osi&th=1&psc=1","https://m.media-amazon.com/images/I/41Ie7BVZV-L._SL500_.jpg","1"
"survival food","Outdoor & Camping","Mountain House Beef Stew| Freeze Dried Survival & Emergency Food | #10 Can | Gluten-Free | Entree Meal | Easy to Prepare | Delicious and Nutritious | Single Can","$79.99","$18.20 (19%)","19","https://www.amazon.ca/dp/B0988BDCRW?tag=lesdealsduw02-20&linkCode=osi&th=1&psc=1","https://m.media-amazon.com/images/I/51E2CfoYPOL._SL500_.jpg","1"
"thermal underwear","Clothing & Accessories","CL convallaria Thermal Underwear for Men Long Johns Fleece Lined Base Layer Top and Bottom Set for Cold Weather Black, L","$28.99","$7.00 (19%)","19","https://www.amazon.ca/dp/B08DQYVLZ4?tag=lesdealsduw02-20&linkCode=osi&th=1&psc=1","https://m.media-amazon.com/images/I/31Cfr4nH7VL._SL500_.jpg","2"
"tv mount","TV & Video","USX Mount UL Listed Full Motion TV Wall Mount for Most 37-86 inch TV, Swivel and Tilt Mount with Dual Articulating Arms Up to 132lbs, VESA 600x400mm, 16"" Wood Studs, XML019","$69.99","$15.90 (19%)","19","https://www.amazon.ca/dp/B08M92P11W?tag=lesdealsduw02-20&linkCode=osi&th=1&psc=1","https://m.media-amazon.com/images/I/41cUEKxouxL._SL500_.jpg","2"
"usb c cable","Power & Chargers","INIU USB C to USB C Cable, [6.6ft 100W, 2Pack ] Fast Charging PD USB C Charger Cable, Nylon Braided Type C Cable for Samsung S23 S22 iPhone 16 15 Pro Max MacBook iPad Dell Google Pixel, etc","$15.29","$3.70 (19%)","19","https://www.amazon.ca/dp/B08J2HXYPH?tag=lesdealsduw02-20&linkCode=osi&th=1&psc=1","https://m.media-amazon.com/images/I/41Ksq-Qp8EL._SL500_.jpg","2"
"vitamin c","Health & Wellness","Jamieson Vitamin C 250 mg Gummies Natural Tangy Orange Flavour, Supports Immune Health, Strong Teeth and Bones. Family Friendly (3+), Vegetarian, Non-GMO, Gelatin-Free, No Artificial Flavours, Colours, or Preservatives, 60 Count, Proudly Canadian","$7.74 ($0.13 / count)","$1.85 (19%)","19","https://www.amazon.ca/dp/B00HHYHTQK?tag=lesdealsduw02-20&linkCode=osi&th=1&psc=1","https://m.media-amazon.com/images/I/41dtmEhSddL._SL500_.jpg","1"
"weight scale","Health & Wellness","Etekcity Digital Body Weight Bathroom Scale, Large Blue LCD Backlight Display, High Precision Measurements,6mm Tempered Glass, 400 Pounds","$21.98","$5.01 (19%)","19","https://www.amazon.ca/dp/B01G8LWT26?tag=lesdealsduw02-20&linkCode=osi&th=1&psc=1","https://m.media-amazon.com/images/I/31y2IAotxsL._SL500_.jpg","2"
"western boots","Clothing & Accessories","DREAM PAIRS Womens Cowboy Boots Wide Calf Cowgirl Knee High Boots Comfortable Pull On Zipper Chunky Heel Pointed Toe Embroidered Western Ladies Retro Tall Boot,Size 7.5,Black/Pu,SDKB224W","$64.99","$15.00 (19%)","19","https://www.amazon.ca/dp/B09ZLF94P6?tag=lesdealsduw02-20&linkCode=osi&th=1&psc=1","https://m.media-amazon.com/images/I/31nIDBpEyOL._SL500_.jpg","1"
"whiteboard","Kids & Education","Amazon Basics Small Dry Erase Whiteboard, Magnetic Whiteboard with Marker and Magnets, 27.94 cm x 35.56 cm, Aluminum Frame","$12.99","$3.11 (19%)","19","https://www.amazon.ca/dp/B085PH6Z51?tag=lesdealsduw02-20&linkCode=osi&th=1&psc=1","https://m.media-amazon.com/images/I/21pXGwUfzQL._SL500_.jpg","1"
"wifi extender","Networking & Connectivity","LYZNSMART WiFi Extender","$20.99","$5.00 (19%)","19","https://www.amazon.ca/dp/B0FB8G14YH?tag=lesdealsduw02-20&linkCode=osi&th=1&psc=1","https://m.media-amazon.com/images/I/31clxPHvMcL._SL500_.jpg","2"
"wifi extender","Networking & Connectivity","LYZNSMART WiFi Extender, WiFi Booster Signal Range up to 12880 Sq.ft and 45 Devices, 1200Mbps 6 Antennas Dual Band Wireless Repeater for Home, Internet Booster with Ethernet Port","$20.99","$5.00 (19%)","19","https://www.amazon.ca/dp/B0FB8RP8ZY?tag=lesdealsduw02-20&linkCode=osi&th=1&psc=1","https://m.media-amazon.com/images/I/31Vyqnd2kYL._SL500_.jpg","2"
"womens shirts","Clothing & Accessories","WNEEDU Women's Waffle Knit Tops Button Down V Neck Tunic Long Sleeve Henley Shirts 2025 New Casual Blouses Pure Black M","$16.14","$3.85 (19%)","19","https://www.amazon.ca/dp/B0D83LDJ39?tag=lesdealsduw02-20&linkCode=osi&th=1&psc=1","https://m.media-amazon.com/images/I/41xvGiDMBZL._SL500_.jpg","2"
"womens swimsuits","Clothing & Accessories","SEAFORM Womens Two Piece Swimsuits Wrap Front Bikini High Waisted Bottom Tummy Control Bathing Suits Vintage Print Swimwear, Blue Stripes, Large","$11.15","$2.54 (19%)","19","https://www.amazon.ca/dp/B0B4NY97FV?tag=lesdealsduw02-20&linkCode=osi&th=1&psc=1","https://m.media-amazon.com/images/I/41rnnjWIc8L._SL500_.jpg","1"
"workout clothes","Sports & Fitness","Women Pilates Wrap Workout Top Cross Tie Long Sleeve Crop Tops Ballet Deep V Neck Yoga Shirt Summer, Pink, Small","$13.01","$2.99 (19%)","19","https://www.amazon.ca/dp/B0F1CY1NMN?tag=lesdealsduw02-20&linkCode=osi&th=1&psc=1","https://m.media-amazon.com/images/I/31j35xSP80L._SL500_.jpg","2"
"wrench set","Tools","WORKPRO 8-Piece Flex-Head Ratcheting Combination Wrench Set, SAE 5/16-3/4 in, 72-Teeth, Cr-V Nickel Finish with Organizer Bag","$53.99","$13.00 (19%)","19","https://www.amazon.ca/dp/B06ZY3DG6P?tag=lesdealsduw02-20&linkCode=osi&th=1&psc=1","https://m.media-amazon.com/images/I/51TuV3m924L._SL500_.jpg","1"
"yoga pants","Sports & Fitness","Boerfmian Flare Leggings for Women with Pockets 2pack High Waisted Crossover Flare Leggings Bootcut Yoga Pants","$30.00","$6.99 (19%)","19","https://www.amazon.ca/dp/B0C8TKT3L9?tag=lesdealsduw02-20&linkCode=osi&th=1&psc=1","https://m.media-amazon.com/images/I/31pNcTGGTLL._SL500_.jpg","1"
"zinc","Health & Wellness","Jamieson Zinc 50 mg, Ultra Strength, High Absorption, Supports Immune Health, Tissue Formation, and Healthy Skin. Vegetarian, Non-GMO, Gluten-Free, 90 Tablets, Proudly Canadian","$9.67 ($0.11 / count)","$2.22 (19%)","19","https://www.amazon.ca/dp/B00CP7QKGO?tag=lesdealsduw02-20&linkCode=osi&th=1&psc=1","https://m.media-amazon.com/images/I/41BNMoSVldL._SL500_.jpg","1"
"action camera","Cameras & Photography","AKASO EK7000 4K30FPS 20MP WiFi Action Camera with EIS Ultra HD 131FT Waterproof Underwater Camera Remote Control 4X Zoom Support External Microphone Black","$89.99","$20.00 (18%)","18","https://www.amazon.ca/dp/B0B28F3L8X?tag=lesdealsduw02-20&linkCode=osi&th=1&psc=1","https://m.media-amazon.com/images/I/51xaociWTNL._SL500_.jpg","1"
"acrylic paint","Arts & Crafts","Acrylic Paint Set with 12 Art Brushes, 24 Colors (2 oz/Bottle) Acrylic Paint for Painting Canvas, Wood, Ceramic and Fabric, Paint Set for Beginners, Students and Professional Artist, Rich Pigments","$26.99 ($44.98 / 100 ml)","$6.00 (18%)","18","https://www.amazon.ca/dp/B0D8SWT57F?tag=lesdealsduw02-20&linkCode=osi&th=1&psc=1","https://m.media-amazon.com/images/I/51F-1z8cpGL._SL500_.jpg","2"
"all purpose cleaner","Home & Cleaning","Method All-Purpose Cleaner Spray, Back to School Teacher Supplies, French Lavender, Plant-Based and Biodegradable Formula Perfect for Most Counters, Tiles and More, 28 Fl Oz, (Pack of 4)","$18.68 ($0.01 / Milliliters)","$4.08 (18%)","18","https://www.amazon.ca/dp/B09DQC6Y1X?tag=lesdealsduw02-20&linkCode=osi&th=1&psc=1","https://m.media-amazon.com/images/I/51D2+e5okhL._SL500_.jpg","1"
"apple pencil","Computers & Tech","Apple Pencil Pro","$139.16","$29.84 (18%)","18","https://www.amazon.ca/dp/B0D3J71RM7?tag=lesdealsduw02-20&linkCode=osi&th=1&psc=1","https://m.media-amazon.com/images/I/113ayBRtAuL._SL500_.jpg","1"
"apple watch","Wearables","Apple Watch Ultra 2 [GPS + Cellular 49mm] Smartwatch, Sport Watch with Rugged Black Titanium Case with Dark Green Alpine Loop. Fitness Tracker, Precision GPS, Action Button, Extra-Long Battery Life","$899.97","$199.03 (18%)","18","https://www.amazon.ca/dp/B0DGJ6DQBQ?tag=lesdealsduw02-20&linkCode=osi&th=1&psc=1","https://m.media-amazon.com/images/I/51dt1lYUMHL._SL500_.jpg","2"
"baby gate","Baby","Safety 1st Easy Install Walk-Through Gate, Black","$73.45","$16.54 (18%)","18","https://www.amazon.ca/dp/B0B94S9VBQ?tag=lesdealsduw02-20&linkCode=osi&th=1&psc=1","https://m.media-amazon.com/images/I/31jO4NsBkZL._SL500_.jpg","1"
"baby gate","Baby","Regalo 50"" Extra Wide Gray Expandable Mesh Gate, Pressure Mounted, Includes Rubber Bumpers to Protect Walls","$44.97","$10.00 (18%)","18","https://www.amazon.ca/dp/B092XTZVBX?tag=lesdealsduw02-20&linkCode=osi&th=1&psc=1","https://m.media-amazon.com/images/I/41RxSO4uqOS._SL500_.jpg","2"
"baby swing","Baby","Ingenuity Comfort 2 Go Portable Swing - Fanciful Forest","$77.96","$16.69 (18%)","18","https://www.amazon.ca/dp/B079TFK7HJ?tag=lesdealsduw02-20&linkCode=osi&th=1&psc=1","https://m.media-amazon.com/images/I/31g2ZW43jQL._SL500_.jpg","1"
"backpacking gear","Outdoor & Camping","Ferro Rod Fire Starter Survival Kit, Waterproof Flint and Steel Fire Starter for Camping, Hiking and Backpacking Gear, Green 1 Pack","$13.99","$3.00 (18%)","18","https://www.amazon.ca/dp/B0CB3H4G4R?tag=lesdealsduw02-20&linkCode=osi&th=1&psc=1","https://m.media-amazon.com/images/I/410YeT04yyL._SL500_.jpg","1"
"balance bike","Kids & Education","allobebe Toddler Balance Bike 2 Year Old, 12 Inch Push Bicycle for 2-5 Year Old, No Pedal Bike for Kids with Adjustable Seat and Handlebar","$65.99","$14.00 (18%)","18","https://www.amazon.ca/dp/B0D41LCJJV?tag=lesdealsduw02-20&linkCode=osi&th=1&psc=1","https://m.media-amazon.com/images/I/41k7cdfklgL._SL500_.jpg","1"
"beach blanket","Outdoor & Camping","Beach Blanket Waterproof Sandproof Oversized 95”x 80”,Sand Free Beach Mat with Corner Pockets,Portable Mesh Bag for Beach Festival,Picnic,Travel and Outdoor Camping (Seaturtle)","$26.99","$6.00 (18%)","18","https://www.amazon.ca/dp/B08RXVSVWH?tag=lesdealsduw02-20&linkCode=osi&th=1&psc=1","https://m.media-amazon.com/images/I/512263OFTML._SL500_.jpg","2"
"beach blanket","Outdoor & Camping","Giant Huge Thin Boho Throw Blanket Turkish Beach Blanket Towel Jumbo Extra Large XL XXL Big Oversized Outdoor Picnic Accessories Airplane Travel Essentials Camping Gears Must Haves Yard Yoga Mat Aqua","$26.99","$6.00 (18%)","18","https://www.amazon.ca/dp/B0C9M2CQ4K?tag=lesdealsduw02-20&linkCode=osi&th=1&psc=1","https://m.media-amazon.com/images/I/413KbJ7FmFL._SL500_.jpg","2"
"bedside table","Bedroom","Somdot Black Nightstand, Small Dresser for Bedroom with 2 Drawers, Bedside Table Night Stand End Table with Fabric Bins for Bedroom Kids Closet Dorm Guest Room, Black Rustic Brown","$45.99","$10.00 (18%)","18","https://www.amazon.ca/dp/B087C39L4L?tag=lesdealsduw02-20&linkCode=osi&th=1&psc=1","https://m.media-amazon.com/images/I/31f2WFjQeUL._SL500_.jpg","1"
"bike accessories","Sports & Fitness","Bike Lights, Oldowl USB-C Rechargeable Bike Light Set, Super Bright 6 LED Bike Headlight with Spot & Flood Beam, IP65 Waterproof, 4X4 + 6X6 Lighting Modes, Cycling Mountain Bike Lights Front and Back","$18.89","$4.10 (18%)","18","https://www.amazon.ca/dp/B0BC89C2C7?tag=lesdealsduw02-20&linkCode=osi&th=1&psc=1","https://m.media-amazon.com/images/I/51Wh8MZxiVL._SL500_.jpg","1"
"bluetooth headphones","Audio & Music","soundcore Life Q30 by Anker, Hybrid Active Noise Cancelling Headphones with Multiple Modes, Hi-Res Sound, Custom EQ via App, 50H Playtime, Comfortable Fit, Bluetooth, Multipoint Connection","$89.99","$20.00 (18%)","18","https://www.amazon.ca/dp/B08HMWZBXC?tag=lesdealsduw02-20&linkCode=osi&th=1&psc=1","https://m.media-amazon.com/images/I/31snXvae44L._SL500_.jpg","2"
"body pillow","Bedroom","Meiz Pregnancy Pillows, Pregnancy Pillows for Sleeping, Full Body Pregnancy Pillow with 300TC Comfy Pillowcase & Microfiber Inner Cover- for Back Support - 65 Inch Light Gray","$84.49","$18.10 (18%)","18","https://www.amazon.ca/dp/B075TZB1VY?tag=lesdealsduw02-20&linkCode=osi&th=1&psc=1","https://m.media-amazon.com/images/I/41G4QnuSr5L._SL500_.jpg","2"
"can opener","Kitchen","OXO Good Grips Good Grips Can Opener Black 7.5 inches","$17.98","$4.01 (18%)","18","https://www.amazon.ca/dp/B00004OCJW?tag=lesdealsduw02-20&linkCode=osi&th=1&psc=1","https://m.media-amazon.com/images/I/219iAuyS3eL._SL500_.jpg","1"
"car accessories","Automotive","2PCS Upgrade Car Seat Gap Filler Organizer,Car Gap Filler Organizer with Storage Space for Filling Gaps & Storing Items,Versatile Car Accessories Gap Filler for Car Fit Most Vehicles (Black)","$13.99","$3.00 (18%)","18","https://www.amazon.ca/dp/B0DDX6G9MB?tag=lesdealsduw02-20&linkCode=osi&th=1&psc=1","https://m.media-amazon.com/images/I/41lEPOWFx+L._SL500_.jpg","1"
"carry on","Travel","SHOWKOO PC+ABS Durable Carry-On Hardside Luggage with Spinner Wheels TSA Lock,20-Inch,ArmyGreen","$89.99","$20.00 (18%)","18","https://www.amazon.ca/dp/B0BKFTJGQZ?tag=lesdealsduw02-20&linkCode=osi&th=1&psc=1","https://m.media-amazon.com/images/I/31C91QS6NoL._SL500_.jpg","1"
"cat litter","Pet Supplies","Tidy Cats 24/7 Performance Cat Litter, LightWeight Multi-Cat - 5.44 kg Box","$19.68 ($3.62 / Kilograms)","$4.29 (18%)","18","https://www.amazon.ca/dp/B07WYHG3B8?tag=lesdealsduw02-20&linkCode=osi&th=1&psc=1","https://m.media-amazon.com/images/I/51UapmdfQ1L._SL500_.jpg","1"
"chainsaw","Tools","TROY BILT Chainsaw Gas Powered 20 in. 46cc Engine with Spring Assist Technology (TB4620C) (41AY462S866)","$243.10","$54.90 (18%)","18","https://www.amazon.ca/dp/B0B5KC1ZJY?tag=lesdealsduw02-20&linkCode=osi&th=1&psc=1","https://m.media-amazon.com/images/I/31U2J6hbg3L._SL500_.jpg","2"
"clip coupon","General","50 Pcs Paper Clips Rose Gold Creative Animal Shaped Paper Clips Small for School Supplies Documents Organizer","$8.99","$2.00 (18%)","18","https://www.amazon.ca/dp/B08NPT7KYS?tag=lesdealsduw02-20&linkCode=osi&th=1&psc=1","https://m.media-amazon.com/images/I/51k8vvv-4fL._SL500_.jpg","1"
"coffee maker","Kitchen","Ninja CFP301C DualBrew Pro Specialty Coffee System, Single-Serve, Pod, and 12-Cup Drip Coffee Maker (Canadian Version) , Black","$229.99","$50.00 (18%)","18","https://www.amazon.ca/dp/B093KFBFKV?tag=lesdealsduw02-20&linkCode=osi&th=1&psc=1","https://m.media-amazon.com/images/I/41yolHxHWQL._SL500_.jpg","2"
"coffee pods","Kitchen","Timothy`s Breakfast Blend Single Serve Keurig K-Cup Pods for Keurig Brewers, 30 Count","$17.97 ($61.12 / kg)","$4.02 (18%)","18","https://www.amazon.ca/dp/B00O1LA8GK?tag=lesdealsduw02-20&linkCode=osi&th=1&psc=1","https://m.media-amazon.com/images/I/51zIqgkU6bL._SL500_.jpg","1"
"cooler","Outdoor & Camping","Lifewit Large Lunch Bag Insulated Lunch Box Leakproof Soft Cooler Cooling Tote for Adult Men Women, Waterproof Reusable Cooler Bags for Work Office Outdoor Picnic Camping, Grey, 24-Can (15L)","$32.99","$7.00 (18%)","18","https://www.amazon.ca/dp/B0788GKSZ9?tag=lesdealsduw02-20&linkCode=osi&th=1&psc=1","https://m.media-amazon.com/images/I/41PlRsSzBlL._SL500_.jpg","1"
"cutting board","Kitchen","GoodCook Bamboo Cutting Board, 10-inch by 14-inch, Brown, Medium (10102)","$10.71","$2.28 (18%)","18","https://www.amazon.ca/dp/B001CCUKQ4?tag=lesdealsduw02-20&linkCode=osi&th=1&psc=1","https://m.media-amazon.com/images/I/31EHB0gZl3L._SL500_.jpg","1"
"deodorant","Beauty & Personal Care","Dove Advanced Care Cool Essentials Antiperspirant Deodorant for Women with Pro-Ceramide Technology for Soft, Resilient Skin, 45g","$4.88","$1.09 (18%)","18","https://www.amazon.ca/dp/B00BMI3R68?tag=lesdealsduw02-20&linkCode=osi&th=1&psc=1","https://m.media-amazon.com/images/I/31IxY+-qLML._SL500_.jpg","2"
"desk chair","Furniture & Decor","CYKOV Ergonomic Office Chair with Adjustable Headrest & Lumbar Support - High Back Desk Chair with Flip-Up Arms, 360 Swivel Executive Computer Task Chair","$179.99","$40.00 (18%)","18","https://www.amazon.ca/dp/B0CF52Y6H7?tag=lesdealsduw02-20&linkCode=osi&th=1&psc=1","https://m.media-amazon.com/images/I/517f9BhyKGL._SL500_.jpg","1"
"diapers","Baby","Pampers Cruisers 360° Fit Pull on diapers, size 7, 66 count, Disposable Diapers with Stretchy Waistband","$32.97 ($0.50 / count)","$7.02 (18%)","18","https://www.amazon.ca/dp/B0C9JVYCZC?tag=lesdealsduw02-20&linkCode=osi&th=1&psc=1","https://m.media-amazon.com/images/I/41hrZcLqQkL._SL500_.jpg","1"
"diapers","Baby","Pampers Swaddlers 360 Pull-On Diapers, Size 4, 100 Count for up to 100% Leakproof Skin Protection and Easy Changes","$32.97 ($0.33 / count)","$7.02 (18%)","18","https://www.amazon.ca/dp/B0CW9ZS1BX?tag=lesdealsduw02-20&linkCode=osi&th=1&psc=1","https://m.media-amazon.com/images/I/51cvHX-ry6L._SL500_.jpg","1"
"diapers bulk","Baby","Pampers Swaddlers Newborn Diapers Size 1 160 Count","$32.97 ($0.21 / count)","$7.02 (18%)","18","https://www.amazon.ca/dp/B0CSDTXPQT?tag=lesdealsduw02-20&linkCode=osi&th=1&psc=1","https://m.media-amazon.com/images/I/41kGhJXYSSL._SL500_.jpg","1"
