"keyword","category","title","price","savings","percent","link","imageUrl","page"
"food processor","Kitchen","KitchenAid KFP0921BM 9 Cup Food Processor","$119.87","$60.12 (33%)","33","https://www.amazon.ca/dp/B09HSPKNBQ?tag=lesdealsduw02-20&linkCode=osi&th=1&psc=1","https://m.media-amazon.com/images/I/41D+Xsfz8OL._SL500_.jpg","2"
"gaming mouse","Gaming","MSI Clutch GM08 4200 DPI, Accurate Optical Sensor, Durable Build Quality, Adjustable Weight System, Dragon Scale Design Side Grips, On The Fly DPI Changing, Optical Wired Gaming Mouse with Red LED","$19.99","$10.00 (33%)","33","https://www.amazon.ca/dp/B08DDLMGCY?tag=lesdealsduw02-20&linkCode=osi&th=1&psc=1","https://m.media-amazon.com/images/I/31FUVU6esJL._SL500_.jpg","1"
"hat","Clothing & Accessories","Gelapa Baseball Caps, Vintage Cap for Men Women, Full Cotton Hat, Adjustment Mens Hats for Golf Running Outdoor Workouts, 3 Packs, Black+Blue+Red","$11.99","$6.00 (33%)","33","https://www.amazon.ca/dp/B0F4R6B1M3?tag=lesdealsduw02-20&linkCode=osi&th=1&psc=1","https://m.media-amazon.com/images/I/41xszNWo1mL._SL500_.jpg","2"
"headphone stand","Audio & Music","Nayubo Headphone Stand, Universal Headset Display Hanger Rack Aluminum Headset Holder with Flexible Headrest Gaming Headset Stand Earphone Stand for All Headphones Size (Black)","$8.00","$3.99 (33%)","33","https://www.amazon.ca/dp/B0CGR9ZGS7?tag=lesdealsduw02-20&linkCode=osi&th=1&psc=1","https://m.media-amazon.com/images/I/21EgAz8h7LL._SL500_.jpg","1"
"instant coffee","Food","NESCAFE Sweet & Creamy Mocha Instant Coffee Mix, Single-serve Sachets Containing Coffee, Coffee Whitener & Sugar, Just Add Hot Water, 100% Responsibly Sourced Coffee, 342 g","$4.00 ($11.70 / kg)","$2.00 (33%)","33","https://www.amazon.ca/dp/B0CJ5V8BT6?tag=lesdealsduw02-20&linkCode=osi&th=1&psc=1","https://m.media-amazon.com/images/I/41d0NENG4lL._SL500_.jpg","1"
"keyboard tray","Office","suptek Keyboard Tray Under Desk Pull Out with C Clamp Mount, Computer Keyboard & Mouse Tray, 25.6 (30 Including Clamps) x 11.8 inch Slide-Out Platform Computer Drawer for Typing, Carbon White, DSF1DJW","$39.99","$20.00 (33%)","33","https://www.amazon.ca/dp/B0DBZR5JFZ?tag=lesdealsduw02-20&linkCode=osi&th=1&psc=1","https://m.media-amazon.com/images/I/412aiB3dLiL._SL500_.jpg","1"
"kitchen organizer","Home & Cleaning","Nmgkokew 4 Piece Kitchen Cabinet Door Storage Box,Self Adhesive Wall Mounted Storage Box,Wardrobe/Bathroom/Refrigerator Small Items Organizer Storage Box","$8.50 ($2.12 / Count)","$4.20 (33%)","33","https://www.amazon.ca/dp/B0CHJ3XYDG?tag=lesdealsduw02-20&linkCode=osi&th=1&psc=1","https://m.media-amazon.com/images/I/41tCNvEGZjL._SL500_.jpg","2"
"logitech","Computers & Tech","Logitech Brio 101 Full HD 1080p Webcam for Meetings and Streaming, Auto-Light Balance, Built-in Mic, Privacy Shutter, USB-A, for Microsoft Teams, Google Meet, Zoom and More - Black","$39.99","$20.00 (33%)","33","https://www.amazon.ca/dp/B0BXGFFSL1?tag=lesdealsduw02-20&linkCode=osi&th=1&psc=1","https://m.media-amazon.com/images/I/31UO5pEZcVL._SL500_.jpg","1"
"luxury sheets","Bedroom","Amazon Basics Luxury, Ultra Soft, Breathable Lightweight Microfiber 4 Piece Bed Sheet Set with 36cm Deep Pockets, King, Bright White, Solid","$29.99","$15.02 (33%)","33","https://www.amazon.ca/dp/B0154ASKAM?tag=lesdealsduw02-20&linkCode=osi&th=1&psc=1","https://m.media-amazon.com/images/I/21q8tWkbruL._SL500_.jpg","1"
"mechanical keyboard","Computers & Tech","RK ROYAL KLUDGE RK61 Wired 60% Mechanical Gaming Keyboard Programmable QMK/VIA RGB Backlit 61 Keys Ultra-Compact Hot Swappable Brown Switch White","$59.99","$30.00 (33%)","33","https://www.amazon.ca/dp/B0832CZNS5?tag=lesdealsduw02-20&linkCode=osi&th=1&psc=1","https://m.media-amazon.com/images/I/41bborQ0jcL._SL500_.jpg","2"
"mens jeans","Clothing & Accessories","Levi's Men's 550 Relaxed Fit Jean, Black, 36x32","$44.98","$22.18 (33%)","33","https://www.amazon.ca/dp/B0018OMMEY?tag=lesdealsduw02-20&linkCode=osi&th=1&psc=1","https://m.media-amazon.com/images/I/41hfagJ1XeL._SL500_.jpg","2"
"mesh router","Networking & Connectivity","TP-Link Tri-Band BE9300 WiFi 7 Router (Archer BE550) - 6-Stream 9.2Gbps, Full 2.5G Ports USB 3.0, 6 Smart Internal Antennas, VPN Clients & Server, Easy Mesh, HomeShield, Private IoT Network","$269.99","$130.00 (33%)","33","https://www.amazon.ca/dp/B0CW1PK5QT?tag=lesdealsduw02-20&linkCode=osi&th=1&psc=1","https://m.media-amazon.com/images/I/31i9l63mj2L._SL500_.jpg","1"
"microwave","Kitchen","Avanti MT09V3S Microwave Oven 900-Watts Compact with 10 Power Levels and 6 Pre Cooking Settings, Speed Defrost, Electronic Control Panel and Glass Turntable, 0.9-Cu.Ft, Stainless Steel","$89.99","$44.00 (33%)","33","https://www.amazon.ca/dp/B00QEU9GVO?tag=lesdealsduw02-20&linkCode=osi&th=1&psc=1","https://m.media-amazon.com/images/I/31NV7lsI2nL._SL500_.jpg","2"
"phone charger station","Bedroom","JARGOU 3 in 1 Charging Station for Apple Wireless Charger for iPhone 16 15 14 13 12 11 X 8 & for Apple Watch Charger Wireless Charging Station for Multiple Devices for AirPods 2/3/4/Pro/Pro 2","$39.99","$20.00 (33%)","33","https://www.amazon.ca/dp/B0BQ2SYFJ7?tag=lesdealsduw02-20&linkCode=osi&th=1&psc=1","https://m.media-amazon.com/images/I/51dp9brWOqL._SL500_.jpg","1"
"plant pots","Garden","LE TAUCI Plant Pots for Indoor Plants, Set of 3, 4+5+6.5 Inch Ceramic Plant Pots with Drainage Hole & Saucer, Indoor Flower Pot with Mesh Pad, Pot Plante Interieur, Reactive Glaze Beige","$36.99","$18.00 (33%)","33","https://www.amazon.ca/dp/B08F7TP4TN?tag=lesdealsduw02-20&linkCode=osi&th=1&psc=1","https://m.media-amazon.com/images/I/41w5vbf-uoL._SL500_.jpg","1"
"pool float","Outdoor & Camping","SwimWays Spring Float Premium Hammock Pool Lounger, Inflatable Pool Floats Adult with Fast Inflation for Ages 15 & Up, Sky Blue","$16.44","$8.13 (33%)","33","https://www.amazon.ca/dp/B0CCW4TKHB?tag=lesdealsduw02-20&linkCode=osi&th=1&psc=1","https://m.media-amazon.com/images/I/41SRDbxB6oL._SL500_.jpg","1"
"pool float","Outdoor & Camping","3 Pack Inflatable Pool Float Chair, Floating Pool Lounge Floats for Swimming Pool Water Chair Pool Lounger with Cup Holder Pool Toy Party Floaties for Adults","$19.99","$10.00 (33%)","33","https://www.amazon.ca/dp/B0DXK8P3PG?tag=lesdealsduw02-20&linkCode=osi&th=1&psc=1","https://m.media-amazon.com/images/I/51ZOY09LNsL._SL500_.jpg","2"
"printer","Computers & Tech","HP DeskJet 2855e Wireless All-in-One Colour Inkjet Printer, Scanner, Copier, Best for Home, 3 Months of Ink Included (588S5A)","$69.99","$35.00 (33%)","33","https://www.amazon.ca/dp/B0CT2R7199?tag=lesdealsduw02-20&linkCode=osi&th=1&psc=1","https://m.media-amazon.com/images/I/41MPmwozjiL._SL500_.jpg","1"
"protein bars","Health & Wellness","CLIF BUILDERS Protein Bars, Chocolate Peanut Butter Flavour, 20g of Protein, Prepared in Canada, Gluten Free, No Artificial Sweeteners, 68 g (Pack of 6)","$11.10 ($2.72 / 100 g)","$5.38 (33%)","33","https://www.amazon.ca/dp/B00V69IM6I?tag=lesdealsduw02-20&linkCode=osi&th=1&psc=1","https://m.media-amazon.com/images/I/51D0NRFBSgL._SL500_.jpg","1"
"puzzle games","Toys & Games","Rubik's Cube, The Original 3x3 Cube 3D Puzzle Fidget Cube Stress Relief Fidget Toy Brain Teasers Travel Games, for Adults and Kids Ages 8 and up, Packaging May Vary","$8.68","$4.31 (33%)","33","https://www.amazon.ca/dp/B09FG5L5ZX?tag=lesdealsduw02-20&linkCode=osi&th=1&psc=1","https://m.media-amazon.com/images/I/41KutkkMqOL._SL500_.jpg","2"
"rhinestones","Arts & Crafts","B7000 Jewelry Bead Glue with Rhinestones for Crafts, Audab 2100Pcs Round Flat Back Gems Crystal Rhinestones with Tweezer Dotting Tools Clear Glue for Clothes Fabric Shoes Jewelry Making Nail Art","$9.99","$5.00 (33%)","33","https://www.amazon.ca/dp/B09XVCY9CL?tag=lesdealsduw02-20&linkCode=osi&th=1&psc=1","https://m.media-amazon.com/images/I/61b8CqS7RKL._SL500_.jpg","1"
"robot vacuum","Home & Cleaning","roborock Q7 L5+ Robot Vacuum and Mop, Self-Emptying, Dual Anti-Tangle System, 8,000 Pa HyperForce Suction, Electronic Water Tank, Schedule Daily Cleaning, Perfect for Hard Floors, Carpets and Pet Hair","$399.99","$200.00 (33%)","33","https://www.amazon.ca/dp/B0DX1PT8X6?tag=lesdealsduw02-20&linkCode=osi&th=1&psc=1","https://m.media-amazon.com/images/I/41Wcq4-9FnL._SL500_.jpg","2"
"samsung","TV & Video","Samsung Galaxy Buds3, Wireless Bluetooth Earbuds with Adaptive Noise Control, Sweat and Water Resistance, AI translator, Adaptive EQ - Silver (CAD Version & Warranty)","$139.99","$70.00 (33%)","33","https://www.amazon.ca/dp/B0D6SX4FPW?tag=lesdealsduw02-20&linkCode=osi&th=1&psc=1","https://m.media-amazon.com/images/I/31K40sOqzYL._SL500_.jpg","2"
"sandals","Clothing & Accessories","DREAM PAIRS Women's Flip Flops Thong Ladies Walking Sandals with Comfortable Soft Orthopedic Arch Support Indoor Outdoor for Summer,Size 9,White,BREEZE-1","$32.99","$16.00 (33%)","33","https://www.amazon.ca/dp/B08371WSJL?tag=lesdealsduw02-20&linkCode=osi&th=1&psc=1","https://m.media-amazon.com/images/I/31LR3HZWQNL._SL500_.jpg","1"
"sandals","Clothing & Accessories","adidas Unisex-Adult Adissage, Black/White/Black, 13 Women/12 Men","$28.00","$14.00 (33%)","33","https://www.amazon.ca/dp/B07D9HQCF1?tag=lesdealsduw02-20&linkCode=osi&th=1&psc=1","https://m.media-amazon.com/images/I/319dKDaKftL._SL500_.jpg","2"
"security light","Security","CLAONER Solar Lights Outdoor Motion Sensor Lights 3 Modes, Solar Powered Security Lights (Permanent On All Night/Smart Brightness Control) with 270 Degree Wide Angle IP65 Waterproof for Deck Garage Animal","$39.99","$20.00 (33%)","33","https://www.amazon.ca/dp/B07XXWRZJ6?tag=lesdealsduw02-20&linkCode=osi&th=1&psc=1","https://m.media-amazon.com/images/I/51o+tMS0HhL._SL500_.jpg","1"
"shampoo","Beauty & Personal Care","Garnier Fructis Pure Clean Zero Silicone Fortifying Shampoo for Normal to Oily Hair, with Citrus Extract, 650mL","$5.99 ($0.92 / 100 ml)","$3.00 (33%)","33","https://www.amazon.ca/dp/B09M594546?tag=lesdealsduw02-20&linkCode=osi&th=1&psc=1","https://m.media-amazon.com/images/I/41eG7qNF8vL._SL500_.jpg","1"
"sheer curtains","Bedroom","TRLYC White Sheer Curtains - 84 Inches Long Voile Panels Curtain Solid Window Treatments Rod Pocket Breathable Light Filtering Drapes for Bedroom Living Room Kitchen (White, 2 Panels, 60"" W x 84"" L)","$8.99","$4.34 (33%)","33","https://www.amazon.ca/dp/B0F475XLP8?tag=lesdealsduw02-20&linkCode=osi&th=1&psc=1","https://m.media-amazon.com/images/I/41PJtIH7HOL._SL500_.jpg","1"
"sheets","Bedroom","Amazon Basics, 4 Piece Microfiber Lightweight Wrinkle-free Breathable Bed Sheet Set, Super Soft Easy Care, 36cm Deep Pockets, Queen, Bright White, Solid","$25.99","$12.61 (33%)","33","https://www.amazon.ca/dp/B0154ASID6?tag=lesdealsduw02-20&linkCode=osi&th=1&psc=1","https://m.media-amazon.com/images/I/31TR8MVXLaL._SL500_.jpg","1"
"shower head","Home & Cleaning","AquaCare High Pressure 8-Mode Handheld Shower Head - Anti-Clog Nozzles, Built-in Power Wash to Clean Tub, Tile & Pets, Extra Long 6 ft. Stainless Steel Hose, Wall & Overhead Brackets","$26.99 ($1.12 / oz)","$13.00 (33%)","33","https://www.amazon.ca/dp/B08WPQ12XX?tag=lesdealsduw02-20&linkCode=osi&th=1&psc=1","https://m.media-amazon.com/images/I/51NLE0Fl+oL._SL500_.jpg","1"
"silk sheets","Bedroom","Sfoothome Queen Satin Sheets [4-Piece, Pink] Hotel Luxury Silky Bed Sheets - Microfiber Sheet Set, Wrinkle, Fade, Resistant - Deep Pocket Fitted Sheet, Flat Sheet, Pillow Cases","$26.99","$13.00 (33%)","33","https://www.amazon.ca/dp/B09RZWVFY6?tag=lesdealsduw02-20&linkCode=osi&th=1&psc=1","https://m.media-amazon.com/images/I/51r3UCqwA3L._SL500_.jpg","2"
"sleeping pad","Outdoor & Camping","ECOTEK Outdoors Hybern8 Ultralight Inflatable Sleeping Pad with Contoured FlexCell Honeycomb Design - Easy to Inflate, Comfortable, Lightweight, Durable, and Hammock Approved [Fire Orange]","$39.95","$20.00 (33%)","33","https://www.amazon.ca/dp/B072C632C2?tag=lesdealsduw02-20&linkCode=osi&th=1&psc=1","https://m.media-amazon.com/images/I/41mpC4voXEL._SL500_.jpg","1"
"smart lock","Smart Home","TEEHO TE001 Keyless Entry Door Lock with Keypad - Smart Deadbolt Lock for Front Door with 2 Keys - Auto Lock - Easy Installation - Matte Black","$53.98","$26.01 (33%)","33","https://www.amazon.ca/dp/B09P56Z4JC?tag=lesdealsduw02-20&linkCode=osi&th=1&psc=1","https://m.media-amazon.com/images/I/41YEcbSEVhL._SL500_.jpg","1"
"string lights","Furniture & Decor","RTTY Outdoor String Lights 200ft, 2 Pack 100ft G40 Led Patio Lights with 52pcs Plastics Bulbs,Waterproof Shatterproof Dimmable Globe Outside Hanging Lights for Patio Cafe Bistro Backyard Gazebo","$66.99 ($0.33 / Feet)","$33.00 (33%)","33","https://www.amazon.ca/dp/B09F5PBMTG?tag=lesdealsduw02-20&linkCode=osi&th=1&psc=1","https://m.media-amazon.com/images/I/41L8Wl2BF2L._SL500_.jpg","2"
"student planner","Kids & Education","Dzhzal 2025-2026 Weekly and Monthly Academic Year Planner Calendar, July 2025 - June 2026, 8.5"" x 5.8"", Hard Cover, Wirebound, Laminated Tabs with Elastic Band","$9.99","$5.00 (33%)","33","https://www.amazon.ca/dp/B0DYYDQ33F?tag=lesdealsduw02-20&linkCode=osi&th=1&psc=1","https://m.media-amazon.com/images/I/318zwrxRvqL._SL500_.jpg","1"
"swimming","Sports & Fitness","SEEKWAY Water Shoes Women Men Quick-Dry Beach Aqua Socks Barefoot Non Slip Swim Pool Outdoor Surf River Lake Yoga SK001 Black Size 6.5-7.5 W/5.5-6.5 M","$16.18","$7.80 (33%)","33","https://www.amazon.ca/dp/B0834N4XXM?tag=lesdealsduw02-20&linkCode=osi&th=1&psc=1","https://m.media-amazon.com/images/I/41mZ2PfAMlL._SL500_.jpg","2"
"tennis","Sports & Fitness","Elbow Brace 2 Pack for Tennis & Golfer's Elbow Pain Relief","$19.99","$10.00 (33%)","33","https://www.amazon.ca/dp/B07253Z16J?tag=lesdealsduw02-20&linkCode=osi&th=1&psc=1","https://m.media-amazon.com/images/I/41jEhqZJ3cL._SL500_.jpg","2"
"thermal curtains","Bedroom","Deconovo Blackout Curtains 2 Panels – 63 Inches Long Thermal Insulated, Soundproof, Energy-Saving, OEKO-TEX Certified, Noise-Reducing Drapes for Bedroom & Living Room Curtains – 42x63 Inch, Dark Grey","$24.21","$11.78 (33%)","33","https://www.amazon.ca/dp/B01HROIDBY?tag=lesdealsduw02-20&linkCode=osi&th=1&psc=1","https://m.media-amazon.com/images/I/41ivaIpxxVL._SL500_.jpg","1"
"tools","Tools","Endoscope Camera with Light, Borescope Camera with 4.3"" IPS Screen, 1080P HD with 8 LED Lights, 16.4FT Semi-Rigid Cord Bore Scope, IP67 Waterproof Endoscope Cool Gadgets for Men","$39.99","$20.00 (33%)","33","https://www.amazon.ca/dp/B0C3R381FC?tag=lesdealsduw02-20&linkCode=osi&th=1&psc=1","https://m.media-amazon.com/images/I/51v-Aq6UvRL._SL500_.jpg","1"
"travel towel","Travel","2 Pack Microfiber Thin Beach Towel Lightweight 71x32 Oversized Extra Large Sand Free Towels Quick Dry for Travel Pool Yoga Gym Sports Beach Accessories Vacation Essential Gift","$19.99","$10.00 (33%)","33","https://www.amazon.ca/dp/B0C3CD84DZ?tag=lesdealsduw02-20&linkCode=osi&th=1&psc=1","https://m.media-amazon.com/images/I/51lxAOVaAGL._SL500_.jpg","2"
"travel wallet","Travel","Buffway Slim Minimalist Front Pocket RFID Blocking Leather Wallets for Men Women - Cross Black","$19.99","$10.00 (33%)","33","https://www.amazon.ca/dp/B079DCW7GB?tag=lesdealsduw02-20&linkCode=osi&th=1&psc=1","https://m.media-amazon.com/images/I/5123VeURueL._SL500_.jpg","1"
"tv mount","TV & Video","Pipishell Full Motion TV Wall Mount for 26-65 inch TVs, up to 99lbs and VESA 400x400mm, Wall Mount TV Bracket with Articulating Swivel Extension Tilting Leveling for LED LCD OLED 4K Flat Curved Screen","$39.98","$20.01 (33%)","33","https://www.amazon.ca/dp/B09MQKK4TW?tag=lesdealsduw02-20&linkCode=osi&th=1&psc=1","https://m.media-amazon.com/images/I/41qc8Db84uL._SL500_.jpg","1"
"ukulele","Audio & Music","Mahalo Slimline Series Soprano Ukulele With Carrying Bag, Transparent Brown","$39.99","$19.96 (33%)","33","https://www.amazon.ca/dp/B0B3N3CDP6?tag=lesdealsduw02-20&linkCode=osi&th=1&psc=1","https://m.media-amazon.com/images/I/31WAexUmGAL._SL500_.jpg","1"
"utensils","Kitchen","Yoehka 40 Pieces Black Silverware Set, Premium Stainless Steel Flatware Set for 8, Mirror Polished Tableware Cutlery Set for Home & Restaurant, Utensil Set Include Knife/Spoon and Fork, Dishwasher","$44.98","$22.01 (33%)","33","https://www.amazon.ca/dp/B097QMPJFR?tag=lesdealsduw02-20&linkCode=osi&th=1&psc=1","https://m.media-amazon.com/images/I/51ZKQtu9BnL._SL500_.jpg","2"
"vitamin c","Health & Wellness","REDOXON Vitamin C-Orange Effervescent Tablets, 15-Count","$4.37 ($0.29 / count)","$2.12 (33%)","33","https://www.amazon.ca/dp/B01DKMMDYA?tag=lesdealsduw02-20&linkCode=osi&th=1&psc=1","https://m.media-amazon.com/images/I/41abgkjhXBL._SL500_.jpg","2"
"wall decor","Furniture & Decor","BASE ROOTS Moon Phase Wall Decor, Gold Wall Decor for Bedroom & Living Room, Bohemian Wall Decor, Handmade Hammered Metal 34"" 7 Phases Moon Wall Decor, Celestial Wall Art, Gift for Women & Kids","$18.39","$9.20 (33%)","33","https://www.amazon.ca/dp/B07T45KR41?tag=lesdealsduw02-20&linkCode=osi&th=1&psc=1","https://m.media-amazon.com/images/I/31MReAydPTL._SL500_.jpg","1"
"water bottle","Home & Cleaning","BOZ Stainless Steel Water Bottle XL (1 L / 32oz) Wide Mouth, BPA Free, Vacuum Double Wall Insulated (Matte Black)","$19.99","$10.00 (33%)","33","https://www.amazon.ca/dp/B086V7JVBZ?tag=lesdealsduw02-20&linkCode=osi&th=1&psc=1","https://m.media-amazon.com/images/I/419zGZ6w08L._SL500_.jpg","1"
"waterproof bag","Outdoor & Camping","WALNEW Waterproof Dry Bag with Watertight Zipper, Lightweight Waterproof Pouch for Women Men, IPX5 Crossbody Dry Sack Keeps Gear Dry for Kayaking, Beach, Boating, Camping, Fishing, Hiking (Blue)","$9.99","$5.00 (33%)","33","https://www.amazon.ca/dp/B0D95VS8B3?tag=lesdealsduw02-20&linkCode=osi&th=1&psc=1","https://m.media-amazon.com/images/I/41VThTax1xL._SL500_.jpg","2"
"watering can","Garden","Fasmov 1-Gallon Plastic Watering Can with Comfortable Handle, Garden Watering Cans Long Spout for Indoor Outdoor Watering Plants, Green","$17.99","$9.00 (33%)","33","https://www.amazon.ca/dp/B09G6KPS4K?tag=lesdealsduw02-20&linkCode=osi&th=1&psc=1","https://m.media-amazon.com/images/I/41kPvXrKTJL._SL500_.jpg","1"
"weather radio","Outdoor & Camping","48100mWh Emergency Radio,Solar Hand Crank AM FM NOAA Weather Radio,Portable Battery Powered Radio with Phone Charger,Crank Flashlight,Reading Lamp,SOS for Home Power Outages Storm Outdoor Survival Kit","$39.99","$20.00 (33%)","33","https://www.amazon.ca/dp/B0B9HD4VN7?tag=lesdealsduw02-20&linkCode=osi&th=1&psc=1","https://m.media-amazon.com/images/I/51pPgpEhyzL._SL500_.jpg","2"
"wireless mouse","Computers & Tech","Logitech M325s Wireless Mouse, 2.4 GHz with USB Receiver, 1000 DPI Optical Tracking, 18-Month Life Battery, PC/Mac/Laptop/Chromebook - Vivid Violet","$19.99","$10.00 (33%)","33","https://www.amazon.ca/dp/B0BGS2K547?tag=lesdealsduw02-20&linkCode=osi&th=1&psc=1","https://m.media-amazon.com/images/I/41qEdpjad3L._SL500_.jpg","1"
"womens blouses","Clothing & Accessories","Hotouch Women's Boyfriend Button-Down Dressy Shirt Classic Long Sleeve Tops Basic Collared Blouse with Pocket Black XL","$19.99","$10.00 (33%)","33","https://www.amazon.ca/dp/B0DJZ84NCS?tag=lesdealsduw02-20&linkCode=osi&th=1&psc=1","https://m.media-amazon.com/images/I/41yEC2+cNgL._SL500_.jpg","1"
"womens blouses","Clothing & Accessories","Zeagoo Womens Summer Tops Button Down Shirts Short Sleeve Cardigans Dressy Casual Crew Neck Knit Blouse Clothes Navy Blue","$19.99","$10.00 (33%)","33","https://www.amazon.ca/dp/B0DTHH5JB6?tag=lesdealsduw02-20&linkCode=osi&th=1&psc=1","https://m.media-amazon.com/images/I/41LBmnNbuiL._SL500_.jpg","2"
"yoga mat","Sports & Fitness","CAMBIVO Large Yoga Mat (6' x 4' x 6mm), Non-Slip Extra Wide Workout Mat, Eco-Friendly Barefoot TPE Fitness Mat, Multiple Uses for Home Gym, Workout, Yoga, Pilates (Black,6mm)","$49.99","$25.00 (33%)","33","https://www.amazon.ca/dp/B07RKV9Z9D?tag=lesdealsduw02-20&linkCode=osi&th=1&psc=1","https://m.media-amazon.com/images/I/41zc0Olqs5L._SL500_.jpg","2"
"3d printing filament","Makers & Digital Fabrication","OVERTURE PLA Filament 1.75mm PLA 3D Printer Filament, 1kg Cardboard Spool (2.2lbs), Dimensional Accuracy +/- 0.02mm, Fit Most FDM Printer (White 1-Pack)","$20.99 ($0.02 / gram)","$10.00 (32%)","32","https://www.amazon.ca/dp/B07PGZNM34?tag=lesdealsduw02-20&linkCode=osi&th=1&psc=1","https://m.media-amazon.com/images/I/41FHPE948PL._SL500_.jpg","2"
"air bed","Outdoor & Camping","Queen Air Mattress with Built-in Pump, TOUCHXEL Double Blow-up Camping Foldable Electric Airbed, Portable Travel Inflatable Beds, Matelas Gonflable, 203 x 152 x 47 CM","$94.51","$45.48 (32%)","32","https://www.amazon.ca/dp/B09LCL59Z6?tag=lesdealsduw02-20&linkCode=osi&th=1&psc=1","https://m.media-amazon.com/images/I/41-79PpTVKL._SL500_.jpg","1"
"bamboo sheets","Bedroom","Mooreeke Pink Bamboo Draps Queen Sheets, Wrinkle Free Cooling Bed Sheets, Deep Pocket Bedding Sheets & Pillowcases","$33.99","$16.00 (32%)","32","https://www.amazon.ca/dp/B0CXCYBBB6?tag=lesdealsduw02-20&linkCode=osi&th=1&psc=1","https://m.media-amazon.com/images/I/31k8s1hlvzL._SL500_.jpg","1"
"books","Books","Atomic Habits: An Easy & Proven Way to Build Good Habits & Break Bad Ones","$24.58","$11.42 (32%)","32","https://www.amazon.ca/dp/0735211299?tag=lesdealsduw02-20&linkCode=osi&th=1&psc=1","https://m.media-amazon.com/images/I/51b4CfdTSDL._SL500_.jpg","1"
"bras","Clothing & Accessories","SHAPERMINT Seamless Bras for Women Full Support Bra - Bralette for Women with Support - Soutien Gorge Femme Sans Armature, Brassiere Femme, Large, Black","$50.99","$24.01 (32%)","32","https://www.amazon.ca/dp/B0D9YKHWW3?tag=lesdealsduw02-20&linkCode=osi&th=1&psc=1","https://m.media-amazon.com/images/I/41K9OGxNm0L._SL500_.jpg","1"
"cooling towel","Outdoor & Camping","ESTUSR 8 Pack Cooling Towels, Microfiber Ice Towels for Neck and Face, Cooling Towels for Athletes Cooling Neck Wraps Instant Cooling Towels for Yoga, Gym, Golf, Running, Fitness Hot Weather","$14.99","$7.00 (32%)","32","https://www.amazon.ca/dp/B09TL6MGJ5?tag=lesdealsduw02-20&linkCode=osi&th=1&psc=1","https://m.media-amazon.com/images/I/61sfDfPvNBL._SL500_.jpg","2"
"exercise bike","Sports & Fitness","Exercise Bike, DMASUN Silent Magnetic Resistance 350 LB Capacity Stationary Bike for Home, App Compatible, Workout Bike with Solid Flywheel and Tablet Holder","$299.99","$140.00 (32%)","32","https://www.amazon.ca/dp/B0F82S4HVG?tag=lesdealsduw02-20&linkCode=osi&th=1&psc=1","https://m.media-amazon.com/images/I/41u0UvW7RfL._SL500_.jpg","2"
"fishing rod","Outdoor & Camping","Micro Series Spinning Rod-7' 2pc Light -","$37.73","$17.56 (32%)","32","https://www.amazon.ca/dp/B0D15ZZCWV?tag=lesdealsduw02-20&linkCode=osi&th=1&psc=1","https://m.media-amazon.com/images/I/21qzxUuIhUL._SL500_.jpg","2"
"forks","Kitchen","Set of 12, Stainless Steel Dinner Forks Silverware Set, Heavy-Duty Dinner Forks (8 Inch) Cutlery Set, Dishwasher Safe (Silver)","$16.99","$8.00 (32%)","32","https://www.amazon.ca/dp/B0B1M9D6T1?tag=lesdealsduw02-20&linkCode=osi&th=1&psc=1","https://m.media-amazon.com/images/I/41CLjv9uQ+L._SL500_.jpg","1"
"humidifier","Home & Cleaning","Pharata Humidifiers for Bedroom Large Room, 2.5L Cool Mist Humidifier with Essential Oil Diffuser, Top Fill Humidifier for Baby, Home, Plant, Ultrasonic Humidification for whole house, Auto Shut-Off","$33.99","$16.00 (32%)","32","https://www.amazon.ca/dp/B09XJW3NN2?tag=lesdealsduw02-20&linkCode=osi&th=1&psc=1","https://m.media-amazon.com/images/I/219D097hpwL._SL500_.jpg","1"
"keyboard tray","Office","Fellowes Office Suites Underdesk Keyboard Drawer, Black 9140301, 2.31 x 22.00 x 11.63, 9140305","$50.99","$23.80 (32%)","32","https://www.amazon.ca/dp/B0002LD0ZY?tag=lesdealsduw02-20&linkCode=osi&th=1&psc=1","https://m.media-amazon.com/images/I/41XkIUPvr7L._SL500_.jpg","2"
"kids camera","Kids & Education","CIMELR Kids Camera Toys for 3 4 5 6 7 8 9 10 11 12 Year Old Boys/Girls, Kids Digital Camera for Toddler with Video, Christmas Birthday Festival Gifts for Kids, Selfie Camera for Kids, 32GB SD Card","$33.99","$16.00 (32%)","32","https://www.amazon.ca/dp/B09QZLHS6H?tag=lesdealsduw02-20&linkCode=osi&th=1&psc=1","https://m.media-amazon.com/images/I/511S5+DfiQL._SL500_.jpg","1"
"lego","Toys & Games","LEGO Speed Champions McLaren F1 Team MCL38 Race Car Toy - Building Set for Kids, Boys & Girls, Ages 10+ - Toy Car for F1 Fans - Gift Idea for Birthday - 77251","$23.74","$11.25 (32%)","32","https://www.amazon.ca/dp/B0DHLGFRV3?tag=lesdealsduw02-20&linkCode=osi&th=1&psc=1","https://m.media-amazon.com/images/I/51iUNy8IwNL._SL500_.jpg","1"
"lego","Toys & Games","LEGO Speed Champions Aston Martin Aramco F1 AMR24 Race Car Toy - Building Set for Kids, Boys & Girls, Ages 10+ - Toy Car for F1 Fans - Gift Idea for Birthday - 77245","$23.72","$11.27 (32%)","32","https://www.amazon.ca/dp/B0DHLK6WLB?tag=lesdealsduw02-20&linkCode=osi&th=1&psc=1","https://m.media-amazon.com/images/I/51zO3PNEayL._SL500_.jpg","1"
"monitor stand","Computers & Tech","HUANUO Dual Monitor Stand for 13 to 32 Inches, Pneumatic Spring Dual Monitor Mount, Fully Flexible Adjustable with Tilt, Swivel, Rotation, VESA 75/100, 19.8lbs per arm","$87.99","$42.00 (32%)","32","https://www.amazon.ca/dp/B07T4KB7H4?tag=lesdealsduw02-20&linkCode=osi&th=1&psc=1","https://m.media-amazon.com/images/I/41ETt6QMcDL._SL500_.jpg","2"
"outdoor camera","Security","2K HD Security Camera Outdoor with 360° Pan-Tilt Motion Tracking, Home Camera Surveillance Exterieur, Wireless 2.4G WiFi Wired Security Camera, Full Color Night Vision, 2-Way Audio, Waterproof","$33.99","$16.00 (32%)","32","https://www.amazon.ca/dp/B0F3VRXM3P?tag=lesdealsduw02-20&linkCode=osi&th=1&psc=1","https://m.media-amazon.com/images/I/41OS-EuAcpL._SL500_.jpg","2"
