"keyword","category","title","price","savings","percent","link","imageUrl","page"
"apple watch","Wearables","Smart Watch for Men Women with Bluetooth Call, Alexa Built-in, Heart Rate & Sleep Monitor, 1.83"" DIY Dial Fitness Watch with 100+ Sport Modes, IP68 Waterproof, Compatible with Android iOS","$49.99","$350.00 (88%)","88","https://www.amazon.ca/dp/B0FNW5PNX5?tag=lesdealsduw02-20&linkCode=osi&th=1&psc=1","https://m.media-amazon.com/images/I/41Y+wQmlmlL._SL500_.jpg","1"
"sleep tracker","Health & Wellness","Smart Watches for Men Women, with Bluetooth Calling, 1.85"" Screen DIY Dial Smartwatch for Android iPhone. 100+ Sports Modes, Heart Rate Sleep Monitor, AI Built-in Fitness Tracker, IP68 Waterproof","$49.99","$350.00 (88%)","88","https://www.amazon.ca/dp/B0FKT7HN1T?tag=lesdealsduw02-20&linkCode=osi&th=1&psc=1","https://m.media-amazon.com/images/I/413yXf9W91L._SL500_.jpg","1"
"sleep tracker","Health & Wellness","Smart Watch for Men Women (Answer/Make Call), Alexa Smartwatch Compatible with Android iOS, Fitness Tracker with Heart Rate SpO2 Sleep Monitor, 1.8'' HD DIY Dial Waterproof Watch with Bluetooth Call","$49.99","$350.00 (88%)","88","https://www.amazon.ca/dp/B0FS6J2C7T?tag=lesdealsduw02-20&linkCode=osi&th=1&psc=1","https://m.media-amazon.com/images/I/41KL3gkPSyL._SL500_.jpg","2"
"smartwatch","Wearables","Smart Watch for Men Women Bluetooth Call, 1.85"" HD Touch Screen AI Voice Smartwatch, Fitness Tracker with Sleep/Heart Rate Monitor, 100+ Sports Modes, IP68 Waterproof, Compatible with Android & iOS","$35.99","$264.00 (88%)","88","https://www.amazon.ca/dp/B0F2SXCYR9?tag=lesdealsduw02-20&linkCode=osi&th=1&psc=1","https://m.media-amazon.com/images/I/4181ejDYTML._SL500_.jpg","1"
"car vacuum","Automotive","MBNGF Car Vacuum Portable Cordless, 50000PA High Power Suction & Blower, Cordless Handheld Vacuum Cleaner for Car, Home, Office, Pet(Charcoal Black)","$89.99","$610.00 (87%)","87","https://www.amazon.ca/dp/B0FF24ZTSP?tag=lesdealsduw02-20&linkCode=osi&th=1&psc=1","https://m.media-amazon.com/images/I/41ruP0W2IDL._SL500_.jpg","1"
"digital camera","Cameras & Photography","Digital Camera 4K Autofocus 48MP Vlogging Point and Shoot Cameras Video Kids with 16X Zoom, 64GB TF Card, 2.8"" Screen for Photography Anti Shake Flash, Portable Compact Camera Beginner Student, White","$62.99","$437.00 (87%)","87","https://www.amazon.ca/dp/B0FKYWH27S?tag=lesdealsduw02-20&linkCode=osi&th=1&psc=1","https://m.media-amazon.com/images/I/4174YyyEmaL._SL500_.jpg","2"
"solar charger","Power & Chargers","Power-Bank-Solar-Charger - 42800mAh Power Bank,Portable Charger,External Battery Pack 5V3.1A Qc 3.0 Fast Charging Built-in Super Bright Flashlight (Black)","$44.99","$255.00 (85%)","85","https://www.amazon.ca/dp/B0CCJ2K5N5?tag=lesdealsduw02-20&linkCode=osi&th=1&psc=1","https://m.media-amazon.com/images/I/41FTfbzC-PL._SL500_.jpg","1"
"digital camera","Cameras & Photography","4K Digital Camera for Photography Autofocus, 50MP Vlogging Camera with 2.8'' 180° Flip Screen 18X Digital Zoom 32G Card Compact Point and Shoot Cameras Kids Anti Shake YouTube Video Photo Teens Black","$79.98","$420.01 (84%)","84","https://www.amazon.ca/dp/B0FKYSW4K6?tag=lesdealsduw02-20&linkCode=osi&th=1&psc=1","https://m.media-amazon.com/images/I/41kFhei+GWL._SL500_.jpg","1"
"apple watch","Wearables","Smart Watch for Men Women, Bluetooth Calling, 1.83"" HD Touch Screen Fitness Tracker, 100+ Sports Modes,Heart Rate Sleep Monitor， DIY Dial, IP68 Waterproof, Compatible with Android & iOS","$29.99","$14.99 (33%)","33","https://www.amazon.ca/dp/B0F43L98X4?tag=lesdealsduw02-20&linkCode=osi&th=1&psc=1","https://m.media-amazon.com/images/I/414tx8mCAxL._SL500_.jpg","2"
"travel charger","Travel","3 in 1 Wireless Charger for iPhone,RTOPS Fodable Charging Stations for Multiple Apple Devices, W312 Fast Travel Charging Stand for Airpod, iWatch and iPhone 12-15 (Adapter Included)","$21.99","$118.00 (84%)","84","https://www.amazon.ca/dp/B0FQBHK6W4?tag=lesdealsduw02-20&linkCode=osi&th=1&psc=1","https://m.media-amazon.com/images/I/41HEFbiqYhL._SL500_.jpg","2"
"fitness tracker","Wearables","Fitness Tracker Smart Watch for Men Women, 1.47"" HD with Bluetooth, 24/7 Heart Rate & Blood Oxygen Monitor, Sleep & Step Counter, 100+ Sports Modes, IP68 Waterproof, Compatible with Android iOS","$44.98","$215.01 (83%)","83","https://www.amazon.ca/dp/B0FNCVJ6ZH?tag=lesdealsduw02-20&linkCode=osi&th=1&psc=1","https://m.media-amazon.com/images/I/41wztqo9C+L._SL500_.jpg","2"
"portable charger","Power & Chargers","Portable Charger Power Bank - 15000mAh Dual USB Power Bank Output 5V3.1A Fast Charger Portable Charger Compatible with Smartphones and All USB Devices","$16.98","$83.01 (83%)","83","https://www.amazon.ca/dp/B0DKT781K7?tag=lesdealsduw02-20&linkCode=osi&th=1&psc=1","https://m.media-amazon.com/images/I/41HPO4gPmaL._SL500_.jpg","2"
"power bank","Power & Chargers","Solar Charger, Power Bank, 42800mAh Portable Charger Power Bank External Battery Pack 5V3.1A Qc 3.0 Fast Charger Built-in Super Bright Flashlight (Deep Orange)","$49.98","$250.01 (83%)","83","https://www.amazon.ca/dp/B0CCJ4DXK3?tag=lesdealsduw02-20&linkCode=osi&th=1&psc=1","https://m.media-amazon.com/images/I/41GiI2mVEmL._SL500_.jpg","2"
"smartwatch","Wearables","Smart Watch for Men Women with Bluetooth Call,Alexa Built-in Smartwatch,1.83""DIY Dial Fitness Watch with Sleep Heart Rate SpO2 Monitor,100+ Sport Mode,IP68 Waterproof Watch Compatible with Android iOS","$49.99","$250.00 (83%)","83","https://www.amazon.ca/dp/B0FF1NYRQ5?tag=lesdealsduw02-20&linkCode=osi&th=1&psc=1","https://m.media-amazon.com/images/I/4101eMzJASL._SL500_.jpg","1"
"car dashcam","Automotive","4K Dash Cam Front and Rear Camera with 5G WiFi, Dashcams for Cars with APP, 170°Wide Angle, 3"" IPS Screen, Night Vision & 24/7 Parking Monitor, Loop Recording, 32GB Card Included","$85.49","$362.50 (81%)","81","https://www.amazon.ca/dp/B0FH49VZDJ?tag=lesdealsduw02-20&linkCode=osi&th=1&psc=1","https://m.media-amazon.com/images/I/51F8skDiqEL._SL500_.jpg","1"
"humidifier","Home & Cleaning","CHIVALZ Humidifiers for Bedroom, 6L Cool Mist Humidifiers for Baby Nursery, 26dB Quiet, 50H Runtime, Top Fill Humidifier for Large Room, Home, Plants, Nightlight, Oil Diffuser 1 Pack, White","$57.99","$241.91 (81%)","81","https://www.amazon.ca/dp/B0FK54QMB4?tag=lesdealsduw02-20&linkCode=osi&th=1&psc=1","https://m.media-amazon.com/images/I/41q3370y7wL._SL500_.jpg","2"
"air purifier","Home & Cleaning","Pureborne Air Purifiers for Home Large Room up to 1076 Sq Ft, HEPA Filter with PM 2.5 Display and Dual Air Intake, 24dB Quiet for Bedroom, Pet Hair Dust Smoke, White","$113.99","$466.00 (80%)","80","https://www.amazon.ca/dp/B0FLDQB6XH?tag=lesdealsduw02-20&linkCode=osi&th=1&psc=1","https://m.media-amazon.com/images/I/41I88LsOxwL._SL500_.jpg","1"
"echo dot","Smart Home","Bluetooth Speakers,Vanzon V40 Wireless Portable Bluetooth Speaker, IPX7 Waterproof Speaker with 24W Stereo Sound and 24H Playtime,TWS Dual Pairing Bluetooth 5.0 Speaker for Home/Outdoor","$39.98","$160.01 (80%)","80","https://www.amazon.ca/dp/B0FQQ1JGN7?tag=lesdealsduw02-20&linkCode=osi&th=1&psc=1","https://m.media-amazon.com/images/I/513ZCm9VbTL._SL500_.jpg","2"
"space heater","Home & Cleaning","FLANUR Space Heaters for Indoor Use, 1500W Room Heater Fan 2 in 1 with Remote, Thermostat, LED Display, Overheat & Tip Over Protection, 12H Timer, 70° Oscillating Heater for Bedroom, Black","$55.99","$209.00 (79%)","79","https://www.amazon.ca/dp/B0FCXS2LCS?tag=lesdealsduw02-20&linkCode=osi&th=1&psc=1","https://m.media-amazon.com/images/I/51WSIUWCvZL._SL500_.jpg","2"
"space heater","Home & Cleaning","FLANUR Space Heater for Indoor Use, 1500W Portable Electric Heater with Thermostat, WiFi and APP Control, Overheat & Tip-Over Protection, 12H Timer, 4 Modes, 36dB Heater for Office Bedroom Home, Black","$85.99","$313.96 (78%)","78","https://www.amazon.ca/dp/B0FLL3K1V4?tag=lesdealsduw02-20&linkCode=osi&th=1&psc=1","https://m.media-amazon.com/images/I/41TNAWy4KjL._SL500_.jpg","1"
"robot vacuum","Home & Cleaning","Robot Vacuum and Mop Combo, 2 in 1 Mopping Robot Vacuum Cleaner with Schedule, Wi-Fi/Voice/App, Strong Suction, Ease of Use, Self-Charging Robotic Vacuum, Slim, Ideal for Hard Floor, Pet Hair, Carpet","$159.99","$540.00 (77%)","77","https://www.amazon.ca/dp/B0F8MWC8N4?tag=lesdealsduw02-20&linkCode=osi&th=1&psc=1","https://m.media-amazon.com/images/I/41yOpwPUs3L._SL500_.jpg","1"
"standing desk","Office","Small Standing Desk Adjustable Height 32 Inch Mobile Sit Stand up Desk Portable Rolling with Wheels Standing for Walking pad Treadmill Rustic","$94.99","$305.00 (76%)","76","https://www.amazon.ca/dp/B0DZ5PBCLW?tag=lesdealsduw02-20&linkCode=osi&th=1&psc=1","https://m.media-amazon.com/images/I/31tYyVGCHaL._SL500_.jpg","2"
"car phone mount","Automotive","Phone Holder Car for Magsafe Car Accessories [78+LBS Hyper Suction & 4400gf Strongest Magnetic] 360°Adjustable Car Phone Holder Mount, Phone Holders for Car/Gym/Mirror for iPhone 16 Pro Max & Android","$19.99","$60.00 (75%)","75","https://www.amazon.ca/dp/B0FGQ658L3?tag=lesdealsduw02-20&linkCode=osi&th=1&psc=1","https://m.media-amazon.com/images/I/416Cp+ot-JL._SL500_.jpg","2"
"tools","Tools","XClifes Labor Saving Arm Jack Handle 2 Pack, Construction Jack, Wall Tile Locator, Multi Function Height Adjustment Lifting Device, Door Panel Lifting Cabinet, Raised 6.69 in, Pair Dynamic Load 450 LB","$48.44","$141.55 (75%)","75","https://www.amazon.ca/dp/B097K7JG56?tag=lesdealsduw02-20&linkCode=osi&th=1&psc=1","https://m.media-amazon.com/images/I/51L7oLmBU6L._SL500_.jpg","2"
"vacuum sealer","Kitchen","75Kpa Food Vacuum Sealer, 6-in-1 Dry/Moist Modes with Digital Timer, Compact Design, 10 Bags & Built-in Cutter (Sliver)","$41.99","$128.00 (75%)","75","https://www.amazon.ca/dp/B0FXFBN28C?tag=lesdealsduw02-20&linkCode=osi&th=1&psc=1","https://m.media-amazon.com/images/I/41V1ENd+9uL._SL500_.jpg","1"
"cutting board","Kitchen","Titanium Cutting Board for Kitchen, Cutting Board Double Sided Food Grade, Pure Titanium/PP, Easy to Clean Large Size 16”×10”","$52.99","$147.00 (74%)","74","https://www.amazon.ca/dp/B0FMDR8KG2?tag=lesdealsduw02-20&linkCode=osi&th=1&psc=1","https://m.media-amazon.com/images/I/41HPxcjXPBL._SL500_.jpg","2"
"vacuum","Home & Cleaning","Cordless Vacuum Cleaner, 80,000PRM Stick Vacuum with 2 Powerful Suction Modes, Max 40 Mins Runtime, Protable 2600mAh Rechargeable Battery Vacuum Cleaner for Home (Afterglow Red)","$149.99","$420.00 (74%)","74","https://www.amazon.ca/dp/B0F43P3QHV?tag=lesdealsduw02-20&linkCode=osi&th=1&psc=1","https://m.media-amazon.com/images/I/41qbfZK2PVL._SL500_.jpg","1"
"vacuum","Home & Cleaning","80,000PRM Motor Cordless Vacuum for Home, Vacuum Cleaner with 2 Adjustable Modes, 2200mAH Battery Max 35 Mins Runtime, and Washable Parts Stick Vacuum (Goose Gray)","$145.99","$424.00 (74%)","74","https://www.amazon.ca/dp/B0DN19ZB6T?tag=lesdealsduw02-20&linkCode=osi&th=1&psc=1","https://m.media-amazon.com/images/I/31EpuhkNVcL._SL500_.jpg","1"
"vacuum","Home & Cleaning","Cordless Vacuum Cleaner, 80,000 RPM Motor and Power Filtration, Stick Vacuum with 2200 mAh Battery, 35 Mins Worktime, 2 Modes, Rotated Multi-Heads, Height-Adjustable Vacuum for Home (Light Ash Gray)","$149.94","$420.05 (74%)","74","https://www.amazon.ca/dp/B0F5BCCLRJ?tag=lesdealsduw02-20&linkCode=osi&th=1&psc=1","https://m.media-amazon.com/images/I/41xMRYhyEWL._SL500_.jpg","2"
"fitness tracker","Wearables","IMFRCHCS Fitness Tracker,Smart Watch with 1.47"" Touch Display,137+Sport Modes Fitness Watch with Heart Rate Sleep Monitor, Step Counter,IP68 Waterproof Activity Trackers for Women Men","$39.98","$110.01 (73%)","73","https://www.amazon.ca/dp/B0FP19Q368?tag=lesdealsduw02-20&linkCode=osi&th=1&psc=1","https://m.media-amazon.com/images/I/412-tA+HGNL._SL500_.jpg","2"
"shower head","Home & Cleaning","High Pressure 10-Mode Handheld Shower Head - Built in Power Wash for Clean, Replaceable Filter Soften Hard Water Remove Chlorine, 60 Inches Hose, Overhead Bracket, Anti-Clog Nozzle (Chrome)","$39.99","$99.01 (71%)","71","https://www.amazon.ca/dp/B0D1P1XXKD?tag=lesdealsduw02-20&linkCode=osi&th=1&psc=1","https://m.media-amazon.com/images/I/51bRoukLc4L._SL500_.jpg","1"
"vacuum sealer","Kitchen","Mesliese Vacuum Sealer Machine Powerful 90Kpa Precision 6-in-1 Compact Vacuum Food Preservation System Built-in Cutter, Include 2 Bag Rolls & 5 Pre-cut Bags, Dry&Moist Modes Smart Suction (Deep Gray)","$89.98","$210.01 (70%)","70","https://www.amazon.ca/dp/B0FJMCQ68F?tag=lesdealsduw02-20&linkCode=osi&th=1&psc=1","https://m.media-amazon.com/images/I/41oqHt9LbVL._SL500_.jpg","1"
"hair dryer","Beauty & Personal Care","Hair Dryer - 150000 RPM High-Speed Brushless Motor Negative Ionic Blow Dryer for Fast Drying, Low Noise Thermo-Control Hair-Dryer-with-Diffuser and Nozzle","$129.99","$270.00 (68%)","68","https://www.amazon.ca/dp/B0C39T2VG5?tag=lesdealsduw02-20&linkCode=osi&th=1&psc=1","https://m.media-amazon.com/images/I/41CrBoVuf9L._SL500_.jpg","2"
"hairbrush","Beauty & Personal Care","Crave Naturals Glide Thru Detangling Hair Brush for Adults & Kids Hair Detangler Brush for Natural, Curly, Straight, Wet or Dry Hair Hairbrush for Men & Women 1 Pack Soft Hazy Swirl","$7.99","$17.00 (68%)","68","https://www.amazon.ca/dp/B0B2WX5D7S?tag=lesdealsduw02-20&linkCode=osi&th=1&psc=1","https://m.media-amazon.com/images/I/41XtWYpD6ML._SL500_.jpg","1"
"hairbrush","Beauty & Personal Care","Crave Naturals Glide Thru Detangling Brush for Adults and Kids Hair. Detangler Hairbrush for Curly, Straight, Wet or Dry Hair. Hair Brushes for Women. Styling Brush. (TURQUOISE AND PINK)","$8.99","$19.00 (68%)","68","https://www.amazon.ca/dp/B0B2WXXDT5?tag=lesdealsduw02-20&linkCode=osi&th=1&psc=1","https://m.media-amazon.com/images/I/41--I+HAVtL._SL500_.jpg","1"
"pet grooming","Pet Supplies","EGFKI Dog Dryer, 5.2HP/ 3800W Pet Grooming High Velocity Force Blower with 4 Nozzles, Adjustable Speed and Temperature Dog Hair Dryers for Grooming","$129.99 ($129.99 / count)","$270.00 (68%)","68","https://www.amazon.ca/dp/B0C53CJTVT?tag=lesdealsduw02-20&linkCode=osi&th=1&psc=1","https://m.media-amazon.com/images/I/41w3z9eJ63L._SL500_.jpg","2"
"sauna blanket","Health & Wellness","Portable Infrared Steam Sauna Tent for Outdoor & Indoor,3L 1400W Steamer with 5-Layer Waterproof Insulation,Folding Chair & Remote Control,Home Spa for Detox Relaxation Muscle Recovery (Black)","$289.99","$610.00 (68%)","68","https://www.amazon.ca/dp/B0FDGNF9TL?tag=lesdealsduw02-20&linkCode=osi&th=1&psc=1","https://m.media-amazon.com/images/I/51nQPh8NaaL._SL500_.jpg","2"
"travel bottles","Travel","Bottles","$3.00 ($0.75 / piece)","$6.49 (68%)","68","https://www.amazon.ca/dp/B0DFM5JZCG?tag=lesdealsduw02-20&linkCode=osi&th=1&psc=1","https://m.media-amazon.com/images/I/31DaZU5y1HL._SL500_.jpg","1"
"heating pad","Health & Wellness","Heating Pad Electric Heat Pad, Hot Heated Pad,Moist Heat Heating Pad Moist and Dry Heat,Multiple Temp and Timer Settings (Dawn Blue, 24""X12"")","$19.99 ($19.99 / count)","$39.01 (66%)","66","https://www.amazon.ca/dp/B0CXHJCR7T?tag=lesdealsduw02-20&linkCode=osi&th=1&psc=1","https://m.media-amazon.com/images/I/31NYl+JeB3L._SL500_.jpg","1"
"wireless earbuds","Audio & Music","Wireless Earbuds, Bluetooth 5.3 Headphones HiFi Stereo, Mini in-Ear Bluetooth Earbuds, Wireless Earphones with 4 ENC Noise Cancelling Mic, IP7 Waterproof, LED Display, Touch Control Ear Buds, Black","$23.98","$46.01 (66%)","66","https://www.amazon.ca/dp/B0CBWLWGDB?tag=lesdealsduw02-20&linkCode=osi&th=1&psc=1","https://m.media-amazon.com/images/I/410v7d4GccL._SL500_.jpg","2"
"electric bike","Sports & Fitness","Electric Bike for Adults, 2000/1000W, 35/30MPH,40/20/15AH Removable Battery, Max 50-180 Miles Electric Motorcycle, 20/26"" Fat Tire Bike, All-Terrain E Bike for Mountains, Snow, Sand, Road","$415.00","$784.00 (65%)","65","https://www.amazon.ca/dp/B0CYL4V4YM?tag=lesdealsduw02-20&linkCode=osi&th=1&psc=1","https://m.media-amazon.com/images/I/41nlmeALP7L._SL500_.jpg","1"
"laptop","Laptops & Tablets","jumper Laptop 15.6 Inch FHD IPS Display, 12GB RAM 640GB ROM, Windows 11 Computer with Office 365 Subscription, 38Wh Battery, 2 Stereo Speakers, USB3.0 * 2, HDMI.","$419.99","$780.00 (65%)","65","https://www.amazon.ca/dp/B0FSKBYLVR?tag=lesdealsduw02-20&linkCode=osi&th=1&psc=1","https://m.media-amazon.com/images/I/41WZJ4+DjyL._SL500_.jpg","2"
"laptop","Laptops & Tablets","2 in 1 Laptop, 12 Inch 2K FHD IPS Touchscreen, 12GB DDR5 RAM 512GB SSD, N95, Detachable Keyboard, UHD Graphics, Dual Stereo Speakers, Dual Camera, Convertible Tablet PC.","$529.99","$970.00 (65%)","65","https://www.amazon.ca/dp/B0FRRTGMQ7?tag=lesdealsduw02-20&linkCode=osi&th=1&psc=1","https://m.media-amazon.com/images/I/41rpMSm-KtL._SL500_.jpg","2"
"vacuum sealer","Kitchen","Vacuum Sealer, Fully Automatic Food Saver Vacuum Sealer Machine with 20 Pcs Food Preservation Bags, Super Suction Power, One-Touch Intelligent Operation, Digital Display","$34.98","$65.01 (65%)","65","https://www.amazon.ca/dp/B0F12R1L28?tag=lesdealsduw02-20&linkCode=osi&th=1&psc=1","https://m.media-amazon.com/images/I/51agE-BLk-L._SL500_.jpg","1"
"blackout stickers","Home & Cleaning","ECUCM Blackout Curtains, 78"" x 57"" Portable Travel Window Coverings Blackout Shades, 100% Room Darkening Black Shades for Baby Nursery Kids Bedroom Temporary Blinds","$9.99","$18.00 (64%)","64","https://www.amazon.ca/dp/B0C3R3YQ95?tag=lesdealsduw02-20&linkCode=osi&th=1&psc=1","https://m.media-amazon.com/images/I/41Y3ulU2UNL._SL500_.jpg","2"
"car accessories","Automotive","3-in-1 Car Phone Holder, [ Off-Road Level Suction Cup & Clip] Universal Cell Phone Holder Mount Dashboard Windshield Vent One-Hand Operation Holder Compatible with All Smartphones and Cars","$17.98","$32.01 (64%)","64","https://www.amazon.ca/dp/B0D5LLR9LN?tag=lesdealsduw02-20&linkCode=osi&th=1&psc=1","https://m.media-amazon.com/images/I/51jcE+iSEsL._SL500_.jpg","2"
"essential oils","Beauty & Personal Care","SoulOrigin Halloween Essential Oils Set, Fragrance Oil Set for Oil Diffusers, Fragrant stone and Soap Making Scents 6x10ml - Caramel Apples, Pumpkin Pie, Candy Corn, Halloween Cookies, Popcorn Balls, Snickers","$5.99 ($9.98 / 100 ml)","$10.00 (63%)","63","https://www.amazon.ca/dp/B0FB8ZDQ9H?tag=lesdealsduw02-20&linkCode=osi&th=1&psc=1","https://m.media-amazon.com/images/I/51ORj6IKMZL._SL500_.jpg","1"
"pool","Outdoor & Camping","Large Foldable Dog Pool 97""x16"", Hyperzoo Super Oversize Collapsible Dog Pet Bathing Tub Portable Kiddie Pool Leakproof PVC Swimming Pool for Small Large Dogs Pets Kids Blue","$27.49","$46.50 (63%)","63","https://www.amazon.ca/dp/B0CRB67QXB?tag=lesdealsduw02-20&linkCode=osi&th=1&psc=1","https://m.media-amazon.com/images/I/41MzN4V7M9L._SL500_.jpg","1"
"robot vacuum","Home & Cleaning","Lefant M310 Robot Vacuum Cleaner, 4500Pa Powerful Suction, PreciSense Obstacle Avoidance, Slim, Quite, 160 Mins Self-Charging Robotic Vacuums, WiFi/App/Voice, Ideal for Pet Hair Hard Floors, Gray","$139.99","$240.00 (63%)","63","https://www.amazon.ca/dp/B0CRCW8CXY?tag=lesdealsduw02-20&linkCode=osi&th=1&psc=1","https://m.media-amazon.com/images/I/41pQv1AAXIL._SL500_.jpg","2"
"apple pencil","Computers & Tech","JAMJAKE 5 Mins Fast Charging Stylus Pen for iPad 2018-2025,Palm Rejection Pencil for Apple iPad Compatible with iPad 6/7/8/9/10/11,iPad Air 3/4/5/M2/M3,iPad Pro 11""/12.9""/M4,iPad mini 5/6/7","$18.99","$30.99 (62%)","62","https://www.amazon.ca/dp/B08L7975V6?tag=lesdealsduw02-20&linkCode=osi&th=1&psc=1","https://m.media-amazon.com/images/I/41VNMbJjCDL._SL500_.jpg","1"
"chainsaw","Tools","Greenworks 40V 16-Inch Brushless Cordless Chainsaw | Powerful Electric Handheld Chainsaw | Auto Oiler for Yard Tree Felling, Firewood Cutting Logging Pruning, 4.0 AH Battery & Charger Included","$152.61","$236.39 (61%)","61","https://www.amazon.ca/dp/B07WTDF563?tag=lesdealsduw02-20&linkCode=osi&th=1&psc=1","https://m.media-amazon.com/images/I/41Tq4x2nrHL._SL500_.jpg","1"
"joggers","Clothing & Accessories","BROKIG Mens Lightweight Gym Jogger Pants,Men's Workout Sweatpants with Zip Pocket(Dark Grey, Large)","$31.19","$47.80 (61%)","61","https://www.amazon.ca/dp/B08F3HJK1M?tag=lesdealsduw02-20&linkCode=osi&th=1&psc=1","https://m.media-amazon.com/images/I/41RkiVTjdML._SL500_.jpg","2"
"laptop","Laptops & Tablets","jumper Laptop, 14 Inch 1080p FHD IPS Screen, 12GB LPDDR4 RAM, 256GB SSD ROM, Windows 11 Laptops Computer with Celeron 4-Core Processor, UHD Graphics 600, 2 Stereo Speaker, Lightweight, Portable.","$309.99","$490.00 (61%)","61","https://www.amazon.ca/dp/B0FPQJV9B6?tag=lesdealsduw02-20&linkCode=osi&th=1&psc=1","https://m.media-amazon.com/images/I/41OQPZ8V4pL._SL500_.jpg","1"
"apple pencil","Computers & Tech","Metapen A8 Pencil for i Pad 2018-2025, 4Min Fast Charge, Palm Rejection, Tilt Sensitivity Stylus Pen for iPad 10th 11/9/8/7/6, iPad Accessories for Pro 12.9/11/13"", iPad Air 3/4/5/M2/M3, iPad Mini 5/6","$19.99","$30.00 (60%)","60","https://www.amazon.ca/dp/B09ZTXVNVD?tag=lesdealsduw02-20&linkCode=osi&th=1&psc=1","https://m.media-amazon.com/images/I/212wLzsvuSL._SL500_.jpg","1"
"car dashcam","Automotive","Dash Cam Front, VEEMENT Mini Dash Cam for Cars, 1440P Car Camera with APP, 1.47"" Display Dashcam, WiFi Dash Cam with WDR Night Vision, 24 Hours Parking Monitor Dashcams, 170°Wide, G-Sensor","$39.99","$60.00 (60%)","60","https://www.amazon.ca/dp/B0FT13D339?tag=lesdealsduw02-20&linkCode=osi&th=1&psc=1","https://m.media-amazon.com/images/I/51zfiurn69L._SL500_.jpg","1"
"cervical pillow","Bedroom","Mkicesky Neck Support Pillow for Sleeping Memory Foam Pillow for Neck Shoulder Pain Relief – Ergonomic Cervical Pillow for Side, Back & Stomach Sleepers – Orthopedic Reading Pillow","$40.35","$59.64 (60%)","60","https://www.amazon.ca/dp/B0FBWPTW4F?tag=lesdealsduw02-20&linkCode=osi&th=1&psc=1","https://m.media-amazon.com/images/I/41V+md8cSbL._SL500_.jpg","1"
"garden tools","Garden","WORKPRO Garden Tools Set, 7 Piece, Stainless Steel Heavy Duty Gardening Tools with Wooden Handle, Including Garden Tote, Gloves, Trowel, Hand Weeder, Cultivator and More-Gardening Gifts for Women Men","$20.00","$29.99 (60%)","60","https://www.amazon.ca/dp/B07T7LN3MN?tag=lesdealsduw02-20&linkCode=osi&th=1&psc=1","https://m.media-amazon.com/images/I/51+xaV6wWrL._SL500_.jpg","1"
"laptop","Laptops & Tablets","SGIN 15.6 Inch Laptops Computer with Office 365, Win 11 Laptop, 16GB RAM 1024GB SSD Ordinateur Portable, Celeron N5100 Quad-Core, 180° Open Angle, 7000mAh, Type-C, HDMI, for Business and Students","$499.99","$750.00 (60%)","60","https://www.amazon.ca/dp/B0FM8JF6TP?tag=lesdealsduw02-20&linkCode=osi&th=1&psc=1","https://m.media-amazon.com/images/I/41Egmf2jf2L._SL500_.jpg","1"
"laptop","Laptops & Tablets","SGIN 15.6 Inch Laptops Computer, Windows 11 Laptop, 16GB RAM 1024GB SSD Ordinateur Portable, Core i3 Processor(Up to3.9GHz), 180° Open Angle, 7000mAh, Type-C, for Business and Students(Grey)","$549.99","$825.00 (60%)","60","https://www.amazon.ca/dp/B0FM31SPYP?tag=lesdealsduw02-20&linkCode=osi&th=1&psc=1","https://m.media-amazon.com/images/I/51HfBuD2e2L._SL500_.jpg","1"
"portable charger","Power & Chargers","Power Bank, Portable Charger 10000mAh with PD 15w Fast Charging, 4 Outputs 3 Inputs with Built in TypeC, USBA Battery Pack, Compatible with iPhone 17 16 15 14 Pro Max Samsung Android Cell Phone etc","$19.99","$30.00 (60%)","60","https://www.amazon.ca/dp/B0DJVSR429?tag=lesdealsduw02-20&linkCode=osi&th=1&psc=1","https://m.media-amazon.com/images/I/41qTQZcJuYL._SL500_.jpg","1"
"tennis","Sports & Fitness","adidas Men's Club Tennis Climacool 3-Stripes T-Shirt, Black, X-Large","$22.00","$33.00 (60%)","60","https://www.amazon.ca/dp/B0D235K85W?tag=lesdealsduw02-20&linkCode=osi&th=1&psc=1","https://m.media-amazon.com/images/I/31lVtVd2xCL._SL500_.jpg","2"
"vacuum","Home & Cleaning","MQDXE Cordless Stick Vacuum Cleaner: 550W Powerful Suction, LED Display, 55 Min Runtime, Anti-Tangle Brush, Rechargeable Battery, Lightweight for Home, Pet Hair, Hard Floors, Carpet","$199.99","$300.00 (60%)","60","https://www.amazon.ca/dp/B0DGPLQSYM?tag=lesdealsduw02-20&linkCode=osi&th=1&psc=1","https://m.media-amazon.com/images/I/41413OXgPqL._SL500_.jpg","1"
"action camera","Cameras & Photography","Action Camera 4K 60FPS with Dual Screens Design, Underwater Camera 64GB Memory Card Included, 132FT Waterproof Camera, 30MP Photo, EIS, 5X Zoom, Sports Camera with Accessories Kit, WiFi Remote Control","$69.99","$100.00 (59%)","59","https://www.amazon.ca/dp/B0FTK4Q2C7?tag=lesdealsduw02-20&linkCode=osi&th=1&psc=1","https://m.media-amazon.com/images/I/51zpFIyNAFL._SL500_.jpg","1"
"badminton","Sports & Fitness","SONGMICS 13 ft Badminton Net, Height Adjustable Volleyball Net, Pickleball Net with Poles, Foldable Nylon Net for Tennis Indoor Outdoor Court, Black USYQ400H","$37.29","$52.70 (59%)","59","https://www.amazon.ca/dp/B085B22VJK?tag=lesdealsduw02-20&linkCode=osi&th=1&psc=1","https://m.media-amazon.com/images/I/51ZeIPQnpyL._SL500_.jpg","2"
"robot vacuum","Home & Cleaning","Lefant Robot Vacuum Cleaner, 4000Pa Powerful Suction, 200 Min Runtime, 6 Cleaning Modes, Slim, Quiet, Self-Charging, WiFi/App/Alexa Control, Ideal for Pet Hair and Hard Floors(M210 Pro)","$119.99","$170.00 (59%)","59","https://www.amazon.ca/dp/B0DT93GNXL?tag=lesdealsduw02-20&linkCode=osi&th=1&psc=1","https://m.media-amazon.com/images/I/41Mn9iugF3L._SL500_.jpg","1"
"cervical pillow","Bedroom","Mkicesky Orthopedic Memory Foam Pillow for Neck Shoulder Pain Relief - Ergonomic Neck Support Sleeping Pillow for Side, Back & Stomach Sleepers - Cervical Bed Pillow with Cooling Cover-Reading Pillow","$43.30","$56.69 (57%)","57","https://www.amazon.ca/dp/B08FJ9737F?tag=lesdealsduw02-20&linkCode=osi&th=1&psc=1","https://m.media-amazon.com/images/I/41BgNWpahAL._SL500_.jpg","1"
