"keyword","category","title","price","savings","percent","link","imageUrl","page"
"fishing gear","Outdoor & Camping","Pristis UTA II Fishing Pliers, Multi-Function Gear for Experts, Saltwater Resistant Teflon Coated Hook Remover, Stainless Steel Top & Aluminum Body Split Ring Fly Fishing Equipment, Bass Fishing Gift","$19.99","$10.00 (33%)","33","https://www.amazon.ca/dp/B0CKSXMYYV?tag=lesdealsduw02-20&linkCode=osi&th=1&psc=1","https://m.media-amazon.com/images/I/41iXKduQT-L._SL500_.jpg","1"
"fishing reel","Outdoor & Camping","Sougayilang Fishing Reel 13+1BB Light Weight Ultra Smooth Aluminum Spinning Fishing Reel with Free Spare Spool - XY2000","$32.98","$16.57 (33%)","33","https://www.amazon.ca/dp/B0747N5N9G?tag=lesdealsduw02-20&linkCode=osi&th=1&psc=1","https://m.media-amazon.com/images/I/51aVlOZnfmL._SL500_.jpg","1"
"fitness equipment","Sports & Fitness","Resistance Bands with Ankle Straps, Ankle Weights Bands for Working Out, Exercise Band for Women Leg and Glute, Booty Workout Equipment for Kickbacks,Butt and Hip Training, Home Gym Fitness Equipment","$19.99","$10.00 (33%)","33","https://www.amazon.ca/dp/B0CJ2QR1PY?tag=lesdealsduw02-20&linkCode=osi&th=1&psc=1","https://m.media-amazon.com/images/I/51qY+pOhMJL._SL500_.jpg","1"
"gaming headset","Gaming","JBL Quantum 100M2 - Wired Over-Ear Gaming Headset with omnidirectional, Detachable mic with Mute Option and Fabric-Covered Memory Foam Ear Cushions, Compatible with All Platforms (Black)","$39.98","$20.00 (33%)","33","https://www.amazon.ca/dp/B0DRM949PC?tag=lesdealsduw02-20&linkCode=osi&th=1&psc=1","https://m.media-amazon.com/images/I/31Pgyw9itKL._SL500_.jpg","1"
"gaming headset","Gaming","JBL Quantum 350 Wireless Over-Ear PC Gaming Headset with Detachable Boom mic - Black","$99.98","$50.00 (33%)","33","https://www.amazon.ca/dp/B098R6CLQ6?tag=lesdealsduw02-20&linkCode=osi&th=1&psc=1","https://m.media-amazon.com/images/I/31sYiqsM8PL._SL500_.jpg","1"
"gaming keyboard","Gaming","RK ROYAL KLUDGE RK61 Wired 60% Mechanical Gaming Keyboard Programmable QMK/VIA RGB Backlit 61 Keys Ultra-Compact Hot Swappable Red Switch White","$59.99","$30.00 (33%)","33","https://www.amazon.ca/dp/B089GN2KBT?tag=lesdealsduw02-20&linkCode=osi&th=1&psc=1","https://m.media-amazon.com/images/I/41bborQ0jcL._SL500_.jpg","2"
"garden tools","Garden","Garden Tool Hoe and Cultivator Hand Tiller with 45inch Adjustable Handle,Heavy Duty Garden Rake with Hoe, Hand Garden Tools Sturdy Sharp","$15.99","$8.00 (33%)","33","https://www.amazon.ca/dp/B0C5QDTBXZ?tag=lesdealsduw02-20&linkCode=osi&th=1&psc=1","https://m.media-amazon.com/images/I/51YXQOhRgML._SL500_.jpg","1"
"grill tools","Garden","VIKEYHOME Griddle Accessories Kit, 28 Pcs Griddle Grill Tools Set, Professional Grill BBQ Spatula Set with Basting Cover, Spatula, Scraper, Bottle, Tongs, Egg Ring","$37.36","$18.63 (33%)","33","https://www.amazon.ca/dp/B0CSK5QC59?tag=lesdealsduw02-20&linkCode=osi&th=1&psc=1","https://m.media-amazon.com/images/I/41hVhMB1eaL._SL500_.jpg","2"
"gua sha","Beauty & Personal Care","Rena Chris Gua Sha Facial Tools, Stainless Steel Guasha, Manual Massage Sticks for Jawline Sculpting and Puffiness Reducing, Facial Massage Tool, Skin-Care Tool (Silver)","$6.99","$3.00 (30%)","30","https://www.amazon.ca/dp/B09TPDYS7N?tag=lesdealsduw02-20&linkCode=osi&th=1&psc=1","https://m.media-amazon.com/images/I/412aXkYxBBL._SL500_.jpg","1"
"headphone stand","Audio & Music","Nayubo Headphone Stand, Universal Headset Display Hanger Rack Aluminum Headset Holder with Flexible Headrest Gaming Headset Stand Earphone Stand for All Headphones Size (Black)","$8.00","$3.99 (33%)","33","https://www.amazon.ca/dp/B0CGR9ZGS7?tag=lesdealsduw02-20&linkCode=osi&th=1&psc=1","https://m.media-amazon.com/images/I/21EgAz8h7LL._SL500_.jpg","1"
"jewelry box","Bedroom","SONGMICS Jewelry Box, 5-Layer Jewelry Organizer, 6.1 x 10.3 x 12.6 Inches, Cloud White and Metallic Gold UJBC162W01","$53.99","$26.00 (33%)","33","https://www.amazon.ca/dp/B09W89YJP1?tag=lesdealsduw02-20&linkCode=osi&th=1&psc=1","https://m.media-amazon.com/images/I/41IgMM0EUYL._SL500_.jpg","1"
"keyboard","Computers & Tech","Logitech MK345 Wireless Combo Full-Sized Keyboard with Palm Rest and Comfortable Right-Handed Mouse, 2.4 GHz Wireless USB Receiver, Compatible with PC, Laptop,Black","$39.99","$20.00 (33%)","33","https://www.amazon.ca/dp/B00QXT5T3U?tag=lesdealsduw02-20&linkCode=osi&th=1&psc=1","https://m.media-amazon.com/images/I/318zs7Y1XML._SL500_.jpg","2"
"kids headphones","Kids & Education","iClever BTH12 Kids Headphones Wireless with Colorful LED Lights, Kids Bluetooth5.2 Headphones, 74/85dBA Volume Limited & 85H Playtime, Over Ear Headphone & Mic for iPad/Tablet/Airplane/Travel, Blue","$32.29","$15.70 (33%)","33","https://www.amazon.ca/dp/B0895PBJCQ?tag=lesdealsduw02-20&linkCode=osi&th=1&psc=1","https://m.media-amazon.com/images/I/41pSkthTd0L._SL500_.jpg","2"
"kids toys","Toys & Games","Girls Charm Bracelet Making Kit: Unicorn Toys for Girls Gifts 8-12 Years Old, Birthday Gifts 6 7 8 9 10 Year Old Girl Gift Ideas, Inspires Creativity Art and Crafts for Kids Age 6-8 Jewelry Making Set","$19.99","$10.00 (33%)","33","https://www.amazon.ca/dp/B07M6CDS77?tag=lesdealsduw02-20&linkCode=osi&th=1&psc=1","https://m.media-amazon.com/images/I/51x9rC42AeL._SL500_.jpg","1"
"lego","Toys & Games","LEGO Creator 3 in 1 Playful Cat Toy - Building Toy with 3 Building Options, Cat, Dog, or Pigeon - Animal Figures for Kids, Girls and Boys, Ages 8+ - Gift Idea for Birthday - 31163","$19.98","$10.01 (33%)","33","https://www.amazon.ca/dp/B0DJ19581W?tag=lesdealsduw02-20&linkCode=osi&th=1&psc=1","https://m.media-amazon.com/images/I/41xHit8BLcL._SL500_.jpg","1"
"manicure set","Beauty & Personal Care","Utopia Care - Professional Manicure Pedicure Set, 15 in 1 Stainless Steel Nail Clippers Kit, Portable Travel Grooming Set, Facial Cuticle and Nail Care Tools for Men and Women (Black)","$13.99 ($0.93 / count)","$7.00 (33%)","33","https://www.amazon.ca/dp/B073WKPXDX?tag=lesdealsduw02-20&linkCode=osi&th=1&psc=1","https://m.media-amazon.com/images/I/511g3eSbojL._SL500_.jpg","1"
"mascara","Beauty & Personal Care","Rimmel London - Lash Accelerator Endless Mascara","$5.99 ($59.90 / 100 ml)","$2.99 (33%)","33","https://www.amazon.ca/dp/B00DL4N0O0?tag=lesdealsduw02-20&linkCode=osi&th=1&psc=1","https://m.media-amazon.com/images/I/31ENr-99opL._SL500_.jpg","1"
"mascara","Beauty & Personal Care","COVERGIRL - Lash Blast Cleantopia Mascara, Clean Volumizing Mascara, plant-powered clean vegan Formula, Conditions Lashes - Extreme Black - 800","$9.99 ($105.16 / 100 ml)","$5.00 (33%)","33","https://www.amazon.ca/dp/B0BVBZWHBR?tag=lesdealsduw02-20&linkCode=osi&th=1&psc=1","https://m.media-amazon.com/images/I/41Wg3ic2F1L._SL500_.jpg","2"
"mens polo shirts","Clothing & Accessories","JACK & JONES Paulos Polo SS Bright Cobalt Large","$29.94","$15.06 (33%)","33","https://www.amazon.ca/dp/B079C8RP9Y?tag=lesdealsduw02-20&linkCode=osi&th=1&psc=1","https://m.media-amazon.com/images/I/41d4lCW2QRL._SL500_.jpg","1"
"mens underwear","Clothing & Accessories","EKQ Mens Boxer Briefs Underwear 6 Pack Soft Bamboo Rayon Trunks Comfortable Stretch Men's Tagless Underwear with Fly","$23.42","$11.57 (33%)","33","https://www.amazon.ca/dp/B0BV6FKGK5?tag=lesdealsduw02-20&linkCode=osi&th=1&psc=1","https://m.media-amazon.com/images/I/41GHTPxRLrL._SL500_.jpg","1"
"microwave","Kitchen","Avanti MT09V3S Microwave Oven 900-Watts Compact with 10 Power Levels and 6 Pre Cooking Settings, Speed Defrost, Electronic Control Panel and Glass Turntable, 0.9-Cu.Ft, Stainless Steel","$89.99","$44.00 (33%)","33","https://www.amazon.ca/dp/B00QEU9GVO?tag=lesdealsduw02-20&linkCode=osi&th=1&psc=1","https://m.media-amazon.com/images/I/31NV7lsI2nL._SL500_.jpg","1"
"neck fan","Health & Wellness","AMACOOL Bladeless Neck Fan Portable Personal Fan 5000mAh Rechargeable Battery Operated Wearable Fan for Women Men Outdoor Sport Travel Patio Garden Work Home Kitchen","$26.99","$13.00 (33%)","33","https://www.amazon.ca/dp/B098K83GKL?tag=lesdealsduw02-20&linkCode=osi&th=1&psc=1","https://m.media-amazon.com/images/I/41c-TsPpzLL._SL500_.jpg","2"
"notebooks","Kids & Education","ZICOTO Aesthetic Spiral Notebook Set of 3 For Women - Cute College Ruled 8x6 Journal/Notebook with Large Pockets And Lined Pages - Perfect Supplies to Stay Organized at Work or School","$19.99","$10.00 (33%)","33","https://www.amazon.ca/dp/B0BWYLWWC1?tag=lesdealsduw02-20&linkCode=osi&th=1&psc=1","https://m.media-amazon.com/images/I/41Kbtd7UkVL._SL500_.jpg","2"
"office decor","Office","Der Rose 3 Pack Mini Potted Fake Plants Artificial Plastic Eucalyptus Plants for Home Office Desk Farmhouse Room Decor Indoor","$24.99","$12.49 (33%)","33","https://www.amazon.ca/dp/B07VKJKFN2?tag=lesdealsduw02-20&linkCode=osi&th=1&psc=1","https://m.media-amazon.com/images/I/51GgiCXMCkL._SL500_.jpg","1"
"oven","Kitchen","Danby DBTO0412BBSS 0.4 cu ft 4 Slice Countertop Toaster Oven With Toast, Bake, Broil, Keep Warm functions in Stainless Steel","$53.27","$26.72 (33%)","33","https://www.amazon.ca/dp/B097RZQJ56?tag=lesdealsduw02-20&linkCode=osi&th=1&psc=1","https://m.media-amazon.com/images/I/41CUhIgO4oS._SL500_.jpg","2"
"pasta","Food","La Molisana Farfalle (Bow Ties) N.66, 450g","$1.99 ($0.44 / 100 g)","$1.00 (33%)","33","https://www.amazon.ca/dp/B0765ZJVSG?tag=lesdealsduw02-20&linkCode=osi&th=1&psc=1","https://m.media-amazon.com/images/I/51Ycf1rPMbL._SL500_.jpg","1"
"pasta","Food","La Molisana Rigatoni N.31, 450g","$1.99 ($0.44 / 100 g)","$1.00 (33%)","33","https://www.amazon.ca/dp/B07MMMNWCM?tag=lesdealsduw02-20&linkCode=osi&th=1&psc=1","https://m.media-amazon.com/images/I/51Iu7RSIiaL._SL500_.jpg","1"
"pasta","Food","La Molisana Elbows (Coudes) N.70, 450g","$1.99 ($0.44 / 100 g)","$1.00 (33%)","33","https://www.amazon.ca/dp/B00L2YFG16?tag=lesdealsduw02-20&linkCode=osi&th=1&psc=1","https://m.media-amazon.com/images/I/519HvuyhuFL._SL500_.jpg","1"
"pasta","Food","La Molisana Fettucce Ricce N.2, 450g, (Package May Vary)","$1.99 ($0.44 / 100 g)","$1.00 (33%)","33","https://www.amazon.ca/dp/B07PV3PNX9?tag=lesdealsduw02-20&linkCode=osi&th=1&psc=1","https://m.media-amazon.com/images/I/41-WRPgnybL._SL500_.jpg","1"
"pasta","Food","La Molisana Capellini N.17, 450g","$1.99 ($0.44 / 100 g)","$1.00 (33%)","33","https://www.amazon.ca/dp/B07RRC6BDN?tag=lesdealsduw02-20&linkCode=osi&th=1&psc=1","https://m.media-amazon.com/images/I/41AVzNhcZCL._SL500_.jpg","1"
"pasta","Food","La Molisana Linguine N.6, 450g","$1.99 ($0.44 / 100 g)","$1.00 (33%)","33","https://www.amazon.ca/dp/B00LM923E4?tag=lesdealsduw02-20&linkCode=osi&th=1&psc=1","https://m.media-amazon.com/images/I/3192pjz3I2L._SL500_.jpg","2"
"pasta","Food","La Molisana Capellini Spezzati N.58A, 450g","$1.99 ($0.44 / 100 g)","$1.00 (33%)","33","https://www.amazon.ca/dp/B00LM95HAG?tag=lesdealsduw02-20&linkCode=osi&th=1&psc=1","https://m.media-amazon.com/images/I/51FSmdH+g2L._SL500_.jpg","2"
"pasta","Food","La Molisana Orzo N.65, 450g ( Packaging May Vary )","$1.99 ($0.44 / 100 g)","$1.00 (33%)","33","https://www.amazon.ca/dp/B07N1Y1CKN?tag=lesdealsduw02-20&linkCode=osi&th=1&psc=1","https://m.media-amazon.com/images/I/51guLHPfJqL._SL500_.jpg","2"
"pet brush","Pet Supplies","aumuca Cat Brush Dog Brush for Shedding, Cat Brushes for Long or Short Haired Cats, Dog Hair Brush Cat Grooming Brush Cat Comb Cat Deshedding Brush Easily Removes Mats, Tangles, and Loose Fur, White","$19.99","$10.00 (33%)","33","https://www.amazon.ca/dp/B098P6164W?tag=lesdealsduw02-20&linkCode=osi&th=1&psc=1","https://m.media-amazon.com/images/I/41KLVMlxkfL._SL500_.jpg","1"
"pet ramp","Pet Supplies","COZY KISS Dog Stairs for Small Dogs 15.7"" H, Pet Step with Leakproof Cover, High Density Foam Cat Ramp for Couch, Sofa or Chair, Lightweight, Durable, Comfort, 15.7x22.4x15.7 inch, 3 Step, Beige","$59.99","$30.00 (33%)","33","https://www.amazon.ca/dp/B0CS6GZ4YQ?tag=lesdealsduw02-20&linkCode=osi&th=1&psc=1","https://m.media-amazon.com/images/I/41D278OtbGL._SL500_.jpg","1"
"pet stairs","Pet Supplies","COZY KISS Dog Stairs for Small Dogs 15.7"" H, Curved Dog Step for Puppy, Older Cat, Medium Pet Ramp for Sofa, Couch or Chair, Ladder with High Density Foam, 15.7x22.4x15.7 inch, 3 Step, Charcoal Grey","$59.99","$30.00 (33%)","33","https://www.amazon.ca/dp/B0CRV942QH?tag=lesdealsduw02-20&linkCode=osi&th=1&psc=1","https://m.media-amazon.com/images/I/41JxtfJsI2L._SL500_.jpg","2"
"phone charger station","Bedroom","JARGOU 3 in 1 Charging Station for Apple Wireless Charger for iPhone 17 16e 16 15 14 13 12 11 X 8 & for iWatch Charger Wireless Charging Station for Multiple Devices for AirPods 2/3/4/Pro/Pro 2/Pro 3","$39.99","$20.00 (33%)","33","https://www.amazon.ca/dp/B0BQ2SYFJ7?tag=lesdealsduw02-20&linkCode=osi&th=1&psc=1","https://m.media-amazon.com/images/I/51dp9brWOqL._SL500_.jpg","1"
"portable monitor","Computers & Tech","InnoView Portable Monitor, 15.6 Inch FHD 1080P USB C HDMI Second External Monitor for Laptop, Desktop, MacBook, Phones, Tablet, PS5/4, Xbox, Switch, Built-in Speaker with Smart Cover","$93.49","$46.50 (33%)","33","https://www.amazon.ca/dp/B0B2PJNG8D?tag=lesdealsduw02-20&linkCode=osi&th=1&psc=1","https://m.media-amazon.com/images/I/41sp4WWMsDL._SL500_.jpg","2"
"razer","Gaming","Razer Barracuda X Wireless Gaming & Mobile Headset (PC, PlayStation, Switch, Android, iOS): 2022 Model - 2.4GHz Wireless + Bluetooth - Lightweight 250g - 40mm Drivers - 50 Hr Battery - Black","$96.98","$48.01 (33%)","33","https://www.amazon.ca/dp/B09XZZQK6Q?tag=lesdealsduw02-20&linkCode=osi&th=1&psc=1","https://m.media-amazon.com/images/I/41NwwLy4txL._SL500_.jpg","1"
"rhinestones","Arts & Crafts","B7000 Jewelry Bead Glue with Rhinestones for Crafts, Audab 2100Pcs Round Flat Back Gems Crystal Rhinestones with Tweezer Dotting Tools Clear Glue for Clothes Fabric Shoes Jewelry Making Nail Art","$9.99","$5.00 (33%)","33","https://www.amazon.ca/dp/B09XVCY9CL?tag=lesdealsduw02-20&linkCode=osi&th=1&psc=1","https://m.media-amazon.com/images/I/61b8CqS7RKL._SL500_.jpg","1"
"running shoes","Clothing & Accessories","adidas Men's Lite Racer Adapt 7.0, Core Black/Grey Six/Grey Six, 8.5","$40.00","$20.00 (33%)","33","https://www.amazon.ca/dp/B0CKM9JVJB?tag=lesdealsduw02-20&linkCode=osi&th=1&psc=1","https://m.media-amazon.com/images/I/31v3rB-l87L._SL500_.jpg","1"
"screwdriver","Tools","DEWALT 4V Cordless Screwdriver 15 PC Set (DWHT66719)","$81.00","$39.26 (33%)","33","https://www.amazon.ca/dp/B0DJBQ9ZBF?tag=lesdealsduw02-20&linkCode=osi&th=1&psc=1","https://m.media-amazon.com/images/I/41twyXZUjYL._SL500_.jpg","2"
"security light","Security","CLAONER Solar Lights Outdoor Motion Sensor Lights 3 Modes, Solar Powered Security Lights (Permanent On All Night/Smart Brightness Control) with 270 Degree Wide Angle IP65 Waterproof for Deck Garage Animal","$39.99","$20.00 (33%)","33","https://www.amazon.ca/dp/B07XXWRZJ6?tag=lesdealsduw02-20&linkCode=osi&th=1&psc=1","https://m.media-amazon.com/images/I/51o+tMS0HhL._SL500_.jpg","1"
"shampoo","Beauty & Personal Care","Garnier Fructis Pure Clean Zero Silicone Fortifying Shampoo for Normal to Oily Hair, with Citrus Extract, 650mL","$5.99 ($0.92 / 100 ml)","$3.00 (33%)","33","https://www.amazon.ca/dp/B09M594546?tag=lesdealsduw02-20&linkCode=osi&th=1&psc=1","https://m.media-amazon.com/images/I/41eG7qNF8vL._SL500_.jpg","1"
"shovel","Garden","Heavy-Duty Round Point Shovel, Carbon Steel Blade, Fibreglass, Straight Handle","$32.49","$15.71 (33%)","33","https://www.amazon.ca/dp/B07JBJ7H1J?tag=lesdealsduw02-20&linkCode=osi&th=1&psc=1","https://m.media-amazon.com/images/I/31jHq+C6I8L._SL500_.jpg","1"
"sleeping pad","Outdoor & Camping","ECOTEK Outdoors Hybern8 Ultralight Inflatable Sleeping Pad with Contoured FlexCell Honeycomb Design - Easy to Inflate, Comfortable, Lightweight, Durable, and Hammock Approved [Fire Orange]","$39.95","$20.00 (33%)","33","https://www.amazon.ca/dp/B072C632C2?tag=lesdealsduw02-20&linkCode=osi&th=1&psc=1","https://m.media-amazon.com/images/I/41mpC4voXEL._SL500_.jpg","2"
"student planner","Kids & Education","Rileys Academic Planner 2025-2026, Daily, Weekly & Monthly Planner, July 2025 - June 2026, Student Notes Pages, Twin-Wire Binding, Weekly Agenda for School & Work (20 x 15 cm, Lilac)","$9.99","$5.00 (33%)","33","https://www.amazon.ca/dp/B0BRKP57RB?tag=lesdealsduw02-20&linkCode=osi&th=1&psc=1","https://m.media-amazon.com/images/I/41Xcx8yfSZL._SL500_.jpg","1"
"survival gear","Outdoor & Camping","Simpeak 2-Pack Hand Crank Solar Powered LED Flashlight, Emergency Rechargeable Survival Torch With Quick Snap Carbiner for Outdoor Sports, Green","$19.98","$10.01 (33%)","33","https://www.amazon.ca/dp/B01CS949OS?tag=lesdealsduw02-20&linkCode=osi&th=1&psc=1","https://m.media-amazon.com/images/I/415jYPZx3TL._SL500_.jpg","1"
"tools","Tools","Endoscope Camera with Light, Borescope Camera with 4.3"" IPS Screen, 1080P HD with 8 LED Lights, 16.4FT Semi-Rigid Cord Bore Scope, IP67 Waterproof Endoscope Cool Gadgets for Men","$39.99","$20.00 (33%)","33","https://www.amazon.ca/dp/B0C3R381FC?tag=lesdealsduw02-20&linkCode=osi&th=1&psc=1","https://m.media-amazon.com/images/I/61fNTTJZSqL._SL500_.jpg","1"
"towels","Home & Cleaning","Utopia Towels 6 Pack Premium Hand Towels (16 x 28 inches) 100% Ring Spun Cotton Soft and Absorbent 600 GSM Towels for Bathroom, Gym, Hotel (White)","$25.99","$13.00 (33%)","33","https://www.amazon.ca/dp/B083KKQD5S?tag=lesdealsduw02-20&linkCode=osi&th=1&psc=1","https://m.media-amazon.com/images/I/41l6C1g6w1L._SL500_.jpg","2"
"travel charger","Travel","Charging Station for Apple Multiple Devices: 3 in 1 Foldable Magnetic Wireless Charger Stand for Mag-Safe iPhone - Travel Charging Dock for iPhone 16 15 14 13 12 Pro Max Plus & Apple Watch & Airpods","$33.38","$16.61 (33%)","33","https://www.amazon.ca/dp/B0DCBHHNPH?tag=lesdealsduw02-20&linkCode=osi&th=1&psc=1","https://m.media-amazon.com/images/I/21KpXLfVVCL._SL500_.jpg","1"
"travel mug","Travel","WETOWETO 20oz Insulated Stainless Steel Tumbler, Double Wall Vacuum Travel Coffee Mug, Leak-Proof Tumbler Cup for Home Office Travel (Army Green, 1 Pack)","$13.99","$7.00 (33%)","33","https://www.amazon.ca/dp/B0B455GMKZ?tag=lesdealsduw02-20&linkCode=osi&th=1&psc=1","https://m.media-amazon.com/images/I/41sSgsQPKYL._SL500_.jpg","1"
"travel wallet","Travel","Buffway Slim Minimalist Front Pocket RFID Blocking Leather Wallets for Men Women - Cross Black","$19.99","$10.00 (33%)","33","https://www.amazon.ca/dp/B079DCW7GB?tag=lesdealsduw02-20&linkCode=osi&th=1&psc=1","https://m.media-amazon.com/images/I/5123VeURueL._SL500_.jpg","1"
"tv mount","TV & Video","Pipishell Full Motion TV Wall Mount for 26-65 inch TVs, up to 99lbs and VESA 400x400mm, Wall Mount TV Bracket with Articulating Swivel Extension Tilting Leveling for LED LCD OLED 4K Flat Curved Screen","$39.98","$20.01 (33%)","33","https://www.amazon.ca/dp/B09MQKK4TW?tag=lesdealsduw02-20&linkCode=osi&th=1&psc=1","https://m.media-amazon.com/images/I/41qc8Db84uL._SL500_.jpg","1"
"vacuum","Home & Cleaning","AlloyMove Cordless Vacuum Cleaner, 550W/50KPA Powerful Suction Vacuum Cleaner, Up to 80mins Runtime,Rechargeable Vacuum Cleaner for Home, Stick Vacuum for Carpet/Floor/Pet Hair Cleaning, A05","$199.99","$100.00 (33%)","33","https://www.amazon.ca/dp/B0FC2VJH5N?tag=lesdealsduw02-20&linkCode=osi&th=1&psc=1","https://m.media-amazon.com/images/I/41qODnTnb-L._SL500_.jpg","2"
"vinyl records","Audio & Music","Johnny Cash Vinyl - Country Boy","$24.78","$12.21 (33%)","33","https://www.amazon.ca/dp/B0B2P7JCHL?tag=lesdealsduw02-20&linkCode=osi&th=1&psc=1","https://m.media-amazon.com/images/I/31+YghJxb+L._SL500_.jpg","2"
"vr carrying case","Gaming","Carrying Case for Quest 2, Hard Bag for Quest 2 Accessories VR Headset with Elite Strap and Touch Controllers Other VR Accessories, Protable Design for Travel and Home Storage","$19.99","$9.77 (33%)","33","https://www.amazon.ca/dp/B0CKVQ5F36?tag=lesdealsduw02-20&linkCode=osi&th=1&psc=1","https://m.media-amazon.com/images/I/51+ReugHbqL._SL500_.jpg","2"
"vr lens protector","Gaming","Relohas Deluxe VR Accessories for Meta Quest 3, Safe 2 in 1 Silicone Case Set for Oculus Quest 3, Include Upgraded Lens Protector, Face Cover(Black)","$9.99","$5.00 (33%)","33","https://www.amazon.ca/dp/B0CJY94GGV?tag=lesdealsduw02-20&linkCode=osi&th=1&psc=1","https://m.media-amazon.com/images/I/414kmTP6xSL._SL500_.jpg","2"
"weight scale","Health & Wellness","Runstar Smart Scale for Body Weight and Fat Percentage, High Accuracy Digital Bathroom Scale FSA or HSA Eligible with LCD Display for BMI 13 Body Composition Analyzer Sync with Fitness App","$39.99","$20.00 (33%)","33","https://www.amazon.ca/dp/B0C1Z137KK?tag=lesdealsduw02-20&linkCode=osi&th=1&psc=1","https://m.media-amazon.com/images/I/418NgDnMinL._SL500_.jpg","2"
"window cleaner","Home & Cleaning","Windex Original Blue Glass and Window Cleaner, Removes Fingerprints, Smudges, and Smears, 765mL, (Pack of 3)","$15.00 ($0.65 / 100 ml)","$7.47 (33%)","33","https://www.amazon.ca/dp/B07HPXPK2C?tag=lesdealsduw02-20&linkCode=osi&th=1&psc=1","https://m.media-amazon.com/images/I/41vDlIAI9TL._SL500_.jpg","2"
"wireless mouse","Computers & Tech","Logitech M325s Wireless Mouse, 2.4 GHz with USB Receiver, 1000 DPI Optical Tracking, 18-Month Life Battery, PC/Mac/Laptop/Chromebook - Vivid Violet","$19.99","$10.00 (33%)","33","https://www.amazon.ca/dp/B0BGS2K547?tag=lesdealsduw02-20&linkCode=osi&th=1&psc=1","https://m.media-amazon.com/images/I/41qEdpjad3L._SL500_.jpg","1"
"womens blouses","Clothing & Accessories","Hotouch Womens Blouses Dressy Casual Basic Button-Down Shirts Long Sleeve Collared Basic Tops with Pocket Army Green M","$19.99","$10.00 (33%)","33","https://www.amazon.ca/dp/B0DJZ864HN?tag=lesdealsduw02-20&linkCode=osi&th=1&psc=1","https://m.media-amazon.com/images/I/41fc1A7gMhL._SL500_.jpg","2"
"womens tops","Clothing & Accessories","WIHOLL Women Tops Long Sleeve Tops Black T Shirts Fall Clothes 2025 Trendy Crew Neck Lace Shirts for Women Sweaters L","$19.99","$10.00 (33%)","33","https://www.amazon.ca/dp/B0D5Y71NJP?tag=lesdealsduw02-20&linkCode=osi&th=1&psc=1","https://m.media-amazon.com/images/I/51ICvu+9iiL._SL500_.jpg","1"
"3d printer nozzle","Makers & Digital Fabrication","12Pcs Volcano Nozzle 0.4mm, Vyper Nozzles 0.4mm,Vyper Hotend 3D Printer Nozzle Compatible for Artillery Genius, Sidewinder X1, Sidewinder X2, Anycubic Vyper, Kobra Plus, Kobra Max 3D Printer,","$10.88","$5.11 (32%)","32","https://www.amazon.ca/dp/B0DKJV9CG6?tag=lesdealsduw02-20&linkCode=osi&th=1&psc=1","https://m.media-amazon.com/images/I/411lGb6MBOL._SL500_.jpg","2"
"abs filament","Makers & Digital Fabrication","OVERTURE ABS Filament 1.75mm, High Strength & Heat-Resistant 3D Printer Filament, Low Warping, Excellent Durability, 1kg (2.2lbs) Cardboard Spool, High Precision +/- 0.02mm (ABS White)","$17.79","$8.20 (32%)","32","https://www.amazon.ca/dp/B08GQ1Y5X1?tag=lesdealsduw02-20&linkCode=osi&th=1&psc=1","https://m.media-amazon.com/images/I/41Uaw-EBH1L._SL500_.jpg","1"
"art supplies","Kids & Education","JOYIN Rock Painting Kit- Glow in The Dark Rock Kit, 10 Rocks， Gift Toy, Arts and Crafts for Kids Ages 6-12, Art Supplies Toy, Kids Craft Paint Kits, Toys for Boys Girls 3 4 5 6 7 8 9 10，Birthday Party Gift","$18.99","$9.00 (32%)","32","https://www.amazon.ca/dp/B08HD89CX6?tag=lesdealsduw02-20&linkCode=osi&th=1&psc=1","https://m.media-amazon.com/images/I/51OJTZjUlKL._SL500_.jpg","1"
"backpack","Travel","MATEIN Travel Laptop Backpack, 17 inch Business Flight Approved Carry on Backpack, TSA Large Computer Backpack for Men Women with USB Port and Trolley Sleeve, College School Tactical Book Bag, Grey","$33.99","$16.00 (32%)","32","https://www.amazon.ca/dp/B07QN9NPKN?tag=lesdealsduw02-20&linkCode=osi&th=1&psc=1","https://m.media-amazon.com/images/I/51PkMowrJyL._SL500_.jpg","1"
"board games","Toys & Games","Hasbro Gaming The Game of Life Game, Family Board Game for 2-4 Players, Indoor Game for Kids Ages 8 and Up, Pegs Come in 6 Colors","$22.99","$11.00 (32%)","32","https://www.amazon.ca/dp/B08BHHRSPK?tag=lesdealsduw02-20&linkCode=osi&th=1&psc=1","https://m.media-amazon.com/images/I/51IaDXxrOpL._SL500_.jpg","1"
"books","Books","The Housemaid","$16.99","$8.00 (32%)","32","https://www.amazon.ca/dp/1538742578?tag=lesdealsduw02-20&linkCode=osi&th=1&psc=1","https://m.media-amazon.com/images/I/51sx4eLa6NL._SL500_.jpg","1"
"books","Books","The Let Them Theory: A Life-Changing Tool That Millions of People Can't Stop Talking About","$27.29","$12.70 (32%)","32","https://www.amazon.ca/dp/1401971369?tag=lesdealsduw02-20&linkCode=osi&th=1&psc=1","https://m.media-amazon.com/images/I/51UmNg33hCL._SL500_.jpg","1"
"bras","Clothing & Accessories","SHAPERMINT Seamless Bras for Women Full Support Bra - Bralette for Women with Support - Soutien Gorge Femme Sans Armature, Brassiere Femme, Large, Black","$50.99","$24.01 (32%)","32","https://www.amazon.ca/dp/B0D9YKHWW3?tag=lesdealsduw02-20&linkCode=osi&th=1&psc=1","https://m.media-amazon.com/images/I/41K9OGxNm0L._SL500_.jpg","1"
"camping knife","Outdoor & Camping","Mossy Oak 11.5'' Machete for Yard Work, Survival Kukri Machete Knife with Sheath, EDC Gear, Ergonomic Anti-Slip Handle, Stainless Steel Machetes for Cutting Trees, Gardening, Bushcraft and Hunting","$18.25","$8.74 (32%)","32","https://www.amazon.ca/dp/B0DPY7JXRT?tag=lesdealsduw02-20&linkCode=osi&th=1&psc=1","https://m.media-amazon.com/images/I/313wwMdDHfL._SL500_.jpg","2"
"capture card","Gaming","4K HDMI Video Capture Card for Live Streaming & Gaming - USB 3.0/Type-C Compatible with PS5, Switch, Xbox, PC, Mac, OBS (Ultra-Low Latency, Plug & Play)","$13.55","$6.44 (32%)","32","https://www.amazon.ca/dp/B0DXK9NZPJ?tag=lesdealsduw02-20&linkCode=osi&th=1&psc=1","https://m.media-amazon.com/images/I/41h66F7QeTL._SL500_.jpg","2"
