"keyword","category","title","price","savings","percent","link","imageUrl","page"
"razer","Gaming","Razer Blade 14 (2025) Gaming Laptop: NVIDIA GeForce RTX 5070 - AMD Ryzen AI 9 365 CPU - 3K 120Hz OLED Display - 32GB LPDDR5X RAM - 1TB SSD - Thin & Lightweight - Chroma RGB - Windows - Black","$2,799.99","$650.00 (19%)","19","https://www.amazon.ca/dp/B0DYLB2QRF?tag=lesdealsduw02-20&linkCode=osi&th=1&psc=1","https://m.media-amazon.com/images/I/51ZsO1rjEyL._SL500_.jpg","1"
"record player","Audio & Music","Victrola Vintage 3-Speed Bluetooth Portable Suitcase Record Player with Built-in Speakers | Upgraded Turntable Audio Sound| Includes Extra Stylus | Brown","$71.20","$17.09 (19%)","19","https://www.amazon.ca/dp/B07CVVM115?tag=lesdealsduw02-20&linkCode=osi&th=1&psc=1","https://m.media-amazon.com/images/I/41HbtpdzYtL._SL500_.jpg","1"
"robe","Bedroom","HEARTNICE Womens Cotton Robe, Soft Kimono Spa Knit Long Bathrobe Lightweight Loungewear (Grey mel.,M)","$29.99","$7.00 (19%)","19","https://www.amazon.ca/dp/B079GWD2S5?tag=lesdealsduw02-20&linkCode=osi&th=1&psc=1","https://m.media-amazon.com/images/I/31jECD1AgsL._SL500_.jpg","1"
"scarf","Clothing & Accessories","EIysee 35 x 35 Women's Fashion Pattern Large Square Silk Like Hair Scarf Head Sleeping Wrap Satin Neck Bandana for Gift…, Blue and White Porcelain-navy Blue, 35 x 35 in","$6.44","$1.51 (19%)","19","https://www.amazon.ca/dp/B09BJCR71M?tag=lesdealsduw02-20&linkCode=osi&th=1&psc=1","https://m.media-amazon.com/images/I/61iNf2GueCL._SL500_.jpg","2"
"shampoo","Beauty & Personal Care","L’Oréal Paris Hair Expertise Total Repair 5 Shampoo for Dry and Damaged Hair, With Keratin XS Technology to Repair Split Ends and Restore Strength Bond, 828ml (Packaging May Vary)","$10.97 ($1.32 / 100 ml)","$2.52 (19%)","19","https://www.amazon.ca/dp/B078GVJF78?tag=lesdealsduw02-20&linkCode=osi&th=1&psc=1","https://m.media-amazon.com/images/I/31V2XfFwx-L._SL500_.jpg","2"
"shelter tarp","Outdoor & Camping","WADEO Camping Rain Fly with Heavy Duty Poles Kit, 10x12FT Tarp Oxfordfabric Tent Waterproof UV Protection for Outdoor Hammock Shelter Camping Tarp Pad, Hiking, Camper Gear","$51.29","$11.70 (19%)","19","https://www.amazon.ca/dp/B0BLMJLMPR?tag=lesdealsduw02-20&linkCode=osi&th=1&psc=1","https://m.media-amazon.com/images/I/415DQ+cbxgL._SL500_.jpg","2"
"sleeping bag","Outdoor & Camping","Sleeping Bags, Sportneer 4 Seasons Sleeping Bag Warm Cold Weather Wearable Sleeping Bag with Zipper Holes in Arms and Feet Portable Sleeping Bags for Adults Backpacking Camping Hiking Outdoor Travel","$56.99","$13.00 (19%)","19","https://www.amazon.ca/dp/B095LDHJ74?tag=lesdealsduw02-20&linkCode=osi&th=1&psc=1","https://m.media-amazon.com/images/I/41E2-N28TdL._SL500_.jpg","1"
"sleeping pad","Outdoor & Camping","Afurkuot Self Inflating Sleeping Pad for Camping, Inflatable Single Air Mattress Built-in Foot Pump & Pillow, Outdoor Camping Air Mattress Sleeping Pad for Camping Hiking Picnic, Orange","$25.99","$6.00 (19%)","19","https://www.amazon.ca/dp/B0CMCDC2VF?tag=lesdealsduw02-20&linkCode=osi&th=1&psc=1","https://m.media-amazon.com/images/I/31PPjQmdxUL._SL500_.jpg","2"
"smart alarm","Security","ecozy Sunrise Alarm Clock for Heavy Sleepers, Smart Wake Up Light with Sunrise/Sunset Simulation, App & Voice Controlled, Natural Sounds & FM Radio, 4 Alarms & Snooze, 8 Colors Night Light for Bedroom","$56.99","$13.00 (19%)","19","https://www.amazon.ca/dp/B09YHBRHC4?tag=lesdealsduw02-20&linkCode=osi&th=1&psc=1","https://m.media-amazon.com/images/I/31OicpbkfcL._SL500_.jpg","1"
"smart bulb","Smart Home","Lloyd's E26 Smart Bulb - Ampoule Intelligente - Alexa Compatible + Google Home Compliant, Colour Changing, LED Smart Light Bulb (10W) Dimmable from The App - Works with 2.4 GHz WiFi","$12.95","$3.04 (19%)","19","https://www.amazon.ca/dp/B07XPJBPNX?tag=lesdealsduw02-20&linkCode=osi&th=1&psc=1","https://m.media-amazon.com/images/I/41qnZoelp0L._SL500_.jpg","2"
"solar charger","Power & Chargers","Solar Charger Power Bank 26800mah, 2 USB Output Fast Phone Portable Charger Power Bank Solar Battery Bank Pack External Backup Pack Cell Phone for iPhone, Samsung Galaxy Android, iPad Tablet","$28.95","$7.00 (19%)","19","https://www.amazon.ca/dp/B0861SMBLJ?tag=lesdealsduw02-20&linkCode=osi&th=1&psc=1","https://m.media-amazon.com/images/I/410+V96dIoL._SL500_.jpg","2"
"speaker cable","Audio & Music","Amazon Basics 12-Gauge Audio Speaker Wire Cable - 99.9% Oxygen Free Copper, 200-Foot","$77.99","$18.37 (19%)","19","https://www.amazon.ca/dp/B0758CVS43?tag=lesdealsduw02-20&linkCode=osi&th=1&psc=1","https://m.media-amazon.com/images/I/41cMVG8j8XL._SL500_.jpg","1"
"standing desk converter","Office","VIVO Height Adjustable 81cm Standing Desk Converter with Dual 13 to 30 inch Monitor Stand, Sit Stand Monitor Mount and Desk Riser, Black, DESK-V000K-M2","$189.99","$45.00 (19%)","19","https://www.amazon.ca/dp/B08RHKKX6K?tag=lesdealsduw02-20&linkCode=osi&th=1&psc=1","https://m.media-amazon.com/images/I/41DKSpMk1IL._SL500_.jpg","1"
"stapler","Office","Amazon Basics Full-strip Metal Office Desktop Stapler, 20 Sheet Capacity, 3 Pack, Black","$14.56","$3.48 (19%)","19","https://www.amazon.ca/dp/B07VYJTPL9?tag=lesdealsduw02-20&linkCode=osi&th=1&psc=1","https://m.media-amazon.com/images/I/41EDIK5zl6L._SL500_.jpg","1"
"steering wheel cover","Automotive","iolory 15 Inch Car Leather Steering Wheel Cover,Car Accessories,Breathable Anti-Slip Auto Steering Wheel Wrap Protector,Elastic Steering Wheel Wrap,Suitable for Cars, SUVs,Trucks (Black&Red)","$16.99","$4.00 (19%)","19","https://www.amazon.ca/dp/B0F8BC5KB9?tag=lesdealsduw02-20&linkCode=osi&th=1&psc=1","https://m.media-amazon.com/images/I/51wwWbDw3OL._SL500_.jpg","1"
"survival backpack","Outdoor & Camping","QT&QY 45L Military Tactical Backpack combat Molle Army Assault Pack CCW 3 Day survival Bag Hiking rucking Rucksack heavy duty backpack","$45.99","$11.00 (19%)","19","https://www.amazon.ca/dp/B087RF22S8?tag=lesdealsduw02-20&linkCode=osi&th=1&psc=1","https://m.media-amazon.com/images/I/41Ie7BVZV-L._SL500_.jpg","2"
"travel adapter","Travel","2 Pack European Travel Plug Adapter, VYLEE International Travel Adapter with 2 Outlets 4 USB Ports(2 USB C), 6 in 1 Type C Travel Essentials Charger for US to Most of Europe EU Italy Spain France","$28.99","$7.00 (19%)","19","https://www.amazon.ca/dp/B0D21PNPFV?tag=lesdealsduw02-20&linkCode=osi&th=1&psc=1","https://m.media-amazon.com/images/I/31tr3PTiojL._SL500_.jpg","1"
"travel mug","Travel","Contigo Superior 2.0 Stainless Steel Vacuum-Insulated Travel Mug, Dark Ice, 20 oz (591 mL)","$16.94","$4.05 (19%)","19","https://www.amazon.ca/dp/B0BXFTN5CL?tag=lesdealsduw02-20&linkCode=osi&th=1&psc=1","https://m.media-amazon.com/images/I/31quG6NBt-L._SL500_.jpg","1"
"tv mount","TV & Video","USX Mount UL Listed Full Motion TV Wall Mount for Most 37-86 inch TV, Swivel and Tilt Mount with Dual Articulating Arms Up to 132lbs, VESA 600x400mm, 16"" Wood Studs, XML019","$69.99","$15.90 (19%)","19","https://www.amazon.ca/dp/B08M92P11W?tag=lesdealsduw02-20&linkCode=osi&th=1&psc=1","https://m.media-amazon.com/images/I/41cUEKxouxL._SL500_.jpg","2"
"usb c cable","Power & Chargers","INIU USB C to USB C Cable, [6.6ft 100W, 2Pack ] Fast Charging PD USB C Charger Cable, Nylon Braided Type C Cable for Samsung S23 S22 iPhone 16 15 Pro Max MacBook iPad Dell Google Pixel, etc","$15.29","$3.70 (19%)","19","https://www.amazon.ca/dp/B08J2HXYPH?tag=lesdealsduw02-20&linkCode=osi&th=1&psc=1","https://m.media-amazon.com/images/I/41kGn-WLBQL._SL500_.jpg","2"
"vinyl records","Audio & Music","Greatest Hits (2LP Vinyl)","$37.91","$9.09 (19%)","19","https://www.amazon.ca/dp/B01LY8SIX7?tag=lesdealsduw02-20&linkCode=osi&th=1&psc=1","https://m.media-amazon.com/images/I/41Nv+fFczAL._SL500_.jpg","1"
"waterproof bag","Outdoor & Camping","HEETA Dry Bag Waterproof for Women Men, Roll Top Lightweight Dry Storage Bag Backpack with Phone Case for Travel Swimming Boating Kayaking Paddle Board Camping Beach Accessories (Transparent Black,5L)","$16.99","$4.00 (19%)","19","https://www.amazon.ca/dp/B07PM1R4N8?tag=lesdealsduw02-20&linkCode=osi&th=1&psc=1","https://m.media-amazon.com/images/I/41Z-OyeBHpL._SL500_.jpg","1"
"wifi extender","Networking & Connectivity","2025 Faster WiFi Extender, WiFi Repeater, Covers Up to 10000 Sq.ft and 80 Devices, Internet Booster - with Ethernet Port, Quick Setup, Home Wireless Signal Booster","$20.99","$5.00 (19%)","19","https://www.amazon.ca/dp/B0FCY9PNZZ?tag=lesdealsduw02-20&linkCode=osi&th=1&psc=1","https://m.media-amazon.com/images/I/3169b2UXeEL._SL500_.jpg","1"
"window valance","Bedroom","White Sheer Valance 10 inches Long Living Room Curtain Toppers Voile Valence for Windows Kitchen Bedroom Bathroom Short Small Mini Curtain Sheer Rod Pocket 1 Panel 52""x10""","$11.39","$2.60 (19%)","19","https://www.amazon.ca/dp/B0DZ2BG2RG?tag=lesdealsduw02-20&linkCode=osi&th=1&psc=1","https://m.media-amazon.com/images/I/41IWSyELYwL._SL500_.jpg","2"
"womens pants","Clothing & Accessories","EVALESS Corduroy Pants for Women Dressy Casual Drawstring Elastic High Waist Straight Leg Pants Fall 2023 Loose Comfy Trousers with Pockets Khaki X-Large","$33.99","$8.00 (19%)","19","https://www.amazon.ca/dp/B0CC5R2DHS?tag=lesdealsduw02-20&linkCode=osi&th=1&psc=1","https://m.media-amazon.com/images/I/41WM7k7IHQL._SL500_.jpg","1"
"work boots","Clothing & Accessories","NORTIV 8 Men's Steel Toe Work Boots Safety Shoes Supportive Breathable Protective Anti-Slip Industrial Leather Booties TROOPER-STL,Size 12,Black,TROOPER-STEEL","$69.99","$16.00 (19%)","19","https://www.amazon.ca/dp/B07V8H8PQQ?tag=lesdealsduw02-20&linkCode=osi&th=1&psc=1","https://m.media-amazon.com/images/I/41Qn0UJPFUL._SL500_.jpg","2"
"xbox controller","Gaming","PowerA Advantage Wired Controller for Xbox Series X|S with Lumectra - Black, gamepad, wired video game controller, gaming controller, works with Xbox One and Windows 10/11, officially licensed","$48.72","$11.27 (19%)","19","https://www.amazon.ca/dp/B0CCW9BDHB?tag=lesdealsduw02-20&linkCode=osi&th=1&psc=1","https://m.media-amazon.com/images/I/41f0-saXykL._SL500_.jpg","2"
"yoga mat","Sports & Fitness","Gaiam Yoga Mat Classic Print Non Slip Exercise & Fitness Mat for All Types of Yoga, Pilates & Floor Workouts, Pink Marrakesh, 4mm, 68""L x 24""W x 4mm Thick","$24.18","$5.80 (19%)","19","https://www.amazon.ca/dp/B01MY5MZSQ?tag=lesdealsduw02-20&linkCode=osi&th=1&psc=1","https://m.media-amazon.com/images/I/41PRCWxH4JL._SL500_.jpg","2"
"action camera","Cameras & Photography","AKASO EK7000 4K30FPS 20MP WiFi Action Camera with EIS Ultra HD 131FT Waterproof Underwater Camera Remote Control 4X Zoom Support External Microphone Black","$89.99","$20.00 (18%)","18","https://www.amazon.ca/dp/B0B28F3L8X?tag=lesdealsduw02-20&linkCode=osi&th=1&psc=1","https://m.media-amazon.com/images/I/51xaociWTNL._SL500_.jpg","1"
"acrylic paint","Arts & Crafts","Acrylic Paint Set with 12 Art Brushes, 24 Colors (2 oz/Bottle) Acrylic Paint for Painting Canvas, Wood, Ceramic and Fabric, Paint Set for Beginners, Students and Professional Artist, Rich Pigments","$26.99 ($44.98 / 100 ml)","$6.00 (18%)","18","https://www.amazon.ca/dp/B0D8SWT57F?tag=lesdealsduw02-20&linkCode=osi&th=1&psc=1","https://m.media-amazon.com/images/I/51F-1z8cpGL._SL500_.jpg","1"
"air fryer accessories","Kitchen","TrendPlain 470ml Olive Oil Spray Bottle for Kitchen Gadgets - 2 in 1 Olive Oil Dispenser Bottle and Air Fryer Accessories for Cooking, Salad and BBQ - Black","$13.99","$3.00 (18%)","18","https://www.amazon.ca/dp/B0CJF94M8J?tag=lesdealsduw02-20&linkCode=osi&th=1&psc=1","https://m.media-amazon.com/images/I/51QrHUQnxGL._SL500_.jpg","1"
"card reader","Computers & Tech","Memory Card Reader, BENFEI 4in1 USB 3.0 and USB-C to SD Micro SD MS CF Card Reader Adapter, 4 Cards Simultaneously Read and Write, Compatible with iPhone 15 Series, MacBook Pro/Air 2023, and More","$13.99","$3.00 (18%)","18","https://www.amazon.ca/dp/B08P517NW5?tag=lesdealsduw02-20&linkCode=osi&th=1&psc=1","https://m.media-amazon.com/images/I/41aQJlQb1KL._SL500_.jpg","1"
"athletic socks","Clothing & Accessories","Puma Men's 6pk 1/2 Terry Low Cut-Cool Cell, White Traditional, 10-13","$13.72","$3.01 (18%)","18","https://www.amazon.ca/dp/B06XKXTDLS?tag=lesdealsduw02-20&linkCode=osi&th=1&psc=1","https://m.media-amazon.com/images/I/41SBTsyr2QL._SL500_.jpg","2"
"baby gate","Baby","Regalo Home Accents Extra Wide Walk Thru Baby Gate, Includes Décor Hardwood, 4-Inch Extension Kit, 4-Inch Extension Kit, 4 Pack of Pressure Mount Kit and 4 Pack of Wall Cups and Mounting Ki","$43.70","$9.27 (18%)","18","https://www.amazon.ca/dp/B00VQZ2MIG?tag=lesdealsduw02-20&linkCode=osi&th=1&psc=1","https://m.media-amazon.com/images/I/41fjl4h5eLL._SL500_.jpg","1"
"baby gate","Baby","North States Industries North States Classic Supergate, Charcoal Grey","$44.94","$10.05 (18%)","18","https://www.amazon.ca/dp/B086K7V7D8?tag=lesdealsduw02-20&linkCode=osi&th=1&psc=1","https://m.media-amazon.com/images/I/51jd6yUFb5L._SL500_.jpg","1"
"bamboo sheets","Bedroom","GOKOTTA 100% Bamboo Sheets Queen, Queen Bed Sheets 4 Piece Set, 16 inch Deep Pockets, Super Soft Cooling Luxury and Silky Bamboo Sheets for Hot Sleeper (Cream White, Queen)","$139.99","$30.00 (18%)","18","https://www.amazon.ca/dp/B08F3HFQ6X?tag=lesdealsduw02-20&linkCode=osi&th=1&psc=1","https://m.media-amazon.com/images/I/41kiJA0qn4L._SL500_.jpg","2"
"bathroom organizer","Home & Cleaning","2 Tier Bathroom Storage Organizer, Vtopmart 2 Pack Clear Under Sink Organizers Vanity Counter Storage Container, Medicine Cabinet Drawers Bins, Pull-Out Organization with Track for Pantry, Kitchen","$32.89 ($16.44 / count)","$7.10 (18%)","18","https://www.amazon.ca/dp/B0BZCMRNB9?tag=lesdealsduw02-20&linkCode=osi&th=1&psc=1","https://m.media-amazon.com/images/I/41A0LEfnjbL._SL500_.jpg","2"
"beads","Arts & Crafts","1000 Pcs 6x9 Mm Pony Beads Bulk Plastic Bracelet Beads Plastic Pony Beads for Bracelets Making Multi-Colored for Hair Braiding DIY Necklace Key Chain and Jewelry Making","$8.99","$2.00 (18%)","18","https://www.amazon.ca/dp/B0BQ6Q29XM?tag=lesdealsduw02-20&linkCode=osi&th=1&psc=1","https://m.media-amazon.com/images/I/61He7oLRkWL._SL500_.jpg","2"
"bike accessories","Sports & Fitness","Bike Chain Cleaner Lube Set, YIMAX Bicycle Degreaser & Wet Lubricant with Chain Scrubber Cleaning Brush Tool Bike Cleaning Kit for Bicycle Chains,Rear Cogs,Chainrings.Lube 2oz,Degreaser 10oz","$21.69 ($5.42 / 100 ml)","$4.65 (18%)","18","https://www.amazon.ca/dp/B09ZKKCHDL?tag=lesdealsduw02-20&linkCode=osi&th=1&psc=1","https://m.media-amazon.com/images/I/51xPHKqu56L._SL500_.jpg","2"
"boom box","Audio & Music","W-KING Bluetooth Speaker Loud, 180W Peak Party Portable Outdoor Haut Parleur Speaker Wireless Boom Box/4 Drivers(2 * 4.04’’ Woofer)-80W Deep Bass Tube, Huge 105dB Sound, Lights/IPX5/EQ/24H/USB/TF/AUX","$163.99","$36.00 (18%)","18","https://www.amazon.ca/dp/B08TTCHNP2?tag=lesdealsduw02-20&linkCode=osi&th=1&psc=1","https://m.media-amazon.com/images/I/41yE8uzcuxL._SL500_.jpg","1"
"boots","Clothing & Accessories","DREAM PAIRS Women's Knee High Pull On Slouch Tall Long Ladies Fall Winter Boots,Size 8.5,Black,BLVD","$61.99","$14.00 (18%)","18","https://www.amazon.ca/dp/B01G990SNE?tag=lesdealsduw02-20&linkCode=osi&th=1&psc=1","https://m.media-amazon.com/images/I/31ehyYPd-IL._SL500_.jpg","1"
"bras","Clothing & Accessories","Wonderbra Womens Lightly Lined Full Coverage Bra, BLACK/EXCALIBUR, 38 C US","$14.86","$3.16 (18%)","18","https://www.amazon.ca/dp/B08XTC4FW6?tag=lesdealsduw02-20&linkCode=osi&th=1&psc=1","https://m.media-amazon.com/images/I/415IjTQJIBL._SL500_.jpg","2"
"cabin air filter","Automotive","EPAuto CPJ6X (KD45-61-J6X) Cabin Air Filter includes Activated Carbon Replacement for Mazda 3 (2014-2018), Mazda 6 (2014-2021), CX-5 (2013-2025)","$17.97","$4.02 (18%)","18","https://www.amazon.ca/dp/B01LWV2W5M?tag=lesdealsduw02-20&linkCode=osi&th=1&psc=1","https://m.media-amazon.com/images/I/51G4pzbXSWL._SL500_.jpg","1"
"cable management","Computers & Tech","254 in Cable Concealer Raceway, Delamu Cord Cover, Wire Hider for Wall Mounted TVs, Cable Hider Cover with Easy Snap-on Elbows, TV Cable Management System, 15x L16.9in W1.18in H0.6in, Large, White","$35.99","$8.00 (18%)","18","https://www.amazon.ca/dp/B08NJJPRP1?tag=lesdealsduw02-20&linkCode=osi&th=1&psc=1","https://m.media-amazon.com/images/I/51ufMZmcPNL._SL500_.jpg","2"
"calming tea","Health & Wellness","Yogi Tea - Soothing Cinnamon Stress Support Tea (3 Pack) - With Ashwagandha and Passionflower- Caffeine Free Organic Herbal Tea - 48 Tea Bags","$16.41 ($0.34 / count)","$3.56 (18%)","18","https://www.amazon.ca/dp/B0CB1TPVF3?tag=lesdealsduw02-20&linkCode=osi&th=1&psc=1","https://m.media-amazon.com/images/I/41M0RyHfFPL._SL500_.jpg","1"
"camping cookware","Outdoor & Camping","Overmont 16pc Camping Cookware Mess Kit, Portable Camping Cooking Set for Backpacking, Outdoor Hiking and Picnic Pot Pan Kettle Bowl Plate","$44.29","$9.70 (18%)","18","https://www.amazon.ca/dp/B0BCVV1X7J?tag=lesdealsduw02-20&linkCode=osi&th=1&psc=1","https://m.media-amazon.com/images/I/41KoqqTYjKL._SL500_.jpg","1"
"cap","Clothing & Accessories","LANGZHEN Unisex Baseball Cap 100% Cotton Fits Men Women Washed Denim Adjustable Dad Hat(Denim Blue)","$10.29","$2.20 (18%)","18","https://www.amazon.ca/dp/B07MR5KVVY?tag=lesdealsduw02-20&linkCode=osi&th=1&psc=1","https://m.media-amazon.com/images/I/31Z-UenJYvL._SL500_.jpg","2"
"car charger","Automotive","Anker Car Charger, Mini Aluminum Alloy 24W Dual USB Car Charger, PowerDrive 2 Alloy Car Adapter with Blue LED for iPhone12/11/XR/Xs, iPad Pro/Air 2/Mini, Galaxy (Not Compatible with Quick Charge)","$13.99","$3.00 (18%)","18","https://www.amazon.ca/dp/B07PGT7LSR?tag=lesdealsduw02-20&linkCode=osi&th=1&psc=1","https://m.media-amazon.com/images/I/31Dz3QrI4DL._SL500_.jpg","1"
"cat food","Pet Supplies","Friskies Grillers Tenders & Crunchy Bites Dry Cat Food - 7.5 kg Bag","$22.22 ($2.96 / kg)","$4.75 (18%)","18","https://www.amazon.ca/dp/B00KACLUVQ?tag=lesdealsduw02-20&linkCode=osi&th=1&psc=1","https://m.media-amazon.com/images/I/51FBdyJbjEL._SL500_.jpg","2"
"cheese","Food","John Wm. Macy's Melting Romano Cheesecrisps, 127 Grams","$5.50 ($4.33 / 100 g)","$1.19 (18%)","18","https://www.amazon.ca/dp/B07YHTHCKD?tag=lesdealsduw02-20&linkCode=osi&th=1&psc=1","https://m.media-amazon.com/images/I/51joOC69TqL._SL500_.jpg","2"
"closet organizer","Bedroom","SONGMICS 6 Cube Storage Organizer, DIY Closet Shelf, Plastic Clothes Organizer, Modular Bookcase, 11.8 x 11.8 x 11.8 Inch Cubes, with Feet and Rubber Mallet, Black ULPC06H","$32.99","$7.00 (18%)","18","https://www.amazon.ca/dp/B01LGZOR6A?tag=lesdealsduw02-20&linkCode=osi&th=1&psc=1","https://m.media-amazon.com/images/I/41IBFEv8pJL._SL500_.jpg","1"
"coffee pods","Kitchen","Van Houtte Original House Blend K-Cup Coffee Pods, 48 Count For Keurig Coffee Makers","$35.99 ($0.75 / count)","$8.00 (18%)","18","https://www.amazon.ca/dp/B01M6C0H61?tag=lesdealsduw02-20&linkCode=osi&th=1&psc=1","https://m.media-amazon.com/images/I/41FcJWJ0lmL._SL500_.jpg","2"
"coffee pods","Kitchen","Van Houtte Colombian Medium Roast K-Cup Coffee Pods, 48 Count For Keurig Coffee Makers","$35.99 ($0.75 / count)","$8.00 (18%)","18","https://www.amazon.ca/dp/B0883W2MMW?tag=lesdealsduw02-20&linkCode=osi&th=1&psc=1","https://m.media-amazon.com/images/I/51YtDq15vAL._SL500_.jpg","2"
"command hooks","Home & Cleaning","Command Variety Pack, Picture Hanging Strips, Wire Hooks and Utility Hooks, Damage Free Hanging Variety Pack for Up to 19 Items, 1 Kit","$29.88","$6.78 (18%)","18","https://www.amazon.ca/dp/B07712H557?tag=lesdealsduw02-20&linkCode=osi&th=1&psc=1","https://m.media-amazon.com/images/I/41dfHADJEuL._SL500_.jpg","2"
"compression socks","Health & Wellness","PhysFlex Compression Socks for Women and Men - Best Support for Running, Flying, Pregnancy - Knee High Graduated Compression Stockings (Black, L/XL)","$13.99","$2.98 (18%)","18","https://www.amazon.ca/dp/B0CX3YDK1S?tag=lesdealsduw02-20&linkCode=osi&th=1&psc=1","https://m.media-amazon.com/images/I/413OfhZwZnL._SL500_.jpg","2"
"lunch bags","Kitchen","Lifewit Lunch Bag for Men, Insulated Lunch Box Leakproof Soft Cooler Cooling Tote for Adult Women, Waterproof Reusable Lunch Bags for Work Office Outdoor Picnic Camping, Black, 12-Can (9L)","$26.99","$6.00 (18%)","18","https://www.amazon.ca/dp/B0B56CHMSC?tag=lesdealsduw02-20&linkCode=osi&th=1&psc=1","https://m.media-amazon.com/images/I/41Ega3mH+KL._SL500_.jpg","1"
"cutting blades","Makers & Digital Fabrication","SALI 50 Pack Cut Off Wheel 4 1/2 Inch Cutting Wheels 4-1/2"" x 3/64"" x 7/8"" for Metal & Stainless Steel, Angle Grinder Cutting Wheel,Cutting Discs with Aggressive Cutting","$32.99 ($0.66 / count)","$7.00 (18%)","18","https://www.amazon.ca/dp/B09DYQD55R?tag=lesdealsduw02-20&linkCode=osi&th=1&psc=1","https://m.media-amazon.com/images/I/51yStHPsYeL._SL500_.jpg","1"
"dash cam","Automotive","VIOFO A119 V3 Dash Cam 2K, GPS, True HDR, Buffered Parking Mode 24h, 2560x1660P Quad HD+ Car Dash Camera, Ultra Clear Night Vision, 140 Deg Wide Angle, Motion Detection, G-Sensor, Time Lapse, Loop Record","$139.00","$30.99 (18%)","18","https://www.amazon.ca/dp/B07SRQH4R7?tag=lesdealsduw02-20&linkCode=osi&th=1&psc=1","https://m.media-amazon.com/images/I/41q+nzLfjLL._SL500_.jpg","2"
"dehumidifier","Home & Cleaning","Midea Cube 20 Pint Dehumidifier for Basement and Rooms at Home for up to 1,500 Sq. Ft., Smart Control, Works with Alexa (White), Drain Hose Included, ENERGY STAR Most Efficient 2023","$204.98","$45.01 (18%)","18","https://www.amazon.ca/dp/B097Q46S2V?tag=lesdealsduw02-20&linkCode=osi&th=1&psc=1","https://m.media-amazon.com/images/I/31X4HslPrAL._SL500_.jpg","1"
"desk","Furniture & Decor","IMGadgets Standing Desk Electric, 40x24 Inches Height Adjustable, 2026 6th Gen Quieter Motor Ergonomic Sit Stand Desk, Computer Desk for Home Office, Height Memory Buttons, Display, 2 Holders (Ivory)","$122.95","$27.00 (18%)","18","https://www.amazon.ca/dp/B0DR3B2XPW?tag=lesdealsduw02-20&linkCode=osi&th=1&psc=1","https://m.media-amazon.com/images/I/413VsqKeEcL._SL500_.jpg","2"
"desk lamp","Furniture & Decor","Simple Designs LD1003-BLK Basic Desk Lamp, Black","$17.01","$3.61 (18%)","18","https://www.amazon.ca/dp/B00CM5SBSO?tag=lesdealsduw02-20&linkCode=osi&th=1&psc=1","https://m.media-amazon.com/images/I/314vaAS6AnL._SL500_.jpg","1"
"duffel bag","Travel","EASYFUN Travel Duffle Bag, Waterproof Weekender Carry On Tote Bags for Women, Men, Hospital Bag, Overnight Bag Luggage with Trolley Sleeve","$18.89","$4.10 (18%)","18","https://www.amazon.ca/dp/B0CZ72TKRQ?tag=lesdealsduw02-20&linkCode=osi&th=1&psc=1","https://m.media-amazon.com/images/I/416JShWhJnL._SL500_.jpg","1"
"dumbbells","Sports & Fitness","Amazon Basics Neoprene Dumbbell Hand Weights, 4.5 Kilograms, Pair, Navy Blue","$37.26","$8.19 (18%)","18","https://www.amazon.ca/dp/B01LR5S6HK?tag=lesdealsduw02-20&linkCode=osi&th=1&psc=1","https://m.media-amazon.com/images/I/41S7hjNEY+L._SL500_.jpg","1"
"fishing bait","Outdoor & Camping","100 Pcs 3.3inch Soft Worms Fishing Lure Baits, Earthworm Baits Lifelike Fake Bloodworm, Fishing Soft Lure Grubs Worm, Bass Trout Fishing Lures, Fresh Water Fishing Baits, 2 Colors (Brown and Red)","$9.00","$1.99 (18%)","18","https://www.amazon.ca/dp/B0DL5YTJ75?tag=lesdealsduw02-20&linkCode=osi&th=1&psc=1","https://m.media-amazon.com/images/I/51fi0AOa9GL._SL500_.jpg","2"
"fishing rod","Outdoor & Camping","PLUSINNO Fishing Rod and Reel Combos - Carbon Fiber Telescopic Fishing Pole - Spinning Reel 12 +1 Shielded Bearings Stainless Steel BB (Full Kit with Carrier Case, 2.1m 5.91FT)","$69.97","$15.02 (18%)","18","https://www.amazon.ca/dp/B07HMH8CCS?tag=lesdealsduw02-20&linkCode=osi&th=1&psc=1","https://m.media-amazon.com/images/I/51hamePSXWL._SL500_.jpg","1"
"food storage","Kitchen","PRAKI Airtight Food Storage Container Set with Lids, 16 Pcs Plastic Dry Food Canisters for Kitchen Pantry Organizers and Storage, Ideal for Cereal, Flour & Sugar - Labels, Marker(Black)","$39.99 ($2.50 / count)","$9.00 (18%)","18","https://www.amazon.ca/dp/B08TWBX7KT?tag=lesdealsduw02-20&linkCode=osi&th=1&psc=1","https://m.media-amazon.com/images/I/61saCgGVaQL._SL500_.jpg","1"
"garden rake","Garden","Dremmt Lawn Leveling Rake 30x10 inch, (Professional-Grade) Lawn Leveler Tool with Stainless Steel Handle Rakes for Lawns Heavy Duty Landscape Rake for Backyard, Garden, Golf Course, Farm, Pasture","$59.99","$13.00 (18%)","18","https://www.amazon.ca/dp/B0BZMXK6YL?tag=lesdealsduw02-20&linkCode=osi&th=1&psc=1","https://m.media-amazon.com/images/I/61cDZWCiU6L._SL500_.jpg","2"
"glue gun","Arts & Crafts","Full Size Hot Glue Gun, 150 Watts with 6 Copper Nozzles Temperature Adjustable Craft Repair Tool Professional Melting Glue Gun DIY Thermo Tool Include 5Pcs Highly Viscous Glue Sticks Luxury Set","$52.99","$12.00 (18%)","18","https://www.amazon.ca/dp/B07PGDLHBQ?tag=lesdealsduw02-20&linkCode=osi&th=1&psc=1","https://m.media-amazon.com/images/I/513Z2W7RBnL._SL500_.jpg","2"
"google home","Smart Home","Google Nest Doorbell - Battery - Snow","$195.68","$44.31 (18%)","18","https://www.amazon.ca/dp/B0B1PJQB17?tag=lesdealsduw02-20&linkCode=osi&th=1&psc=1","https://m.media-amazon.com/images/I/11VeYmhBRXL._SL500_.jpg","2"
"guitar fx processor","Audio & Music","HeadRush FRFR-GO - 30W Electric and Bass Guitar Amplifier with Dual 3"" Speakers, Bluetooth and Rechargeable Battery, for Multi-FX/Amp Modeling Pedals","$163.18","$35.82 (18%)","18","https://www.amazon.ca/dp/B0DL9XS5V7?tag=lesdealsduw02-20&linkCode=osi&th=1&psc=1","https://m.media-amazon.com/images/I/41WZJHvzq0L._SL500_.jpg","1"
