"keyword","category","title","price","savings","percent","link","imageUrl","page"
"ready meals","Food","Rio Mare - Insalatissime Tuna Salad - Couscous and Light Tuna - Ready to Eat Salad, High in Protein, No Preservatives, 160g","$3.47","$1.50 (30%)","30","https://www.amazon.ca/dp/B00E20UJSM?tag=lesdealsduw02-20&linkCode=osi&th=1&psc=1","https://m.media-amazon.com/images/I/51XCxyv+ayL._SL500_.jpg","1"
"running shoes men","Shoes","Reebok Mens Runner 4 4E Running Shoe, Core Black/Pure Grey 5/FTWR White, 11 US","$41.99","$18.00 (30%)","30","https://www.amazon.ca/dp/B09Z731FWK?tag=lesdealsduw02-20&linkCode=osi&th=1&psc=1","https://m.media-amazon.com/images/I/31LQcXYy9HL._SL500_.jpg","1"
"running shoes men","Shoes","Reebok Classics,Classic Leather,FTWR White/Pure Grey 3/reebok Rubber gum-02,9.5","$40.24","$17.25 (30%)","30","https://www.amazon.ca/dp/B093TYSQPM?tag=lesdealsduw02-20&linkCode=osi&th=1&psc=1","https://m.media-amazon.com/images/I/316M33rNJIL._SL500_.jpg","2"
"scanner","Computers & Laptops","Tera Barcode Scanner Wireless 1D Laser Cordless Barcode Reader with Battery Level Indicator, Versatile 2 in 1 2.4Ghz Wireless and USB 2.0 Wired","$29.99","$13.00 (30%)","30","https://www.amazon.ca/dp/B078SQ91FB?tag=lesdealsduw02-20&linkCode=osi&th=1&psc=1","https://m.media-amazon.com/images/I/41yYzUNKhDL._SL500_.jpg","2"
"shoes","Shoes","Reebok Classics,Classic Leather,FTWR White/Pure Grey 3/reebok Rubber gum-02,9","$40.24","$17.25 (30%)","30","https://www.amazon.ca/dp/B093TX6WQZ?tag=lesdealsduw02-20&linkCode=osi&th=1&psc=1","https://m.media-amazon.com/images/I/316M33rNJIL._SL500_.jpg","2"
"smartwatch","Wearables","Smart Watch for Men Women (Answer/Make Calls), Smartwatch for Android iPhone, 1.39"" Fitness Trackers with Heart Rate Blood Oxygen Sleep Monitor Pedometer (Black)","$13.99","$6.00 (30%)","30","https://www.amazon.ca/dp/B0DW9217PY?tag=lesdealsduw02-20&linkCode=osi&th=1&psc=1","https://m.media-amazon.com/images/I/41JJ7Eew8tL._SL500_.jpg","2"
"sneakers","Shoes","Reebok Mens Classic Leather Sneaker, FTWR White/Pure Grey 3/reebok Rubber Gum-02, 13.5 Women/12 Men US","$40.24","$17.25 (30%)","30","https://www.amazon.ca/dp/B093TY15ZT?tag=lesdealsduw02-20&linkCode=osi&th=1&psc=1","https://m.media-amazon.com/images/I/316M33rNJIL._SL500_.jpg","1"
"sneakers","Shoes","Reebok Womens Club C 85 Vintage Sneaker, Chalk/Alabaster/Glen Green, 8.5 US","$55.95","$23.99 (30%)","30","https://www.amazon.ca/dp/B093WB7PZV?tag=lesdealsduw02-20&linkCode=osi&th=1&psc=1","https://m.media-amazon.com/images/I/31qcVeAU19L._SL500_.jpg","1"
"sneakers","Shoes","Reebok Classics,Classic Leather,FTWR White/Pure Grey 3/reebok Rubber gum-02,8","$40.24","$17.25 (30%)","30","https://www.amazon.ca/dp/B093TYYVQS?tag=lesdealsduw02-20&linkCode=osi&th=1&psc=1","https://m.media-amazon.com/images/I/316M33rNJIL._SL500_.jpg","2"
"sport","Sports & Fitness","Resistance Bands with Ankle Straps, Ankle Weights Bands for Working Out, Exercise Band for Women Leg and Glute, Booty Workout Equipment for Kickbacks,Butt and Hip Training, Home Gym Fitness Equipment","$20.99","$9.00 (30%)","30","https://www.amazon.ca/dp/B0CJ2QR1PY?tag=lesdealsduw02-20&linkCode=osi&th=1&psc=1","https://m.media-amazon.com/images/I/51qY+pOhMJL._SL500_.jpg","1"
"television","TV & Video","Amazon Fire TV 50"" 4-Series 4K UHD smart TV, stream live TV without cable","$417.93","$182.06 (30%)","30","https://www.amazon.ca/dp/B08T6G1DCB?tag=lesdealsduw02-20&linkCode=osi&th=1&psc=1","https://m.media-amazon.com/images/I/41YuCIrxq-L._SL500_.jpg","2"
"tennis shoes","Shoes","Reebok Men's Smash Edge S Tennis Shoes White/Black/Gum, Size 10","$47.24","$20.25 (30%)","30","https://www.amazon.ca/dp/B0CNV2YLW6?tag=lesdealsduw02-20&linkCode=osi&th=1&psc=1","https://m.media-amazon.com/images/I/41+ZzEvUa3L._SL500_.jpg","2"
"tools","Home","DEKOPRO 126-Piece Power Tool Combo Kit with 8V Cordless Drill, NiMh Battery, 10MM 3/8'' Keyless Chuck, DIY Hand Tools for Garden, Office, House Repair","$69.99","$30.00 (30%)","30","https://www.amazon.ca/dp/B0D2VRS76D?tag=lesdealsduw02-20&linkCode=osi&th=1&psc=1","https://m.media-amazon.com/images/I/51nKGql1r3L._SL500_.jpg","1"
"travel accessories","Outdoor","Arae Electronic Organizer, Travel Cable Organizer, Double Layers Portable Waterproof Pouch, Electronic Accessories Storage Case for Cable, Cord, Charger, Phone, Earphone (Black, M)","$13.98","$6.01 (30%)","30","https://www.amazon.ca/dp/B09Y88QB9C?tag=lesdealsduw02-20&linkCode=osi&th=1&psc=1","https://m.media-amazon.com/images/I/51B-u6RzlrL._SL500_.jpg","2"
"vacuum bags","Home","Simple Deluxe 8 Jumbo Vacuum Storage Bags, Space Saver Bags, Vacuum Seal Bags with Hand Pump for Comforters, Blankets, Bedding, Pillows and Clothes","$22.99","$10.00 (30%)","30","https://www.amazon.ca/dp/B0CYKQG7S1?tag=lesdealsduw02-20&linkCode=osi&th=1&psc=1","https://m.media-amazon.com/images/I/51MWfkADEdL._SL500_.jpg","2"
"vitamins","Beauty & Health","Webber Naturals Vitamin D3 2500 IU Extra Strength, 180 Softgels, For Healthy Bones, Teeth, and Helps Prevent Vitamin D Deficiency","$5.97 ($0.03 / count)","$2.52 (30%)","30","https://www.amazon.ca/dp/B0B3LWGHGD?tag=lesdealsduw02-20&linkCode=osi&th=1&psc=1","https://m.media-amazon.com/images/I/411zsj71DRL._SL500_.jpg","1"
"water bottle","Home","Sahara Sailor Water Bottle, 32oz Motivational Sports Water Bottle with Time Marker - Times to Drink - Tritan, BPA Free, Wide Mouth Leakproof, Fast Flow Technology with Clean Brush (1 Bottle)","$17.59","$7.40 (30%)","30","https://www.amazon.ca/dp/B09FPXDLKR?tag=lesdealsduw02-20&linkCode=osi&th=1&psc=1","https://m.media-amazon.com/images/I/41QYx1jzetL._SL500_.jpg","1"
"wifi router","Networking & Connectivity","Tenda WiFi 6 Router for Home, AX1500 Dual Band Gigabit Router for Wireless Internet, Long Range Coverage with 5 * 6dBi High-Gain Antennas, 4 Gigabit Ports, Support WPA3, IPv6, Parental Control(RX2Pro)","$42.16","$17.83 (30%)","30","https://www.amazon.ca/dp/B0BL6PR5N4?tag=lesdealsduw02-20&linkCode=osi&th=1&psc=1","https://m.media-amazon.com/images/I/316qDzRKl+L._SL500_.jpg","1"
"womens shirts","Womens clothing","PRETTYGARDEN Women's 2025 Spring Fall Long Sleeve Henley T Shirts Button Ribbed Knit Slim Fit Casual Basic Tops Blouse (Dark Grey,Medium)","$18.88","$8.11 (30%)","30","https://www.amazon.ca/dp/B0CT7ZWD1T?tag=lesdealsduw02-20&linkCode=osi&th=1&psc=1","https://m.media-amazon.com/images/I/41MFBi96k3L._SL500_.jpg","2"
"womens tank top","Womens clothing","OMSJ White Women Shirts Sleeveless Summer Tunic Loose Fit Tank Tops (Solid White, X-Large)","$13.99","$6.00 (30%)","30","https://www.amazon.ca/dp/B07T3YS7NR?tag=lesdealsduw02-20&linkCode=osi&th=1&psc=1","https://m.media-amazon.com/images/I/41tjeIZ81QL._SL500_.jpg","2"
"workout equipment","Sports & Fitness","Resistance Loop Exercise Bands Exercise Bands for Home Fitness, Stretching, Strength Training, Physical Therapy,Elastic Workout Bands for Women Men Kids, Set of 5 (Assorted)","$9.85","$4.14 (30%)","30","https://www.amazon.ca/dp/B097JQYZR1?tag=lesdealsduw02-20&linkCode=osi&th=1&psc=1","https://m.media-amazon.com/images/I/41agmXMDsrL._SL500_.jpg","1"
"workout equipment","Sports & Fitness","Foldable Pilates Reformer Ab Machine with Automatic Rebound Function for Home Gym - Core & Abdominal Strength Training Equipment with Knee Pad - Ab Core Trainer, Push-Up Board","$69.99","$30.00 (30%)","30","https://www.amazon.ca/dp/B0DFGG11MX?tag=lesdealsduw02-20&linkCode=osi&th=1&psc=1","https://m.media-amazon.com/images/I/41Id0czHjjL._SL500_.jpg","1"
"yoga pants","Sports & Fitness","Sunzel Butterflycra High Waist Mini Flared Leggings for Women, Tummy Control Casual Flare Yoga Pants for Yoga Workout Gym 32"" Black Medium","$25.99","$11.00 (30%)","30","https://www.amazon.ca/dp/B0CB1N49GT?tag=lesdealsduw02-20&linkCode=osi&th=1&psc=1","https://m.media-amazon.com/images/I/31t2LZaq+5L._SL500_.jpg","1"
"apple products","Smartphones","3 in 1 Charging Station for iPhone - Wireless Charger for Apple Products Multiple Devices - Charging Dock Stand for AirPods (for iPhone 16 15 14 13 pro 12 11 X Max)","$39.99","$16.00 (29%)","29","https://www.amazon.ca/dp/B0BF9TYJWR?tag=lesdealsduw02-20&linkCode=osi&th=1&psc=1","https://m.media-amazon.com/images/I/41fiKPmdr8L._SL500_.jpg","1"
"backpack for school","School & Stationery","Roots Essential 3-in-1 Matching Water Resistant Kids Backpack and Lunch Bag Set with Bonus Pencil Case - Made from 100% Recycled Fabrics -22.5 litres, Multi Ombre","$37.79","$15.73 (29%)","29","https://www.amazon.ca/dp/B0D6BSZZPM?tag=lesdealsduw02-20&linkCode=osi&th=1&psc=1","https://m.media-amazon.com/images/I/513+Bp8e4IL._SL500_.jpg","1"
"baby bottle","Baby","Philips Avent Natural Baby Bottle Newborn Baby Gift Set, SCD838/02, Clear","$49.99","$20.00 (29%)","29","https://www.amazon.ca/dp/B098YHK4CN?tag=lesdealsduw02-20&linkCode=osi&th=1&psc=1","https://m.media-amazon.com/images/I/4130UoyLB+L._SL500_.jpg","2"
"baby shoes","Baby","Kqwfsiu Baby Sock Shoes Boys Girls Non Slip First Walking Shoes Sneakers Soft Rubber Sole Lightweight Toddler Infant Sock Shoes Yellow","$9.99","$4.00 (29%)","29","https://www.amazon.ca/dp/B0CNXL86SP?tag=lesdealsduw02-20&linkCode=osi&th=1&psc=1","https://m.media-amazon.com/images/I/41IcsCmOqfL._SL500_.jpg","1"
"basketball","Sports & Fitness","Senston Basketball Outdoor Indoor 29.5 Basketball Ball Official Size 7 Street Basket Ball Blue with Pump","$28.49","$11.50 (29%)","29","https://www.amazon.ca/dp/B07MH6LV4C?tag=lesdealsduw02-20&linkCode=osi&th=1&psc=1","https://m.media-amazon.com/images/I/51hsxVw8eTL._SL500_.jpg","1"
"blender","Kitchen","Ninja BL481C Nutri-Ninja Auto-iQ Technology Blender, 1000W (Canadian Version),Silver","$99.99","$39.99 (29%)","29","https://www.amazon.ca/dp/B01H8UHB8S?tag=lesdealsduw02-20&linkCode=osi&th=1&psc=1","https://m.media-amazon.com/images/I/310TZGqHcUS._SL500_.jpg","1"
"board games","Toys & Games","Yahtzee Dice Game","$11.98","$5.01 (29%)","29","https://www.amazon.ca/dp/B00VQ6UBBA?tag=lesdealsduw02-20&linkCode=osi&th=1&psc=1","https://m.media-amazon.com/images/I/51a9uItLJbL._SL500_.jpg","1"
"books","Books","The Let Them Theory: A Life-Changing Tool That Millions of People Can't Stop Talking About","$28.22","$11.77 (29%)","29","https://www.amazon.ca/dp/1401971369?tag=lesdealsduw02-20&linkCode=osi&th=1&psc=1","https://m.media-amazon.com/images/I/51UmNg33hCL._SL500_.jpg","1"
"car cleaner","Home","TICARVE Cleaning Gel for Car Detail Tools Car Cleaning Automotive Dust Air Vent Interior Detail Putty Universal Dust Cleaner for Auto Laptop Car Slime Cleaner","$9.89","$4.10 (29%)","29","https://www.amazon.ca/dp/B07VCBQ6KF?tag=lesdealsduw02-20&linkCode=osi&th=1&psc=1","https://m.media-amazon.com/images/I/51iVDwgXXML._SL500_.jpg","1"
"car gadgets","Automotive","Ginsco 3 Gallons Open-Top Car Trash Can, Large Capacity Hanging Car Trash Bag with Water-proof PEVA Liner, Stand Trash Bag for Cars Foldable Storage Bag for Cars SUV Truck RV","$11.99","$5.00 (29%)","29","https://www.amazon.ca/dp/B0CMGGDG96?tag=lesdealsduw02-20&linkCode=osi&th=1&psc=1","https://m.media-amazon.com/images/I/51jhwt2dk6L._SL500_.jpg","1"
"car gadgets","Automotive","200W Car Power Inverter, PiSFAU DC 12V to 110V AC Car Plug Adapter Outlet with [20W USB-C] /USB-Fast Charger(18W) / 4.8A Dual USB/car Charger for Laptop","$28.48","$11.50 (29%)","29","https://www.amazon.ca/dp/B0CFB6T2QN?tag=lesdealsduw02-20&linkCode=osi&th=1&psc=1","https://m.media-amazon.com/images/I/41TnIJVNvzL._SL500_.jpg","2"
"cello","Music","Cello: A Journey Through Silence to Sound","$33.49","$13.51 (29%)","29","https://www.amazon.ca/dp/1639367500?tag=lesdealsduw02-20&linkCode=osi&th=1&psc=1","https://m.media-amazon.com/images/I/51+0TH99rwL._SL500_.jpg","2"
"chocolate","Food","Snack Factory Pretzel Crisps - Milk Chocolate Crunch 155 Grams","$4.74 ($3.06 / 100 g)","$1.95 (29%)","29","https://www.amazon.ca/dp/B0CPKQ9N13?tag=lesdealsduw02-20&linkCode=osi&th=1&psc=1","https://m.media-amazon.com/images/I/51-pSKYbicL._SL500_.jpg","1"
"coffee espresso machine","Kitchen","Chefman CaféMaster Pro Espresso Machine, Brew Single or Double Shots, Coffee Maker with Built-In Milk Frother for Cappuccino & Latte, XL 1.8 Liter Removable Water Reservoir - Stainless Steel","$169.99","$70.00 (29%)","29","https://www.amazon.ca/dp/B0D79TYRW7?tag=lesdealsduw02-20&linkCode=osi&th=1&psc=1","https://m.media-amazon.com/images/I/41iMKlwYrTL._SL500_.jpg","2"
"coffee grinder","Kitchen","Mini Manual Coffee Grinder with 40 Adjustable Settings, Portable Hand Coffee Bean Mill with 30g Capacity, Conical Burr Coffee Grinder with Crank for Travel, Camping, Office, Espresso, Pour Over, etc","$28.49","$11.50 (29%)","29","https://www.amazon.ca/dp/B0DMZL1K3G?tag=lesdealsduw02-20&linkCode=osi&th=1&psc=1","https://m.media-amazon.com/images/I/41dzh73+f+L._SL500_.jpg","1"
"electronics","Other Tech","JBL Go 4 - Ultra-Portable, Waterproof and Dustproof Bluetooth Speaker, 7-Hour Built-in Battery, Made in Part with Recycled Materials (Purple)","$49.98","$20.00 (29%)","29","https://www.amazon.ca/dp/B0CTNWKGM2?tag=lesdealsduw02-20&linkCode=osi&th=1&psc=1","https://m.media-amazon.com/images/I/41276zT5XyL._SL500_.jpg","1"
"external hard drive","Computers & Laptops","Western Digital 14TB Elements Desktop External Hard Drive, USB 3.0 external hard drive for plug-and-play storage - WDBWLG0140HBK-NESN","$274.99","$112.23 (29%)","29","https://www.amazon.ca/dp/B07YD3G568?tag=lesdealsduw02-20&linkCode=osi&th=1&psc=1","https://m.media-amazon.com/images/I/31cKLKahZRL._SL500_.jpg","1"
"gaming headset","Gaming","Logitech G435 Lightspeed and Bluetooth Wireless Gaming Headset - Lightweight Over-Ear Headphones, Built-in mics, 18h Battery, Compatible with Dolby Atmos, PC, Mobile - Black","$49.99","$20.00 (29%)","29","https://www.amazon.ca/dp/B08R8DT7X6?tag=lesdealsduw02-20&linkCode=osi&th=1&psc=1","https://m.media-amazon.com/images/I/41PVoomjxaL._SL500_.jpg","2"
"gimbal","Cameras & Photography","Hohem iSteady M6 Handheld 3-Axis Gimbal Stabilizer for Smartphone Gimbal for iPhone and Android Cell Phone,Built-in OLED Display Reverse Charging 400g Payload","$191.20","$77.80 (29%)","29","https://www.amazon.ca/dp/B0BXDFQK47?tag=lesdealsduw02-20&linkCode=osi&th=1&psc=1","https://m.media-amazon.com/images/I/41b6eMcCcrL._SL500_.jpg","2"
"hair dryer","Beauty & Health","Ion Hair Dryer AC Motor 1800 W Hair Dryer, slopehill Quick Drying Hair Dryer, Salon Hair Dryer with Hot/Cold Button, 3 Hair Dryer Concentrators and Diffuser, 3 Temperature Settings, 2-Speed (Purple)","$49.99","$20.00 (29%)","29","https://www.amazon.ca/dp/B086SR1KML?tag=lesdealsduw02-20&linkCode=osi&th=1&psc=1","https://m.media-amazon.com/images/I/41mWclWOhGS._SL500_.jpg","1"
"hair dryer","Beauty & Health","InfinitiPro by Conair 259NC Performance Hair Dryer, 1875 Watts Blow Dryer, Fast Drying, Ceramic Ionic Technology, Smooth, Shiny Hair and Less Frizz, 3 Heat/ 2 Speed, Removable Filter, Good for travel","$24.97","$10.26 (29%)","29","https://www.amazon.ca/dp/B00VYEB3IY?tag=lesdealsduw02-20&linkCode=osi&th=1&psc=1","https://m.media-amazon.com/images/I/31ZlROHoNKL._SL500_.jpg","2"
"home security","Home","EMDMAK Door Stop Alarm with 120DB Siren Door Stop for Home & Travel (Black) (Pack of 2)","$15.65 ($7.82 / Count)","$6.34 (29%)","29","https://www.amazon.ca/dp/B01M0X4QM4?tag=lesdealsduw02-20&linkCode=osi&th=1&psc=1","https://m.media-amazon.com/images/I/4114pIJpJzL._SL500_.jpg","2"
"instant coffee","Food","Mount Hagen 25 Count Single Serve Instant Coffee Packets | Organic Medium Roast Arabica Beans | Eco-friendly, Fair-Trade [25 sticks/1.76oz/50g]","$16.99 ($0.68 / count)","$6.88 (29%)","29","https://www.amazon.ca/dp/B002HQLCJS?tag=lesdealsduw02-20&linkCode=osi&th=1&psc=1","https://m.media-amazon.com/images/I/51NRQIBayqL._SL500_.jpg","2"
"iphone case","Smartphones","JETech Case for iPhone 11 6.1-Inch, Non-Yellowing Shockproof Phone Bumper Cover, Anti-Scratch Clear Back (Clear)","$11.99","$5.00 (29%)","29","https://www.amazon.ca/dp/B07QQZD49D?tag=lesdealsduw02-20&linkCode=osi&th=1&psc=1","https://m.media-amazon.com/images/I/41-ZRKH65kL._SL500_.jpg","2"
"kitchen organizer","Kitchen","Nmgkokew 4 Piece Kitchen Cabinet Door Storage Box,Self Adhesive Wall Mounted Storage Box,Wardrobe/Bathroom/Refrigerator Small Items Organizer Storage Box","$9.17 ($2.29 / count)","$3.82 (29%)","29","https://www.amazon.ca/dp/B0CHJ3XYDG?tag=lesdealsduw02-20&linkCode=osi&th=1&psc=1","https://m.media-amazon.com/images/I/41tCNvEGZjL._SL500_.jpg","2"
"lego","Toys & Games","LEGO Technic Bush Plane Toy - Buildable Airplane Toy for Kids, Boys and Girls, Ages 8+ - Model Airplane Gift with Spinning Propeller, 4-Cylinder Piston Engine, and More - 42198","$24.87","$10.12 (29%)","29","https://www.amazon.ca/dp/B0DJ197ZQY?tag=lesdealsduw02-20&linkCode=osi&th=1&psc=1","https://m.media-amazon.com/images/I/51jwhiP0kwL._SL500_.jpg","2"
"lego","Toys & Games","LEGO Speed Champions Mercedes-AMG F1 W15 Race Car Toy - Building Set for Kids, Boys & Girls, Ages 10+ - Toy Car for F1 Fans - Gift Idea for Birthday - 77244","$24.98","$10.01 (29%)","29","https://www.amazon.ca/dp/B0DHLHMK9V?tag=lesdealsduw02-20&linkCode=osi&th=1&psc=1","https://m.media-amazon.com/images/I/51epsJ7smqL._SL500_.jpg","2"
"lego sets","Toys & Games","LEGO Technic Bugatti Bolide Racing Car Building Set - Model and Race Engineering Toy for Back to School, Collectible Sports Car Construction Kit for Boys, Girls, and Teen Builders Ages 9+, 42151","$45.94","$19.05 (29%)","29","https://www.amazon.ca/dp/B0BBWG5T23?tag=lesdealsduw02-20&linkCode=osi&th=1&psc=1","https://m.media-amazon.com/images/I/51hE1RjGLrL._SL500_.jpg","1"
"led strip lights","Home","Govee White LED Light Strip, 16.4ft Dimmable Led Strip Lights White, Bright 6500K Daylight, Cuttable and Strong Adhesive, 300 LEDs Flexible Tape Lights for Mirror, Under Cabinet, Party and Bedroom","$19.99","$8.00 (29%)","29","https://www.amazon.ca/dp/B07V46H7YL?tag=lesdealsduw02-20&linkCode=osi&th=1&psc=1","https://m.media-amazon.com/images/I/51bMTamufXS._SL500_.jpg","1"
"laptop","Computers & Laptops","ASUS Vivobook S 15 Copilot+ PC, 15.6"" Thin and Light Laptop, 3K 120Hz OLED Display, Snapdragon® X Plus Processor, 16GB Memory, 1 TB SSD, Copilot Key, Wi-Fi 7, Cool Silver, S5507QA-DB71-CB","$1,069.99","$429.01 (29%)","29","https://www.amazon.ca/dp/B0DHLRXY5F?tag=lesdealsduw02-20&linkCode=osi&th=1&psc=1","https://m.media-amazon.com/images/I/41AYN-P6tML._SL500_.jpg","2"
"markers","School & Stationery","Upanic Brush Markers for Adults Coloring Books,36 Colors Dual Art Markers Colored Pens for Bullet Journaling Note Taking Drawing Calligraphy Lettering,Dual Brush Markers Pens School Supplies","$11.99","$5.00 (29%)","29","https://www.amazon.ca/dp/B09W8NQTJ2?tag=lesdealsduw02-20&linkCode=osi&th=1&psc=1","https://m.media-amazon.com/images/I/51N3p9TyAUL._SL500_.jpg","1"
"markers","School & Stationery","Mr. Sketch Scented Markers, 12 Pack, Assorted Colours (1905069)","$8.54","$3.44 (29%)","29","https://www.amazon.ca/dp/B00006IFH0?tag=lesdealsduw02-20&linkCode=osi&th=1&psc=1","https://m.media-amazon.com/images/I/512Cu0RCOyL._SL500_.jpg","1"
"mens tank top","Mens clothing","COOFANDY Men's 3 Pack Workout Tank Top Gym Muscle Tee Fitness Bodybuilding Sleeveless T Shirts","$28.39","$11.60 (29%)","29","https://www.amazon.ca/dp/B082NZJZZK?tag=lesdealsduw02-20&linkCode=osi&th=1&psc=1","https://m.media-amazon.com/images/I/51p7BpS92sL._SL500_.jpg","1"
"phone case","Smartphones","JETech Case for iPhone 13 6.1-Inch, Non-Yellowing Shockproof Phone Bumper Cover, Anti-Scratch Clear Back (Clear)","$11.99","$5.00 (29%)","29","https://www.amazon.ca/dp/B09BTKNGN5?tag=lesdealsduw02-20&linkCode=osi&th=1&psc=1","https://m.media-amazon.com/images/I/41X6XclyaWL._SL500_.jpg","2"
"portable power station","Power & Chargers","Takki 83Wh Portable Power Station Camping Solar Power Bank Generator with 110V 80W AC Outlet Type-C USB Port and Camping Flashlight for Home Use Emergency Battery Backup","$106.99","$42.91 (29%)","29","https://www.amazon.ca/dp/B097M9R9CT?tag=lesdealsduw02-20&linkCode=osi&th=1&psc=1","https://m.media-amazon.com/images/I/41OmZb8DMzL._SL500_.jpg","1"
"printer","Computers & Laptops","Canon PIXMA TS3720 Wireless All-in-One Printer - White","$49.98","$20.01 (29%)","29","https://www.amazon.ca/dp/B0D2RQHYND?tag=lesdealsduw02-20&linkCode=osi&th=1&psc=1","https://m.media-amazon.com/images/I/312UuON8mWL._SL500_.jpg","1"
"printer","Computers & Laptops","HP DeskJet 2842e Wireless All-in-One Colour Inkjet Printer, Scanner, Copier (Aloe), Best for Home, 6 Months of Instant Ink Included (6W7E7A)","$49.98","$20.01 (29%)","29","https://www.amazon.ca/dp/B0DZNPYD4Z?tag=lesdealsduw02-20&linkCode=osi&th=1&psc=1","https://m.media-amazon.com/images/I/314AKMsl-DL._SL500_.jpg","1"
"projector mount","Cameras & Photography","VIVO Universal Adjustable White Ceiling Projector / Projection Mount Extending Arms MOUNT-VP01W.","$29.99","$12.00 (29%)","29","https://www.amazon.ca/dp/B01013QA86?tag=lesdealsduw02-20&linkCode=osi&th=1&psc=1","https://m.media-amazon.com/images/I/31TjsQhltKL._SL500_.jpg","1"
"running shoes men","Shoes","ASICS Men's Gel-Excite 10 Running Shoes, 12, Black/Wave Teal","$84.94","$35.06 (29%)","29","https://www.amazon.ca/dp/B0D3Y16FMC?tag=lesdealsduw02-20&linkCode=osi&th=1&psc=1","https://m.media-amazon.com/images/I/31gnw0rl1jL._SL500_.jpg","2"
"running shoes women","Shoes","Under Armour Women's Charged Pursuit 3 Big Logo Running Shoe, (003) Black/Black/Black, 10","$47.49","$19.00 (29%)","29","https://www.amazon.ca/dp/B0CJTBGXYX?tag=lesdealsduw02-20&linkCode=osi&th=1&psc=1","https://m.media-amazon.com/images/I/318TisoBGdL._SL500_.jpg","1"
"running shoes women","Shoes","ASICS Women's Gel-Excite 10 Running Shoes, 8, Black/White","$84.94","$35.06 (29%)","29","https://www.amazon.ca/dp/B0BZDXLGLH?tag=lesdealsduw02-20&linkCode=osi&th=1&psc=1","https://m.media-amazon.com/images/I/41R-Q9yKUeL._SL500_.jpg","1"
"smart home devices","Smart Home","Amazon Echo Dot (newest model), Vibrant sounding Alexa speaker, Great for bedrooms, dining rooms and offices, Glacier White","$49.99","$20.00 (29%)","29","https://www.amazon.ca/dp/B09B94RL1R?tag=lesdealsduw02-20&linkCode=osi&th=1&psc=1","https://m.media-amazon.com/images/I/41RionP4m8L._SL500_.jpg","1"
"smart plug","Smart Home","Amazon Smart Plug | Works with Alexa | Simple setup, endless possibilities","$24.99","$10.00 (29%)","29","https://www.amazon.ca/dp/B089DTMHW4?tag=lesdealsduw02-20&linkCode=osi&th=1&psc=1","https://m.media-amazon.com/images/I/21aSpFdXxQL._SL500_.jpg","1"
"smart speaker","Smart Home","Amazon Echo Dot (newest model), Vibrant sounding Alexa speaker, Great for bedrooms, dining rooms and offices, Charcoal","$49.99","$20.00 (29%)","29","https://www.amazon.ca/dp/B09B8V1LZ3?tag=lesdealsduw02-20&linkCode=osi&th=1&psc=1","https://m.media-amazon.com/images/I/514+cOjHgYL._SL500_.jpg","1"
"smart speaker","Smart Home","JBL Go 4 - Ultra-Portable, Waterproof and Dustproof Bluetooth Speaker, 7-Hour Built-in Battery, Made in Part with Recycled Materials (Black)","$49.98","$20.00 (29%)","29","https://www.amazon.ca/dp/B0CTNWBT1Z?tag=lesdealsduw02-20&linkCode=osi&th=1&psc=1","https://m.media-amazon.com/images/I/41GTcsw-oFL._SL500_.jpg","2"
"solar panel","Other Tech","DOKIO Semi-Flexible Solar Panel 100W 12V Bendable Thin Film Monocrystalline Lightweight(4.9lb) for Caravan RV Boat Camper Trailer……","$84.77 ($2.29 / oz)","$34.23 (29%)","29","https://www.amazon.ca/dp/B07VL1PT64?tag=lesdealsduw02-20&linkCode=osi&th=1&psc=1","https://m.media-amazon.com/images/I/51RDzbkA-aL._SL500_.jpg","2"
"st patrick","Events","Green Confetti Glitter St. Patrick's Day Lucky Clover Shamrock Cutouts Glitter Irish Table Scatters for St. Patrick's Decorations (Pure, Green)","$9.99","$4.00 (29%)","29","https://www.amazon.ca/dp/B0BWFH9B8M?tag=lesdealsduw02-20&linkCode=osi&th=1&psc=1","https://m.media-amazon.com/images/I/51wqMbKQ4kL._SL500_.jpg","1"
"tennis shoes","Shoes","ASICS Men's Gel-Dedicate 8 Tennis Shoes, 11, White/Saxon Green","$84.94","$35.06 (29%)","29","https://www.amazon.ca/dp/B0D6WW935R?tag=lesdealsduw02-20&linkCode=osi&th=1&psc=1","https://m.media-amazon.com/images/I/31fWyGWCLLL._SL500_.jpg","1"
"tennis shoes","Shoes","ASICS Women's Gel-Dedicate 8 Tennis Shoes, 8, Light Blue/Blue Coast","$84.94","$35.06 (29%)","29","https://www.amazon.ca/dp/B0D6X573WZ?tag=lesdealsduw02-20&linkCode=osi&th=1&psc=1","https://m.media-amazon.com/images/I/31qoG-0efAL._SL500_.jpg","1"
"tennis shoes","Shoes","adidas Women's Gamecourt 2.0 Tennis, White/Silver Metallic/White, 9.5","$63.00","$26.13 (29%)","29","https://www.amazon.ca/dp/B09Y861DXY?tag=lesdealsduw02-20&linkCode=osi&th=1&psc=1","https://m.media-amazon.com/images/I/41L5VnD0z7L._SL500_.jpg","1"
"vacuum bags","Home","Vacuum Storage Bags 20 Pack,4 jumbo, 4 large, 4 midium, 4 small,4 roll bags, Space Saver Sealer Bags, Airtight Compression Bags for Clothes, Pillows, Comforters, Blankets, Bedding","$25.59","$10.40 (29%)","29","https://www.amazon.ca/dp/B0CM2WZ81Z?tag=lesdealsduw02-20&linkCode=osi&th=1&psc=1","https://m.media-amazon.com/images/I/51zlmTg0mQL._SL500_.jpg","1"
"vitamins","Beauty & Health","Centrum Men 50 Plus Multivitamins/Minerals Supplement for Men 50+, 90 Tablets (Packaging May Vary)","$11.97 ($0.13 / count)","$5.00 (29%)","29","https://www.amazon.ca/dp/B00L8RWBQU?tag=lesdealsduw02-20&linkCode=osi&th=1&psc=1","https://m.media-amazon.com/images/I/41hXBqGxaDL._SL500_.jpg","2"
"washing machine cleaner","Home","Home Remover Gel, 8 Fl Oz Household Washing Machine Cleaner for Washing Machine, Refrigerator Strips, For Tiles Grout Sealant Bathroom Cleaning Home Kitchen Sinks Cleaning Grout","$12.00 ($6.00 / 100 g)","$4.99 (29%)","29","https://www.amazon.ca/dp/B0DJSWFS3P?tag=lesdealsduw02-20&linkCode=osi&th=1&psc=1","https://m.media-amazon.com/images/I/51fGiSn4iOL._SL500_.jpg","2"
