"keyword","category","title","price","savings","percent","link","imageUrl","page"
"luggage scale","Travel","Briskyloom LCD Display Portable Bag Scales Hanging Hook Scale for Fishing Travel 110lb/50kg","$9.04","$2.86 (24%)","24","https://www.amazon.ca/dp/B07M6Q16FW?tag=lesdealsduw02-20&linkCode=osi&th=1&psc=1","https://m.media-amazon.com/images/I/41SOAOBUjiL._SL500_.jpg","1"
"markers","Kids & Education","58-8106 Crayola Super Tips Washable Markers-20/Pkg","$7.00","$2.20 (24%)","24","https://www.amazon.ca/dp/B07QDC855T?tag=lesdealsduw02-20&linkCode=osi&th=1&psc=1","https://m.media-amazon.com/images/I/41s1yV46KKL._SL500_.jpg","1"
"microphone","Audio & Music","Blue Yeti USB Microphone for PC, Mac, Gaming, Recording, Streaming, Podcasting, Studio and Computer Condenser Mic with Blue VO!CE effects, 4 Pickup Patterns, Plug and Play - Blackout","$137.26","$42.73 (24%)","24","https://www.amazon.ca/dp/B00N1YPXW2?tag=lesdealsduw02-20&linkCode=osi&th=1&psc=1","https://m.media-amazon.com/images/I/3130DkWZPWL._SL500_.jpg","2"
"microwave","Kitchen","BLACK+DECKER EM720CB7 Digital Microwave Oven with Turntable Push-Button Door, Child Safety Lock, 700W, Stainless Steel, 0.7 Cu.ft","$109.99","$34.17 (24%)","24","https://www.amazon.ca/dp/B0C9DY3MHG?tag=lesdealsduw02-20&linkCode=osi&th=1&psc=1","https://m.media-amazon.com/images/I/31om8X6cJsL._SL500_.jpg","1"
"monitor","Computers & Tech","Dell 27 Plus 4K Monitor - S2725QS - 27-inch 4K (3840 x 2160) 120Hz 16:9 Display, IPS Panel, AMD FreeSync Premium, sRGB 99%, Integrated Speakers, 1500:1 Contrast Ratio, Comfortview Plus - Ash White","$319.99","$100.00 (24%)","24","https://www.amazon.ca/dp/B0F1GF1KFC?tag=lesdealsduw02-20&linkCode=osi&th=1&psc=1","https://m.media-amazon.com/images/I/41s7eTNxbWL._SL500_.jpg","2"
"pencils","Kids & Education","STAEDTLER Yellow School Pencils (144-Pack), Pre-Sharpened #2 HB with Erasers, Ready-to-Use School Supplies for Students and Teachers","$18.98","$5.99 (24%)","24","https://www.amazon.ca/dp/B00XWK29I6?tag=lesdealsduw02-20&linkCode=osi&th=1&psc=1","https://m.media-amazon.com/images/I/41H0n1xU3uL._SL500_.jpg","2"
"phone case","Smartphones","JETech Silicone Case for iPhone 13 6.1-Inch, Silky-Soft Touch Full-Body Protective Phone Case, Shockproof Cover with Microfiber Lining (Black)","$12.99","$4.00 (24%)","24","https://www.amazon.ca/dp/B09BVHH3F6?tag=lesdealsduw02-20&linkCode=osi&th=1&psc=1","https://m.media-amazon.com/images/I/310oou7O5QL._SL500_.jpg","2"
"pool","Outdoor & Camping","Intex 28290EH 8 Feet by 30 Inches Easy to Assemble Large Round Metal Frame Above Ground Swimming Pool with Dual Suction Outlet Fittings, Pink","$167.99","$52.00 (24%)","24","https://www.amazon.ca/dp/B0BVNTPZCK?tag=lesdealsduw02-20&linkCode=osi&th=1&psc=1","https://m.media-amazon.com/images/I/31GlATlUjLL._SL500_.jpg","2"
"pressure washer","Automotive","QIOMALA Electric Pressure Washer, 5500 PSI 3.8 GPM Adjustable Touch Screen, High Pressure Cleaning Machine with 35 FT Power Cord, 4 Nozzles, Hose Reel, Foam Cannon for Car/Patio/Garage,Green","$129.99","$40.00 (24%)","24","https://www.amazon.ca/dp/B0F5992MPN?tag=lesdealsduw02-20&linkCode=osi&th=1&psc=1","https://m.media-amazon.com/images/I/41PdxlEn3IL._SL500_.jpg","2"
"refurbished laptop","Laptops & Tablets","Lenovo 11.6"" 300e Chromebook Touchscreen LCD 2 in 1- MediaTek M8173C Quad-core 2.1GHz 4GB LPDDR3 32GB Flash Memory Chrome OS Model 81H00000US (Renewed)","$89.90","$29.10 (24%)","24","https://www.amazon.ca/dp/B07RJZMC49?tag=lesdealsduw02-20&linkCode=osi&th=1&psc=1","https://m.media-amazon.com/images/I/41aZSudPOWL._SL500_.jpg","1"
"retinol serum","Beauty & Personal Care","Neutrogena Anti Aging Retinol Oil for Face, Rapid Wrinkle Repair Face Serum and Eye Serum, 30 Milliliters","$28.99 ($0.97 / Milliliters)","$9.28 (24%)","24","https://www.amazon.ca/dp/B07KKYTJB4?tag=lesdealsduw02-20&linkCode=osi&th=1&psc=1","https://m.media-amazon.com/images/I/41vvUBa9SUL._SL500_.jpg","1"
"ring light","Cameras & Photography","Anautin Selfie Light, 60 LED 2200mAh Rechargeable Clip Fill Video Light (Black)","$25.98","$8.01 (24%)","24","https://www.amazon.ca/dp/B0C14DTY3M?tag=lesdealsduw02-20&linkCode=osi&th=1&psc=1","https://m.media-amazon.com/images/I/41xPueJAObL._SL500_.jpg","1"
"satin sheets","Bedroom","DECOLURE Satin Bed Sheets - 4 Piece Luxury Silky Queen Size Bedding Set - Softer Than Silk, Wrinkle-Free with 15” Deep Pocket Fitted Sheet, Perfect for Hair & Skin, Gifts for Women (Grey)","$47.99","$15.00 (24%)","24","https://www.amazon.ca/dp/B0839LQK8K?tag=lesdealsduw02-20&linkCode=osi&th=1&psc=1","https://m.media-amazon.com/images/I/51RKZGRwKNL._SL500_.jpg","1"
"saw","Tools","MOSSY OAK 3 in 1 Folding Saw, Pruning Hand Saw with Wood, Metal and PVC Blade, Camping Saw for Backpacking, Hunting and Bushcraft, Pouch Included","$24.99","$8.00 (24%)","24","https://www.amazon.ca/dp/B071Z1Y34D?tag=lesdealsduw02-20&linkCode=osi&th=1&psc=1","https://m.media-amazon.com/images/I/41HrQtrz8HL._SL500_.jpg","1"
"scrapbooking","Arts & Crafts","48 Rolls Washi Tape Set - 8mm Wide Decorative Masking Tape, Colourful Flower Style Design for DIY Craft Scrapbooking Gift Wrapping","$13.59 ($0.28 / count)","$4.40 (24%)","24","https://www.amazon.ca/dp/B076K76CBV?tag=lesdealsduw02-20&linkCode=osi&th=1&psc=1","https://m.media-amazon.com/images/I/613pnPiiqHL._SL500_.jpg","1"
"solar cream","Beauty & Personal Care","Garnier Ombrelle Sport Endurance Sunscreen Lotion, SPF 60, Body Sunscreen, Broad Spectrum UVA & UVB Sun Protection, Suitable for Sensitive Skin, Water and Sweat Resistant, Non-Greasy, 231ml","$15.47 ($6.70 / 100 ml)","$5.00 (24%)","24","https://www.amazon.ca/dp/B078XYBXY1?tag=lesdealsduw02-20&linkCode=osi&th=1&psc=1","https://m.media-amazon.com/images/I/31mzc7yGraL._SL500_.jpg","2"
"sound machine","Bedroom","Dreamegg White Noise Machine - Portable Sound Machine Baby Adult, Travel White Noise Sound Machine, 16 Soothing Sounds, Rechargeable, Mini Sound Machine for Sleeping Baby Shower Home Hotel Gift, White","$15.19","$4.80 (24%)","24","https://www.amazon.ca/dp/B0D1JYYNQL?tag=lesdealsduw02-20&linkCode=osi&th=1&psc=1","https://m.media-amazon.com/images/I/31cfexHGhdL._SL500_.jpg","1"
"string lights","Furniture & Decor","Outdoor String Lights 25 Feet G40 Globe LEDs Patio Lights with 13 Edison LED Bulbs(1 Spare), Waterproof Connectable Hanging Light for Backyard Porch Balcony Party Decor, E12 Socket Base, Black","$21.99 ($0.88 / Foot)","$7.00 (24%)","24","https://www.amazon.ca/dp/B00RQHBZVS?tag=lesdealsduw02-20&linkCode=osi&th=1&psc=1","https://m.media-amazon.com/images/I/41ML0AVdbmL._SL500_.jpg","1"
"sugar","Food","REDPATH White Granulated Sugar 3 Qty 6KG | Each 2KG X 3 Bags | by NUTRICHOLAI","$21.69 ($3.62 / kg)","$6.80 (24%)","24","https://www.amazon.ca/dp/B08HY54SL6?tag=lesdealsduw02-20&linkCode=osi&th=1&psc=1","https://m.media-amazon.com/images/I/41HJ60jzG-L._SL500_.jpg","1"
"swimming","Sports & Fitness","Speedo Unisex Adult Swim Cap Silicone Long Hair, Speedo Black, One Size","$12.99","$4.01 (24%)","24","https://www.amazon.ca/dp/B000F6E2JE?tag=lesdealsduw02-20&linkCode=osi&th=1&psc=1","https://m.media-amazon.com/images/I/31AdRrdtjzL._SL500_.jpg","1"
"tablet stand","Computers & Tech","UGREEN Tablet Stand Holder Adjustable Protable Desktop Holder Dock Compatible for iPad 10.2 iPad Pro 11 Inch iPad 9.7 iPad Mini 5 4 3 2 iPad Air Nintendo Switch iPhone 13 12 Pro Max 11 XS XR Black","$14.38","$4.61 (24%)","24","https://www.amazon.ca/dp/B07CG71KQ1?tag=lesdealsduw02-20&linkCode=osi&th=1&psc=1","https://m.media-amazon.com/images/I/311Xfyq9JaL._SL500_.jpg","1"
"table lamp","Furniture & Decor","Soilsiu Beside Table Lamp-Bedroom 3-Way Dimmable Solid Wood Lamps with Modern Fabric Shade Reading Nightstand Lamps for Living Room, Kids Room, College Dorm, Office (LED Bulb Included)","$24.99","$8.00 (24%)","24","https://www.amazon.ca/dp/B091T6YBMN?tag=lesdealsduw02-20&linkCode=osi&th=1&psc=1","https://m.media-amazon.com/images/I/41a2DboxaAL._SL500_.jpg","2"
"thermometer","Health & Wellness","Meat Thermometers, DOQAUS Instant Read Food Thermometer for Cooking, Digital Kitchen Thermometer Probe with Backlight & Reversible Display, Wide Temperature Range for Turkey Grill BBQ Oven Candy","$12.99","$4.00 (24%)","24","https://www.amazon.ca/dp/B07WV4BFCP?tag=lesdealsduw02-20&linkCode=osi&th=1&psc=1","https://m.media-amazon.com/images/I/41jrMsPv57L._SL500_.jpg","2"
"toilet paper","Home & Cleaning","Cascades Standard Bath Tissue, 2 PLY - 420 Sheets - Box of 48 Rolls","$45.50 ($10.83 / 100 Sheets)","$14.49 (24%)","24","https://www.amazon.ca/dp/B071GP9TZZ?tag=lesdealsduw02-20&linkCode=osi&th=1&psc=1","https://m.media-amazon.com/images/I/41VQP5UCz9L._SL500_.jpg","2"
"trash can","Home & Cleaning","Glad 13 Gallon Trash Can, 2 Pack | Plastic Kitchen Waste Bin with Odor Protection of Lid | Hands Free with Step On Foot Pedal and Garbage Bag Rings, Black, 2 Count","$99.36 ($49.68 / count)","$30.63 (24%)","24","https://www.amazon.ca/dp/B0BWPRZ9R4?tag=lesdealsduw02-20&linkCode=osi&th=1&psc=1","https://m.media-amazon.com/images/I/31z3UFvUVAL._SL500_.jpg","2"
"travel locks","Travel","Puroma 2 Pack TSA Approved Luggage Lock, 4 Digit Combination Travel Locks Resettable Code Lock with Zinc Alloy Body for Suitcase, Toolbox, Backpack, Bag, Gym Locker (Black)","$12.99","$4.00 (24%)","24","https://www.amazon.ca/dp/B0D2QZSSDH?tag=lesdealsduw02-20&linkCode=osi&th=1&psc=1","https://m.media-amazon.com/images/I/4159iVXu6iL._SL500_.jpg","1"
"usb cable","Power & Chargers","Cable Matters Long USB 3.0 Cable 10ft, USB to USB Cable/USB A to USB A Cable/Male to Male USB Cord/Double USB Cord in Black","$12.99","$4.00 (24%)","24","https://www.amazon.ca/dp/B00HSS9KJY?tag=lesdealsduw02-20&linkCode=osi&th=1&psc=1","https://m.media-amazon.com/images/I/41TewsWfudL._SL500_.jpg","2"
"usb charger","Power & Chargers","Anker PowerPort 6 (60W 6-Port USB Charging Hub) Multi-Port USB Charger for Apple iPhone 6s / 6/6 Plus, iPad Air 2 / Mini 3, Samsung Galaxy S6 / S6 Edge, Note 5 and More","$22.70","$7.29 (24%)","24","https://www.amazon.ca/dp/B00QTIQ21I?tag=lesdealsduw02-20&linkCode=osi&th=1&psc=1","https://m.media-amazon.com/images/I/31Nrt2ZUiUL._SL500_.jpg","1"
"voltage converter","Travel","X-STAR Voltage Converter Canada to Europe,220V to 110V Converter,International European Universal Travel Adapter Plug Power Convertisseur for Hair Dryer,CA US to Europe UK AU Over 200 Countries.","$45.59","$14.40 (24%)","24","https://www.amazon.ca/dp/B0FFB3Y77N?tag=lesdealsduw02-20&linkCode=osi&th=1&psc=1","https://m.media-amazon.com/images/I/41EQclq090L._SL500_.jpg","1"
"vr carrying case","Gaming","PGmoon Storage Carrying Bag Compatible with Oculus Meta Quest 2/Quest 3/Quest 3S/Quest Pro/VR Elite Strap and Controller, Travel Backpack Case with Lots of Space for Accessories (Patent Design)","$37.99","$12.00 (24%)","24","https://www.amazon.ca/dp/B0D5CD6WSP?tag=lesdealsduw02-20&linkCode=osi&th=1&psc=1","https://m.media-amazon.com/images/I/41AGBB-RMIL._SL500_.jpg","1"
"vr carrying case","Gaming","PGmoon Travel Carry Case Compatible with Oculus Meta Quest 2/Quest 3/Quest 3S/VR Elite Strap, Protective Carrying Case Bag with Plenty of Pockets for Controllers & Accessories (Patent Design)","$37.99","$12.00 (24%)","24","https://www.amazon.ca/dp/B0D5CDBDWT?tag=lesdealsduw02-20&linkCode=osi&th=1&psc=1","https://m.media-amazon.com/images/I/41hNCi1eI9L._SL500_.jpg","2"
"vr carrying case","Gaming","PGmoon Carrying Case Compatible with Oculus Meta Quest 2/3/Pro, VR Elite Strap Travel Storage Bag Backpack with Separate Room for Touch Controllers and Multi-Pockets (Patent Design) (Black)","$37.99","$12.00 (24%)","24","https://www.amazon.ca/dp/B0CKP2K93W?tag=lesdealsduw02-20&linkCode=osi&th=1&psc=1","https://m.media-amazon.com/images/I/51bjSiEOocL._SL500_.jpg","2"
"vr treadmill","Gaming","Syntech Link Cable 16FT for PCVR Compatible with Oculus/Quest 3/Meta Quest 3S, Quest2/Pro/Pico 4/Ultra Accessories and PC/SteamVR, High Speed PC Data Transfer, USB 3.0 to USB C Cable for VR Headset","$24.99","$8.00 (24%)","24","https://www.amazon.ca/dp/B098399X91?tag=lesdealsduw02-20&linkCode=osi&th=1&psc=1","https://m.media-amazon.com/images/I/41o0+ZQiNcL._SL500_.jpg","1"
"wallet","Clothing & Accessories","RUNBOX Slim Wallet for Men 15 Slots Ultra Large Capacity RFID Blocking Bifold Credit Card Holder with 2 ID Window","$19.67","$6.32 (24%)","24","https://www.amazon.ca/dp/B0B7N8SG45?tag=lesdealsduw02-20&linkCode=osi&th=1&psc=1","https://m.media-amazon.com/images/I/512tffZyZrL._SL500_.jpg","1"
"watercolor","Arts & Crafts","Artecho Watercolor Paint Set 100 Colors in Portable Box Including, Travel Watercolor Set with Watercolor Papers, Brushes and other Tools, Idea for Artists and Hobbyists","$24.99","$8.00 (24%)","24","https://www.amazon.ca/dp/B0CLTLKQWF?tag=lesdealsduw02-20&linkCode=osi&th=1&psc=1","https://m.media-amazon.com/images/I/51x+Gi6fn-L._SL500_.jpg","1"
"watercolor","Arts & Crafts","Watercolor in the Woods: Paint a Whimsical World of Forest Animals, Botanicals, Toadstools and More","$23.68","$7.31 (24%)","24","https://www.amazon.ca/dp/B0CLTPB4CD?tag=lesdealsduw02-20&linkCode=osi&th=1&psc=1","https://m.media-amazon.com/images/I/51m3TwtUrTL._SL500_.jpg","2"
"weighted blanket","Bedroom","Wemore Sherpa Fleece Weighted Blanket for Adult, 15 lbs Dual Sided Cozy Fluffy Heavy Blanket, Ultra Fuzzy Throw Blanket with Soft Plush Flannel Top, 60 x 80 inches Grey on Both Sides","$72.84","$22.75 (24%)","24","https://www.amazon.ca/dp/B087PJZX3V?tag=lesdealsduw02-20&linkCode=osi&th=1&psc=1","https://m.media-amazon.com/images/I/51XThp+oV0L._SL500_.jpg","1"
"yoga blocks","Sports & Fitness","MBKHFLL Yoga Blocks - Supportive Latex-Free Eva Foam - Soft Non-Slip Surface with Beveled Edges for Yoga, Pilates, Meditation - Yoga Accessories for Stability, Balance, Deepen Stretches (orange-1 Pack, 9""x6""x3"")","$9.90","$3.08 (24%)","24","https://www.amazon.ca/dp/B0DLTNVPFZ?tag=lesdealsduw02-20&linkCode=osi&th=1&psc=1","https://m.media-amazon.com/images/I/31nfNRlQdIL._SL500_.jpg","2"
"3d printer nozzle","Makers & Digital Fabrication","Anycubic 3D Printer Nozzle 0.4 mm/ 1.75 mm High Temperature Wear Resistant, Compatible with Anycubic Kobra 2 Series (5 Pcs)","$9.99","$3.00 (23%)","23","https://www.amazon.ca/dp/B0CC9BMWS6?tag=lesdealsduw02-20&linkCode=osi&th=1&psc=1","https://m.media-amazon.com/images/I/41T9pYTAOiL._SL500_.jpg","1"
"adhesive vinyl","Makers & Digital Fabrication","HTVRONT White Permanent Vinyl - 12"" x14FT Glossy White Vinyl for Cricut, Adhesive Vinyl Roll for Cricut, Silhouette Cameo & Other Cutters - Vinyl for Party & Home Decoration, Sticker","$14.99","$4.50 (23%)","23","https://www.amazon.ca/dp/B0D97BKTKZ?tag=lesdealsduw02-20&linkCode=osi&th=1&psc=1","https://m.media-amazon.com/images/I/31v-jKJtbCL._SL500_.jpg","2"
"air fryer","Kitchen","Chefman Air Fryer – 4 QT Compact Airfryer for Quick & Easy Meals, Features Hi-Fry Technology for Extra Crisp, Easy-View Window, Touch Controls with 4 Presets, Nonstick & Dishwasher Safe Basket - Black","$84.99","$25.00 (23%)","23","https://www.amazon.ca/dp/B0D5FRXYMJ?tag=lesdealsduw02-20&linkCode=osi&th=1&psc=1","https://m.media-amazon.com/images/I/41bGcYTIvpL._SL500_.jpg","2"
"art supplies","Kids & Education","Kalour 33 Pieces Pro Drawing Kit Sketching Pencils Set,Portable Zippered Travel Case-Charcoal Pencils, Sketch Pencils, Charcoal Stick,Sharpener,Eraser.Art Supplies for Artists Beginner Adults Teens","$22.99","$7.00 (23%)","23","https://www.amazon.ca/dp/B07DTCQHD4?tag=lesdealsduw02-20&linkCode=osi&th=1&psc=1","https://m.media-amazon.com/images/I/514vfWDRu9L._SL500_.jpg","1"
"baby stroller","Baby","Evenflo Pivot Xplore All-Terrain Stroller Wagon (Adventurer Gray)","$299.99","$90.00 (23%)","23","https://www.amazon.ca/dp/B0876T55JJ?tag=lesdealsduw02-20&linkCode=osi&th=1&psc=1","https://m.media-amazon.com/images/I/41wvCINELzL._SL500_.jpg","2"
"balance bike","Kids & Education","KRIDDO Toddler Balance Bike 2 Year Old, Age 24 Months to 5 Years Old, 12 Inch Push Bicycle with Customize Plate (3 Sets of Stickers Included), Steady Balancing, Gift Bike for 2-3 Boys Girls, White","$99.99","$30.00 (23%)","23","https://www.amazon.ca/dp/B09Z65PBXP?tag=lesdealsduw02-20&linkCode=osi&th=1&psc=1","https://m.media-amazon.com/images/I/410RNXOpVYL._SL500_.jpg","1"
"bamboo pillowcase","Bedroom","Gogreen Pillow Cases (Set of 2) for Hot Sleepers & Night Sweats, Rayon Derived from Bamboo Rayon Pillow Case, Breathable and Silky Soft Envelope Pillowcases (Grey, King 20""x36"")","$9.99","$3.00 (23%)","23","https://www.amazon.ca/dp/B0DFGRDGWL?tag=lesdealsduw02-20&linkCode=osi&th=1&psc=1","https://m.media-amazon.com/images/I/41aBMUp2E-L._SL500_.jpg","1"
"beach blanket","Outdoor & Camping","Diveblues Beach Blanket, 10'X 9' Extra Large Sandproof Waterproof Soft, 8 Persons Family Size, Sand Free, Comfortable, Hard-Wearing 150D PES, Lightweight, 4 Stakes&1 Travel Bag, S12","$29.99","$9.00 (23%)","23","https://www.amazon.ca/dp/B0CS66VSP2?tag=lesdealsduw02-20&linkCode=osi&th=1&psc=1","https://m.media-amazon.com/images/I/51-kZcYpz5L._SL500_.jpg","2"
"bluetooth headphones","Audio & Music","Louise&Mann Wireless Headphones Over Ear, Bluetooth Headphones 5.3, Foldable Lightweight with Soft Memory Foam Earmuffs, Built-in Mic with Wired Mode and Carry Case for Travel,Office,PC","$22.99","$7.00 (23%)","23","https://www.amazon.ca/dp/B08HRVFF65?tag=lesdealsduw02-20&linkCode=osi&th=1&psc=1","https://m.media-amazon.com/images/I/31e7M1s0LsL._SL500_.jpg","2"
"candle warmer","Home & Cleaning","Droyek Fragrance Candle Warmer Lamp with 2 Bulbs Electric Candle Warmer with Timer & Dimmer for Home Decor Wax Melt for Small Large Size Jar Candles Retro Wooden Base","$22.99","$7.00 (23%)","23","https://www.amazon.ca/dp/B0C7ML25K7?tag=lesdealsduw02-20&linkCode=osi&th=1&psc=1","https://m.media-amazon.com/images/I/41pkL1BzAXL._SL500_.jpg","1"
"car accessories","Automotive","FIXSMITH Microfiber Cleaning Cloth - Pack of 8, Size: 12 x 16 in, Multi-Functional Cleaning Towels, Highly Absorbent Cleaning Rags, Lint-Free, Streak-Free Cleaning Cloths for Car Kitchen Home Office.","$9.99","$3.00 (23%)","23","https://www.amazon.ca/dp/B083DN8KNB?tag=lesdealsduw02-20&linkCode=osi&th=1&psc=1","https://m.media-amazon.com/images/I/51TUmsinX4L._SL500_.jpg","2"
"car seat cover","Automotive","BDK PolyPro Car Seat Covers Full Set in Charcoal on Black – Front and Rear Split Bench for Cars, Easy to Install Cover Set, Accessories Auto Trucks Van SUV","$55.40","$16.87 (23%)","23","https://www.amazon.ca/dp/B01FKQVZOS?tag=lesdealsduw02-20&linkCode=osi&th=1&psc=1","https://m.media-amazon.com/images/I/31+RZFC-sXL._SL500_.jpg","2"
"cat food","Pet Supplies","WHISKAS Meaty Selections Adult Dry Cat Food With Real Chicken, 2kg bag","$7.32 ($3.66 / kg)","$2.17 (23%)","23","https://www.amazon.ca/dp/B007HQY1CS?tag=lesdealsduw02-20&linkCode=osi&th=1&psc=1","https://m.media-amazon.com/images/I/41-zQCuWELL._SL500_.jpg","1"
"clay","Arts & Crafts","Ixiaoyoo Air Dry Clay, Modelling Clay for Kids, 30 Colors DIY Molding Magic Clay for with Tools, Soft & Non-Sticky, Toys Gifts for Age 3 4 5 6 7 8+ Years Old Boys Girls Kids","$9.99","$3.00 (23%)","23","https://www.amazon.ca/dp/B0C3C3MSPS?tag=lesdealsduw02-20&linkCode=osi&th=1&psc=1","https://m.media-amazon.com/images/I/51x+Hhl6gIL._SL500_.jpg","1"
"compression socks","Health & Wellness","DHSO 4 Pairs Graduated Compression Socks for Men and Women(15-20mmHg), Compression Stocking for Swelling, Running, Hiking, Travel, Nursing(4 Pack Black/White/Gray/Nude, Small-Medium)","$17.76","$5.23 (23%)","23","https://www.amazon.ca/dp/B0BLTMMBXZ?tag=lesdealsduw02-20&linkCode=osi&th=1&psc=1","https://m.media-amazon.com/images/I/41vs+thY1JL._SL500_.jpg","1"
"cooler","Outdoor & Camping","Iknoe Large Cooler Bag Collapsible 24 Can Insulated Bags Leakproof Lunch Cooler Tote with Multi-Pockets for Adult Insulated Lunch Box for Beach, Picnic, Work…","$22.99","$7.00 (23%)","23","https://www.amazon.ca/dp/B091GBR4Z9?tag=lesdealsduw02-20&linkCode=osi&th=1&psc=1","https://m.media-amazon.com/images/I/41KvKt4u9dL._SL500_.jpg","2"
"daypack","Travel","ZOMAKE Lightweight Packable Backpack 21L,Foldable Small Hiking Backpack Light Daypack for Men Women(Black)","$16.99","$5.00 (23%)","23","https://www.amazon.ca/dp/B01DNGEHP6?tag=lesdealsduw02-20&linkCode=osi&th=1&psc=1","https://m.media-amazon.com/images/I/41yg4RxUDLL._SL500_.jpg","1"
"deodorant","Beauty & Personal Care","AXE Apollo Deodorant Stick for 48-Hour Lasting Fragrance, Sage & Cedarwood, Aluminum-free Deodorant, 85g","$4.98 ($5.86 / 100 g)","$1.51 (23%)","23","https://www.amazon.ca/dp/B00BMI38Z8?tag=lesdealsduw02-20&linkCode=osi&th=1&psc=1","https://m.media-amazon.com/images/I/41FqQY0LiWL._SL500_.jpg","2"
"dish soap","Kitchen","Dawn Ultra Dish Soap Refill, Dishwashing Liquid, Original Scent, 2.64 L","$9.99 ($0.38 / 100 ml)","$3.00 (23%)","23","https://www.amazon.ca/dp/B09SNR3CDV?tag=lesdealsduw02-20&linkCode=osi&th=1&psc=1","https://m.media-amazon.com/images/I/41U41K8nhoL._SL500_.jpg","1"
"dish soap","Kitchen","Dawn Platinum Dish Soap Refill, Dishwashing Liquid, Refreshing Rain Scent, 2.21 L","$9.99 ($0.45 / 100 ml)","$3.00 (23%)","23","https://www.amazon.ca/dp/B09SNT1NND?tag=lesdealsduw02-20&linkCode=osi&th=1&psc=1","https://m.media-amazon.com/images/I/41tzrE8n6yL._SL500_.jpg","1"
"docking station","Computers & Tech","Selore USB C Docking Station for Laptop Dual Monitor, Ethernet Docking Station 3 Monitors Triple 4K Display with 2 HDMI,DisplayPort,1 Gbps Ethernet,100W PD Charging,USB 3.0 Ports Adapter for Dell HP","$38.39","$11.60 (23%)","23","https://www.amazon.ca/dp/B0DJVLGZ86?tag=lesdealsduw02-20&linkCode=osi&th=1&psc=1","https://m.media-amazon.com/images/I/41KVkmT-zRL._SL500_.jpg","2"
"dog collar","Pet Supplies","CollarDirect Reflective Padded Dog Collar for a Small, Medium, Large Dog or Puppy with a Quick Release Buckle Boy and Girl Nylon Suitable for Swimming (18-26 Inch, Lime Green Padded )","$9.99","$3.00 (23%)","23","https://www.amazon.ca/dp/B09XY437ZP?tag=lesdealsduw02-20&linkCode=osi&th=1&psc=1","https://m.media-amazon.com/images/I/5154PySpvzL._SL500_.jpg","1"
"door lock","Security","TEEHO TE002 Fingerprint Door Lock, Smart Keyless Entry Electronic Keypad Deadbolt for Front Door - Auto Lock - Easy Installation - Stain Nickel","$99.99 ($3.55 / oz)","$30.00 (23%)","23","https://www.amazon.ca/dp/B09T6929J6?tag=lesdealsduw02-20&linkCode=osi&th=1&psc=1","https://m.media-amazon.com/images/I/41riwTkMjSL._SL500_.jpg","1"
"door sensor","Security","Door Sensor Chime for Door Opens, Door Entry Chime for Business/Home/Office/Store, 600 FT Range, 32 Chimes 5 Adjustable Volume Door Ringer Alert Alarm 1 Receivers +1 Sensors","$19.93","$6.05 (23%)","23","https://www.amazon.ca/dp/B0FLK881XH?tag=lesdealsduw02-20&linkCode=osi&th=1&psc=1","https://m.media-amazon.com/images/I/31HuH8dhfXL._SL500_.jpg","1"
"educational toys","Kids & Education","HahaGift Educational Toys for 3-5 Year Old Boy Girl Gifts, Matching Letter Learning Games Activities, Ideal Christmas Birthday Gift for Toddler Kids Age 3 4 5 6 7 Year Olds Boys Girls","$23.99","$7.00 (23%)","23","https://www.amazon.ca/dp/B08HTZDNPV?tag=lesdealsduw02-20&linkCode=osi&th=1&psc=1","https://m.media-amazon.com/images/I/51IupBqK7sL._SL500_.jpg","1"
"energy drinks","Food","Rockstar Energy Drink Pure Zero Punched, 473 mL Cans, 12 Pack","$29.88 ($5.26 / l)","$9.11 (23%)","23","https://www.amazon.ca/dp/B08TDKFV2F?tag=lesdealsduw02-20&linkCode=osi&th=1&psc=1","https://m.media-amazon.com/images/I/41fzNjwXNGL._SL500_.jpg","2"
"ethernet cable","Networking & Connectivity","25 Ft Ethernet Cable for Cat 6e/Cat6, 10Gbps 24AWG High Speed Network Cable, Direct Burial Cable, UTP, LLDPE, RJ45 Patch LAN Cord, Waterproof, Indoor&Outdoor, Cat 5E/Cat 5 Internet Cable for PC-White","$9.99","$3.00 (23%)","23","https://www.amazon.ca/dp/B0D4LPVCY1?tag=lesdealsduw02-20&linkCode=osi&th=1&psc=1","https://m.media-amazon.com/images/I/51ec7Bx+uIL._SL500_.jpg","2"
"exercise bike","Sports & Fitness","USLIM Exercise Bike, Foldable Stationary Bikes for Home, 5 IN 1 Indoor Workout Bike, with 16-Level Quiet Magnetic Resistance, 6.6 LBS Flywheel and 300LBS Capacity, 2025 Designed 817 X-bike","$199.99","$60.00 (23%)","23","https://www.amazon.ca/dp/B0FBR1YVQS?tag=lesdealsduw02-20&linkCode=osi&th=1&psc=1","https://m.media-amazon.com/images/I/41EA8qRIvrL._SL500_.jpg","2"
"exercise equipment","Sports & Fitness","FateFan Multifunction Tension Rope, 6-Tube Elastic Yoga Pedal Puller Resistance Band, Natural Latex Tension Rope Fitness, for Abdomen/Waist/Arm/Leg Stretching Slimming Training (Purple)","$10.60","$3.09 (23%)","23","https://www.amazon.ca/dp/B0876ZY2VB?tag=lesdealsduw02-20&linkCode=osi&th=1&psc=1","https://m.media-amazon.com/images/I/51gOARX2xkL._SL500_.jpg","1"
"fabric softener","Home & Cleaning","Downy Rinse & Refresh Laundry Odour Remover and Fabric Softener, Fresh Lavender, Safe On All Fabrics, HE Compatible, 1.08L","$9.99 ($0.01 / millilitre)","$3.00 (23%)","23","https://www.amazon.ca/dp/B0D98ZS3QJ?tag=lesdealsduw02-20&linkCode=osi&th=1&psc=1","https://m.media-amazon.com/images/I/419qDaIg7jL._SL500_.jpg","2"
"fan","Home & Cleaning","LEVOIT 25dB Tower Fan for Bedroom, 26ft/s Velocity Standing Fan, 90° Oscillating Cooling Fans for Home, 12 Speeds, LED Display, 4 Modes, 12H Timer, Bladeless, Remote Control, 36 inch","$99.99","$30.00 (23%)","23","https://www.amazon.ca/dp/B0D4LQPC5M?tag=lesdealsduw02-20&linkCode=osi&th=1&psc=1","https://m.media-amazon.com/images/I/31y9dYZ1taL._SL500_.jpg","1"
"fitness equipment","Sports & Fitness","Houselog Resistance Bands Sets Portable Exercise Loops for Legs and Hip 3 Resistance Level Workout Weight Bands with Non-Slip Design Workout Flexbands for Home Gym Office Yoga Pilates (Green Blue)","$19.98","$6.01 (23%)","23","https://www.amazon.ca/dp/B0BZP3QJYF?tag=lesdealsduw02-20&linkCode=osi&th=1&psc=1","https://m.media-amazon.com/images/I/517m3KdmbsL._SL500_.jpg","1"
