"keyword","category","title","price","savings","percent","link","imageUrl","page"
"luggage scale","Travel","Briskyloom LCD Display Portable Bag Scales Hanging Hook Scale for Fishing Travel 110lb/50kg","$9.04","$2.86 (24%)","24","https://www.amazon.ca/dp/B07M6Q16FW?tag=lesdealsduw02-20&linkCode=osi&th=1&psc=1","https://m.media-amazon.com/images/I/41SOAOBUjiL._SL500_.jpg","1"
"markers","Kids & Education","Crayola 64 Pip-Squeak Skinnies Markers Arts & Crafts (58-8764)","$11.94","$3.80 (24%)","24","https://www.amazon.ca/dp/B007K1P5UC?tag=lesdealsduw02-20&linkCode=osi&th=1&psc=1","https://m.media-amazon.com/images/I/51vNclAfMqL._SL500_.jpg","2"
"modem","Networking & Connectivity","GL.iNet GL-MT6000 (Flint 2) WiFi 6 High Speed Gaming Routers for Wireless Internet, 2 x 2.5G Ethernet Ports for Fiber Optic Modem, Long Range Computer VPN WiFi Router, Home & Business","$194.99","$62.91 (24%)","24","https://www.amazon.ca/dp/B0CP7S3117?tag=lesdealsduw02-20&linkCode=osi&th=1&psc=1","https://m.media-amazon.com/images/I/3178dJLMIcL._SL500_.jpg","1"
"monitor","Computers & Tech","SANSUI Monitor 27 inch 120Hz 1080P Computer Monitor FHD, HDMI DP Ports 110% sRGB HDR Tilt Adjustable/VESA Compatible, for Game and Office (HDMI Cable Included)","$132.99","$43.01 (24%)","24","https://www.amazon.ca/dp/B0CG9HF9KW?tag=lesdealsduw02-20&linkCode=osi&th=1&psc=1","https://m.media-amazon.com/images/I/5150x8Qbz7L._SL500_.jpg","1"
"mouse","Computers & Tech","TECKNET Wireless Mouse, 2.4G Quiet Computer Mouse with USB Receiver, 4 Buttons Portable Cordless Mice for Chromebook, Laptop, PC, Mac, 800/1200/1600 DPI","$12.98","$4.01 (24%)","24","https://www.amazon.ca/dp/B0BJ6NBYJG?tag=lesdealsduw02-20&linkCode=osi&th=1&psc=1","https://m.media-amazon.com/images/I/319eaPtIJ4L._SL500_.jpg","1"
"nail polish","Beauty & Personal Care","Revlon Nail Enamel, Chip Resistant Nail Polish, Glossy Shine Finish, in Plum/Berry, 151 Iced Mauve, 0.5 oz/ 14.7ml","$6.48 ($44.08 / 100 ml)","$2.00 (24%)","24","https://www.amazon.ca/dp/B004K0MU9U?tag=lesdealsduw02-20&linkCode=osi&th=1&psc=1","https://m.media-amazon.com/images/I/31T11BQvvBL._SL500_.jpg","1"
"oil filter","Automotive","Bosch 3330 Premium Filtech Oil Filter","$12.86","$4.13 (24%)","24","https://www.amazon.ca/dp/B002EBSLA4?tag=lesdealsduw02-20&linkCode=osi&th=1&psc=1","https://m.media-amazon.com/images/I/51Pj1mJWleL._SL500_.jpg","1"
"parchment paper","Kitchen","Katbite 200Pcs 9x13 inch Heavy Duty Unbleached Parchment Paper, Parchment Paper Sheets for Baking Cookies, Cooking, Frying, Air Fryer, Grilling Rack, Oven(9x13 Inch)","$21.99","$7.00 (24%)","24","https://www.amazon.ca/dp/B08353YPCP?tag=lesdealsduw02-20&linkCode=osi&th=1&psc=1","https://m.media-amazon.com/images/I/41GMJk0NJoL._SL500_.jpg","1"
"pencils","Kids & Education","STAEDTLER Yellow School Pencils (144-Pack), Pre-Sharpened #2 HB with Erasers, Ready-to-Use School Supplies for Students and Teachers","$18.97","$6.00 (24%)","24","https://www.amazon.ca/dp/B00XWK29I6?tag=lesdealsduw02-20&linkCode=osi&th=1&psc=1","https://m.media-amazon.com/images/I/41H0n1xU3uL._SL500_.jpg","1"
"pet ramp","Pet Supplies","MOOACE Dog Stairs for Small Dogs, 4 Steps Foam Pet Step for Beds and Couches 19.7"" H, Non-Slip Dog Ramp Soft for Injured Pets Senior Cats Dogs, Washable Cover and Hair Remover Roller","$49.99","$16.00 (24%)","24","https://www.amazon.ca/dp/B0BW9983NX?tag=lesdealsduw02-20&linkCode=osi&th=1&psc=1","https://m.media-amazon.com/images/I/412vO4oZIyL._SL500_.jpg","2"
"pill organizer","Health & Wellness","Large Weekly Pill Organizer, Pill Box 7 Day, KAPENS Daily Vitamin Case Large Capacity Compartments, Pill Containers for Fish Oil Medicine Supplements (Red)","$7.62","$2.37 (24%)","24","https://www.amazon.ca/dp/B09PG5MCY7?tag=lesdealsduw02-20&linkCode=osi&th=1&psc=1","https://m.media-amazon.com/images/I/419gmgo5ghL._SL500_.jpg","2"
"polymer clay","Arts & Crafts","Yoimisk Polymer Clay Kits, 52 Colors Oven Bake Modeling Clay, Safe & Non-Toxic, Ideal Gift for Kids and Adults","$24.39","$7.60 (24%)","24","https://www.amazon.ca/dp/B0BW6W5BND?tag=lesdealsduw02-20&linkCode=osi&th=1&psc=1","https://m.media-amazon.com/images/I/518TjcF0q3L._SL500_.jpg","1"
"portable ac","Home & Cleaning","Portable Air Conditioners Fan with Remote, 1500ml Water Tank, 3 Wind Speeds, 4-in-1 Portable AC with 6H Timer, 2 Cool Mist, 7 Lights, Personal Mini Air Cooler Fan for Room Bedroom Office (White)","$27.99","$9.00 (24%)","24","https://www.amazon.ca/dp/B0F1N2ZSLH?tag=lesdealsduw02-20&linkCode=osi&th=1&psc=1","https://m.media-amazon.com/images/I/413bfwJ1rXL._SL500_.jpg","1"
"power drill","Tools","21v Cordless Power Drill Combi Driver Electric Screwdriver Tools Kit,2 Variable Speed 25+1 Torque Setting,29pcs Drill/Driver Bits","$34.99 ($34.99 / Set)","$10.91 (24%)","24","https://www.amazon.ca/dp/B0BQQRGQWB?tag=lesdealsduw02-20&linkCode=osi&th=1&psc=1","https://m.media-amazon.com/images/I/41mDZG5EeTL._SL500_.jpg","1"
"puzzle games","Toys & Games","Rubik's Cube, The Original 3x3 Cube 3D Puzzle Fidget Cube Stress Relief Fidget Toy Brain Teasers Travel Games, for Adults and Kids Ages 8 and up, Packaging May Vary","$9.93","$3.06 (24%)","24","https://www.amazon.ca/dp/B09FG5L5ZX?tag=lesdealsduw02-20&linkCode=osi&th=1&psc=1","https://m.media-amazon.com/images/I/41KutkkMqOL._SL500_.jpg","2"
"racing wheel","Gaming","PC Racing Wheel, PXN V3II 180 Degree Universal Usb Car Sim Race Steering Wheel with Pedals for PS3, PS4, Xbox One, Xbox Series X/S, Switch (Black)","$105.99","$34.00 (24%)","24","https://www.amazon.ca/dp/B07XK6F14F?tag=lesdealsduw02-20&linkCode=osi&th=1&psc=1","https://m.media-amazon.com/images/I/41p6bXUxOaL._SL500_.jpg","1"
"refurbished laptop","Laptops & Tablets","Lenovo 11.6"" 300e Chromebook Touchscreen LCD 2 in 1- MediaTek M8173C Quad-core 2.1GHz 4GB LPDDR3 32GB Flash Memory Chrome OS Model 81H00000US (Renewed)","$89.90","$29.10 (24%)","24","https://www.amazon.ca/dp/B07RJZMC49?tag=lesdealsduw02-20&linkCode=osi&th=1&psc=1","https://m.media-amazon.com/images/I/41aZSudPOWL._SL500_.jpg","2"
"robot vacuum","Home & Cleaning","dreame D10 Plus Gen 2 Robot Vacuum and Mop with Self-Emptying Base for 90 Days of Cleaning, 6000 Pa Suction and LiDAR Navigation, Obstacle Avoidance, Wi-Fi Connected","$379.99","$120.00 (24%)","24","https://www.amazon.ca/dp/B0DMNC2P45?tag=lesdealsduw02-20&linkCode=osi&th=1&psc=1","https://m.media-amazon.com/images/I/315nmhK1pHL._SL500_.jpg","1"
"satin sheets","Bedroom","DECOLURE Satin Bed Sheets - 4 Piece Luxury Silky Queen Size Bedding Set - Softer Than Silk, Wrinkle-Free with 15” Deep Pocket Fitted Sheet, Perfect for Hair & Skin, Gifts for Women (Grey)","$47.99","$15.00 (24%)","24","https://www.amazon.ca/dp/B0839LQK8K?tag=lesdealsduw02-20&linkCode=osi&th=1&psc=1","https://m.media-amazon.com/images/I/51RKZGRwKNL._SL500_.jpg","1"
"saw","Tools","DEWALT 20V MAX* XR Reciprocating Saw, Compact, Tool Only (DCS367B) , Black","$197.00","$62.00 (24%)","24","https://www.amazon.ca/dp/B01M69K91R?tag=lesdealsduw02-20&linkCode=osi&th=1&psc=1","https://m.media-amazon.com/images/I/41mtEmji24L._SL500_.jpg","1"
"scrapbooking","Arts & Crafts","48 Rolls Washi Tape Set - 8mm Wide Decorative Masking Tape, Colourful Flower Style Design for DIY Craft Scrapbooking Gift Wrapping","$13.59 ($0.28 / count)","$4.40 (24%)","24","https://www.amazon.ca/dp/B076K76CBV?tag=lesdealsduw02-20&linkCode=osi&th=1&psc=1","https://m.media-amazon.com/images/I/613pnPiiqHL._SL500_.jpg","1"
"sheets","Bedroom","Extra Deep King Sheet Set - 6 Piece Breathable & Cooling Sheets - Hotel Luxury Bed Sheets Set - Easy & Secure Fit - Soft, Wrinkle Free & Comfy Sheets Set - White Sheet Set w/Extra Deep Pockets","$64.99","$20.00 (24%)","24","https://www.amazon.ca/dp/B07F91D1Z3?tag=lesdealsduw02-20&linkCode=osi&th=1&psc=1","https://m.media-amazon.com/images/I/41p9MqELeZL._SL500_.jpg","2"
"slow cooker","Kitchen","Hamilton Beach 33861 Portable Programmable Slow Cooker, Dishwasher Safe Crock, 6 Qt, FlexCook Dual Digital Timer/2 Heat Settings, Lid Lock for Easy Travel, Silver","$69.98","$22.10 (24%)","24","https://www.amazon.ca/dp/B071F9J5V2?tag=lesdealsduw02-20&linkCode=osi&th=1&psc=1","https://m.media-amazon.com/images/I/41oEZstAczL._SL500_.jpg","1"
"smart bulb","Smart Home","TP-Link Tapo Smart Wi-Fi Light Bulbs, 16M Colors RGBW, Dimmable, Compatible w/Alexa and Google Home, A19, 60W Equivalent, 800LM, 2.4GHz WiFi only, No Hub Required, Tapo L530E(2-Pack)","$18.99","$6.00 (24%)","24","https://www.amazon.ca/dp/B0B2L4YYCC?tag=lesdealsduw02-20&linkCode=osi&th=1&psc=1","https://m.media-amazon.com/images/I/51LmamFBZtL._SL500_.jpg","1"
"solar charger","Power & Chargers","ECO-WORTHY 10W Solar Car Battery Charger Maintainer 12V Waterproof Solar Panel Portable Solar Trickle Charger for Car Truck Boat Lawn Mower RV Trailer Tractor ATV Utility Vehicle Battery","$36.99","$12.00 (24%)","24","https://www.amazon.ca/dp/B017K6PH1S?tag=lesdealsduw02-20&linkCode=osi&th=1&psc=1","https://m.media-amazon.com/images/I/51cpThFB4hL._SL500_.jpg","2"
"strainer","Kitchen","Cuisinart Set of 3 Fine Mesh Stainless Steel Strainers","$23.50","$7.30 (24%)","24","https://www.amazon.ca/dp/B007TUQF9O?tag=lesdealsduw02-20&linkCode=osi&th=1&psc=1","https://m.media-amazon.com/images/I/41dtKmxDO7L._SL500_.jpg","1"
"tent","Outdoor & Camping","GEERTOP Portable 2 Person 4 Season Backpacking Tent Waterproof Lightweight Essential Survival Gear Shelter for Camping Hiking Travel Climbing - Easy Set Up","$152.99","$47.00 (24%)","24","https://www.amazon.ca/dp/B07X381HLD?tag=lesdealsduw02-20&linkCode=osi&th=1&psc=1","https://m.media-amazon.com/images/I/31BiyY6Qb7L._SL500_.jpg","2"
"thermal socks","Clothing & Accessories","Annsuki 5 Pack Mens Merino Wool Socks for Winter Warm Thermal Socks Thick Hiking Socks for Camping Cozy Socks for Man Size Fits 6-11","$18.99","$6.00 (24%)","24","https://www.amazon.ca/dp/B0C9HQT4Y8?tag=lesdealsduw02-20&linkCode=osi&th=1&psc=1","https://m.media-amazon.com/images/I/618JBLaRDdL._SL500_.jpg","2"
"thermometer","Health & Wellness","Meat Thermometers, DOQAUS Instant Read Food Thermometer for Cooking, Digital Kitchen Thermometer Probe with Backlight & Reversible Display, Wide Temperature Range for Turkey Grill BBQ Oven Candy","$12.99","$4.00 (24%)","24","https://www.amazon.ca/dp/B07WV4BFCP?tag=lesdealsduw02-20&linkCode=osi&th=1&psc=1","https://m.media-amazon.com/images/I/41jrMsPv57L._SL500_.jpg","2"
"toothbrush","Beauty & Personal Care","Philips Sonicare 4100 Power Toothbrush, Rechargeable Electric Toothbrush with Pressure Sensor, Forest Green, HX3681/28","$64.94","$20.05 (24%)","24","https://www.amazon.ca/dp/B0CJFTXBYJ?tag=lesdealsduw02-20&linkCode=osi&th=1&psc=1","https://m.media-amazon.com/images/I/41xUkM8lOGL._SL500_.jpg","1"
"toy cars","Toys & Games","JOYIN 50 Pcs Mini Pull Back Cars Set, Toy Cars for Kids 4-8, Bulk Party Favors, Treasure Box Prizes, Classroom Rewards, Pinata Stuffers, Goodie Bags Stuffers for Boys and Girls","$15.99","$5.00 (24%)","24","https://www.amazon.ca/dp/B0CQ8GCRBD?tag=lesdealsduw02-20&linkCode=osi&th=1&psc=1","https://m.media-amazon.com/images/I/61TviOEtISL._SL500_.jpg","2"
"travel locks","Travel","Puroma 2 Pack TSA Approved Luggage Lock, 4 Digit Combination Travel Locks Resettable Code Lock with Zinc Alloy Body for Suitcase, Toolbox, Backpack, Bag, Gym Locker (Black)","$12.99","$4.00 (24%)","24","https://www.amazon.ca/dp/B0D2QZSSDH?tag=lesdealsduw02-20&linkCode=osi&th=1&psc=1","https://m.media-amazon.com/images/I/4159iVXu6iL._SL500_.jpg","1"
"usb cable","Power & Chargers","Cable Matters Long USB 3.0 Cable 10ft, USB to USB Cable/USB A to USB A Cable/Male to Male USB Cord/Double USB Cord in Black","$12.99","$4.00 (24%)","24","https://www.amazon.ca/dp/B00HSS9KJY?tag=lesdealsduw02-20&linkCode=osi&th=1&psc=1","https://m.media-amazon.com/images/I/41TewsWfudL._SL500_.jpg","2"
"usb hub powered","Computers & Tech","SABRENT USB hub 3.2x1 with power adapter, 4 port usb3.2 fast Powered data hub, multiple USB splitter, USB docking station, multiport hubs, on/off Switch compatible with ps5 MacBook Laptop desktop iMac","$27.99","$9.00 (24%)","24","https://www.amazon.ca/dp/B00TPMEOYM?tag=lesdealsduw02-20&linkCode=osi&th=1&psc=1","https://m.media-amazon.com/images/I/41pxWn8d6WL._SL500_.jpg","1"
"velcro strips","Home & Cleaning","COCOBOO 4 Inch x 9 Feet Hook and Loop Tape for Couch Cushions, Strips with Adhesive, Nylon Self Adhesive Heavy Duty Strips for Home Office School Car and Crafting Organization","$12.89","$3.96 (24%)","24","https://www.amazon.ca/dp/B07R1H53M1?tag=lesdealsduw02-20&linkCode=osi&th=1&psc=1","https://m.media-amazon.com/images/I/41tRvRBNTXL._SL500_.jpg","1"
"weighted blanket","Bedroom","Wemore Sherpa Fleece Weighted Blanket for Adult, 15 lbs Dual Sided Cozy Fluffy Heavy Blanket, Ultra Fuzzy Throw Blanket with Soft Plush Flannel Top, 60 x 80 inches Grey on Both Sides","$72.84","$22.75 (24%)","24","https://www.amazon.ca/dp/B087PJZX3V?tag=lesdealsduw02-20&linkCode=osi&th=1&psc=1","https://m.media-amazon.com/images/I/51XThp+oV0L._SL500_.jpg","1"
"womens clothing","Clothing & Accessories","WNEEDU Womens Waffle Knit Long Sleeve Tunic Tops Crewneck Casual Fall Pullover Sweatshirts 2025 Side Slits Shirt Coffee M","$21.24","$6.75 (24%)","24","https://www.amazon.ca/dp/B0D8SYRQS2?tag=lesdealsduw02-20&linkCode=osi&th=1&psc=1","https://m.media-amazon.com/images/I/41maOxUZv3L._SL500_.jpg","2"
"yoga blocks","Sports & Fitness","MBKHFLL Yoga Blocks - Supportive Latex-Free Eva Foam - Soft Non-Slip Surface with Beveled Edges for Yoga, Pilates, Meditation - Yoga Accessories for Stability, Balance, Deepen Stretches (pink-1 Pack, 9""x6""x3"")","$9.90","$3.08 (24%)","24","https://www.amazon.ca/dp/B0CRMRR7KD?tag=lesdealsduw02-20&linkCode=osi&th=1&psc=1","https://m.media-amazon.com/images/I/31BfFZnlVqL._SL500_.jpg","2"
"air bed","Outdoor & Camping","INTEX 64131ED Dura-Beam Plus Deluxe Pillow Rest Air Mattress: Fiber-Tech – Twin Size – Built-in Electric Pump – 16.5in Bed Height – 300lb Weight Capacity","$68.62","$20.27 (23%)","23","https://www.amazon.ca/dp/B0869F6JYB?tag=lesdealsduw02-20&linkCode=osi&th=1&psc=1","https://m.media-amazon.com/images/I/41wVH3x8m1L._SL500_.jpg","2"
"anxiety ring","Health & Wellness","Mr. Pen- Spiky Sensory Rings, 10 Pack, Stress Relief Fidget Sensory Toys, Fidget Rings, Fidget Ring for Anxiety, Stress Relief Rings, Massager for Fidget ADHD Autism, Silent Stress Reducer Ring","$9.85","$3.00 (23%)","23","https://www.amazon.ca/dp/B08D3VSRFV?tag=lesdealsduw02-20&linkCode=osi&th=1&psc=1","https://m.media-amazon.com/images/I/51xXLjzeSvL._SL500_.jpg","1"
"apple tv","TV & Video","Google TV Streamer (4K) - Fast Streaming Entertainment With Voice Search Remote - Watch Movies, Shows, Live TV, and Netflix in 4K HDR - Smart Home Control - 32 GB Storage - Porcelain","$99.99","$30.00 (23%)","23","https://www.amazon.ca/dp/B0D514NQRG?tag=lesdealsduw02-20&linkCode=osi&th=1&psc=1","https://m.media-amazon.com/images/I/21paPZ1xs+L._SL500_.jpg","1"
"automatic pet feeder","Pet Supplies","IMIPAW Automatic Cat Feeders, 3L Timed Cat Dry Food Dispenser with Anti-Clogging Design, Dual Power Supply, Auto Pet Feeder for Cats and Dogs, 1-6 Meals Per Day, with Desiccant Bag","$39.98 ($39.98 / count)","$12.01 (23%)","23","https://www.amazon.ca/dp/B0BR5VST5N?tag=lesdealsduw02-20&linkCode=osi&th=1&psc=1","https://m.media-amazon.com/images/I/31smh+Fyk0L._SL500_.jpg","1"
"baby gate","Baby","Regalo Home Accents Extra Wide Walk Thru Baby Gate, Includes Décor Hardwood, 4-Inch Extension Kit, 4-Inch Extension Kit, 4 Pack of Pressure Mount Kit and 4 Pack of Wall Cups and Mounting Ki","$42.48","$12.49 (23%)","23","https://www.amazon.ca/dp/B00VQZ2MIG?tag=lesdealsduw02-20&linkCode=osi&th=1&psc=1","https://m.media-amazon.com/images/I/41fjl4h5eLL._SL500_.jpg","1"
"baby gate","Baby","Munchkin Easy Close Pressure Mounted Baby Gate for Stairs, Hallways and Doors, Walk Through with Door, Metal, White, 35x29.5 Inch (Pack of 1)","$61.68","$18.29 (23%)","23","https://www.amazon.ca/dp/B00DCR5EKE?tag=lesdealsduw02-20&linkCode=osi&th=1&psc=1","https://m.media-amazon.com/images/I/41v4lBBEfWL._SL500_.jpg","2"
"balance bike","Kids & Education","KRIDDO Toddler Balance Bike 2 Year Old, Age 24 Months to 5 Years Old, 12 Inch Push Bicycle with Customize Plate (3 Sets of Stickers Included), Steady Balancing, Gift Bike for 2-3 Boys Girls, White","$99.99","$30.00 (23%)","23","https://www.amazon.ca/dp/B09Z65PBXP?tag=lesdealsduw02-20&linkCode=osi&th=1&psc=1","https://m.media-amazon.com/images/I/410RNXOpVYL._SL500_.jpg","1"
"beach blanket","Outdoor & Camping","OCOOPA Beach Blanket Sand Free, Super Large 7.2'×6.8', Sandproof Waterproof, Soft Comfortable Sturdy Material, Wide Stripe Design, Light Weight Compact for Picnic, Vacations","$22.99","$7.00 (23%)","23","https://www.amazon.ca/dp/B09PBDNWS5?tag=lesdealsduw02-20&linkCode=osi&th=1&psc=1","https://m.media-amazon.com/images/I/41VbmW2YfeL._SL500_.jpg","1"
"belt","Clothing & Accessories","Mile High Life | Nylon Web Belt | Outdoor Military Belt | Cut to Fit up to 52” | 1.5” Width | TSA Safe Buckle Plastic/Metal (Black, 142CM)","$8.88","$2.60 (23%)","23","https://www.amazon.ca/dp/B082194KLG?tag=lesdealsduw02-20&linkCode=osi&th=1&psc=1","https://m.media-amazon.com/images/I/41PN6megUML._SL500_.jpg","1"
"blender","Kitchen","KitchenAid® Pure Power Blender KSB2072ER - Empire Red","$99.99","$30.00 (23%)","23","https://www.amazon.ca/dp/B09R4P8SSP?tag=lesdealsduw02-20&linkCode=osi&th=1&psc=1","https://m.media-amazon.com/images/I/31isypdYOXL._SL500_.jpg","1"
"cable management","Computers & Tech","Yecaye 8 Pack Cable Concealer, 125 in Large Size TV Cable Cord Hider, Cable Management for Wires on Wall, Paintable Cable Cord Organizer for Home Office, 8X L15.7 X W1.18 X H0.6 in","$26.99","$8.00 (23%)","23","https://www.amazon.ca/dp/B07BLQPVFD?tag=lesdealsduw02-20&linkCode=osi&th=1&psc=1","https://m.media-amazon.com/images/I/41k0fe2DSiL._SL500_.jpg","1"
"car accessories","Automotive","FIXSMITH Microfiber Cleaning Cloth - Pack of 8, Size: 12 x 16 in, Multi-Functional Cleaning Towels, Highly Absorbent Cleaning Rags, Lint-Free, Streak-Free Cleaning Cloths for Car Kitchen Home Office.","$9.99","$3.00 (23%)","23","https://www.amazon.ca/dp/B083DN8KNB?tag=lesdealsduw02-20&linkCode=osi&th=1&psc=1","https://m.media-amazon.com/images/I/51TUmsinX4L._SL500_.jpg","2"
"car air freshener","Automotive","LITTLE TREES Car Air Freshener. Vent Wrap Provides Long-Lasting Scent, Slip on Vent Blade. Black Ice, 16 Air Fresheners","$20.53","$6.18 (23%)","23","https://www.amazon.ca/dp/B083FVQMWL?tag=lesdealsduw02-20&linkCode=osi&th=1&psc=1","https://m.media-amazon.com/images/I/51Fr-0TtP1L._SL500_.jpg","2"
"car seat cover","Automotive","FREESOO Black Red Car Seat Covers Full Set - Faux Nappa Leather Seat Covers for Cars, Breathable Waterproof Front Seats with Lumbar Support and Rear Seat Cover, Fit for Automotive Sedans SUVs Pickups","$169.99","$50.00 (23%)","23","https://www.amazon.ca/dp/B0DFMVNW7P?tag=lesdealsduw02-20&linkCode=osi&th=1&psc=1","https://m.media-amazon.com/images/I/51Zx5fIzL4L._SL500_.jpg","1"
"car wash soap","Automotive","Meguiar's Gold Class Car Wash Shampoo & Conditioner, 1.89L - G7164C","$13.48","$3.92 (23%)","23","https://www.amazon.ca/dp/B07SBBJT6T?tag=lesdealsduw02-20&linkCode=osi&th=1&psc=1","https://m.media-amazon.com/images/I/41oRGKPzuoL._SL500_.jpg","1"
"cleaning cloths","Home & Cleaning","HOMEXCEL Microfiber Cleaning Cloth 12 Pack, 12.5 x 12.5 inch Microfiber Towels for Cars, Ultra Absorbent Car Washing Cloth, Lint Free Streak Free Cleaning Rags for Car, Kitchen, and Window (Grey)","$9.99","$3.00 (23%)","23","https://www.amazon.ca/dp/B0CYT2JKRP?tag=lesdealsduw02-20&linkCode=osi&th=1&psc=1","https://m.media-amazon.com/images/I/512VXXSbmVL._SL500_.jpg","1"
"coffee maker","Kitchen","Kenmore Drip Coffee Maker - 12 Cup Programmable Cafe Machine With Glass Pot, Regular & Bold Brew, Auto Shut Off Large Water Reservoir, Reusable Filter, Kitchen Appliances For Cafeteria Barista","$68.99","$21.00 (23%)","23","https://www.amazon.ca/dp/B08YRRJT2N?tag=lesdealsduw02-20&linkCode=osi&th=1&psc=1","https://m.media-amazon.com/images/I/41KR5q0TLkL._SL500_.jpg","2"
"command hooks","Home & Cleaning","Command Medium Decorative Wall Hooks, Damage Free Hanging Wall Hooks with Adhesive Strips, No Tools Wall Hooks for Hanging Decorations in Living Spaces, 2 Black Hooks and 4 Command Strips","$13.78 ($6.89 / Hook)","$4.18 (23%)","23","https://www.amazon.ca/dp/B07N2BC377?tag=lesdealsduw02-20&linkCode=osi&th=1&psc=1","https://m.media-amazon.com/images/I/41QiwNiFIFL._SL500_.jpg","2"
"cooler","Outdoor & Camping","Iknoe Large Cooler Bag Collapsible 24 Can Insulated Bags Leakproof Lunch Cooler Tote with Multi-Pockets for Adult Insulated Lunch Box for Beach, Picnic, Work…","$22.99","$7.00 (23%)","23","https://www.amazon.ca/dp/B091GBR4Z9?tag=lesdealsduw02-20&linkCode=osi&th=1&psc=1","https://m.media-amazon.com/images/I/41KvKt4u9dL._SL500_.jpg","2"
"cooling pillowcase","Bedroom","ArthCrafted 100% Austrian Eucalyptus Tencel Cooling Pillowcases, 2 Pack Moisture Wicking, Temperature Regulating, Soft & Smooth, Envelope Enclosure Pillowcase Pair (Sea Green, Queen (21"" X 31""))","$19.99","$6.00 (23%)","23","https://www.amazon.ca/dp/B0DCV46W1R?tag=lesdealsduw02-20&linkCode=osi&th=1&psc=1","https://m.media-amazon.com/images/I/31SUme3bK+L._SL500_.jpg","2"
"cordless drill","Tools","BLACK+DECKER 12V MAX Cordless Drill/Driver (BDCDD12C)","$52.98","$16.00 (23%)","23","https://www.amazon.ca/dp/B0111N8L7I?tag=lesdealsduw02-20&linkCode=osi&th=1&psc=1","https://m.media-amazon.com/images/I/41PTdwOUkGL._SL500_.jpg","2"
"dehumidifier","Home & Cleaning","Midea 4,500 Sq. Ft. WiFi Enabled Dehumidifier With Reusable Air Filter 50 Pint 2019 DOE (Previously 70 Pint), Ideal For Basements, Large & Medium Sized Rooms, Bathrooms (White)","$253.69","$76.30 (23%)","23","https://www.amazon.ca/dp/B07NRBDMJR?tag=lesdealsduw02-20&linkCode=osi&th=1&psc=1","https://m.media-amazon.com/images/I/31hkhJ9hsQL._SL500_.jpg","1"
"dish soap","Kitchen","Dawn Platinum Dish Soap Refill, Dishwashing Liquid, Refreshing Rain Scent, 2.21 L","$9.97 ($0.45 / 100 ml)","$3.02 (23%)","23","https://www.amazon.ca/dp/B09SNT1NND?tag=lesdealsduw02-20&linkCode=osi&th=1&psc=1","https://m.media-amazon.com/images/I/41tzrE8n6yL._SL500_.jpg","1"
"door lock","Security","TEEHO TE002 Fingerprint Door Lock, Smart Keyless Entry Electronic Keypad Deadbolt for Front Door - Auto Lock - Easy Installation - Stain Nickel","$99.99 ($3.55 / oz)","$30.00 (23%)","23","https://www.amazon.ca/dp/B09T6929J6?tag=lesdealsduw02-20&linkCode=osi&th=1&psc=1","https://m.media-amazon.com/images/I/41riwTkMjSL._SL500_.jpg","1"
"educational toys","Kids & Education","HahaGift Educational Toys for 3-5 Year Old Boy Girl Gifts, Matching Letter Learning Games Activities, Ideal Christmas Birthday Gift for Toddler Kids Age 3 4 5 6 7 Year Olds Boys Girls","$23.99","$7.00 (23%)","23","https://www.amazon.ca/dp/B08HTZDNPV?tag=lesdealsduw02-20&linkCode=osi&th=1&psc=1","https://m.media-amazon.com/images/I/51IupBqK7sL._SL500_.jpg","1"
"ergonomic chair","Office","Office Chair, SPRDENG Ergonomic Office Chair with Two-Way Adjustable Lumbar Support & Headrest, High Back S-Shaped Computer Chair with Flip-up Padded Armrests, Swivel Task Chair for Home Office","$199.99","$60.00 (23%)","23","https://www.amazon.ca/dp/B0F5N6VV8L?tag=lesdealsduw02-20&linkCode=osi&th=1&psc=1","https://m.media-amazon.com/images/I/519uUMicbXL._SL500_.jpg","2"
"face wash","Beauty & Personal Care","NIVEA MEN Protect & Care Refreshing Face Wash, Men’s Face Cleanser with Pro-Vitamin B5 & Aloe Vera, Moisturizing Men's Face Wash, No Drying Alcohol, Dermatologically-Tested Skin Care, 150mL","$8.47 ($5.65 / 100 ml)","$2.52 (23%)","23","https://www.amazon.ca/dp/B005OKYNW2?tag=lesdealsduw02-20&linkCode=osi&th=1&psc=1","https://m.media-amazon.com/images/I/41C7lmn2UNL._SL500_.jpg","1"
"fidget toys","Toys & Games","Fidget Toys Adults Sensory Stone Toys: 6 Pack Textured Worry Stone for Autism Kids Calming Down - Fidget Stress Toys for Anxiety Relief - Small Students Prizes Fidget Toys","$9.99","$3.00 (23%)","23","https://www.amazon.ca/dp/B0DXLD2FJT?tag=lesdealsduw02-20&linkCode=osi&th=1&psc=1","https://m.media-amazon.com/images/I/511qkJw4ETL._SL500_.jpg","1"
"fitness equipment","Sports & Fitness","Houselog Resistance Bands Sets Portable Exercise Loops for Legs and Hip 3 Resistance Level Workout Weight Bands with Non-Slip Design Workout Flexbands for Home Gym Office Yoga Pilates (Green Blue)","$19.98","$6.01 (23%)","23","https://www.amazon.ca/dp/B0BZP3QJYF?tag=lesdealsduw02-20&linkCode=osi&th=1&psc=1","https://m.media-amazon.com/images/I/517m3KdmbsL._SL500_.jpg","2"
"fitness tracker","Wearables","Google Fitbit Inspire 3 Health and Fitness Tracker with Stress Management, Workout Intensity, Sleep Tracking, 24/7 Heart Rate and More, Midnight Zen/black, One Size (S and L Bands Included)","$99.95","$30.00 (23%)","23","https://www.amazon.ca/dp/B0B75RC9C3?tag=lesdealsduw02-20&linkCode=osi&th=1&psc=1","https://m.media-amazon.com/images/I/31aV3JbnURL._SL500_.jpg","1"
"fitness tracker","Wearables","Google Fitbit Versa 4 Fitness Smart Watch for Men and Women with Daily Readiness, Gps, 24/7 Heart Rate, 40+ Exercise Modes, Sleep Tracking and More, Black/graphite, One Size (S and L Bands Included","$199.95","$60.00 (23%)","23","https://www.amazon.ca/dp/B0B75TVZZZ?tag=lesdealsduw02-20&linkCode=osi&th=1&psc=1","https://m.media-amazon.com/images/I/31no9Y6TZdL._SL500_.jpg","2"
"flour","Food","La Molisana Durum Wheat Semolina Flour for Pizza, 1 Kilogram","$4.99 ($0.50 / 100 g)","$1.50 (23%)","23","https://www.amazon.ca/dp/B07NMZS2ZP?tag=lesdealsduw02-20&linkCode=osi&th=1&psc=1","https://m.media-amazon.com/images/I/41BSHW+VMkL._SL500_.jpg","2"
