"keyword","category","title","price","savings","percent","link","imageUrl","page"
"apple watch","Wearables","Smart Watches for Men Women, with Bluetooth Calling, 1.85"" Screen DIY Dial Smartwatch for Android iPhone. 100+ Sports Modes, Heart Rate Sleep Monitor, AI Built-in Fitness Tracker, IP68 Waterproof","$49.99","$350.00 (88%)","88","https://www.amazon.ca/dp/B0FKT7HN1T?tag=lesdealsduw02-20&linkCode=osi&th=1&psc=1","https://m.media-amazon.com/images/I/413yXf9W91L._SL500_.jpg","2"
"air pods","Audio & Music","Wireless Earbuds, 2025 New Bluetooth 5.4 Headphones HiFi Stereo with 4 ENC Mic, 40H Mini Ear Buds In-Ear Noise Cancelling Earbuds with LED Screen, Ultra Light USB-C Bluetooth Earphones for Android iOS","$29.99","$170.00 (85%)","85","https://www.amazon.ca/dp/B0F7H4GG2F?tag=lesdealsduw02-20&linkCode=osi&th=1&psc=1","https://m.media-amazon.com/images/I/411PwMRnQCL._SL500_.jpg","2"
"earbuds","Audio & Music","Wireless Earbuds, Bluetooth 5.4 Headphones with Multifunctional Touch Screen, 48H Bass Stereo Ear Buds with ANC/ENC Noise Cancelling/Transparency Mode, IPX7 Earphones with 5 EQ Modes for iOS Android","$29.99","$170.00 (85%)","85","https://www.amazon.ca/dp/B0FD2XSPYL?tag=lesdealsduw02-20&linkCode=osi&th=1&psc=1","https://m.media-amazon.com/images/I/41uvMWDH7iL._SL500_.jpg","2"
"car dashcam","Automotive","3 Channel Dash Cam,4K+1080P Dash Cam Front and Rear Inside, Dash Camera for Cars, Triple Car Camera with 32GB Card,Built-in G-Sensor, 2’’ IPS Display Car Camera,24Hr Parking,Loop Recording","$65.99","$334.00 (84%)","84","https://www.amazon.ca/dp/B0FJRK8BSS?tag=lesdealsduw02-20&linkCode=osi&th=1&psc=1","https://m.media-amazon.com/images/I/41MQU0KjJJL._SL500_.jpg","1"
"toothbrush","Beauty & Personal Care","Colgate Extra Clean Toothbrush, Medium, 1 Count","$1.46","$7.42 (84%)","84","https://www.amazon.ca/dp/B00FGOPUCS?tag=lesdealsduw02-20&linkCode=osi&th=1&psc=1","https://m.media-amazon.com/images/I/31jSkOhPclL._SL500_.jpg","1"
"apple watch","Wearables","Smart Watch for Men Women Bluetooth Call, 1.85"" HD Touch Screen AI Voice Smartwatch, Fitness Tracker with Sleep/Heart Rate Monitor, 100+ Sports Modes, IP68 Waterproof, Compatible with Android & iOS","$49.99","$250.00 (83%)","83","https://www.amazon.ca/dp/B0F2SVV5JM?tag=lesdealsduw02-20&linkCode=osi&th=1&psc=1","https://m.media-amazon.com/images/I/41x4Inf1LFL._SL500_.jpg","2"
"apple watch","Wearables","Smart Watch for Men Women, Bluetooth Call Smartwatch with AI Voice, 1.85"" HD DIY Dial Fitness Watch, Heart Rate/SpO2/Steps/Sleep Monitor, 100+ Sports Modes, IP68 Waterproof Watch for Android iOS","$49.99","$250.00 (83%)","83","https://www.amazon.ca/dp/B0F1F587M1?tag=lesdealsduw02-20&linkCode=osi&th=1&psc=1","https://m.media-amazon.com/images/I/51Rdx8VBhpL._SL500_.jpg","2"
"fitness tracker","Wearables","Smart Watch for Men Women with Bluetooth Call 1.91"" HD Touch Screen Fitness Watch with 24H Sleep/Heart Rate Monitor, 120+ Sports Modes Fitness Tracker Smartwatch with IP68 Waterproof for Android iOS","$26.98","$133.01 (83%)","83","https://www.amazon.ca/dp/B0FJ27J46L?tag=lesdealsduw02-20&linkCode=osi&th=1&psc=1","https://m.media-amazon.com/images/I/51KgcKRFr1L._SL500_.jpg","2"
"power bank","Power & Chargers","Power-Bank-Solar-Charger - 42800mAh Power Bank,Portable Charger,External Battery Pack 5V3.1A Qc 3.0 Fast Charging Built-in Super Bright Flashlight (Orange)","$49.99","$250.00 (83%)","83","https://www.amazon.ca/dp/B0CCJ5JZGD?tag=lesdealsduw02-20&linkCode=osi&th=1&psc=1","https://m.media-amazon.com/images/I/411AdD6NPGL._SL500_.jpg","1"
"solar charger","Power & Chargers","Power-Bank-Solar-Charger - 42800mAh Power Bank,Portable Charger,External Battery Pack 5V3.1A Qc 3.0 Fast Charging Built-in Super Bright Flashlight (Black)","$49.99","$250.00 (83%)","83","https://www.amazon.ca/dp/B0CCJ2K5N5?tag=lesdealsduw02-20&linkCode=osi&th=1&psc=1","https://m.media-amazon.com/images/I/41FTfbzC-PL._SL500_.jpg","1"
"fitness tracker","Wearables","Fitness Tracker Smart Watch for Men Women, 1.47"" HD with Bluetooth, 24/7 Heart Rate & Blood Oxygen Monitor, Sleep & Step Counter, 100+ Sports Modes, IP68 Waterproof, Compatible with Android iOS","$49.99","$210.00 (81%)","81","https://www.amazon.ca/dp/B0FNCVJ6ZH?tag=lesdealsduw02-20&linkCode=osi&th=1&psc=1","https://m.media-amazon.com/images/I/41wztqo9C+L._SL500_.jpg","2"
"portable charger","Power & Chargers","Power Bank, Portable Charger 10000mAh with PD 15w Fast Charging, 4 Outputs 3 Inputs with Built in TypeC, USBA Battery Pack, Compatible with iPhone 16 15 14 Pro Samsung S22 S21 Android Cell Phone etc","$24.98","$105.01 (81%)","81","https://www.amazon.ca/dp/B0DJVSR429?tag=lesdealsduw02-20&linkCode=osi&th=1&psc=1","https://m.media-amazon.com/images/I/41-WWrXWrXL._SL500_.jpg","1"
"apple watch","Wearables","Smart Watch for Men Women, Bluetooth Calling, 1.83"" HD Touch Screen Fitness Tracker, 100+ Sports Modes,Heart Rate Sleep Monitor， DIY Dial, IP68 Waterproof, Compatible with Android & iOS","$49.99","$200.00 (80%)","80","https://www.amazon.ca/dp/B0F43L98X4?tag=lesdealsduw02-20&linkCode=osi&th=1&psc=1","https://m.media-amazon.com/images/I/414tx8mCAxL._SL500_.jpg","1"
"bluetooth headphones","Audio & Music","Wireless Earbuds, 50H Bluetooth 5.4 Headphones Sport, Bluetooth Earbuds with ENC Noise Canceling, HiFi Stereo Sound Wireless Earphones with Earhooks, IP7 Waterproof Ear Buds for Sports/Workout/Running","$31.99","$128.00 (80%)","80","https://www.amazon.ca/dp/B0D5VJLJGS?tag=lesdealsduw02-20&linkCode=osi&th=1&psc=1","https://m.media-amazon.com/images/I/51EvFnqPj7L._SL500_.jpg","2"
"bluetooth speaker","Audio & Music","Portable Bluetooth Speaker, IPX6 Waterproof, 20W HiFi Stereo Sound with Deep Bass, 12H Playtime, BT 5.2 Wireless, 7 Color Lights, for Smartphone/Tablet/PC, Home/Outdoor/Party (Black)","$39.99","$160.00 (80%)","80","https://www.amazon.ca/dp/B0FGNP8VJR?tag=lesdealsduw02-20&linkCode=osi&th=1&psc=1","https://m.media-amazon.com/images/I/41Rwwcp+sLL._SL500_.jpg","1"
"bluetooth speaker","Audio & Music","Oraolo Portable Bluetooth Speaker, Wireless Speaker with 24W Loud Stereo Sound, RGB Lights, TWS Pairing, Bluetooth 5.4, Support AUX/TF Card, IPX6 Waterproof Outdoor Speaker for Party Camping Home","$39.98","$160.01 (80%)","80","https://www.amazon.ca/dp/B0F1Y31WFB?tag=lesdealsduw02-20&linkCode=osi&th=1&psc=1","https://m.media-amazon.com/images/I/51fyvyafCpL._SL500_.jpg","2"
"car dashcam","Automotive","Dash Camera for Cars, 4K+1080P Dash Cam Front and Rear with 5G WiFi, Built-in 32GB Card, Night Vision, G-Sensor, Loop Recording, 24H Parking Mode","$79.99","$320.00 (80%)","80","https://www.amazon.ca/dp/B0F9YNRNWM?tag=lesdealsduw02-20&linkCode=osi&th=1&psc=1","https://m.media-amazon.com/images/I/41K4NAN+esL._SL500_.jpg","1"
"cervical pillow","Bedroom","Fyova Cervical Neck Pillow, Ergonomic Memory Foam Pillows for Neck Pain Relief with Breathable Pillowcase, Adjustable Contour Neck Support Pillow for Side Back Stomach Sleepers, Odorless","$59.98","$240.01 (80%)","80","https://www.amazon.ca/dp/B0FGV3N9S1?tag=lesdealsduw02-20&linkCode=osi&th=1&psc=1","https://m.media-amazon.com/images/I/41UgtTg-DxL._SL500_.jpg","1"
"portable charger","Power & Chargers","Power-Bank-Portable-Charger - 40000mAh Power Bank Support PD 30W and QC4.0 Fast Charging wiht Built-in 2 Output Cable and LED Display for iPhone and Android Phones and Most Electronic Devices","$39.99","$160.00 (80%)","80","https://www.amazon.ca/dp/B0D9VTNTGL?tag=lesdealsduw02-20&linkCode=osi&th=1&psc=1","https://m.media-amazon.com/images/I/41p4mhaIlhL._SL500_.jpg","2"
"smartwatch","Wearables","Smart Watch for Men Women, Bluetooth Calling, 1.83"" HD Touch Screen Fitness Tracker, 100+ Sports Modes, Heart Rate Sleep Monitor, DIY Dial, IP68 Waterproof, Compatible with Android & iOS","$49.99","$200.00 (80%)","80","https://www.amazon.ca/dp/B0F4839SDF?tag=lesdealsduw02-20&linkCode=osi&th=1&psc=1","https://m.media-amazon.com/images/I/41RHpB37efL._SL500_.jpg","1"
"treadmill","Sports & Fitness","Sperax 4 in 1 Walking Vibration Pad Treadmill, Walking Treadmill Pad for Home with Remote Control and APP","$199.99","$800.00 (80%)","80","https://www.amazon.ca/dp/B0DP4Q5PSJ?tag=lesdealsduw02-20&linkCode=osi&th=1&psc=1","https://m.media-amazon.com/images/I/41LAsN7zkCL._SL500_.jpg","1"
"warehouse deal","General","Wireless Earbuds, 50H Bluetooth 5.4 Headphones Sport, Bluetooth Earbuds with ENC Noise Canceling, HiFi Stereo Sound Wireless Earphones with Earhooks, IP7 Waterproof Ear Buds, Rose","$31.99","$128.00 (80%)","80","https://www.amazon.ca/dp/B0DD6B5G7H?tag=lesdealsduw02-20&linkCode=osi&th=1&psc=1","https://m.media-amazon.com/images/I/41u5Q6pkEhL._SL500_.jpg","1"
"air pods","Audio & Music","Wireless Earbuds, Bluetooth Headphones 5.4 HiFi Stereo, Wireless Earphones with ENC Noise Cancelling Mic, IP7 Waterproof in Ear Headphones, LED Digital Display Ear Buds, Touch Control, White","$31.99","$118.00 (79%)","79","https://www.amazon.ca/dp/B0DGQ8LLBK?tag=lesdealsduw02-20&linkCode=osi&th=1&psc=1","https://m.media-amazon.com/images/I/41dSwomehtL._SL500_.jpg","1"
"air pods","Audio & Music","Monster N-Lite 203 AirLinks Wireless Earbuds, Bluetooth 5.3 Headphones HiFi Stereo, Wireless Earphones with Type-C,30H Playback Charging,HD Clear Call, IPX6 Waterproof Touch Control, in-Ear Earbuds.","$29.99","$115.71 (79%)","79","https://www.amazon.ca/dp/B0FMFBBKXW?tag=lesdealsduw02-20&linkCode=osi&th=1&psc=1","https://m.media-amazon.com/images/I/310Ujqnx+1L._SL500_.jpg","2"
"air purifier","Home & Cleaning","MORENTO Air Purifiers for Bedroom Home Large Room up to 1076 Sq Ft PM 2.5 Display Air Quality Sensor True HEPA Air Filter Remove the Pet Hair with Double-sided Air Inlet, 24db, White, 1 Pack","$119.99","$456.00 (79%)","79","https://www.amazon.ca/dp/B0C1MPDTG7?tag=lesdealsduw02-20&linkCode=osi&th=1&psc=1","https://m.media-amazon.com/images/I/51OIn3EPbQL._SL500_.jpg","2"
"bluetooth headphones","Audio & Music","Monster N-Lite 208 Wireless Earbuds, Bluetooth Earbuds Touch Control, Bluetooth Headphones with 30H Playtime, Wireless Headphones Type-C Charging, Clear Call for Running, White","$29.99","$110.00 (79%)","79","https://www.amazon.ca/dp/B0DQ8DR3XG?tag=lesdealsduw02-20&linkCode=osi&th=1&psc=1","https://m.media-amazon.com/images/I/31pRrriBFxL._SL500_.jpg","2"
"dehumidifier","Home & Cleaning","CHIVALZ 1800 Sq.Ft. Dehumidifiers for Basements, Bedroom, Bathroom and Home Use, 70 OZ Water Tank Dehumidifier with drain hose, 0-24H Timer, 3 Modes, Humidity Display & Auto Defrost (White)","$189.99","$710.00 (79%)","79","https://www.amazon.ca/dp/B0F3HWS4NP?tag=lesdealsduw02-20&linkCode=osi&th=1&psc=1","https://m.media-amazon.com/images/I/21RUpTz4i+L._SL500_.jpg","2"
"earbuds","Audio & Music","Wireless Earbuds, 2025 Bluetooth 5.3 Headphones HiFi Stereo Ear Bud, 40Hrs Playtime Bluetooth Earbuds with 4 ENC Noise Cancelling Mics, IP7 Waterproof, LED Display Wireless Earphones for Android/iOS","$20.69","$79.30 (79%)","79","https://www.amazon.ca/dp/B0CZ3MXPSV?tag=lesdealsduw02-20&linkCode=osi&th=1&psc=1","https://m.media-amazon.com/images/I/41emx6PoBAL._SL500_.jpg","2"
"travel charger","Travel","RTOPS 3 in 1 Wireless Charger for iPhone,W312 Fodable Charging Stations for Multiple Apple Devices, Fast Travel Charging Stand for iWatch, Airpod and iPhone 15 14 13 12 (Adapter Included)","$29.98","$110.01 (79%)","79","https://www.amazon.ca/dp/B0DYDK2RL5?tag=lesdealsduw02-20&linkCode=osi&th=1&psc=1","https://m.media-amazon.com/images/I/41HEFbiqYhL._SL500_.jpg","2"
"cutting board","Kitchen","Stainless Steel Cutting Board Double Sided 304 Steel & Food-Grade PPLarge Chopping Board for Meat and Kitchen, Non-Slip 16""x11"" White","$44.98","$155.01 (78%)","78","https://www.amazon.ca/dp/B0F5Q88GYF?tag=lesdealsduw02-20&linkCode=osi&th=1&psc=1","https://m.media-amazon.com/images/I/41GRmKgwUDL._SL500_.jpg","2"
"standing desk","Office","Small Standing Desk Adjustable Height 32 Inch Mobile Sit Stand up Desk Portable Rolling with Wheels Standing for Walking pad Treadmill Rustic","$89.99","$310.00 (78%)","78","https://www.amazon.ca/dp/B0DZ5PBCLW?tag=lesdealsduw02-20&linkCode=osi&th=1&psc=1","https://m.media-amazon.com/images/I/31tYyVGCHaL._SL500_.jpg","2"
"air purifier","Home & Cleaning","MORENTO Air Purifier for Home Large Room Bedroom Up to 1076 ft², Wi-Fi and Alexa Control, PM2.5 Air Quality Monitor, Auto Mode, HEPA Filter Removes Dust, Pollen, Smoke 1 Pack, White","$139.99","$482.01 (77%)","77","https://www.amazon.ca/dp/B0CMTMJ5TV?tag=lesdealsduw02-20&linkCode=osi&th=1&psc=1","https://m.media-amazon.com/images/I/51bzdBhk4ML._SL500_.jpg","1"
"humidifier","Home & Cleaning","MERONTE Smart Humidifiers for Bedroom Large Room Home, 6L Cool Mist Top Fill Humidifier with Essential Oil Diffuser, Smart App & Voice Control, for Nursery & Plants, White, 1 Pack + 7 Color NightLight","$69.99","$230.00 (77%)","77","https://www.amazon.ca/dp/B0FHCSF2NT?tag=lesdealsduw02-20&linkCode=osi&th=1&psc=1","https://m.media-amazon.com/images/I/41RpXJLZogL._SL500_.jpg","1"
"portable charger","Power & Chargers","Portable Charger for iPhone 15, [5000mAh] USB-C Power Bank with 20W PD Fast Charging, Mini Portable Battery Phone Charger for iPhone 16/15/15 plus/15 pro/15 pro Max/Android/Samsung/Moto/LG,White","$19.99","$66.00 (77%)","77","https://www.amazon.ca/dp/B0DHGDK5SH?tag=lesdealsduw02-20&linkCode=osi&th=1&psc=1","https://m.media-amazon.com/images/I/31oB+4X2EOL._SL500_.jpg","2"
"smartwatch","Wearables","Smart Watch for Men Women with Bluetooth Call,Alexa Built-in Smartwatch,1.83"" DIY Dial Fitness Watch with Sleep Heart Rate SpO2 Monitor,100+ Sport Mode,IP68 Waterproof Watch Compatible with Android","$29.99","$100.00 (77%)","77","https://www.amazon.ca/dp/B0DC6NQTJ9?tag=lesdealsduw02-20&linkCode=osi&th=1&psc=1","https://m.media-amazon.com/images/I/41d5LOo7jxL._SL500_.jpg","2"
"smartwatch","Wearables","Smart Watch for Men Women, 1.27"" HD Touchscreen Fitness Tracker, Bluetooth Calling, 100+ Sports Modes, Heart Rate Sleep Monitor, DIY Dial, IP68 Waterproof, Compatible with Android & iOS","$90.99","$309.00 (77%)","77","https://www.amazon.ca/dp/B0F4WX8RL7?tag=lesdealsduw02-20&linkCode=osi&th=1&psc=1","https://m.media-amazon.com/images/I/41iwn176COL._SL500_.jpg","2"
"air pods","Audio & Music","Monster Clarity 102 Plus Wireless Earbuds, Bluetooth Headphones with HiFi Stereo, 4 ENC Mic for Crystal Clear Call, 30H Playtime, Type-C Charging, IPX6 Waterproof in-Ear Ear Buds Earphones for Sports","$35.97","$114.02 (76%)","76","https://www.amazon.ca/dp/B0F8VF57QC?tag=lesdealsduw02-20&linkCode=osi&th=1&psc=1","https://m.media-amazon.com/images/I/31N7fLu93JL._SL500_.jpg","2"
"bluetooth headphones","Audio & Music","Monster Mission 100 Bluetooth Headphones, On Ear Headphones with Immersive Bass, Crystal Clear Call, 40H Playtime, Bluetooth 5.4, Comfortable Fit Wireless Headset for Travel Work","$45.98","$144.01 (76%)","76","https://www.amazon.ca/dp/B0FLCP6QPB?tag=lesdealsduw02-20&linkCode=osi&th=1&psc=1","https://m.media-amazon.com/images/I/41EFYskpzEL._SL500_.jpg","1"
"echo dot","Smart Home","Monster Cube 1 Portable Bluetooth Speaker, IPX7 Waterproof, Bluetooth 6.0, 20H Playtime, Powerful Stereo Sound, Speaker for Home, Outdoors and Travel","$39.99","$130.00 (76%)","76","https://www.amazon.ca/dp/B0F1XSJKCJ?tag=lesdealsduw02-20&linkCode=osi&th=1&psc=1","https://m.media-amazon.com/images/I/518K-M0VyKL._SL500_.jpg","2"
"bluetooth speaker","Audio & Music","Monster S310 Bluetooth Speaker, Portable Bluetooth Speaker, 30W True Wireless Stereo Pairing Deliver Dynamic Sound, IPX5 Waterproof, Bluetooth 5.2 Built-in Mic, 24H, for Family Outdoor Black","$49.99","$150.00 (75%)","75","https://www.amazon.ca/dp/B0FCSGZZ6H?tag=lesdealsduw02-20&linkCode=osi&th=1&psc=1","https://m.media-amazon.com/images/I/516Y0ObQa8L._SL500_.jpg","2"
"cutting board","Kitchen","Titanium Cutting Board for Kitchen, Cutting Board Double Sided Food Grade, Pure Titanium and Wheat Straw PP, Easy to Clean Large Size 16”×10”","$49.99","$150.00 (75%)","75","https://www.amazon.ca/dp/B0F484HDD2?tag=lesdealsduw02-20&linkCode=osi&th=1&psc=1","https://m.media-amazon.com/images/I/41HPxcjXPBL._SL500_.jpg","1"
"earplugs","Bedroom","Ear Plugs for Sleeping Noise Cancelling -45dB, Soft and Reusable Silicone Hearing Protection Earplugs with 8 Eartips and Carrying Case, for Sleeping, Concert, Working, Studying, Traveling (Black)","$19.99 ($20.19 / count)","$60.00 (75%)","75","https://www.amazon.ca/dp/B0FH48TKRK?tag=lesdealsduw02-20&linkCode=osi&th=1&psc=1","https://m.media-amazon.com/images/I/417iw1jckyL._SL500_.jpg","1"
"exercise equipment","Sports & Fitness","Sperax Vibration Plate Exercise Machine,Vibration Plate,Exercise Equipment,Full Body Workout Vibration Platform for Home & Office","$99.99","$300.00 (75%)","75","https://www.amazon.ca/dp/B0DZGWN4MV?tag=lesdealsduw02-20&linkCode=osi&th=1&psc=1","https://m.media-amazon.com/images/I/418oafN47DL._SL500_.jpg","2"
"night vision camera","Security","Spy Camera, Hidden Camera 4K Ultra HD with 4H Battery Life, SD Card & Cloud Storage, Motion Detection Alarm, Real-Time App Alerts, 2.4G WiFi & Night Vision for Home/Office Security","$39.99","$120.00 (75%)","75","https://www.amazon.ca/dp/B0FLY2B171?tag=lesdealsduw02-20&linkCode=osi&th=1&psc=1","https://m.media-amazon.com/images/I/41tvuSdujAL._SL500_.jpg","2"
"solar charger","Power & Chargers","Solar Charger Power Bank - 38800mAh with Dual 5V3.1A Outputs 10W Qi Wireless Charger Waterproof Built-in 4 Solar Panel and Bright Flashlights (Deep Black)","$49.99","$150.00 (75%)","75","https://www.amazon.ca/dp/B0DFM2ZV5R?tag=lesdealsduw02-20&linkCode=osi&th=1&psc=1","https://m.media-amazon.com/images/I/512w7hgbUaL._SL500_.jpg","1"
"swimming","Sports & Fitness","Swimming Ear Plugs, 3 Pairs Great Waterproof Ultra Comfy Earplugs, Reusable Silicone Ear Plugs for Swimming Surfing Snorkeling and Other Water Sports (Adults & Teens 14+) (Multicolored 1, 3 Pair (Pack of 1))","$6.47","$19.52 (75%)","75","https://www.amazon.ca/dp/B09ZTRP3SH?tag=lesdealsduw02-20&linkCode=osi&th=1&psc=1","https://m.media-amazon.com/images/I/41hDEtW8tPL._SL500_.jpg","1"
"vacuum","Home & Cleaning","Cordless Vacuum Cleaner, Cordless Stick Vacuum with LED Display & Foldable Lightweight Design, 40KPa/450W/50Mins/3 Modes,Rechargeable Handle Cleaners for Home, Pet Hair, Carpet, Hard Floor(Purple)","$139.98","$430.01 (75%)","75","https://www.amazon.ca/dp/B0FKYZK6MB?tag=lesdealsduw02-20&linkCode=osi&th=1&psc=1","https://m.media-amazon.com/images/I/4188GdmubJL._SL500_.jpg","1"
"wireless earbuds","Audio & Music","Wireless Earbuds, Bluetooth Headphones 5.4 HiFi Stereo, Wireless Earphones with ENC Noise Cancelling Mic, IP7 Waterproof in Ear Headphones, LED Digital Display Ear Buds, Touch Control, Grey","$36.99","$113.00 (75%)","75","https://www.amazon.ca/dp/B0DGQFJ22F?tag=lesdealsduw02-20&linkCode=osi&th=1&psc=1","https://m.media-amazon.com/images/I/419d2Qn36ML._SL500_.jpg","1"
"air purifier","Home & Cleaning","MERONTE Air Purifiers for Home, Air Purifier for Smoke Odors with Fragrance Sponge, Small Air Purifier with Sleep Mode for Bedroom Office, Blue Night Light, White, 1 Pack+3 Modes","$69.99","$196.00 (74%)","74","https://www.amazon.ca/dp/B0FFHKQBT3?tag=lesdealsduw02-20&linkCode=osi&th=1&psc=1","https://m.media-amazon.com/images/I/41yRGvqiuhL._SL500_.jpg","2"
"bluetooth speaker","Audio & Music","Monster MFS 1 Bluetooth Speaker, Bluetooth Portable Speaker with Stereo Sound, 12H Playtime Portable Wireless Speaker Supports TF Card, AUX, USB for Indoor Outdoor","$45.99","$134.00 (74%)","74","https://www.amazon.ca/dp/B0DCBJ8MD5?tag=lesdealsduw02-20&linkCode=osi&th=1&psc=1","https://m.media-amazon.com/images/I/51TbV6h+uNL._SL500_.jpg","2"
"air purifier","Home & Cleaning","2 Pack CHIVALZ Air Purifiers for Bedroom, Air Purifiers for Home Bedroom, Quiet Air Cleaner with 24dB Sleep Mode, True HEPA Filter for Pet, White","$91.99","$255.00 (73%)","73","https://www.amazon.ca/dp/B0C9ZV8FFD?tag=lesdealsduw02-20&linkCode=osi&th=1&psc=1","https://m.media-amazon.com/images/I/51hFuIFV6PL._SL500_.jpg","2"
"jump starter","Automotive","AstroAI B8 Booster Pack Jump Starter 2000A, Car Battery Booster Jump Starter for Up to 8L Gas or 6.5L Diesel Engine, with LED Light, QC3.0 USB Output, Jumper Cable for 12V Cars and Motorcycles, Orange","$54.99","$145.00 (73%)","73","https://www.amazon.ca/dp/B0F7RJVGM6?tag=lesdealsduw02-20&linkCode=osi&th=1&psc=1","https://m.media-amazon.com/images/I/41milocRcqL._SL500_.jpg","2"
"lightning deal","General","Bkayp iPhone Charger Apple MFi Certified 3Pack 10 FT Lightning Cable Fast Charging iPhone Charger Cord Compatible with iPhone 14 13 12 11 Pro Max XR XS X 8 7 6 Plus SE iPad and More - Multi Color","$11.69","$32.30 (73%)","73","https://www.amazon.ca/dp/B0CPFLKDXM?tag=lesdealsduw02-20&linkCode=osi&th=1&psc=1","https://m.media-amazon.com/images/I/41guYtZgunL._SL500_.jpg","1"
"printer","Computers & Tech","POLONO Portable Printer, D810 Inkless Bluetooth Thermal Printer Wireless for Travel, Compatible with iOS, Android, Laptop, Supports 8.5""x11"" US Letter for Office, Car, Home, Black","$119.99","$330.00 (73%)","73","https://www.amazon.ca/dp/B0FHQ1CYZH?tag=lesdealsduw02-20&linkCode=osi&th=1&psc=1","https://m.media-amazon.com/images/I/518FP+8TraL._SL500_.jpg","2"
"vacuum","Home & Cleaning","MQDXE Cordless Stick Vacuum Cleaner: 550W Powerful Suction, LED Display, 55 Min Runtime, Anti-Tangle Brush, Rechargeable Battery, Lightweight for Home, Pet Hair, Hard Floors, Carpet","$132.98","$367.01 (73%)","73","https://www.amazon.ca/dp/B0DGPLQSYM?tag=lesdealsduw02-20&linkCode=osi&th=1&psc=1","https://m.media-amazon.com/images/I/41KPcBOkzyL._SL500_.jpg","1"
"night vision camera","Security","Security Mini Camera 1080P Wi-Fi, Indoor Camera with APP Control, Wireless Nanny Cam with Motion Detection, Clear Night Vision, Surveillance Interieur for Baby Pet","$19.99","$50.00 (71%)","71","https://www.amazon.ca/dp/B0DKNMMGMD?tag=lesdealsduw02-20&linkCode=osi&th=1&psc=1","https://m.media-amazon.com/images/I/415iZlIDgeL._SL500_.jpg","1"
"portable charger","Power & Chargers","GTOCE Portable Charger,40000mAh Power Bank with 22.5W Fast Charging LED Digital Display Battery Pack with 6 Outputs 2 Inputs, Type C Powerbank Portable Charger for iPhone Samsung AirPods etc,Black","$39.99","$100.00 (71%)","71","https://www.amazon.ca/dp/B0DHGBR9LY?tag=lesdealsduw02-20&linkCode=osi&th=1&psc=1","https://m.media-amazon.com/images/I/41oWjwgXHRL._SL500_.jpg","1"
"shower head","Home & Cleaning","High Pressure 10-Mode Handheld Shower Head - Built in Power Wash for Clean, Replaceable Filter Soften Hard Water Remove Chlorine, 60 Inches Hose, Overhead Bracket, Anti-Clog Nozzle (Chrome)","$39.99","$99.01 (71%)","71","https://www.amazon.ca/dp/B0D1P1XXKD?tag=lesdealsduw02-20&linkCode=osi&th=1&psc=1","https://m.media-amazon.com/images/I/51bRoukLc4L._SL500_.jpg","1"
"bluetooth headphones","Audio & Music","Monster Persona SE ANC Active Noise Cancelling Headphones, Bluetooth Headphones Over Ear with 60H Playtime, HiFi Stereo Audio, Deep Bass, Wireless Headphone for Home Office","$59.97","$140.02 (70%)","70","https://www.amazon.ca/dp/B0DT17MNT6?tag=lesdealsduw02-20&linkCode=osi&th=1&psc=1","https://m.media-amazon.com/images/I/41nUZeCq-JL._SL500_.jpg","2"
"bluetooth speaker","Audio & Music","Monster S280 Bluetooth Speaker, 40W Stereo Sound, Deep Bass, Bluetooth 6.0, 3D Tunnel Lights, Wireless Charger, Mirror Display, USB (Audio) / AUX/TF-Card Input, Suitable for Home Bedroom Indoor","$59.99","$140.00 (70%)","70","https://www.amazon.ca/dp/B0DX77GG16?tag=lesdealsduw02-20&linkCode=osi&th=1&psc=1","https://m.media-amazon.com/images/I/41nBi6fHwJL._SL500_.jpg","1"
"earplugs","Bedroom","Ear Plugs for Sleeping Noise Cancelling -45dB, Soft and Reusable Silicone Hearing Protection Earplugs with 8 Eartips and Carrying Case, for Sleeping, Concert, Working, Studying, Traveling (Black)","$29.99","$70.00 (70%)","70","https://www.amazon.ca/dp/B0FD9TPFSZ?tag=lesdealsduw02-20&linkCode=osi&th=1&psc=1","https://m.media-amazon.com/images/I/41XZXF4K8ZL._SL500_.jpg","2"
"golf","Sports & Fitness","Golf Rangefinder with Slope - 1200 Yards Laser Range Finder with Flag Pole Locking Vibration, 7X Magnification rangefinder with Magnet Stripe (White)","$119.99","$280.00 (70%)","70","https://www.amazon.ca/dp/B0DBQKB449?tag=lesdealsduw02-20&linkCode=osi&th=1&psc=1","https://m.media-amazon.com/images/I/41FS76SaZUL._SL500_.jpg","1"
"jump starter","Automotive","AstroAI P12 Booster Pack 6000A, Car Jump Starter Battery Booster for Up to All Gas or 12L Diesel Engine, 12V Jumper Box for Cars and Motorcycles with Jumper Cable, LED Light, 2 USB Output, Orange","$103.99","$246.00 (70%)","70","https://www.amazon.ca/dp/B0F7XY3R8J?tag=lesdealsduw02-20&linkCode=osi&th=1&psc=1","https://m.media-amazon.com/images/I/41c51lRWfhL._SL500_.jpg","2"
"noise cancelling headphones","Audio & Music","Monster Persona SE ANC Active Noise Cancelling Headphones, Bluetooth Headphones Over Ear with 60H Playtime, HiFi Stereo Audio, Deep Bass, Wireless Headphones for Home Office(Blue)","$59.99","$140.00 (70%)","70","https://www.amazon.ca/dp/B0F8NTP4PN?tag=lesdealsduw02-20&linkCode=osi&th=1&psc=1","https://m.media-amazon.com/images/I/41V1SBERXtL._SL500_.jpg","2"
"vacuum","Home & Cleaning","80,000PRM Motor Cordless Vacuum for Home, Vacuum Cleaner with 2 Adjustable Modes, 2200mAH Battery Max 35 Mins Runtime, and Washable Parts Stick Vacuum (Wool White)","$169.99","$400.00 (70%)","70","https://www.amazon.ca/dp/B0FBFD7V73?tag=lesdealsduw02-20&linkCode=osi&th=1&psc=1","https://m.media-amazon.com/images/I/31EpuhkNVcL._SL500_.jpg","2"
