"keyword","category","title","price","savings","percent","link","imageUrl","page"
"apple watch","Wearables","Smart Watch for Men Women with Bluetooth Call, Alexa Built-in, Heart Rate & Sleep Monitor, 1.83"" DIY Dial Fitness Watch with 100+ Sport Modes, IP68 Waterproof, Compatible with Android iOS","$44.99","$355.00 (89%)","89","https://www.amazon.ca/dp/B0FPX274H3?tag=lesdealsduw02-20&linkCode=osi&th=1&psc=1","https://m.media-amazon.com/images/I/41Y+eBPpZCL._SL500_.jpg","2"
"air pods","Audio & Music","Wireless Earbuds, 2025 Bluetooth 5.3 Headphones HiFi Stereo 50H Playback Ear Buds with Led Digital Display, ENC Noise Cancelling Earbuds for Laptop Computer, iOS, Android, White","$26.99","$173.00 (87%)","87","https://www.amazon.ca/dp/B0FJ8B5LK5?tag=lesdealsduw02-20&linkCode=osi&th=1&psc=1","https://m.media-amazon.com/images/I/31Ll7aJGshL._SL500_.jpg","1"
"air pods","Audio & Music","Wireless Earbuds, 2025 Bluetooth 5.4 Bass Stereo Headphones with 4 ENC Mic, 48H Playback Ear Buds with Charging Case LED Display,Sport Earphones IPX7 Waterproof for Phone, Android, Pad, White","$27.99","$172.00 (86%)","86","https://www.amazon.ca/dp/B0FKGSGPS7?tag=lesdealsduw02-20&linkCode=osi&th=1&psc=1","https://m.media-amazon.com/images/I/31xWbI4QEXL._SL500_.jpg","2"
"portable charger","Power & Chargers","GTOCE Portable Charger,40000mAh Power Bank with 22.5W Fast Charging LED Digital Display Battery Pack with 6 Outputs 2 Inputs, Type C Powerbank Portable Charger for iPhone 16 pro Samsung AirPods,Black","$42.99","$257.00 (86%)","86","https://www.amazon.ca/dp/B0FP4Q5T6G?tag=lesdealsduw02-20&linkCode=osi&th=1&psc=1","https://m.media-amazon.com/images/I/41oWjwgXHRL._SL500_.jpg","1"
"health monitor","Health & Wellness","Smart Watch for Men Women with Bluetooth Calling, 1.83"" HD Touchscreen, 5 ATM Waterproof, 130+ Sports Modes Fitness Watch with Health Monitor (Sleep/Heart Rate Tracking) for iPhone Android (Black)","$29.99","$170.00 (85%)","85","https://www.amazon.ca/dp/B0FRFP7XTL?tag=lesdealsduw02-20&linkCode=osi&th=1&psc=1","https://m.media-amazon.com/images/I/411Vl9zMyhL._SL500_.jpg","2"
"sleep tracker","Health & Wellness","Smart Watch for Men Women with Bluetooth Calling, 1.83"" HD Touchscreen, 5 ATM Waterproof, 130+ Sports Modes Fitness Watch with Health Monitor (Sleep/Heart Rate Tracking) for iPhone Android (Pink)","$29.99","$170.00 (85%)","85","https://www.amazon.ca/dp/B0FRFNMLW4?tag=lesdealsduw02-20&linkCode=osi&th=1&psc=1","https://m.media-amazon.com/images/I/41ng1GPexQL._SL500_.jpg","2"
"dash cam","Automotive","Dash Camera for Cars,4K Full UHD Car Camera Front Rear,3 Channel Dash Cam with 32GB Card,Built-in Super Night Vision,2.0'' IPS Screen,170°Wide Angle,WDR, Loop Recording, 24H Parking Mode","$69.99","$330.00 (83%)","83","https://www.amazon.ca/dp/B0FL7HM3WN?tag=lesdealsduw02-20&linkCode=osi&th=1&psc=1","https://m.media-amazon.com/images/I/41uydhEj6NL._SL500_.jpg","2"
"camera","Cameras & Photography","4K Digital Camera for Photography Autofocus, 50MP Vlogging Camera Kids with 2.8'' 180° Flip Screen 18X Zoom 32G Card Compact Point Shoot Cameras Anti Shake Flash Video Photo Batteries Girls Boys Pink","$89.99","$410.00 (82%)","82","https://www.amazon.ca/dp/B0FKYWN9DD?tag=lesdealsduw02-20&linkCode=osi&th=1&psc=1","https://m.media-amazon.com/images/I/41RLTLinw6L._SL500_.jpg","1"
"dash cam","Automotive","DELLFY Dash Cam, Dash Cam Front and Rear with App Control, 4K UHD Front Camera+2K Rear Cameras, Front 170°+Rear 160°, Night Vision, Dash Camera for Cars with 3.0"" IPS Screen, 32GB Card","$79.99","$368.00 (82%)","82","https://www.amazon.ca/dp/B0FKMK3JPQ?tag=lesdealsduw02-20&linkCode=osi&th=1&psc=1","https://m.media-amazon.com/images/I/513lFLBi+WL._SL500_.jpg","2"
"digital camera","Cameras & Photography","4K Digital Camera for Photography Autofocus, 50MP Vlogging Camera with 2.8'' 180° Flip Screen 18X Digital Zoom 32G Card Compact Point and Shoot Cameras Kids Anti Shake YouTube Video Photo Teens Black","$89.99","$410.00 (82%)","82","https://www.amazon.ca/dp/B0FKYSW4K6?tag=lesdealsduw02-20&linkCode=osi&th=1&psc=1","https://m.media-amazon.com/images/I/41kFhei+GWL._SL500_.jpg","1"
"fitness tracker","Wearables","Fitness Tracker Smart Watch for Men Women, 1.47"" HD with Bluetooth, 24/7 Heart Rate & Blood Oxygen Monitor, Sleep & Step Counter, 100+ Sports Modes, IP68 Waterproof, Compatible with Android iOS","$49.99","$210.00 (81%)","81","https://www.amazon.ca/dp/B0FNCVJ6ZH?tag=lesdealsduw02-20&linkCode=osi&th=1&psc=1","https://m.media-amazon.com/images/I/41wztqo9C+L._SL500_.jpg","1"
"robot vacuum","Home & Cleaning","Robot Vacuum and Mop Combo, 2 in 1 Mopping Robot Vacuum Cleaner with Schedule, Wi-Fi/App/Remote, 2000Pa Max Suction, Self-Charging Robotic Vacuum, Slim, Ideal for Hard Floor, Pet Hair, Low-Pile Carpet","$123.99","$526.00 (81%)","81","https://www.amazon.ca/dp/B0F8MSD74P?tag=lesdealsduw02-20&linkCode=osi&th=1&psc=1","https://m.media-amazon.com/images/I/41EFapB4r8L._SL500_.jpg","1"
"car dashcam","Automotive","Dash Camera for Cars, 4K+1080P Dash Cam Front and Rear with 5G WiFi, Built-in 32GB Card, Night Vision, G-Sensor, Loop Recording, 24H Parking Mode","$79.99","$320.00 (80%)","80","https://www.amazon.ca/dp/B0F9YNRNWM?tag=lesdealsduw02-20&linkCode=osi&th=1&psc=1","https://m.media-amazon.com/images/I/41K4NAN+esL._SL500_.jpg","1"
"car dashcam","Automotive","4K Dash Cam Front and Rear Camera with 5G WiFi, Dashcams for Cars with APP, 170°Wide Angle, 3"" IPS Screen, Night Vision & 24/7 Parking Monitor, Loop Recording, 32GB Card Included","$89.99","$358.00 (80%)","80","https://www.amazon.ca/dp/B0FH49VZDJ?tag=lesdealsduw02-20&linkCode=osi&th=1&psc=1","https://m.media-amazon.com/images/I/51F8skDiqEL._SL500_.jpg","1"
"portable speaker","Audio & Music","Bluetooth Speakers,Vanzon V40 Wireless Portable Bluetooth Speaker, IPX7 Waterproof Speaker with 24W Stereo Sound and 24H Playtime,TWS Dual Pairing Bluetooth 5.0 Speaker for Home/Outdoor","$39.99","$160.00 (80%)","80","https://www.amazon.ca/dp/B0FQQ1JGN7?tag=lesdealsduw02-20&linkCode=osi&th=1&psc=1","https://m.media-amazon.com/images/I/513ZCm9VbTL._SL500_.jpg","1"
"portable speaker","Audio & Music","Monster Shock Plus Portable Bluetooth Speaker, Bluetooth 5.4 Speaker,30W Dual Speaker, Deep Bass,15H Playtime, Support AUX/TF Card,IPX6 Waterproof,TWS Pairing for Outdoor/Home/Party/Travel,Gift Ideas","$39.99","$160.00 (80%)","80","https://www.amazon.ca/dp/B0FNMGYNF3?tag=lesdealsduw02-20&linkCode=osi&th=1&psc=1","https://m.media-amazon.com/images/I/411drXVu6QL._SL500_.jpg","1"
"space heater","Home & Cleaning","FLANUR Space Heaters for Indoor Use, 1500W Room Heater Fan 2 in 1 with Remote, Thermostat, LED Display, Overheat & Tip Over Protection, 12H Timer, 70° Oscillating Heater for Bedroom, Black","$52.99","$212.00 (80%)","80","https://www.amazon.ca/dp/B0FCXS2LCS?tag=lesdealsduw02-20&linkCode=osi&th=1&psc=1","https://m.media-amazon.com/images/I/61EqCqMFfgL._SL500_.jpg","1"
"space heater","Home & Cleaning","FLANUR Space Heater for Indoor Use, 1500W Portable Electric Heater with Thermostat, WiFi and APP Control, Overheat & Tip-Over Protection, 12H Timer, 4 Modes, 36dB Heater for Office Bedroom Home, Black","$79.99","$319.96 (80%)","80","https://www.amazon.ca/dp/B0FLL3K1V4?tag=lesdealsduw02-20&linkCode=osi&th=1&psc=1","https://m.media-amazon.com/images/I/41TNAWy4KjL._SL500_.jpg","2"
"air purifier","Home & Cleaning","FLANUR Air Purifiers for Home Large Room Up to 1690 ft² Double-sided Air Inlet Smart WiFi Alexa Compatible PM 2.5 Air Quality Monitor for Smoke and Odor 23dB Quiet 1 Pack+2 Pack HEPA Filters White","$119.99","$460.00 (79%)","79","https://www.amazon.ca/dp/B0F8NMWQFD?tag=lesdealsduw02-20&linkCode=osi&th=1&psc=1","https://m.media-amazon.com/images/I/51pQFdFBqtL._SL500_.jpg","2"
"electronics accessories","Electronics","Power Bank Portable Charger 40000mAh, 22.5W Fast Charging, Built-in 2 Output Cable, Charge 5 Devices Simultaneously LCD Display for iPhone and Android Phones and Most Electronic Devices","$49.99","$190.00 (79%)","79","https://www.amazon.ca/dp/B0DW43LY69?tag=lesdealsduw02-20&linkCode=osi&th=1&psc=1","https://m.media-amazon.com/images/I/31-6DmPWB3L._SL500_.jpg","2"
"humidifier","Home & Cleaning","CHIVALZ Humidifiers for Bedroom, 6L Cool Mist Humidifiers for Baby Nursery, 26dB Quiet, 50H Runtime, Top Fill Humidifier for Large Room, Home, Plants, Nightlight, Oil Diffuser 1 Pack","$63.99","$235.91 (79%)","79","https://www.amazon.ca/dp/B0FK54QMB4?tag=lesdealsduw02-20&linkCode=osi&th=1&psc=1","https://m.media-amazon.com/images/I/41q3370y7wL._SL500_.jpg","2"
"phone charger station","Bedroom","3 in 1 Wireless Charger for iPhone,RTOPS Fodable Charging Stations for Multiple Apple Devices, W312 Fast Travel Charging Stand for Airpod, iWatch and iPhone 12-15 (Adapter Included)","$29.99","$110.00 (79%)","79","https://www.amazon.ca/dp/B0FQBHK6W4?tag=lesdealsduw02-20&linkCode=osi&th=1&psc=1","https://m.media-amazon.com/images/I/41HEFbiqYhL._SL500_.jpg","2"
"dash cam","Automotive","Dash Camera for Cars, 8K Ultra HD Dash Cam Front and Rear, Dash Cam with App Control, 32GB Card, Built-in Wi-Fi & GPS, 3.16”IPS Screen, 170°Wide Angle, WDR, Night Vision, 24H Parking Mode","$89.99","$310.00 (78%)","78","https://www.amazon.ca/dp/B0FHF7CRH5?tag=lesdealsduw02-20&linkCode=osi&th=1&psc=1","https://m.media-amazon.com/images/I/51F2h7p6dVL._SL500_.jpg","2"
"air pods","Audio & Music","JBES Bluetooth Earbuds Wireless Headphones, 60H Deep Bass Ear Buds with 4 Noise Cancelling Microphone, IP5 Waterproof Earphones for iPhone Android Sports audifonos Bluetooth inalambricos (White)","$24.98","$84.02 (77%)","77","https://www.amazon.ca/dp/B0FH2669J6?tag=lesdealsduw02-20&linkCode=osi&th=1&psc=1","https://m.media-amazon.com/images/I/314w7YnvdOL._SL500_.jpg","2"
"earbuds","Audio & Music","Monster Open Ear AC339 Earbuds, Bluetooth 6.0 Earphones Stereo Sound, Open Ear Clip Wireless Earbuds 40 Hours Playback,Touch Control, IPX6 Waterproof,Purple","$39.99","$130.00 (76%)","76","https://www.amazon.ca/dp/B0FN7HNWWR?tag=lesdealsduw02-20&linkCode=osi&th=1&psc=1","https://m.media-amazon.com/images/I/41TGl02e1TL._SL500_.jpg","2"
"robot vacuum","Home & Cleaning","ZCWA Robot Vacuum and Mop Combo, 2 in 1 Mopping Robotic Vacuum with WiFi/App, Robotic Vacuum Cleaner, Schedule Settings, Self-Charging, Ideal for Hard Floor, Pet Hair and Low Pile Carpet","$159.99","$520.00 (76%)","76","https://www.amazon.ca/dp/B0CW69TRPG?tag=lesdealsduw02-20&linkCode=osi&th=1&psc=1","https://m.media-amazon.com/images/I/41SvzBxbuzL._SL500_.jpg","1"
"vacuum sealer","Kitchen","95 kPa Vacuum Sealer Machine, 10-IN-1 Modes Powerful Full Automatic Food Saver Vacuum Sealer with Cutter,1 Bag Roll,10 Pre-cut Bags and Accessory Hose Fully Starter Kits","$94.00","$305.99 (76%)","76","https://www.amazon.ca/dp/B0F9433LGZ?tag=lesdealsduw02-20&linkCode=osi&th=1&psc=1","https://m.media-amazon.com/images/I/41REQFCqLjL._SL500_.jpg","1"
"vacuum sealer","Kitchen","75Kpa Vacuum Sealer Machine, 6-in-1 Food Sealer with Digital Timer & Dry/Moist Modes, Compact Design, Includes 10 Bags + Built-in Cutter (Silver)","$40.99","$129.00 (76%)","76","https://www.amazon.ca/dp/B0FQ5V4V8R?tag=lesdealsduw02-20&linkCode=osi&th=1&psc=1","https://m.media-amazon.com/images/I/41DjB0WbpXL._SL500_.jpg","1"
"cutting board","Kitchen","Stainless Steel Cutting Board Double Sided 304 Steel & Food-Grade PPLarge Chopping Board for Meat and Kitchen, Non-Slip 16""x11"" White","$49.99","$150.00 (75%)","75","https://www.amazon.ca/dp/B0F5Q88GYF?tag=lesdealsduw02-20&linkCode=osi&th=1&psc=1","https://m.media-amazon.com/images/I/41GRmKgwUDL._SL500_.jpg","1"
"fitness tracker","Wearables","Smart Watch for Women Men(Answer/Make Calls), Fitness Tracker Built-in AI Voice, 1.27"" HD Smartwatch with Heart Rate/Sleep/Step/SpO2 Monitor, 100+ Sports Modes, IP68 Waterproof Watch for Android iOS","$99.99","$300.00 (75%)","75","https://www.amazon.ca/dp/B0FR4HQV1K?tag=lesdealsduw02-20&linkCode=osi&th=1&psc=1","https://m.media-amazon.com/images/I/41Ji5dnsNoL._SL500_.jpg","1"
"smartwatch","Wearables","Military Smart Watch for Men (Answer/Make Calls), 1.39""HD Touchscreen Fitness Tracker with Sleep/Heart Rate/Blood Oxygen Monitor, 110+ Sport Modes, IP68 Waterproof Smartwatch for iPhone Android, Black","$39.99","$120.00 (75%)","75","https://www.amazon.ca/dp/B0FKT5BSQ4?tag=lesdealsduw02-20&linkCode=osi&th=1&psc=1","https://m.media-amazon.com/images/I/51Exx6wM+jL._SL500_.jpg","1"
"vacuum","Home & Cleaning","Cordless Vacuum Cleaner, Cordless Stick Vacuum with LED Display & Foldable Lightweight Design, 40KPa/450W/50Mins/3 Modes,Rechargeable Handle Cleaners for Home, Pet Hair, Carpet, Hard Floor(Violet)","$139.99","$430.00 (75%)","75","https://www.amazon.ca/dp/B0FKZYPYT4?tag=lesdealsduw02-20&linkCode=osi&th=1&psc=1","https://m.media-amazon.com/images/I/4188GdmubJL._SL500_.jpg","1"
"chromecast","TV & Video","Wireless HDMI Display Dongle Adapter,Portable Transmitter,Plug & Play Streaming Media/Audio/File HDMI Wireless Extender from Smartphone,Laptop to HDTV/Monitor/Projector,Support Airplay DLNA Miracast","$59.99","$174.00 (74%)","74","https://www.amazon.ca/dp/B0FCXZRFXC?tag=lesdealsduw02-20&linkCode=osi&th=1&psc=1","https://m.media-amazon.com/images/I/31LDmFbADfL._SL500_.jpg","2"
"instant camera","Cameras & Photography","Kids Camera,1080P Instant Print Camera for Kids, Christmas Birthday Gifts for 3 4 5 6 7 8 9 10 11 12 Year Old Girls Boys,Toy Digital Camera Gifts with 32GB SD Card & 3 Rolls Printing Paper, Purple","$44.99","$128.00 (74%)","74","https://www.amazon.ca/dp/B0F9W2GQC7?tag=lesdealsduw02-20&linkCode=osi&th=1&psc=1","https://m.media-amazon.com/images/I/414xhENSElL._SL500_.jpg","1"
"vacuum","Home & Cleaning","Cordless Vacuum Cleaner, 80,000PRM Stick Vacuum with 2 Powerful Suction Modes, Max 40 Mins Runtime, Protable 2600mAh Rechargeable Battery Vacuum Cleaner for Home (Pomegranate Red)","$149.99","$420.00 (74%)","74","https://www.amazon.ca/dp/B0F5331SY4?tag=lesdealsduw02-20&linkCode=osi&th=1&psc=1","https://m.media-amazon.com/images/I/41qbfZK2PVL._SL500_.jpg","1"
"vacuum","Home & Cleaning","80,000PRM Motor Cordless Vacuum for Home, Vacuum Cleaner with 2 Adjustable Modes, 2200mAH Battery Max 35 Mins Runtime, and Washable Parts Stick Vacuum (Goose Gray)","$145.99","$424.00 (74%)","74","https://www.amazon.ca/dp/B0DN19ZB6T?tag=lesdealsduw02-20&linkCode=osi&th=1&psc=1","https://m.media-amazon.com/images/I/31EpuhkNVcL._SL500_.jpg","2"
"vacuum","Home & Cleaning","80,000PRM Motor Cordless Vacuum Cleaner, 2 Adjustable Modes Stick Vacuum with 2200mAH Battery up to 35 Mins Runtime, and Washable Parts ((Light Snow White))","$149.99","$420.00 (74%)","74","https://www.amazon.ca/dp/B0FBFD7V73?tag=lesdealsduw02-20&linkCode=osi&th=1&psc=1","https://m.media-amazon.com/images/I/31EpuhkNVcL._SL500_.jpg","2"
"fitness tracker","Wearables","IMFRCHCS Fitness Tracker,Smart Watch with 1.47"" Touch Display,137+Sport Modes Fitness Watch with Heart Rate Sleep Monitor, Step Counter,IP68 Waterproof Activity Trackers for Women Men","$39.98","$110.01 (73%)","73","https://www.amazon.ca/dp/B0FNZQQV34?tag=lesdealsduw02-20&linkCode=osi&th=1&psc=1","https://m.media-amazon.com/images/I/41syeaUl4kL._SL500_.jpg","1"
"phone charger station","Bedroom","Wireless Charger, 3 in 1 Charging Station, Fast Charging Station Foldable Charging Stand, Wireless Charging Station for Multiple Devices, Compatible with lPhone 16/15/14/13 Pro Max Airpods Watch","$27.99","$72.00 (72%)","72","https://www.amazon.ca/dp/B0FP97BDCR?tag=lesdealsduw02-20&linkCode=osi&th=1&psc=1","https://m.media-amazon.com/images/I/41vhH+TtsJL._SL500_.jpg","1"
"wifi extender","Networking & Connectivity","WiFi Extender Booster 1200 Mbps Dual Band (5GHz/2.4GHz) WiFi Extended Signal Booster for Home, Internet WiFi Repeater (White)","$59.99","$140.00 (70%)","70","https://www.amazon.ca/dp/B0FL7NSP89?tag=lesdealsduw02-20&linkCode=osi&th=1&psc=1","https://m.media-amazon.com/images/I/311HPG6ANyL._SL500_.jpg","1"
"wireless earbuds","Audio & Music","Wireless Earbuds, Bluetooth 5.4 Headphones Deep Bass HiFi Stereo, New Ear Bud with 4 ENC Noise Cancelling Mic, 36H Bluetooth Earbuds with LED Display IP7 Waterproof Wireless Earphones for Android/iOS","$29.99","$70.00 (70%)","70","https://www.amazon.ca/dp/B0FMNM2HGF?tag=lesdealsduw02-20&linkCode=osi&th=1&psc=1","https://m.media-amazon.com/images/I/41qmQh1YlKL._SL500_.jpg","2"
"headphones","Audio & Music","Monster Persona 6th ANC Active Noise Cancelling Headphones, Bluetooth Headphones Over Ear with HiFi Stereo Audio, 60H Playtime, 3 EQ Modes, Bluetooth 6.0, Wireless Headphones for Travel Work, White","$61.99","$138.00 (69%)","69","https://www.amazon.ca/dp/B0FSWZS2CQ?tag=lesdealsduw02-20&linkCode=osi&th=1&psc=1","https://m.media-amazon.com/images/I/31P2CVJSqtL._SL500_.jpg","2"
"cutting board","Kitchen","Titanium Cutting Board for Kitchen, Cutting Board Double Sided Food Grade, Pure Titanium and Wheat Straw PP, Easy to Clean Large Size 16”×11”","$64.99","$135.00 (68%)","68","https://www.amazon.ca/dp/B0F484HDD2?tag=lesdealsduw02-20&linkCode=osi&th=1&psc=1","https://m.media-amazon.com/images/I/41HPxcjXPBL._SL500_.jpg","1"
"pet grooming","Pet Supplies","EGFKI Dog Dryer, 5.2HP/ 3800W Pet Grooming High Velocity Force Blower with 4 Nozzles, Adjustable Speed and Temperature Dog Hair Dryers for Grooming","$129.99 ($129.99 / count)","$270.00 (68%)","68","https://www.amazon.ca/dp/B0C53CJTVT?tag=lesdealsduw02-20&linkCode=osi&th=1&psc=1","https://m.media-amazon.com/images/I/41w3z9eJ63L._SL500_.jpg","2"
"portable ac","Home & Cleaning","Portable Air Conditioners for Bedroom, Dual Motor Evaporative Air Cooler with 3 Speeds & 3 Mist, 7 Color Night Light Cooling Fan with 2-8H Timer, 1100ML Personal AC Unit for Office Room","$22.99","$49.00 (68%)","68","https://www.amazon.ca/dp/B0F322T73D?tag=lesdealsduw02-20&linkCode=osi&th=1&psc=1","https://m.media-amazon.com/images/I/41JSoQ7gC1L._SL500_.jpg","2"
"speakers","Audio & Music","Monster Sparkle Bluetooth Speaker Loud, 120W Peak Portable Speaker with Powerful Sound and Heavy Bass, Full-Screen Colorful Lights, 24H Playtime, AUX, USB Playback, Waterproof","$119.99","$260.00 (68%)","68","https://www.amazon.ca/dp/B0FBWNLJ9R?tag=lesdealsduw02-20&linkCode=osi&th=1&psc=1","https://m.media-amazon.com/images/I/511bHzY9K9L._SL500_.jpg","2"
"tools","Tools","XClifes Labor-Saving Handle, 12 in Arm Tool Lift 2PCS, Wall Tile Locator, Multi-Function Height Adjustment Lifting Device, Door Panel Lifting Cabinet Jack Raised by 6.69 inches, Bearing 350LBS","$59.99","$130.00 (68%)","68","https://www.amazon.ca/dp/B097K7JG56?tag=lesdealsduw02-20&linkCode=osi&th=1&psc=1","https://m.media-amazon.com/images/I/51L7oLmBU6L._SL500_.jpg","2"
"travel bottles","Travel","Bottles","$3.00 ($0.75 / Piece)","$6.49 (68%)","68","https://www.amazon.ca/dp/B0DFM5JZCG?tag=lesdealsduw02-20&linkCode=osi&th=1&psc=1","https://m.media-amazon.com/images/I/31DaZU5y1HL._SL500_.jpg","1"
"electric bike","Sports & Fitness","Electric Bike for Adults, 2000/1000W, 35/30MPH,40/20/15AH Removable Battery, Max 50-180 Miles Electric Motorcycle, 20/26"" Fat Tire Bike, All-Terrain E Bike for Mountains, Snow, Sand, Road","$458.00","$941.00 (67%)","67","https://www.amazon.ca/dp/B0CYL4V4YM?tag=lesdealsduw02-20&linkCode=osi&th=1&psc=1","https://m.media-amazon.com/images/I/41nlmeALP7L._SL500_.jpg","1"
"nightlight projector","Baby","Votozi Night Light for Kids, Kids Night Light, Star Night Light, Moon and Star Projector 360 Degree Rotation - 4 LED Bulbs 9 Light Color Changing with USB Cable, Unique Gift for Men Women Children","$10.00","$19.99 (67%)","67","https://www.amazon.ca/dp/B092YYV588?tag=lesdealsduw02-20&linkCode=osi&th=1&psc=1","https://m.media-amazon.com/images/I/41iXzK7SiTS._SL500_.jpg","1"
"roman shades","Bedroom","Madison Park Kyler Cordless Roman Shades - Single Panel, Lightweight Linen Blend Fabric, Natural Design, Easy Installation, Light Filtering Window Blind, Bedroom, Living Room Decor 34""W x 64""L Natural","$39.56","$81.52 (67%)","67","https://www.amazon.ca/dp/B0BXNWH7K8?tag=lesdealsduw02-20&linkCode=osi&th=1&psc=1","https://m.media-amazon.com/images/I/41mDzxAk12L._SL500_.jpg","2"
"vacuum sealer","Kitchen","Mesliese Vacuum Sealer Machine Powerful 90Kpa Precision 6-in-1 Compact Vacuum Food Preservation System Built-in Cutter, Include 2 Bag Rolls & 5 Pre-cut Bags, Dry&Moist Modes Smart Suction (Deep Gray)","$99.99","$200.00 (67%)","67","https://www.amazon.ca/dp/B0FJMCQ68F?tag=lesdealsduw02-20&linkCode=osi&th=1&psc=1","https://m.media-amazon.com/images/I/41oqHt9LbVL._SL500_.jpg","1"
"air pods","Audio & Music","Wireless Earbuds, Bluetooth 5.3 Headphones HiFi Stereo, Mini in-Ear Bluetooth Earbuds, Wireless Earphones with 4 ENC Noise Cancelling Mic, IP7 Waterproof, LED Display, Touch Control Ear Buds, White","$23.99","$46.00 (66%)","66","https://www.amazon.ca/dp/B0CBWN2S86?tag=lesdealsduw02-20&linkCode=osi&th=1&psc=1","https://m.media-amazon.com/images/I/31GJVwVqEBL._SL500_.jpg","2"
"designer bags","Clothing & Accessories","MoreFarther Shoulder Bags for Women, Genuine Leather Crossbody Bags Purses Vintage Handbags-Adjustable Strap Designer Bags (Black)","$34.00","$65.00 (66%)","66","https://www.amazon.ca/dp/B0DPFMHRK7?tag=lesdealsduw02-20&linkCode=osi&th=1&psc=1","https://m.media-amazon.com/images/I/31vBuC-aRGL._SL500_.jpg","2"
"vacuum","Home & Cleaning","MQDXE Cordless Stick Vacuum Cleaner: 550W Powerful Suction, LED Display, 55 Min Runtime, Anti-Tangle Brush, Rechargeable Battery, Lightweight for Home, Pet Hair, Hard Floors, Carpet","$169.99","$330.00 (66%)","66","https://www.amazon.ca/dp/B0DGPLQSYM?tag=lesdealsduw02-20&linkCode=osi&th=1&psc=1","https://m.media-amazon.com/images/I/41413OXgPqL._SL500_.jpg","1"
"bamboo pillowcase","Bedroom","Vipfree Pillow Cases Queen Set of 2, Rayon Derived from Bamboo, Soft & Breathable Pillow Covers with Envelope Closure, Light Gray","$4.27","$7.93 (65%)","65","https://www.amazon.ca/dp/B0DF5KNFB9?tag=lesdealsduw02-20&linkCode=osi&th=1&psc=1","https://m.media-amazon.com/images/I/413uXN5I83L._SL500_.jpg","1"
"gaming headset","Gaming","Monster Mission 300 Wireless Gaming Headset, 2.4GHz/Bluetooth Gaming Headphones,Low Latency, Stereo, Audio Location Recognition, 48H Battery Life, Suitable for PS5, PC, PS4 and Other Gaming Devices","$59.99","$110.00 (65%)","65","https://www.amazon.ca/dp/B0F7LRP4L7?tag=lesdealsduw02-20&linkCode=osi&th=1&psc=1","https://m.media-amazon.com/images/I/41Ml3juOrQL._SL500_.jpg","2"
"air purifier","Home & Cleaning","MERONTE Air Purifiers for Bedroom Home, Air Purifier for Smoke Odors with Fragrance Sponge, Small Air Purifier with Sleep Mode for Bedroom Office, Blue Night Light, White, 1 Pack+3 Modes","$96.99","$169.00 (64%)","64","https://www.amazon.ca/dp/B0FFHKQBT3?tag=lesdealsduw02-20&linkCode=osi&th=1&psc=1","https://m.media-amazon.com/images/I/41yRGvqiuhL._SL500_.jpg","2"
"microphone","Audio & Music","BAILIXIN 3 in 1 Professional Wireless Lavalier Microphone for iPhone, Android, Camera, Wireless Microphones, Mini Microphone, Crystal Clear Sound Quality for Recording, Live Streaming, YouTube, TikTok","$49.99","$90.00 (64%)","64","https://www.amazon.ca/dp/B0FGDD5W11?tag=lesdealsduw02-20&linkCode=osi&th=1&psc=1","https://m.media-amazon.com/images/I/41xj6cU6qvL._SL500_.jpg","2"
"pool","Outdoor & Camping","Large Foldable Dog Pool 97""x16"", Hyperzoo Super Oversize Collapsible Dog Pet Bathing Tub Portable Kiddie Pool Leakproof PVC Swimming Pool for Small Large Dogs Pets Kids Blue","$28.49","$51.50 (64%)","64","https://www.amazon.ca/dp/B0CRB67QXB?tag=lesdealsduw02-20&linkCode=osi&th=1&psc=1","https://m.media-amazon.com/images/I/41MzN4V7M9L._SL500_.jpg","1"
"air pods","Audio & Music","Wireless Earbuds, Bluetooth 5.4 Headphones HiFi Stereo, 2025 Wireless Earphones with 4 ENC Noise Cancelling Mics, 40H Playtime Ear Buds with LED Display, IP7 Waterproof Bluetooth Earbuds USB-C Charge","$59.99","$100.00 (63%)","63","https://www.amazon.ca/dp/B0FFMZ5KYC?tag=lesdealsduw02-20&linkCode=osi&th=1&psc=1","https://m.media-amazon.com/images/I/417xLpPxs6L._SL500_.jpg","1"
"laptop","Laptops & Tablets","jumper 17.6 Inch Laptop Computer, Windows 11 Laptop with 100% sRGB IPS FHD Display, 1 Year Office 365, 16GB DDR4 640GB SSD Notebook, Quad-Cores Processor, Backlit Keyboard, WiFi 6, BT5.2, Type-C","$559.99","$940.00 (63%)","63","https://www.amazon.ca/dp/B0FNMWGVVW?tag=lesdealsduw02-20&linkCode=osi&th=1&psc=1","https://m.media-amazon.com/images/I/51fed+DrwJL._SL500_.jpg","1"
"refurbished laptop","Laptops & Tablets","SGIN Laptop Computer, 12GB RAM 512GB SSD, 15.6 Inch Ordinateur Portable, Celeron N5095 Quad-Core, 180° Open Angle, Windows 11 Laptop, Type-C, 7000mAh, for Business and Students","$369.99","$630.00 (63%)","63","https://www.amazon.ca/dp/B0FM8FL69L?tag=lesdealsduw02-20&linkCode=osi&th=1&psc=1","https://m.media-amazon.com/images/I/51h7H-0nXhL._SL500_.jpg","1"
"swimming","Sports & Fitness","Swimming Ear Plugs, 3 Pairs Great Waterproof Ultra Comfy Earplugs, Reusable Silicone Ear Plugs for Swimming Surfing Snorkeling and Other Water Sports (Adults & Teens 14+) (Multicolored 1, 3 Pair (Pack of 1))","$9.50","$16.49 (63%)","63","https://www.amazon.ca/dp/B09ZTRP3SH?tag=lesdealsduw02-20&linkCode=osi&th=1&psc=1","https://m.media-amazon.com/images/I/41hDEtW8tPL._SL500_.jpg","1"
"apple pencil","Computers & Tech","JAMJAKE 5 Mins Fast Charging Stylus Pen for iPad 2018-2025,Palm Rejection Pencil for Apple iPad Compatible with iPad 6/7/8/9/10/11,iPad Air 3/4/5/M2/M3,iPad Pro 11""/12.9""/M4,iPad mini 5/6/7","$18.99","$30.99 (62%)","62","https://www.amazon.ca/dp/B08L7975V6?tag=lesdealsduw02-20&linkCode=osi&th=1&psc=1","https://m.media-amazon.com/images/I/41VNMbJjCDL._SL500_.jpg","1"
