"keyword","category","title","price","savings","percent","link","imageUrl","page"
"blanket","Bedroom","Utopia Bedding 300GSM Fleece King Size Bed Blanket [Grey, 90x102 Inch] with Anti-Static Microfiber Lightweight Fuzzy Soft Cozy Blanket for Bed, Couch and Sofa - Suitable for All Seasons","$28.99","$7.00 (19%)","19","https://www.amazon.ca/dp/B073H9WRH2?tag=lesdealsduw02-20&linkCode=osi&th=1&psc=1","https://m.media-amazon.com/images/I/419sdnpXy4L._SL500_.jpg","1"
"cake pan","Kitchen","Cuisinart AMB-95FCP Chef's Classic Nonstick Bakeware 9-1/2-Inch Fluted Cake Pan","$26.87","$6.12 (19%)","19","https://www.amazon.ca/dp/B0000D8CAM?tag=lesdealsduw02-20&linkCode=osi&th=1&psc=1","https://m.media-amazon.com/images/I/41FjzghsXFL._SL500_.jpg","2"
"camera strap","Cameras & Photography","Peak Design Slide Lite Camera Strap Midnight Blue (SLL-MN-3)","$80.95","$19.00 (19%)","19","https://www.amazon.ca/dp/B096M845GR?tag=lesdealsduw02-20&linkCode=osi&th=1&psc=1","https://m.media-amazon.com/images/I/31KeBfiybLL._SL500_.jpg","2"
"canned goods","Food","Heinz Original Beans in Tomato Sauce, 398mL (Pack of 9)","$13.99 ($1.55 / count)","$3.28 (19%)","19","https://www.amazon.ca/dp/B078N34JKC?tag=lesdealsduw02-20&linkCode=osi&th=1&psc=1","https://m.media-amazon.com/images/I/51NNhsKk45L._SL500_.jpg","1"
"car wash soap","Automotive","Armor All Ceramic Foaming Car Wash Soap with Extreme Shield, Dirt Repelling Technology, 1.48 L (Pack of 1)","$19.39","$4.60 (19%)","19","https://www.amazon.ca/dp/B0C6FTHQQM?tag=lesdealsduw02-20&linkCode=osi&th=1&psc=1","https://m.media-amazon.com/images/I/41Gn5eIgZOL._SL500_.jpg","1"
"cat treats","Pet Supplies","GREENIES Feline Natural Dental Care Salmon Flavour Cat Treats - with Natural Ingredients - for Adult Cats of All Breeds, 227g Tub","$9.01 ($32.53 / kg)","$2.18 (19%)","19","https://www.amazon.ca/dp/B0828W8FNS?tag=lesdealsduw02-20&linkCode=osi&th=1&psc=1","https://m.media-amazon.com/images/I/41gfNPuv4EL._SL500_.jpg","1"
"cat treats","Pet Supplies","Temptations Creamy Puree Adult Lickable Cat Treats with Chicken & Salmon Variety Pack, 16 Pouches, 192g","$8.05 ($0.50 / count)","$1.93 (19%)","19","https://www.amazon.ca/dp/B0C87JVGJN?tag=lesdealsduw02-20&linkCode=osi&th=1&psc=1","https://m.media-amazon.com/images/I/51b-+-5dhTL._SL500_.jpg","2"
"children books","Kids & Education","Giraffes Can't Dance (Board Book)","$8.10","$1.89 (19%)","19","https://www.amazon.ca/dp/0545392551?tag=lesdealsduw02-20&linkCode=osi&th=1&psc=1","https://m.media-amazon.com/images/I/51nN+r8A53L._SL500_.jpg","1"
"compression socks","Health & Wellness","FITRELL 3 Pairs Compression Socks for Women and Men 20-30mmHg-Circulation Support Socks, Black+white+grey, Small-Medium","$29.99","$7.00 (19%)","19","https://www.amazon.ca/dp/B07VWT4XRG?tag=lesdealsduw02-20&linkCode=osi&th=1&psc=1","https://m.media-amazon.com/images/I/41mwXbTSeaL._SL500_.jpg","1"
"cooler","Outdoor & Camping","Igloo Marine Ultra 100 Qt Cooler","$182.33","$41.78 (19%)","19","https://www.amazon.ca/dp/B0BRLBMMV6?tag=lesdealsduw02-20&linkCode=osi&th=1&psc=1","https://m.media-amazon.com/images/I/31tBZSMxLXL._SL500_.jpg","2"
"cooling sheets","Bedroom","Queen Size 4 Piece Bed Sheet Set/Comfy/Breathable & Cooling Violet Bed Sheets/Shrinkage&Fade Resistant/Easy care-16inch deep Pockets Sheets/Oeko-Tex/Hotel/Extra Soft & Wrinkle Free (3-Violet, Queen)","$20.99","$5.00 (19%)","19","https://www.amazon.ca/dp/B0CLK5QRVC?tag=lesdealsduw02-20&linkCode=osi&th=1&psc=1","https://m.media-amazon.com/images/I/41zA6JZhX9L._SL500_.jpg","2"
"crocs","Clothing & Accessories","Crocs Unisex-Adult Classic Clogs, Green Ivy, 15 Women/13 Men","$48.71","$11.28 (19%)","19","https://www.amazon.ca/dp/B0CJXP593J?tag=lesdealsduw02-20&linkCode=osi&th=1&psc=1","https://m.media-amazon.com/images/I/41qeyVMnBhL._SL500_.jpg","1"
"cupping set","Health & Wellness","ELERA Silicone Cupping Therapy Set (3 Sizes, 7 Cups), Reusable Massage Cups for Deep Tissue, Cellulite, Face, Neck, Back, Joint, Body Relaxation","$28.99 ($4.14 / count)","$7.00 (19%)","19","https://www.amazon.ca/dp/B01G6Z4QE8?tag=lesdealsduw02-20&linkCode=osi&th=1&psc=1","https://m.media-amazon.com/images/I/41gqIfIul2L._SL500_.jpg","1"
"curtain rods","Bedroom","Curtain Rods 48 to 84 inch, Adjustable Window Curtain Rod Set with Brackets, Heavy Duty 5/8 Diameter Drapery Rod, Easy Install Wall Mount, White","$16.99","$4.00 (19%)","19","https://www.amazon.ca/dp/B0C85SL7GG?tag=lesdealsduw02-20&linkCode=osi&th=1&psc=1","https://m.media-amazon.com/images/I/21Lea-ubV0L._SL500_.jpg","1"
"daypack","Travel","Osprey Daylite Commuter Backpack, Soundwave Grey/Latte Brown","$72.66","$17.34 (19%)","19","https://www.amazon.ca/dp/B0DS6JCV7Z?tag=lesdealsduw02-20&linkCode=osi&th=1&psc=1","https://m.media-amazon.com/images/I/31sZkJrvOFL._SL500_.jpg","1"
"dish soap","Kitchen","Mrs. Meyer's Clean Day Dish Soap, Cruelty Free and Biodegradable Dishwashing Liquid, Basil Scent, 474 ml Bottle","$5.48 ($0.01 / Milliliter)","$1.31 (19%)","19","https://www.amazon.ca/dp/B01N30ZLF8?tag=lesdealsduw02-20&linkCode=osi&th=1&psc=1","https://m.media-amazon.com/images/I/41QQJ4yFhcL._SL500_.jpg","2"
"dishwasher","Kitchen","Midea Countertop Dishwasher Portable with 6L(1.59G) Built-in Water Tank, 5+2 Programs, Baby Care, Auto Door Open, Dual Drying System, Energy-Saving and Odor Removal, for Apartments, Dorms& RVs, White","$349.99","$80.00 (19%)","19","https://www.amazon.ca/dp/B0DJVMH456?tag=lesdealsduw02-20&linkCode=osi&th=1&psc=1","https://m.media-amazon.com/images/I/41Un9iQTUnL._SL500_.jpg","1"
"dog crate","Pet Supplies","MidWest Homes for Pets Single Door iCrate 76cm Long Dog Crate, Includes Leak-Proof Pan, Floor Protecting Feet, Divider Panel and New Patented Features, Black, Model 1530","$66.82","$16.17 (19%)","19","https://www.amazon.ca/dp/B000OXAERM?tag=lesdealsduw02-20&linkCode=osi&th=1&psc=1","https://m.media-amazon.com/images/I/51tbiEFFwjL._SL500_.jpg","1"
"electric scooter","Sports & Fitness","Electric Scooter for Adults with Seat, 350W Motor, 30KM/H Top Speed & 34KM Max Range – Foldable Commuter E-Scooter with App Control & Dual Brakes, Scooter with Storage Bag","$299.00","$70.00 (19%)","19","https://www.amazon.ca/dp/B0F9XVY7NC?tag=lesdealsduw02-20&linkCode=osi&th=1&psc=1","https://m.media-amazon.com/images/I/41KTyrX6bPL._SL500_.jpg","1"
"external hard drive","Computers & Tech","Western Digital 4TB My Passport for Mac Portable External Hard Drive - Blue, USB-C/USB-A - WDBA2F0040BBL-WESN","$159.99","$38.00 (19%)","19","https://www.amazon.ca/dp/B07VTNW4ZQ?tag=lesdealsduw02-20&linkCode=osi&th=1&psc=1","https://m.media-amazon.com/images/I/41dKQ1t4AmL._SL500_.jpg","2"
"first aid kit","Outdoor & Camping","First Aid Bag,First Aid Kit 365 Pieces","$21.99 ($4.40 / 100 g)","$5.00 (19%)","19","https://www.amazon.ca/dp/B0FHGKMX6G?tag=lesdealsduw02-20&linkCode=osi&th=1&psc=1","https://m.media-amazon.com/images/I/51arZoO9RHL._SL500_.jpg","1"
"food processor","Kitchen","KitchenAid-KFP0718ER-7-Cup-Food-Processor-Chop,-Puree,-Shred-and-Slice Empire-Red","$109.99","$24.99 (19%)","19","https://www.amazon.ca/dp/B07CB25BRK?tag=lesdealsduw02-20&linkCode=osi&th=1&psc=1","https://m.media-amazon.com/images/I/4184he88uaL._SL500_.jpg","2"
"food storage","Kitchen","Vtopmart Airtight Food Storage Containers with Lids 4PCS Set 3.2L, Spaghetti Container for Pasta organizer,Air Tight House Pantry Organization and Storage","$28.99 ($7.25 / Pack)","$7.00 (19%)","19","https://www.amazon.ca/dp/B08P1QDXTY?tag=lesdealsduw02-20&linkCode=osi&th=1&psc=1","https://m.media-amazon.com/images/I/51oiYTZ3IDL._SL500_.jpg","2"
"food storage","Kitchen","Deli Food Containers with Lids - (48 Sets) 24-32 Oz Quart Size & 24-16 Oz Pint Size Airtight Food Storage Takeout Meal Prep Containers with 54 Lids, BPA-Free, Dishwasher, Microwave Safe","$29.99","$6.90 (19%)","19","https://www.amazon.ca/dp/B09B8SR69P?tag=lesdealsduw02-20&linkCode=osi&th=1&psc=1","https://m.media-amazon.com/images/I/51pCRMDrcxL._SL500_.jpg","2"
"gaming monitor","Gaming","ASUS ROG Strix 27” QHD HDR400 USB-C Gaming Monitor(XG27ACS)-2560x1440, 180Hz, 1ms, Fast IPS, 133% sRGB, Extreme Low Motion Blur Sync, G-Sync Compatible, DisplayWidget, Tripod Socket, 3 Year Warranty","$299.99","$69.01 (19%)","19","https://www.amazon.ca/dp/B0CV24GQ9W?tag=lesdealsduw02-20&linkCode=osi&th=1&psc=1","https://m.media-amazon.com/images/I/41IR44ClD-L._SL500_.jpg","1"
"gaming pc","Gaming","CyberPowerPC Gamer Xtreme VR Gaming PC, Intel Core i9-14900KF 3.2GHz, GeForce RTX 5070 12GB, 32GB DDR5, 2TB PCIe 4.0 SSD, WiFi Ready & Windows 11 Home (GXiVR8080A39)","$2,190.00","$516.01 (19%)","19","https://www.amazon.ca/dp/B0DW48QHFY?tag=lesdealsduw02-20&linkCode=osi&th=1&psc=1","https://m.media-amazon.com/images/I/41DQlgzUpBL._SL500_.jpg","1"
"hand warmers","Outdoor & Camping","OCOOPA UT3 Lite Rechargeable Hand Warmers 2 Pack, Magnetic Electric Handwarmers Ultra Thin Light Portable for Pocket Gloves,3 Levels Heat, Up to 8 hrs, UL Certified, Tech Gifts for Men, Women","$32.29 ($16.14 / Count)","$7.70 (19%)","19","https://www.amazon.ca/dp/B0CC189314?tag=lesdealsduw02-20&linkCode=osi&th=1&psc=1","https://m.media-amazon.com/images/I/41Y6ceHlDKL._SL500_.jpg","1"
"headphones","Audio & Music","BERIBES Bluetooth Headphones Over Ear,65H Playtime and 6 EQ Modes Wireless Headphones with Microphone,Immersive Bass,HiFi Stereo,Foldable Lightweight Headset with Built-in HD Mic for Cellphone/PC/Ect.","$37.99","$8.96 (19%)","19","https://www.amazon.ca/dp/B09LYF2ST7?tag=lesdealsduw02-20&linkCode=osi&th=1&psc=1","https://m.media-amazon.com/images/I/41zSiyit20L._SL500_.jpg","1"
"hunting backpack","Outdoor & Camping","NEW VIEW Hunting Backpack with Waterproof Rain Cover, 60L Camo Backpack for Men, 600D Hunting Bag for Hunter, Hiking, Camping, Tree, 60L, Classic","$129.99","$30.15 (19%)","19","https://www.amazon.ca/dp/B0D5YDS435?tag=lesdealsduw02-20&linkCode=osi&th=1&psc=1","https://m.media-amazon.com/images/I/51RNzLCUYQL._SL500_.jpg","1"
"ice cube trays","Kitchen","Optish 3 Pack Ice Trays for Freezer, 99 PCS Ice Cube Tray with Lid and Bin, Round Ice Cube Trays for Freezer, Circle Ice Cube Tray for Chilling Drinks","$11.28","$2.71 (19%)","19","https://www.amazon.ca/dp/B0C1FMW2L1?tag=lesdealsduw02-20&linkCode=osi&th=1&psc=1","https://m.media-amazon.com/images/I/41ZQqx63HfL._SL500_.jpg","1"
"iphone case","Smartphones","FABSPARK Phone Case for iPhone 13 Case,Simple Wave Design Wavy Frame Soft Silicone Aesthetic for iPhone 13,Wine Red","$12.99","$3.00 (19%)","19","https://www.amazon.ca/dp/B0CRD7W32J?tag=lesdealsduw02-20&linkCode=osi&th=1&psc=1","https://m.media-amazon.com/images/I/41JG-1SxPiL._SL500_.jpg","1"
"joint supplements","Health & Wellness","Webber Naturals Glucosamine Chondroitin MSM, Double Strength, 120 Tablets, Helps Relieve Joint Pain Associated with Osteoarthritis","$20.99 ($0.17 / count)","$5.00 (19%)","19","https://www.amazon.ca/dp/B00BBA8JG0?tag=lesdealsduw02-20&linkCode=osi&th=1&psc=1","https://m.media-amazon.com/images/I/41wCIlb8iRL._SL500_.jpg","1"
"kids art supplies","Kids & Education","Crayola 10 59ml Paint Jars Assorted Classic Colours Arts & Crafts","$7.29","$1.70 (19%)","19","https://www.amazon.ca/dp/B00CMM6L9S?tag=lesdealsduw02-20&linkCode=osi&th=1&psc=1","https://m.media-amazon.com/images/I/51Vwq-2AajL._SL500_.jpg","1"
"kitchen appliances","Kitchen","Cuisinart 5-in-1 Griddler with Reversible Nonstick Grill and Griddle Plates, Silver (CGR-4NEC)","$80.99","$18.98 (19%)","19","https://www.amazon.ca/dp/B002YD99Y4?tag=lesdealsduw02-20&linkCode=osi&th=1&psc=1","https://m.media-amazon.com/images/I/41FEfCzAJ9L._SL500_.jpg","1"
"knife sharpener","Kitchen","SHARPAL 104N 5-in-1 Professional Knife & Scissors Sharpener, Sharpening Tool for Straight & Serrated Blades, Repairs & Hones Euro/American & Asian Knives, Fast Scissor Sharpening","$29.99","$6.96 (19%)","19","https://www.amazon.ca/dp/B01L8QTE92?tag=lesdealsduw02-20&linkCode=osi&th=1&psc=1","https://m.media-amazon.com/images/I/41L5aaRPbBL._SL500_.jpg","1"
"laptop","Laptops & Tablets","Acer Chromebook Laptop | 15.6"" Full HD Display | Intel Celeron N4500 Processor | 4GB LPDDR4X, 64GB eMMC | ChromeOS | Lavender | CB315-4H-C0VN","$299.99","$70.00 (19%)","19","https://www.amazon.ca/dp/B0D946VSDH?tag=lesdealsduw02-20&linkCode=osi&th=1&psc=1","https://m.media-amazon.com/images/I/41pyhx8ERJL._SL500_.jpg","1"
"laser engraver","Makers & Digital Fabrication","xTool S1 40W Laser Engraver and Laser Cutter for Tumblers, 23.93"" x 15.16"" Bed Size Laser Engraving Machine, 600mm/s Speed, Laser Engraver for Wood and Metal, Acrylic, Big Project - Rotary Bundle","$2,679.00","$620.99 (19%)","19","https://www.amazon.ca/dp/B0CQ84BDTX?tag=lesdealsduw02-20&linkCode=osi&th=1&psc=1","https://m.media-amazon.com/images/I/41wiP+8EXVL._SL500_.jpg","1"
"leaf blower","Garden","Leaf Blower Cordless 6 Speed Mode, ETOOLAB 590CFM/165MPH Electric Cordless Leaf Blower with 4000mAh Battery and Charger, Battery Powered Leaf Blower for Patio Cleaning, Lawn Care, Leaves Blowing","$113.99","$26.00 (19%)","19","https://www.amazon.ca/dp/B0DYDV152V?tag=lesdealsduw02-20&linkCode=osi&th=1&psc=1","https://m.media-amazon.com/images/I/41KeCBY0BZL._SL500_.jpg","2"
"lego","Toys & Games","LEGO Classic Medium Creative Brick Box 10696 Building Toy Set with Storage, Includes Train, Car, and a Tiger Figure, and Playset for Boys and Girls, Sensory Toy for Kids Ages 4 and up","$32.28","$7.70 (19%)","19","https://www.amazon.ca/dp/B00NHQFA1I?tag=lesdealsduw02-20&linkCode=osi&th=1&psc=1","https://m.media-amazon.com/images/I/51ooqeyUaeL._SL500_.jpg","1"
"lego","Toys & Games","LEGO Creator 3 in 1 Flatbed Truck with Helicopter Toy, Transforms from Flatbed Truck Toy to Propeller Plane to Hot Rod and SUV Car Toys, Gift Idea for Boys and Girls Ages 7 Years Old and Up, 31146","$20.17","$4.82 (19%)","19","https://www.amazon.ca/dp/B0CGY4J7QT?tag=lesdealsduw02-20&linkCode=osi&th=1&psc=1","https://m.media-amazon.com/images/I/51yy69VtkhL._SL500_.jpg","1"
"lego","Toys & Games","LEGO City Blue Monster Truck Off-Road Toy Playset with a Driver Minifigure, Imaginative Toys for Kids, Fun Gift for Boys and Girls Aged 5 Plus, Mini Monster Truck, 60402","$16.13","$3.86 (19%)","19","https://www.amazon.ca/dp/B0CGYN1GJ5?tag=lesdealsduw02-20&linkCode=osi&th=1&psc=1","https://m.media-amazon.com/images/I/51zVEw39r8L._SL500_.jpg","2"
"lunch bags","Kitchen","Tactical Lunch Bag, Expandable Insulated Lunch Box for Men Women, Waterproof Leakproof Cooler Bag for Adults/Work Office Outdoor Picnic Camping, 20Can/15L, Black, HSHRISH","$47.98","$11.01 (19%)","19","https://www.amazon.ca/dp/B09CGVRVTK?tag=lesdealsduw02-20&linkCode=osi&th=1&psc=1","https://m.media-amazon.com/images/I/415s3dBVyfL._SL500_.jpg","2"
"markers","Kids & Education","Shuttle Art 304 Pack Washable Markers, 16 Assorted Colors Broad Line Conical Tip Large Markers Bulk with a Box, Bonus Caps, Home Classroom School Supplies for Toddlers Kids Adults Students Teachers","$72.99","$17.00 (19%)","19","https://www.amazon.ca/dp/B07VG8B32X?tag=lesdealsduw02-20&linkCode=osi&th=1&psc=1","https://m.media-amazon.com/images/I/51eVXENvVvL._SL500_.jpg","2"
"measuring tape","Tools","CRAFTSMAN Hi-Vis Tape Measure High-Visibility 8M/26-Ft Black and Green (CMHT38226S)","$12.50","$2.99 (19%)","19","https://www.amazon.ca/dp/B0CP68QZK6?tag=lesdealsduw02-20&linkCode=osi&th=1&psc=1","https://m.media-amazon.com/images/I/41XDMrNPuJL._SL500_.jpg","1"
"muffin tin","Kitchen","Wilton 2105-6789 Perfect Results Nonstick 12-Cup Muffin Pan","$23.45","$5.57 (19%)","19","https://www.amazon.ca/dp/B001K26ZPG?tag=lesdealsduw02-20&linkCode=osi&th=1&psc=1","https://m.media-amazon.com/images/I/41uQISYWh9L._SL500_.jpg","1"
"muffin tin","Kitchen","DRAONGYE 2 Packs Round Muffin Baking Pan, Premium Steel Muffin Pan for Baking, Cupcake Tin Cheesecake Pans, Bakeware Muffin Top Pan (6 Cups,Black)","$12.94","$3.05 (19%)","19","https://www.amazon.ca/dp/B0CFV3C19X?tag=lesdealsduw02-20&linkCode=osi&th=1&psc=1","https://m.media-amazon.com/images/I/51oIaXnKscL._SL500_.jpg","1"
"neck pillow","Travel","RAINFLOW Neck Pillow Airplane - Memory Foam Travel Pillow for Head and Neck Support Suitable for Sleeping Airplane,Traveling,Self-Driving Cars,Home,Office,Soft Washable Cover(Grey)","$10.50","$2.49 (19%)","19","https://www.amazon.ca/dp/B0DK95457J?tag=lesdealsduw02-20&linkCode=osi&th=1&psc=1","https://m.media-amazon.com/images/I/31pbEK5hrUL._SL500_.jpg","2"
"outdoor cushions","Garden","All Smiles Outdoor Throw Pillow Covers Cushion Covers Patio Spring Summer Flowers Garden Farmhouse Décor Outside Bench Chair Decorative Cushion Cases 18x18 Set of 4 Decoration for Bed Couch Sofa","$16.99","$4.00 (19%)","19","https://www.amazon.ca/dp/B086DB7BRS?tag=lesdealsduw02-20&linkCode=osi&th=1&psc=1","https://m.media-amazon.com/images/I/51Qmj21QBGL._SL500_.jpg","2"
"pens","Kids & Education","BIC Glide Bold Ultra-Smooth Retractable Ballpoint Pen with 1.6 mm Point, 15-Count in Blue Ink","$12.08","$2.90 (19%)","19","https://www.amazon.ca/dp/B004F9QBD2?tag=lesdealsduw02-20&linkCode=osi&th=1&psc=1","https://m.media-amazon.com/images/I/51Vr2OUs-2L._SL500_.jpg","2"
"pet bed","Pet Supplies","Bunlitent 23'' inch Calming Dog Bed, Anti-Anxiety Donut Small Dog Bed, Warming Cozy Soft Cute Round Washable, Marshmallow Cuddler Nest Puppy Bed, Grey","$16.99","$4.00 (19%)","19","https://www.amazon.ca/dp/B0D5QPPPQV?tag=lesdealsduw02-20&linkCode=osi&th=1&psc=1","https://m.media-amazon.com/images/I/31+wpk52FxL._SL500_.jpg","2"
"pet bed","Pet Supplies","VERZEY Medium/Large Dog Bed Mat Crate Pad, 36"" Metal Crates Fit, Ultra-Soft, Machine Washable & Anti-Slip Kennel Mat, Cozy Sleeping Mat for Medium/Large Dogs, Gray, 36L x 23W x 1H Inches","$29.99 ($29.99 / meter)","$7.19 (19%)","19","https://www.amazon.ca/dp/B0B591N61M?tag=lesdealsduw02-20&linkCode=osi&th=1&psc=1","https://m.media-amazon.com/images/I/41JJXyrUAhL._SL500_.jpg","2"
"ph meter","Tools","VIVOSUN Digital pH Meter, 0.01pH High Accuracy Pen Type pH Tester for Hydroponics, Household Drinking, Pool and Aquarium, Yellow, UL Certified","$16.14","$3.85 (19%)","19","https://www.amazon.ca/dp/B01M5IASHD?tag=lesdealsduw02-20&linkCode=osi&th=1&psc=1","https://m.media-amazon.com/images/I/31XhC5DqsKL._SL500_.jpg","1"
"pool","Outdoor & Camping","BerrysParadise Foldable Dog Pool with Sprinkler, 87 in Extra Large Dog Swimming Pool, Outdoor Collapsible Pet Bathing Tub for Pets Dogs Cats and Kids (87"" D x 12"" H, Blue)","$51.99","$12.00 (19%)","19","https://www.amazon.ca/dp/B0DS21H271?tag=lesdealsduw02-20&linkCode=osi&th=1&psc=1","https://m.media-amazon.com/images/I/41Yx23Xy3+L._SL500_.jpg","1"
"pregnancy pillow","Bedroom","Pregnancy Pillow for Sleeping, Maternity Pillow for Pregnant Women, Cooling Pregnancy Pillow, Pregnancy Wedge Support for Back, Belly, Portable and Adjustable Body Pillow for Side Sleeper, Grey","$29.99","$7.00 (19%)","19","https://www.amazon.ca/dp/B0DS21ZF1D?tag=lesdealsduw02-20&linkCode=osi&th=1&psc=1","https://m.media-amazon.com/images/I/41HhD141qFL._SL500_.jpg","2"
"protein bars","Health & Wellness","Pure Protein Bars - Nutritious, Gluten Free bar, made with Whey protein blend - low sugar, protein snack. Deliciously satisfying. Made in Canada, Cookies and Cream (Pack of 6)","$10.47 ($3.49 / 100 g)","$2.52 (19%)","19","https://www.amazon.ca/dp/B0CQ6Q5NWJ?tag=lesdealsduw02-20&linkCode=osi&th=1&psc=1","https://m.media-amazon.com/images/I/41LIRO1UBzL._SL500_.jpg","1"
"protein bars","Health & Wellness","Pure Protein Bars - Nutritious, Gluten Free protein bar & Bars - Nutritious, Gluten Free protein bar","$20.94 ($1.74 / count)","$5.04 (19%)","19","https://www.amazon.ca/dp/B0D2TZB32S?tag=lesdealsduw02-20&linkCode=osi&th=1&psc=1","https://m.media-amazon.com/images/I/41A5e9+M-NL._SL500_.jpg","1"
"pruning shears","Garden","FLORA GUARD Ratchet Pruning Shears, Professional Garden Clippers, Increases Cutting Power 3X, Sharp Gardening Scissors, Cutting Rose, Flower, Hedge, Stem, Tree, Perfect for Weak Hands & Arthritis","$21.99 ($21.99 / Count)","$5.00 (19%)","19","https://www.amazon.ca/dp/B0CP99RK1C?tag=lesdealsduw02-20&linkCode=osi&th=1&psc=1","https://m.media-amazon.com/images/I/41BJ1vO0zeL._SL500_.jpg","2"
"pulse oximeter","Health & Wellness","BEC PULSE OXIMETER - Includes 2x AAA, lanyard and user manual. For Adults and Children","$39.99","$9.50 (19%)","19","https://www.amazon.ca/dp/B0CHZ7RD3W?tag=lesdealsduw02-20&linkCode=osi&th=1&psc=1","https://m.media-amazon.com/images/I/41xohiiTx+L._SL500_.jpg","1"
"puzzle games","Toys & Games","FoxMind Games: Match Madness, Family Board Games for Kids Ages 7 and up, Teens, and Adults. Pattern Block Matching Board Game, Puzzle Game Think Fast to Make The Match, 1 to 4 Players","$24.18","$5.81 (19%)","19","https://www.amazon.ca/dp/B01FLQM21W?tag=lesdealsduw02-20&linkCode=osi&th=1&psc=1","https://m.media-amazon.com/images/I/518N4+vzr0L._SL500_.jpg","1"
"razer","Gaming","Razer Leviathan V2 X: PC Soundbar with Full-Range Drivers - Compact Design - Chroma RGB - USB Type C Power and Audio Delivery - Bluetooth 5.0 - for PC, Laptop, Smartphones, Tablets & Nintendo Switch","$118.02","$26.97 (19%)","19","https://www.amazon.ca/dp/B0BCCCNHD8?tag=lesdealsduw02-20&linkCode=osi&th=1&psc=1","https://m.media-amazon.com/images/I/21XhAOqXrjL._SL500_.jpg","1"
"rice cooker","Kitchen","Zojirushi NHS-10 6 Cup Rice Cooker / Steamer & Warmer","$91.74","$21.94 (19%)","19","https://www.amazon.ca/dp/B00004S576?tag=lesdealsduw02-20&linkCode=osi&th=1&psc=1","https://m.media-amazon.com/images/I/31z2AJ77i8L._SL500_.jpg","2"
"robe","Bedroom","HEARTNICE Womens Cotton Robe, Soft Kimono Spa Knit Long Bathrobe Lightweight Loungewear (Grey mel.,M)","$29.99","$7.00 (19%)","19","https://www.amazon.ca/dp/B079GWD2S5?tag=lesdealsduw02-20&linkCode=osi&th=1&psc=1","https://m.media-amazon.com/images/I/31jECD1AgsL._SL500_.jpg","2"
"scanner","Computers & Tech","Epson Fastfoto Ff-680w Wireless High-speed Photo and Document Scanning System,black","$649.99","$150.00 (19%)","19","https://www.amazon.ca/dp/B07DLX26BB?tag=lesdealsduw02-20&linkCode=osi&th=1&psc=1","https://m.media-amazon.com/images/I/41MHYjQYf8L._SL500_.jpg","2"
"shelter tarp","Outdoor & Camping","WADEO Camping Rain Fly with Heavy Duty Poles Kit, 10x12FT Tarp Oxfordfabric Tent Waterproof UV Protection for Outdoor Hammock Shelter Camping Tarp Pad, Hiking, Camper Gear","$51.29","$11.70 (19%)","19","https://www.amazon.ca/dp/B0BLMJLMPR?tag=lesdealsduw02-20&linkCode=osi&th=1&psc=1","https://m.media-amazon.com/images/I/415DQ+cbxgL._SL500_.jpg","1"
"shoes","Clothing & Accessories","adidas Unisex-Adult F50 Messi Freestyle, White/Lucid Lemon/Unity Purple, 13","$22.91","$5.38 (19%)","19","https://www.amazon.ca/dp/B0CMS4BNZJ?tag=lesdealsduw02-20&linkCode=osi&th=1&psc=1","https://m.media-amazon.com/images/I/31w8ql9tk4L._SL500_.jpg","2"
"silk pillowcase","Bedroom","Adubor Silk Pillowcase - 100% Pure Mulberry Silk, 23 Momme 6A Grade Fibers, 900 Thread Count, Silk Pillow Cases for Hair and Skin Health, with Hidden Zipper (Standard 20''×26'', Lvory White, 1PC)","$21.99","$5.22 (19%)","19","https://www.amazon.ca/dp/B07VKRTKRM?tag=lesdealsduw02-20&linkCode=osi&th=1&psc=1","https://m.media-amazon.com/images/I/31kq6e+GtIL._SL500_.jpg","1"
"slow cooker","Kitchen","Crock-Pot Large 8-Quart Programmable Slow Cooker with Auto Warm Setting Black Stainless Steel","$129.87","$30.12 (19%)","19","https://www.amazon.ca/dp/B07DFVY29X?tag=lesdealsduw02-20&linkCode=osi&th=1&psc=1","https://m.media-amazon.com/images/I/41hpxKhb5fL._SL500_.jpg","2"
"smart alarm","Security","ecozy Sunrise Alarm Clock for Heavy Sleepers, Smart Wake Up Light with Sunrise/Sunset Simulation, App & Voice Controlled, Natural Sounds & FM Radio, 4 Alarms & Snooze, 8 Colors Night Light for Bedroom","$56.99","$13.00 (19%)","19","https://www.amazon.ca/dp/B09YHBRHC4?tag=lesdealsduw02-20&linkCode=osi&th=1&psc=1","https://m.media-amazon.com/images/I/31OicpbkfcL._SL500_.jpg","1"
"standing desk converter","Office","VIVO Height Adjustable 81cm Standing Desk Converter with Dual 13 to 30 inch Monitor Stand, Sit Stand Monitor Mount and Desk Riser, Black, DESK-V000K-M2","$189.99","$45.00 (19%)","19","https://www.amazon.ca/dp/B08RHKKX6K?tag=lesdealsduw02-20&linkCode=osi&th=1&psc=1","https://m.media-amazon.com/images/I/41DKSpMk1IL._SL500_.jpg","1"
"step stool","Home & Cleaning","HBTower 2 Step Stool for Adults, Folding Step Ladder with Wide Anti-Slip Pedal, Sturdy Steel Ladder Convenient Handgrip, 500lbs Portable, Black","$64.99","$15.00 (19%)","19","https://www.amazon.ca/dp/B0912VXB73?tag=lesdealsduw02-20&linkCode=osi&th=1&psc=1","https://m.media-amazon.com/images/I/418ruGlfP0L._SL500_.jpg","2"
"string lights","Furniture & Decor","33 FT 100 LED Globe Ball String Lights, Fairy String Lights Plug in, 8 Modes with Remote, Decor for Indoor Outdoor Party Wedding Christmas Tree Garden, Warm White","$24.99","$6.00 (19%)","19","https://www.amazon.ca/dp/B01LKS55JQ?tag=lesdealsduw02-20&linkCode=osi&th=1&psc=1","https://m.media-amazon.com/images/I/51cQMMbPQlL._SL500_.jpg","1"
"survival backpack","Outdoor & Camping","QT&QY 45L Military Tactical Backpack combat Molle Army Assault Pack CCW 3 Day survival Bag Hiking rucking Rucksack heavy duty backpack","$45.99","$11.00 (19%)","19","https://www.amazon.ca/dp/B087RF22S8?tag=lesdealsduw02-20&linkCode=osi&th=1&psc=1","https://m.media-amazon.com/images/I/41Ie7BVZV-L._SL500_.jpg","1"
"tablet stand","Computers & Tech","UGREEN Tablet Stand Holder for Desk, Aluminum Desktop Tablet Holder Dock Adjustable Foldable Riser Compatible with iPad Pro 12.9, 9.7, 10.5, iPad Air, iPad mini, Surface Pro, Galaxy Tab, Silver","$32.37","$7.62 (19%)","19","https://www.amazon.ca/dp/B09P87NBYS?tag=lesdealsduw02-20&linkCode=osi&th=1&psc=1","https://m.media-amazon.com/images/I/41WK12ieOqL._SL500_.jpg","1"
